text,html_label,docling_label,similarity,html_index,pdf_index,document
"For over thirty years, the Americans with Disabilities Act (ADA) has been the main federal protection against discrimination for disabled people. Although ADA protections are ensured in the federal legislative branch and in state courthouses, this pivotal disability rights statute does not cover the federal judiciary. ADA claims are consequently litigated in federal courthouses that may be inaccessible to disabled people, yet there is little scholarship on the topic. This Note aims to fill this gap by exploring the implications of the lack of accessibility in the federal judiciary. Without ADA protections, disabled people do not have recourse when faced with discrimination and inaccessible spaces. This lack of protection threatens disabled people's access to justice, access to the workplace, and representation both on juries and within the federal judiciary. This Note consequently argues that the federal judiciary should adopt ADA protections to provide equal access to the federal court system and ensure that the federal judiciary reflects the diverse public it serves. It is time to have an informed conversation with all relevant constituencies about applying ADA protections to the federal judiciary.",body_text,text,0.9991796554552912,0,2,california_law_review_judiciary-ada
"* J.D., 2024, University of California, Berkeley, School of Law. I am grateful to Professor Amanda Tyler for her guidance and thoughtful feedback. I would also like to thank my amazing community for all their support and encouragement.",body_text,footnote,0.9416498993963782,65,5,california_law_review_judiciary-ada
"Eight years after the passage of the Americans with Disabilities Act (ADA), George Lane arrived at the Polk County Courthouse in Tennessee only to find that there was no elevator for him to reach its second floor. A wheelchair user, Lane had no choice but to attempt to crawl up two flights of stairs to appear in court. 1 As he struggled, the judge and other courthouse employees stood by and laughed. 2 When Lane refused to go through the demoralizing and painful experience of crawling up the stairs again after the court took a lunch break, he was arrested and jailed for failing to appear. 3",body_text,text,0.9924686192468619,2,8,california_law_review_judiciary-ada
"When Lane, joined by court reporter and fellow wheelchair user Beverly Jones, sued the state for discrimination, the law was on their side. The ADA protects disabled people from discrimination in many areas of public life, and the U.S. Supreme Court found that this included state courthouses. 4",body_text,text,0.9949238578680203,3,9,california_law_review_judiciary-ada
"But if Lane and Jones had been trying to access a federal courthouse, the case would not have been decided in their favor. While the ADA applies to the legislative branch, 5 it does not cover the executive branch or the federal judiciary. 6 ADA claims are consequently litigated in courthouses that disabled people 7 may be unable to enter.",body_text,text,0.986822840409956,4,10,california_law_review_judiciary-ada
"Adam Cohen, Editorial Observer; Can Disabled People Be Forced to Crawl up the Courthouse Steps? , N.Y. T IMES (Jan. 11, 2004), https://www.nytimes.com/2004/01/11/opinion/editorial-observer-can-disabled-people-be-forcedcrawl-up-courthouse-steps.html [https://perma.cc/S7Y6-E5LG].",body_text,list_item,0.9714285714285714,67,12,california_law_review_judiciary-ada
"Congressional Accountability Act of 1995, Pub. L. No. 104-1, 109 Stat. 3 (1995).",body_text,list_item,0.9696969696969697,70,15,california_law_review_judiciary-ada
"See 42 U.S.C. § 12131(1) (defining 'public entity' as 'any State or local government,' 'any department, agency, special purpose district, or other instrumentality of a State or States or local government,' or 'the National Railroad Passenger Corporation, and any other commuter authority').",body_text,list_item,0.9333333333333333,71,16,california_law_review_judiciary-ada
"7. Individuals have different preferences on person-first (e.g. 'people with disabilities') versus identity-first (e.g. 'disabled people') language when describing the disability community. Jennifer Safstrom & Joseph Mead, Developing Inclusive Language Competency in Clinical Teaching , 29 C LINICAL L. R EV . 349, 362 (2023) ('Different groups within the disability community have very different views on person-first versus identity-first approaches.'); see also Dana S. Dunn & Erin E. Andrews, Person-First and Identity-First Language: Developing Psychologists' Cultural Competence Using Disability Language , 70 A M . P SYCH . 255, 262 (2015) ('[R]esearchers in disability studies encourage the use of identity-first language. Some disabled people choose one over the other, whereas",body_text,text,0.8193163320672816,72,17,california_law_review_judiciary-ada
"More than one in every four adults in the United States has a disability, 8 and it is the only minority group one can join at any time. Yet, disabled people have few protections against discrimination when accessing, litigating, and working in the federal courts, 9 which excludes a large part of the population from fully participating in the justice system. 10",body_text,text,0.9876203576341128,5,18,california_law_review_judiciary-ada
"This Note explores the implications of this lack of ADA protections in the federal judiciary. First, this Note describes the importance of the ADA and the current lack of disability protections in the federal judiciary. Second, it delves into the ramifications of the federal judiciary's exemption from compliance with the ADA. Without ADA protections, disabled people do not have recourse when faced with discrimination and inaccessible spaces, threatening disabled people's access to justice, access to the workplace, and representation on juries and within the federal judiciary itself. Finally, given these concerns, this Note argues that the federal judiciary should adopt ADA protections to align with its stated goal to provide 'the strongest presumption of open access to all levels of the judicial system' 11 and to 'reflect[] the diversity of the public it serves.' 12 More than thirty years after the passage of the ADA, it is past time to have an informed conversation with all relevant constituencies about applying ADA protections to the federal judiciary.",body_text,text,0.9841269841269841,6,19,california_law_review_judiciary-ada
"8. Disability Impacts All of Us , C TRS . FOR D ISEASE C ONTROL & P REVENTION , https://www.cdc.gov/disability-and-health/articles-documents/disability-impacts-all-of-usinfographic.html [https://perma.cc/ND5A-57Y5].",body_text,footnote,0.8403755868544601,73,23,california_law_review_judiciary-ada
"9. See 42 U.S.C. § 12131(1) (defining 'public entity' as not including federal courts, leaving disabled people with few protections in these spaces).",body_text,footnote,0.98,74,24,california_law_review_judiciary-ada
"10. See Tennessee v. Lane, 541 U.S. 509, 531 (2004) ('[F]ailure to accommodate persons with disabilities will often have the same practical effect as outright exclusion . . . .').",body_text,footnote,0.9833333333333333,75,25,california_law_review_judiciary-ada
"11. Talamini v. Allstate Ins. Co., 470 U.S. 1067, 1070-71 (1985) (Stevens, J., concurring) (discussing how a jurisdictional discrepancy in an appeal relates to the broader issue of open access to the judicial system).",body_text,footnote,0.981651376146789,76,26,california_law_review_judiciary-ada
"12. Strategic Plan for the Federal Judiciary , U.S. C TS . [hereinafter Strategic Plan ], https://www.uscourts.gov/statistics-reports/strategic-plan-federal-judiciary [https://perma.cc/7UETW2H2].",body_text,footnote,0.9717223650385605,77,27,california_law_review_judiciary-ada
"The ADA has five parts, each of which establishes protections against discrimination in different areas. Title I regulates employment, prohibiting 'covered entities' from discriminating against disabled people. 17 Covered entities include employers with fifteen or more employees, employment agencies, labor unions, and state and local governments. 18 Covered entities are required to provide reasonable accommodations for disabled employees unless it results in 'undue hardship' for the entity. 19",body_text,text,0.954954954954955,8,31,california_law_review_judiciary-ada
"The remaining sections cover areas beyond employment. Title II requires that state and local governments give disabled people equal opportunity to benefit from their programs and services. 20 Title III prohibits exclusion and segregation in businesses that are generally open to the public, such as restaurants and movie theaters. 21 Title IV protects disabled people's access to telecommunications. 22 Lastly, Title V contains provisions relating to the ADA as a whole, including its interactions with state immunity and insurance providers, its prohibition of retaliation, and attorney's fees. 23 The Congressional Accountability Act of 1995 extends ADA protections to the legislative branch 24 but not to the federal judiciary or the executive branch.",body_text,text,0.9874421678783873,9,32,california_law_review_judiciary-ada
"24. Congressional Accountability Act of 1995, Pub. L. No. 104-1, 109 Stat. 3 (1995).",body_text,footnote,0.9882352941176471,89,43,california_law_review_judiciary-ada
"But before the ADA, no federal statute comprehensively protected disabled people's civil rights. 32 In advocating for the ADA, Attorney General Richard Thornburgh, on behalf of President George H.W. Bush, highlighted:",body_text,text,0.9885057471264368,11,48,california_law_review_judiciary-ada
"One of its most impressive strengths is its comprehensive character. Over the last 20 years, civil rights laws protecting disabled persons have been enacted in piecemeal fashion. Thus, existing Federal laws are like a patchwork quilt in need of repair. There are holes in the fabric, serious gaps in coverage that leave persons with disabilities without adequate civil rights protections. 33",body_text,text,0.9961685823754789,12,49,california_law_review_judiciary-ada
"The ADA is critical because it is the 'world's first comprehensive declaration of equality for people with disabilities.' 34 It acknowledges the history of disabled people being isolated, segregated, and discriminated against and declares the 'Nation's proper goals' for disabled people: 'to assure equality of opportunity, full participation, independent living, and economic self-sufficiency.' 35 Taken together, 'The ADA amounts to a national declaration of commitment to include people with disabilities in all aspects of our civic and cultural life . . . .' 36",body_text,text,0.9496910856134158,13,50,california_law_review_judiciary-ada
32. See id. ; 42 U.S.C. §§ 4151-4157; 20 U.S.C. § 1400.,body_text,footnote,0.954954954954955,97,56,california_law_review_judiciary-ada
"33. Americans with Disabilities Act: Hearing on S. 933 Before the S. Comm. on Lab. & Hum. Res. , 101st Cong. 5 (1989) (statement of Dick Thornburgh, Att'y Gen. of the United States).",body_text,footnote,0.9863013698630136,98,57,california_law_review_judiciary-ada
"34. George H.W. Bush, President of the United States, Remarks at the Signing of the Americans with Disabilities Act (July 26, 1990), https://archive.ada.gov/ghw_bush_ada_remarks.html [https://perma.cc/KDL2-WB9J].",body_text,footnote,0.9953051643192489,99,58,california_law_review_judiciary-ada
"36. Mary A. Lynch, The Application of Equal Protection to Prospective Jurors with Disabilities: Will Batson Cover Disability-Based Strikes? , 57 A LB . L. R EV . 289, 296 (1993).",body_text,footnote,0.9575070821529745,101,60,california_law_review_judiciary-ada
"37. F OREMAN ET AL ., supra note 26, at 19 ('The survey demonstrated that the ADA prompted better access to buildings, greater access to transportation, and fuller inclusion in the community.'); see also L EX F RIEDEN , T EX . H EALTH S CI . C TR . H OUS ., T HE I MPACT OF THE ADA IN A MERICAN C OMMUNITIES 6 (July 23, 2015) (highlighting that the ADA's greatest impact was in access to public accommodations in addition to access to 'transportation, access to independent and community living, and public awareness about the ADA and disability etiquette').",body_text,footnote,0.8054545454545454,102,61,california_law_review_judiciary-ada
"Despite its comprehensive nature, the ADA's scope still has limitations. On the day he signed the ADA, President George H.W. Bush declared, 'Let the shameful wall of exclusion finally come tumbling down.' 40 While the ADA provided more protection and opportunity for disabled people to participate in public life than ever before, many 'shameful wall[s] of exclusion' still persist, particularly in the federal judiciary.",body_text,text,0.9845788849347569,15,63,california_law_review_judiciary-ada
"Despite enormous strides in most areas of public life, disability rights in the federal judiciary are stuck in the 1960s. Although the ADA and the Rehabilitation Act cover state and local courts, these statutes do not apply to the federal judiciary. 41 Instead, in terms of physical access, federal courts are governed by the Architectural Barriers Act of 1968; 42 however, this statute has significant limitations. The Act only requires buildings that are constructed or altered with federal funds after 1968 to be accessible, 43 running the risk of incomplete access. For example, if the entrance of a federal courthouse is updated, it will need to be made accessible, likely including a ramp or lift. However, the restrooms in the courthouse may remain inaccessible if they have not been altered since 1968. 44 Further, the Architectural Barriers Act also does not provide a private right of action for violations, so would-be plaintiffs cannot sue to force the courts to give them access. Instead, one may file a complaint with the U.S. Access Board. 45",body_text,text,0.9929211892402077,16,66,california_law_review_judiciary-ada
"38. Tennessee v. Lane, 541 U.S. 509, 536 (2004) (Ginsburg, J., concurring).",body_text,footnote,0.9868421052631579,103,68,california_law_review_judiciary-ada
"41. Both acts refer to state and local government. Since it is a separate branch of government, the federal judiciary is not included. See 42 U.S.C. § 12131(1); 29 U.S.C. § 794 (covering state or local government departments, agencies, and entities or recipients of state or local government assistance).",body_text,footnote,0.9967213114754099,106,71,california_law_review_judiciary-ada
"Additionally, protections for disabled judicial employees are incomplete. The Judicial Conference has a Model Equal Employment Opportunity (EEO) Plan, which dictates that each court adopt a plan to provide equal employment to all regardless of identity, including 'handicap.' 52 Each court also implements an Employment Dispute Resolution (EDR) plan based on the Model EDR plan released by the Judicial Conference. 53 The Model EDR plan prohibits discrimination, including discrimination on the basis of disability. 54 Similar to the ADA, the plan defines disability as a physical or mental impairment, or record or perception of a mental or physical impairment, that substantially limits one or more major life activities of an employee. 55 If an employee files a complaint, they may receive an accommodation, which may include the 'purchase of specialized equipment or the restructuring of duties and work hours, or other appropriate means.' 56 There is no further information on employee rights, the accommodations process, or the means by which an 'appropriate' accommodation is reached. 57 The result of these half-measures is that employees have only limited, and not legally enforceable, rights, and physical access remains outdated in many buildings. Without the ADA, the protections afforded to disabled people in all aspects of the federal judiciary are incomplete.",body_text,text,0.9811320754716981,18,78,california_law_review_judiciary-ada
"52. J UD . C ONF . U.S., M ODEL E QUAL E MPLOYMENT O PPORTUNITY (EEO) P LAN , at § I (1980) (revised 1986), https://www.ncwb.uscourts.gov/sites/ncwb/files/EEO_Plan.pdf [https://perma.cc/ZD2P-RSVD].",body_text,footnote,0.7668393782383419,117,84,california_law_review_judiciary-ada
"A little over a decade after Congress passed the ADA, the American Bar Association passed a resolution urging all courts to implement the ADA access requirements. 58 Acknowledging the need for greater accessibility, the resolution urged the federal judiciary to view the ADA as a 'model for effective practices in the federal court system.' 59 To date, it does not appear that the federal judiciary has changed its policies in response to this resolution. Federal courts remain unevenly accessible to disabled litigants, witnesses, employees, and spectators, with disastrous results.",body_text,text,0.9914383561643836,19,90,california_law_review_judiciary-ada
"Discrimination against disabled people manifests in two main ways: prejudice and barriers. While prejudice may be akin to the bias faced by other marginalized groups, the barriers to access disabled people face are distinct. 60 Inaccessible buildings are one manifestation of how the 'prejudices against people with disabilities are at work in the architecture of society itself.' 61 Part III describes how the law's failure to protect disabled people against prejudice and ensure their access to the federal judiciary impacts the judiciary's ability to effectively serve the public and ensure a fair workplace for its employees.",body_text,text,0.9888888888888889,20,93,california_law_review_judiciary-ada
"The Constitution establishes the right to access judicial proceedings. But under current law, disabled people do not have the same level of access to federal courts as nondisabled people, threatening their ability to view and participate in court proceedings. 62 For example, in Talamini v. Allstate , Justice Stevens asserted in a concurring opinion that '[f]reedom of access to the courts is a cherished value in our democratic society. . . . There is, and should be, the strongest presumption of open access to all levels of the judicial system.' 63 The",body_text,text,0.8236173393124065,21,95,california_law_review_judiciary-ada
"58. A.B.A., M IDYEAR M EETING R ESOLUTION 112, at 1 (2002), https://www.americanbar.org/content/dam/aba/directories/policy/midyear-2002/2002_my_112.pdf [https://perma.cc/Z663-T74E].",body_text,footnote,0.8698060941828255,123,96,california_law_review_judiciary-ada
"60. Jane West, The Social and Policy Context of the Act , 69 M ILBANK Q. 3, 6 (1991) ('Discrimination against persons with disabilities might be considered to have two aspects: (1) prejudice and (2) barriers . Persons with disabilities share with other groups the experience of being the target of prejudiced, or 'pre-judged' attitudes. However, many of the barriers confronted by persons with disabilities are unique to them.').",body_text,footnote,0.970828471411902,125,98,california_law_review_judiciary-ada
"61. Tobin Siebers, Disability Experience on Trial , in M ATERIAL F EMINISMS 291, 295 (Stacy Alaimo & Susan Hekman eds., 2008).",body_text,footnote,0.8605577689243028,126,99,california_law_review_judiciary-ada
"62. See Richmond Newspapers, Inc. v. Virginia, 448 U.S. 555, 599 (1980) (Stewart, J., concurring) ('[T]he First and Fourteenth Amendments clearly give the press and the public a right of access to trials themselves, civil as well as criminal.').",body_text,footnote,0.9878048780487805,127,100,california_law_review_judiciary-ada
"63. Talamini v. Allstate Ins. Co., 470 U.S. 1067, 1070-71 (1985) (discussing how a jurisdictional discrepancy in an appeal relates to the broader issue of open access to the judicial system).",body_text,footnote,0.9895833333333334,128,101,california_law_review_judiciary-ada
"Access to justice, however, looks different for disabled people. It goes beyond hiring an attorney and having one's day in court. It is more than simply having the courts open to the public to see the judicial process in action. To view or participate in judicial proceedings, disabled people may need an accessible parking spot or restroom. They need to be able to open courthouse and courtroom doors, sit in the jury box, communicate on the witness stand, and reach the clerk counter. 65 Prohibitions on service animals or a lack of assistive technology at a courthouse may preclude a disabled person from being able to participate fully. 66 Many factors that impact disabled people's ability to access courts are often overlooked or taken for granted by nondisabled people, demonstrating disabled people's need for increased protection to ensure equal access to the federal court system. 67",body_text,text,0.9916154276131918,22,103,california_law_review_judiciary-ada
"Without ADA protections, the federal judiciary falls short of its promise to provide 'Access for All.' 68 Only buildings that were updated or constructed after the passage of the Architectural Barriers Act must be made accessible, 69 hindering disabled people's physical access to these historic federal court buildings. 70 Likewise, although the Court Interpreter's Act 71 and Judicial Conference 72 aim to cover people with communication disabilities, these policies fail to include protections and accommodations for other disabilities, such as visual or mobility impairments. Court spectators are also not covered by either of these rules, leaving disabled spectators who need accommodations unable to watch judicial proceedings in person like nondisabled spectators can. 73",body_text,text,0.9833546734955185,23,104,california_law_review_judiciary-ada
"64. Visit a Federal Court , U.S. C TS . [hereinafter Visit a Federal Court ], https://www.uscourts.gov/about-federal-courts/federal-courts-public/visit-federal-court [https://perma.cc/85WF-2VFY].",body_text,footnote,0.9742268041237113,129,105,california_law_review_judiciary-ada
"65. Charmatz & McRae, supra note 48, at 333 ('For individuals with disabilities, 'access to the courts' involves more than hiring a lawyer, filing a complaint, or proceeding through the numerous stages of the litigation process. . . . [I]n this context, [it] means finding an accessible parking place, getting up steps, opening courthouse doors, finding the courtroom, sitting at counsel tables, entering the jury box, sitting on the bench, and communicating effectively with judges, lawyers, courtroom personnel, and the jury.').",body_text,footnote,0.9529190207156308,130,106,california_law_review_judiciary-ada
"66. Stephanie Ortoleva, Inaccessible Justice: Human Rights, Persons with Disabilities, and the Legal System , 17 ILSA J. I NT ' L & C OMPAR . L. 281, 305 (2011).",body_text,footnote,0.9182389937106918,131,107,california_law_review_judiciary-ada
"67. Telephone Interview with Lili Siegel, Former Law Clerk, U.S. Dist. Ct. N.D. Cal. & Or. Ct. App. (Apr. 2, 2024).",body_text,footnote,0.9913793103448276,132,108,california_law_review_judiciary-ada
"70. See Colker, supra note 31, at 140-41 ('Coverage under the ABA is further limited because, when alterations are made, only the altered portion of a covered building must be made accessible to it. Thus, for example, a building might have accessible restrooms (if the portion of the building containing the restrooms is altered) but have no accessible entry into the building.').",body_text,footnote,0.989501312335958,135,111,california_law_review_judiciary-ada
"Remote access of court proceedings is not comprehensive enough to make up for a disabled spectator's inability to access proceedings in person. The Judicial Conference only recently changed its policy to permit remote audio access to non-trial proceedings of civil and bankruptcy cases, but the policy change does not include criminal proceedings. Judges can still exercise discretion to allow parties and counsel to appear remotely by teleconference or videoconference. 74",body_text,text,0.9947201689545935,24,115,california_law_review_judiciary-ada
"Most federal courts do not record or broadcast civil cases. For example, three district courts in the Ninth Circuit are a part of an extended pilot program allowing some video coverage. Likewise, with advance permission, the Ninth Circuit allows cameras and live streaming of oral arguments. The Second Circuit also allows cameras in some cases, and the Third Circuit provides video of select oral arguments. 75 The sparse remote coverage currently offered by the federal court system cannot replace a person's inability to attend proceedings in person.",body_text,text,0.995483288166215,25,116,california_law_review_judiciary-ada
"Moreover, the Judicial Conference policy does not have the legal backing of a statute. The policy functions as a mere suggestion for federal courts to promote uniformity. Each federal court then creates its own policy. 76 Thus, both the substance of the possible accommodations and the procedure by which they are provided are variable and uncertain. 77 For example, the Central District of California has a seven-page policy posted on its website outlining accommodations policies for jurors, trial participants, and the public. 78 In contrast, the Southern District of New York website simply states, 'If you are an individual with a disability who needs an accommodation to participate in a court proceeding or other court activity, you may make a request for accommodations,' and provides a link to an email address for submitting such requests. 79 The Southern District's website provides no additional information about the accommodations process, 80 leaving disabled people without any",body_text,text,0.9493487698986975,26,117,california_law_review_judiciary-ada
