text,html_label,docling_label,similarity,html_index,pdf_index,document
"74. Temporary permission to conduct criminal proceedings by teleconference and video conference concluded in May of 2023. Judicial Conference Revises Policy to Expand Remote Audio Access over Its Pre-COVID Policy , U.S. C TS . (Sept. 12, 2023), https://www.uscourts.gov/news/2023/09/12/judicial-conference-revises-policy-expand-remote-audioaccess-over-its-pre-covid [https://perma.cc/UEY4-HE7Z].",body_text,footnote,0.9873417721518988,139,118,california_law_review_judiciary-ada
"76. Governance and the Judicial Conference , U.S. C TS ., https://www.uscourts.gov/aboutfederal-courts/governance-judicial-conference [https://perma.cc/M4WZ-2PD4].",body_text,footnote,0.9693251533742331,141,120,california_law_review_judiciary-ada
"78. Guidelines for Providing Accommodations for Trial Participants with Communications Disabilities, Jurors, and Members of the Public , U.S. D IST . C T . C.D. C AL ., https://www.cacd.uscourts.gov/forms/guidelines-providing-accommodations-trial-participantscommunications-disabilities-jurors-and [https://perma.cc/5AJ4-NYXE].",body_text,footnote,0.9661538461538461,143,122,california_law_review_judiciary-ada
"79. Request for Accommodation , S.D.N.Y., https://www.nysd.uscourts.gov/request-foraccommodation [https://perma.cc/JF29-QSS2].",body_text,footnote,0.984251968503937,144,123,california_law_review_judiciary-ada
"Conversely, if a courthouse is covered under the ADA, disabled people have recourse to challenge the barriers they face. For example, many plaintiffs have successfully challenged the lack of wheelchair accessibility in state courthouses. In Tennessee v. Lane , two wheelchair users, a defendant and a court reporter, needed to crawl or be carried up the courthouse stairs because the building lacked wheelchair accessibility. 81 The court reporter was dropped as she was carried up the courthouse steps. 82 Similarly, in Matthews v. Jefferson , the plaintiff, a wheelchair user, was carried up to the second floor of the courthouse only to find that there was no accessible restroom for him to use or subsequent plan for him to be carried down at the end of the day. 83 These barriers threaten disabled people's health and safety in addition to their access to justice. Because the ADA covers state and local courts, these plaintiffs could successfully challenge their exclusion from the judicial process.",body_text,text,0.9935355544505221,27,126,california_law_review_judiciary-ada
"The same problems may exist in federal courts, but the ADA does not afford those plaintiffs legal standing to challenge inaccessible spaces. 84 Federal courthouses often have inaccessible witness stands, jury boxes, and restrooms, leaving disabled people without the accommodations they need to fully participate in the court proceedings. 85 Having to crawl up stairs or being unable to access the witness stand or counsel table may also impact disabled people's perceived credibility as attorneys, witnesses, litigants, and employees. 86 The barriers disabled people face in courthouses exemplify how the justice system is not designed for disabled people and contributes to the exclusion of disabled people at large. 87 Furthermore, without ADA protections, disabled litigants may be 'doubly victimized'-they have both been wronged and left without recourse in the federal courts. 88",body_text,text,0.9870422535211267,28,127,california_law_review_judiciary-ada
"Matthews v. Jefferson, 29 F. Supp. 2d 525, 528 (W.D. Ark. 1998).",body_text,list_item,0.9552238805970149,148,130,california_law_review_judiciary-ada
"84. For example, in April 2024 I went to watch my friend, an attorney, represent a client at the Alameda County Courthouse in Berkeley, California. I have a disability that impacts my spine, and I am often unable to sit as a result, so I stood with my cane in the back of the courtroom. After the court clerk had asked everyone to sit down multiple times, he came up to me and asked me to sit down. I told him that I had a disability and was unable to sit. He immediately told me to leave the courtroom and started escorting me out. Since the ADA covers state courts, I had a legal right to be in the courtroom and be accommodated despite the court clerk asking me to leave. If I had been attempting to watch federal court proceedings, I would not have had the legal backing to assert my right to view the court proceedings.",body_text,footnote,0.9987878787878788,149,131,california_law_review_judiciary-ada
"87. See Tennessee v. Lane, 541 U.S. 509, 531 (2004) ('[F]ailure to accommodate persons with disabilities will often have the same practical effect as outright exclusion . . . .'); Siebers, supra note 61 ('Prejudices against disabled people are at work in the architecture of society itself.').",body_text,footnote,0.9829931972789115,152,134,california_law_review_judiciary-ada
"88. Siebers, supra note 61, at 294 ('The wronged are doubly victimized because they have both suffered injustice and been deprived of the means to argue their case.').",body_text,footnote,0.9821428571428571,153,135,california_law_review_judiciary-ada
"Given that ADA cases are often litigated in federal court, the lack of protections for disabled people is even more concerning. In crafting the ADA, Congress gave federal courts the latitude to decide the parameters of disability rights. 89 Federal courts consequently rule on whether state courts and other places covered by the ADA are accessible, 90 even though the federal judiciary itself has limited disability rights because it is not included in the ADA. Disabled people are expected to bring ADA cases in courts that are not mandated to be accessible to them. It is hypocritical and unjust that disabled people must bring their discrimination cases in courts that are exempt from the very statute that ensures their inclusion in public life.",body_text,text,0.9966733200266135,29,136,california_law_review_judiciary-ada
"The lack of ADA protections impacts disabled people's ability to use the justice system and may also hinder their ability to participate in the federal judiciary as judges, clerks, or other courthouse employees. Much like access to justice, access to the workplace looks different for disabled and nondisabled people. Disabled employees may need countless accommodations to access the workplace like their nondisabled peers, 91 and disabled judicial employees are no exception. Disabled workers may need accessible equipment or software, a flexible work schedule, special parking spots and elevators, or an aide to assist them. While the ADA outlines the process and standards by which employers should accommodate disabled people, 92 the federal judiciary, along with the executive branch, are exempt.",body_text,text,0.9950186799501868,30,138,california_law_review_judiciary-ada
"Since disabled employees in the federal judiciary are not protected by the ADA, they have neither the protection from discrimination on the basis of disability nor the ability to seek the accommodations they need. Given the incomplete protections provided by the Architectural Barriers Act, 93 disabled employees may find themselves unable to use the restroom or even enter the building in which they work. 94 Likewise, even though the Model EDR 95 and EEO 96 plans prohibit discrimination on the basis of disability and obtaining accommodations through these processes is possible, 97 the Judicial Conference policies are merely models that courts may-but are not required to-adopt. 98 Court policies are consequently vague and difficult to access, making",body_text,text,0.8170398689240852,31,139,california_law_review_judiciary-ada
"91. Reasonable Accommodations in the Workplace , ADA N AT ' L N ETWORK , https://adata.org/factsheet/reasonable-accommodations-workplace [https://perma.cc/U3QW-SKM9].",body_text,footnote,0.9146341463414634,156,142,california_law_review_judiciary-ada
"94. Colker, supra note 31, at 140-41; Siegel, supra note 67.",body_text,footnote,0.9672131147540983,159,145,california_law_review_judiciary-ada
"97. J UD . C ONF . U.S., supra note 53, at ch. X, § 12(B)(10).",body_text,footnote,0.8688524590163934,162,148,california_law_review_judiciary-ada
"As a result of the lack of protections, disabled judicial employees, such as law clerks and federal public defenders, are unable to sue for discrimination or seek damages. 101 The federal judiciary is similarly exempt from Title VII of the Civil Rights Act of 1964, which prohibits discrimination on the basis of sex, race, religion, or national origin. 102 This lack of protections puts disabled employees with multiple marginalized identities, such as disabled women, 103 without recourse beyond the EDR in the face of unequal treatment.",body_text,text,0.9916743755781684,32,151,california_law_review_judiciary-ada
"Without the ADA to mandate compliance, the federal judiciary is largely unequipped to provide accommodations. A disabled attorney who has clerked at both the federal and state level reports that the way each court handled accommodations was markedly different. While the state court personnel seemed familiar with the interactive accommodations process mandated by the ADA, federal court personnel seemed 'bamboozled' by her disability. 104 Lawyers are not typically trained on how to work with disabled people, leaving disabled judicial employees at the mercy of people who may be unequipped to navigate their access needs. 105 Moreover, without legal rights, disabled judicial employees are reliant on the goodwill of judges and human resources departments to listen to their needs and decide to accommodate them appropriately. 106 The absence of mandated ADA protections leaves disabled employees reliant on goodwill rather than guaranteed rights, resulting in inconsistent and often inadequate accommodations.",body_text,text,0.9935929029078364,33,152,california_law_review_judiciary-ada
"99. Nancy Gertner, Sexual Harassment and the Bench , 71 S TAN . L. R EV . O NLINE 88, 89 (2018) ('Both plans could not be more general.'); id. at 90 ('[T]he rules are effectively inaccessible to employees or, for that matter, other judges.'); Siegel, supra note 67.",body_text,footnote,0.9239543726235742,164,154,california_law_review_judiciary-ada
"101. Neither the Model EEO plan nor the Model EDR plan include the ability to sue for discrimination or seek damages. See J UD . C ONF . U.S., supra note 52; J UD . C ONF . U.S., supra note 53.",body_text,footnote,0.9210526315789473,166,156,california_law_review_judiciary-ada
"103. See e.g. , Robyn Lewis Brown & Mairead Eastin Moloney, Intersectionality, Work, and Well-being: The Effects of Gender and Disability , 33 G ENDER & S OC ' Y 94 (2018) (documenting the layered discrimination that disabled women face from their intersectional identity).",body_text,footnote,0.9520295202952029,168,158,california_law_review_judiciary-ada
"104. Siegel, supra note 67 ('[Clerking] was tough in part because people were a bit bamboozled by me at times and just like wanted to do the right thing, but did not know what [the right thing] was.').",body_text,footnote,0.9851485148514851,169,159,california_law_review_judiciary-ada
"105. See Ortoleva, supra note 66, at 301-02 ('[L]awyers are not trained on disability law or on how to work with clients with disabilities. . . . They also have little experience working with disabled persons and minimal understanding of the so-called 'disability etiquette,' which helps in addressing and interacting with persons with disabilities.').",body_text,footnote,0.9830028328611898,170,160,california_law_review_judiciary-ada
"107. J UD . C ONF . U.S., supra note 53, at ch. X, § 3.",body_text,footnote,0.8518518518518519,172,162,california_law_review_judiciary-ada
"making the process fraught with bias. Recent attention given to the problem of sexual harassment in the federal judiciary underscores this problem. 108 In a hearing before the Subcommittee on Courts, Intellectual Property, and the Internet, former clerk Caitlyn Clark describes how 'complaints against sitting judges are adjudicated by the judges' peers, leaving the fox guarding the henhouse.' 109 Furthermore, the process may take months, and employees may need to hire an attorney. 110 Then, remedies are limited-most complaints are dismissed 111 -and it is rare that the complaint will result in formal discipline. 112 Given the issues of bias and inefficiency, the EDR process is unlikely to aid disabled judicial employees in obtaining reasonable accommodations.",body_text,text,0.8189509306260575,34,163,california_law_review_judiciary-ada
"Additionally, the significant power imbalance between judges who oversee the EDR process and employees likely deters disabled workers from filing a complaint. 113 Unlike judicial employees, federal judges have job protections. For example, Article III judges can only be removed through impeachment by the House and conviction by the Senate. 114 Their salaries also cannot be diminished during their tenure. 115 Likewise, although any person may file complaints about a judge's conduct or health through the Judicial Conduct and Disability",body_text,text,0.8465189873417721,35,164,california_law_review_judiciary-ada
"108. See e.g. , Workplace Protections for Federal Judiciary Employees: Flaws in the Current System and the Need for Statutory Change: Hearing Before the Subcomm. on Cts., Intell. Prop. & the Internet of the H. Comm. on the Judiciary , 117th Cong. 4 (2022) (statement of Laura Minor, Former Assoc. Dir., Dep't Program Servs.; Former Equal Emp. Opportunity Officer, Admin. Off. Cts.; and Former Sec'y, Jud. Conf. U.S.) [hereinafter Minor Statement] ('When employees formally chose to report misconduct, oftentimes investigations were biased against the individual filing the report and conducted in a way that favored the interests of those with greater power and influence.').",body_text,footnote,0.9762962962962963,173,165,california_law_review_judiciary-ada
"109. Workplace Protections for Federal Judiciary Employees: Flaws in the Current System and the Need for Statutory Change: Hearing Before the Subcomm. on Cts., Intell. Prop. & the Internet of the H. Comm. on the Judiciary , 117th Cong. 10 (2022) (statement of Caitlyn Clark, Former Clerk, U.S. Dist. Ct. M.D. Ga.)[hereinafter Clark Statement].",body_text,footnote,0.9956331877729258,174,166,california_law_review_judiciary-ada
"110. See e.g. , Workplace Protections for Federal Judiciary Employees: Flaws in the Current System and the Need for Statutory Change: Hearing Before the Subcomm. on Cts., Intell. Prop. & the Internet of the H. Comm. on the Judiciary , 117th Cong. (2022) (written statement of Michelle Cohen Levy, EDR Couns. for Caitlyn Clark) [hereinafter Levy Statement].",body_text,footnote,0.9943820224719101,175,167,california_law_review_judiciary-ada
"112. See e.g. , id. at 4 (highlighting that, in 2022, there was only one complaint where remedial action was taken, which resulted in censure or reprimand).",body_text,text,0.9904153354632588,177,170,california_law_review_judiciary-ada
"113. See Gertner, supra note 99, at 92 ('[T]here exist large power differentials between judges and employees.'); Clark Statement, supra note 109, at 10 ('Judges wield an immense amount of power and influence . . . I quickly realized that engaging in [the EDR] process would make me a pariah within the legal community.'); Minor Statement, supra note 108.",body_text,text,0.9859550561797753,178,171,california_law_review_judiciary-ada
"The power dynamic between judges and employees has been more thoroughly analyzed in the context of sexual harassment between judges and law clerks. 118 Many judicial employees are law clerks who work for a judge for one to two years early in their careers. Each judge and their clerks work in a small, intimate chambers environment. 119 Each chambers is 'a fiefdom, with its own rules and norms.' 120 The relationship between a judge and a clerk is consequently more 'similar to that of a professor and a student than a traditional employment relationship.' 121 Judges are not only clerks' bosses, but also recommenders who help propel clerks to the next phase of their career paths. 122 Filing a complaint could result in a negative recommendation that could impact a clerk's professional trajectory. This deters clerks from filing complaints. Whether it be for sexual harassment or disability discrimination, there is a high likelihood that going through the EDR process will negatively impact a clerk's career. 123",body_text,text,0.984313725490196,36,175,california_law_review_judiciary-ada
"Given the power dynamic between judges and employees, vague judicial policies, and the fraught complaints process, disabled judicial employees are vulnerable to discrimination and left without recourse. The treacherous landscape of the federal judiciary runs the risk of deterring disabled people from working for the federal judiciary or subjecting them to unequal treatment as employees.",body_text,text,1.0,37,176,california_law_review_judiciary-ada
"117. The Federal Judicial Center reports only fifteen documented impeachments of federal judges by the U.S. House of Representatives and eight convictions by the U.S. Senate throughout history. Impeachments of Federal Judges , F ED . J UD . C TR ., https://www.fjc.gov/history/judges/impeachments-federal-judges [https://perma.cc/WZ86-4GTQ].",body_text,footnote,0.9689807976366323,182,178,california_law_review_judiciary-ada
"118. See e.g. , Gertner, supra note 99; Renee Knake Jefferson, Judicial Ethics in the #MeToo World , 89 F ORDHAM L. R EV . 1197 (2021) (examining how power dynamics contribute to the culture of silence around sexual harassment in the judiciary).",body_text,footnote,0.9363449691991786,183,179,california_law_review_judiciary-ada
"119. Willie J. Epps, Jr. & Jonathan M. Warren, The Who, What, When, Where, Why, and How of Clerking, as Told by a Federal Judge and His Former Law Clerk , 90 UMKC L. R EV . 295, 297 (2021).",body_text,footnote,0.9761273209549072,184,180,california_law_review_judiciary-ada
"121. Public Hearing: Proposed Changes to Code of Conduct for U.S. Judges and Judicial Conduct and Disability Rules , U.S. C TS ., at 01:50:05 (Oct. 30, 2018) (statement of Renee Newman Knake, Doherty Chair in Legal Ethics & Professor of Law, Univ. Hous. L. Ctr.) [hereinafter Knake Statement], https://www.uscourts.gov/administration-policies/judiciary-policies/ethics-policies/codeconduct-us-judges/proposed-changes-code-conduct-us-judges-and-judicial-conduct-and-disabilityrules [https://perma.cc/N8P7-7QCB].",body_text,footnote,0.9892262487757101,186,182,california_law_review_judiciary-ada
"122. See Gertner, supra note 99 ('The judge's recommendations are critical to the clerk, not just in the year or two after the clerkship, but often throughout [their] legal career.').",body_text,footnote,0.9782608695652174,187,183,california_law_review_judiciary-ada
"123. See Knake Statement, supra note 121 ('The pressure to endure harassment silently is fierce; indeed, a decision to report can ruin future prospects in the profession . . . . An unfavorable reference letter, or even the judge's refusal to write one, can compromise or destroy career aspirations.').",body_text,footnote,0.9867549668874173,188,184,california_law_review_judiciary-ada
"Diversity includes disability, and the federal judiciary needs diverse employees and juries to effectively serve the public. As shown in this Section, being exempt from the ADA stifles disability representation in all aspects of the federal court system, creating barriers to access for disabled attorneys, judges, and jurors.",body_text,text,1.0,38,186,california_law_review_judiciary-ada
"'[H]aving a diverse judicial branch is important because it bolsters public confidence in our system.' 124 Trust in institutions like the federal judiciary decreases when the makeup of the institution does not reflect the population it serves. 125 The American Bar Association (ABA) emphasizes that diversity in race, ethnicity, disability, sexual orientation, and gender identity is critical for the legitimacy of the federal court system. 126 Yet the bench is still overwhelmingly male and white. 127 Data regarding disability in the federal judiciary either do not exist or are not publicly available, demonstrating the need to begin counting disabled people in diversity statistics. Without concrete data, the degree of disability representation in the federal judiciary can only be surmised. Given that the federal judiciary does not follow the ADA 128 or maintain employment statistics about disabled workers, disabled people likely comprise a small minority of the bench. 129",body_text,text,0.9888324873096447,39,188,california_law_review_judiciary-ada
"124. Debra Cassens Weiss, A Diverse Judiciary 'Bolsters Public Confidence in Our System,' Says SCOTUS Nominee Jackson , A.B.A. J. (Mar. 23, 2022), https://www.abajournal.com/web/article/jackson-a-diverse-judicial-branch-bolsters-public-confidencein-our-system [https://perma.cc/WF8T-NRMH] (quoting Justice Ketanji Brown Jackson).",body_text,text,0.9878787878787879,189,189,california_law_review_judiciary-ada
"125. See Jay Prapaisilp, Diversifying the Federal Judiciary and Why It Matters , 34 G EO . J. L EGAL E THICS 1221, 1224 (2021) (highlighting that marginalized races and women tend to have less trust in the courts in comparison to white and male individuals).",body_text,text,0.9200779727095516,190,190,california_law_review_judiciary-ada
"126. See A.B.A., A NNUAL M EETING R ESOLUTION 102 (2016), https://www.americanbar.org/content/dam/aba/administrative/mental_physical_disability/102.pdf [https://perma.cc/N62M-R3YD] (urging the Judicial Conference to recognize the importance of diversity and support the hiring of diverse candidates in the Judicial Branch); Diversity Action Plan , A.B.A (2012), https://www.americanbar.org/groups/judicial/committees/scdj/diversity-action-plan/ [https://perma.cc/Z3VG-79XS] ('[D]iversity in the judiciary in racial and ethnic, gender identity, sexual orientation, age, disabilities and religion is essential to maintaining public trust and confidence in the legal system.').",body_text,text,0.962852897473997,191,191,california_law_review_judiciary-ada
"127. See e.g. , Judges: Diversity on the Federal Bench , A.B.A., https://www.abalegalprofile.com/judges.html [https://perma.cc/7E4K-6W5X] (highlighting that, as of October 1, 2023, the 1,423 sitting federal judges were 68 percent male and 76 percent white).",body_text,text,0.9922178988326849,192,192,california_law_review_judiciary-ada
"128. See 42 U.S.C. § 12131(1) (defining 'public entity' as 'any State or local government,' 'any department, agency, special purpose district, or other instrumentality of a State or States or local government,' or 'the National Railroad Passenger Corporation, and any other commuter authority').",body_text,text,0.9391891891891891,193,193,california_law_review_judiciary-ada
"129. In 2023, the labor force participation rate for disabled workers between ages sixteen and sixty-four was 40.2 percent, while the rate was 77.7 percent for nondisabled workers. Disability Employment Statistics , U.S. D EP ' T L AB ., https://www.dol.gov/agencies/odep/researchevaluation/statistics [https://perma.cc/669Y-X7CZ].",body_text,text,0.9681335356600911,194,194,california_law_review_judiciary-ada
"However, disabled judges, clerks, and other judicial employees can bring a valuable worldview that is different from their nondisabled peers. 130 More specifically, diversity in chambers can bring a more nuanced understanding to issues, helping to mitigate implicit bias and support balanced decisionmaking. 131 Diversity of thought and perspective helps explain the need for clerks. Clerks play a critical role in the crafting of judicial orders and their backgrounds inform their opinions on cases. 132 Working closely with a judge also gives clerks the capacity to provide diverse perspectives that a judge may not have and help shape their judge's opinions on a case. 133 Clerks with marginalized identities provide judges with more inclusive views about the law and individual cases. 134",body_text,text,0.9886792452830189,40,195,california_law_review_judiciary-ada
"130. See, e.g. , Prapaisilp, supra note 125, at 1227 ('[S]imply having diverse judges will surely bring different viewpoints than the ones that are commonly shared among white, male judges and the impact can be substantial.').",body_text,footnote,0.9845474613686535,195,197,california_law_review_judiciary-ada
"131. Deeva Shah & Greg Washington, Beyond Symbolism: Accepting the Substantive Value of Diversity in Law Clerk Hiring , 97 N OTRE D AME L. R EV . R EFLECTION 317, 328 (2022) ('When groups consist of individuals with different experiences and values, there are more viewpoints to inform the decision-making process. . . . [T]here are fewer blind spots or implicit biases that will linger without pushback.').",body_text,footnote,0.9259259259259259,196,198,california_law_review_judiciary-ada
"132. See id. at 329 ('Clerks can play significant roles in shaping case outcomes and specific opinion language. Clerks may influence which facts a judge may focus on or what caselaw a judge relies on in coming to a decision.'); Epps & Warren, supra note 119, at 296.",body_text,footnote,0.9887640449438202,197,199,california_law_review_judiciary-ada
