text,html_label,docling_label,similarity,html_index,pdf_index,document
"The notice-and-choice paradigm has dominated privacy regulation. These rules operate under the premise that collecting, distributing, and retaining personal information is permissible as long as reasonable notice is provided and consent is obtained. However, this model has been subject to extensive criticism. According to the American Law Institute's Data Privacy project, '[t]he overwhelming majority of commentary, scholarship, and empirical evidence suggests that traditional notice does not work.' This failure stems from several practical and structural shortcomings in how notice and choice is implemented.",body_text,text,0.996742671009772,39,61,chicago_law_review_children-and-cars-watch-them
"Privacy notices are often incomprehensible and lengthy, making it unrealistic to expect individuals to read them. Most individuals experience 'consent fatigue': They mechanically accept terms without real engagement. The cognitive burden imposed by notice-and-choice exceeds what individuals can actually take in, rendering consent ineffective. Additionally, the 'choice' offered is often illusory. Privacy decisions are typically presented in take-it-or-leave-it terms for essential services.",body_text,text,0.949290060851927,40,62,chicago_law_review_children-and-cars-watch-them
"Notice-and-choice frameworks, especially within families, create deep concerns that mirror the conflicts of interest we see in the criminal context. As scholars like Helen Nissenbaum have argued, privacy is not just individual but contextual and relational, and a notice-and-choice model ignores how data practices affect groups and social structures. Individual adults already demonstrate poor privacy decision-making for themselves-routinely accepting lengthy terms without reading them, misunderstanding the scope of the agreement, and consenting to arrangements they would reject if fully informed. Yet we rely on the parental control model that delegates children's privacy protections to parents, instead of creating substantive protections for children. As Professors Danielle Citron and Ari Waldman observe, 'no parent can meaningfully curtail corporate data collection, either for themselves or their children.'",body_text,text,0.9956521739130435,42,65,chicago_law_review_children-and-cars-watch-them
"Existing legal frameworks are inadequate to these concernsthey operate on a notice and choice basis, and rarely, if ever, consider how third parties can acquire children's data from AVs. Even if parents are well meaning, parental consent can become a vehicle for privacy violations rather than protection, exploited by corporations seeking to access children's data through parental permission and by law enforcement officers who obtain parental consent to gather evidence subsequently used to prosecute those same children.",body_text,text,0.9971401334604385,44,67,chicago_law_review_children-and-cars-watch-them
"The Children's Online Privacy Protection Act (COPPA) exemplifies these limitations. Although COPPA imposes a parental consent requirement for children under thirteen, it adopts the conventional notice-and-choice approach-despite widespread evidence that such notices are just clicked through by parents. If most Americans accept online terms of service without reading them, the percentage is likely even higher among time-constrained parents. Similarly, in the educational arena, scholars like Professor Zahra Takhshid advocate moving away from the parental consent apparatus toward more robust privacy protections for children for these reasons. For educational technology, parents often face a false choice: consent to data collection or impede their child's educational access. AVs present parallel concerns-when the choice lies between vehicle access for essential activities or no access at all, meaningful consent regarding data collection does not exist.",body_text,text,0.9968814968814969,45,68,chicago_law_review_children-and-cars-watch-them
"Rejecting surveillance altogether isn't realistic-or even desirable. As discussed at the outset of Part II, AVs need some monitoring in order to operate safely. The external cameras are integral to making sure the AV avoids collisions, and the internal surveillance can also be justified for safety, for example, making sure individuals are restrained. But we should ask ourselves seriously: What surveillance do we really need? What can we do without? And even for data that we need, how can we mitigate long-term harms?",body_text,text,0.9750479846449136,46,70,chicago_law_review_children-and-cars-watch-them
"So far, we've relied on notice and choice. As long as individuals consent, companies are free to collect whatever they want. Some reformers have proposed improving this process-providing consumers more notice, creating friction before proceeding, making privacy notices more concise. These incremental changes miss the fundamental issue: Every stakeholder in the child surveillance ecosystem-from car manufacturers to government agencies to parents-faces strong incentives to collect more data, not less. It's a one-way ratchet to full surveillance of children.",body_text,text,0.8912655971479501,47,71,chicago_law_review_children-and-cars-watch-them
"And while the child is a stakeholder, children lack representation. This makes them uniquely vulnerable to privacy infringements. Unlike adults who can vote, lobby, or organize to protect their interests, children depend entirely on others to advocate for their rights. This dependence becomes an issue when their privacy conflicts with an adult protecting their own interests. As Professor Aliza Hochman-Bloom has argued in the context of curfews, it is unlikely that parents will oppose curfews, even when they are harmful to children. Few parents will publicly argue that children should be allowed out alone at night, and just as few will argue that children",body_text,text,0.839568801521877,48,72,chicago_law_review_children-and-cars-watch-them
"Additionally, companies and government agencies are unlikely to embrace restraint in collecting and sharing only necessary data. Ride patterns hold tremendous value, not just for marketing to individuals, but for analyzing broader behavioral trends. Dozens of data brokers admit to selling minors' data, including reproductive health care and geolocation information. Children's data holds special value to data brokers (estimated in the hundreds of billion dollars in the United States alone). Given these financial incentives, it's unrealistic to expect companies to care about children's privacy in the absence of regulation.",body_text,text,0.9936305732484076,49,74,chicago_law_review_children-and-cars-watch-them
"The notice-and-choice framework has failed children. We need substantive limits on what data companies can collect about kids and how they use it. In this section, I propose three concrete reforms: (1) robust data minimization, particularly with regard to in-cabin surveillance recordings; (2) strict limitations on the sale and sharing of data with third parties, including data brokers and law enforcement; and (3) clear statutory data retention and deletion requirements. Though this Essay focuses on AVs, these reforms have implications for all surveillance systems that touch children's lives.",body_text,text,0.9983277591973244,50,75,chicago_law_review_children-and-cars-watch-them
"While these principles are seldom codified into binding obligations under U.S. law, they should be. Current industry practices permit continuous, high-resolution video recording of minor passengers with minimal justification. This approach inverts appropriate privacy baselines: Comprehensive surveillance becomes the default rather than the exception. Legal frameworks should instead establish a presumption against full-time recording unless companies can",body_text,text,0.9067460317460317,52,78,chicago_law_review_children-and-cars-watch-them
"In-cabin video is marketed as essential to ensure rider safety, prevent misuse, and enable remote customer support. However, these safety objectives might be achievable through less invasive means. Alternative approaches could include audio-only monitoring, ondemand surveillance systems that only activate during an emergency, or simple physical sensor technology (to verify compliance with things like seatbelt usage). Part of data minimization is collecting information for vehicle safety without a default of sharing it with third parties, including parents. These policies limit unnecessary data collection while still fulfilling safety functions.",body_text,text,0.9992337164750957,53,80,chicago_law_review_children-and-cars-watch-them
"The commodification of children's personal information through secondary data markets is one of the most urgent threats to children's digital privacy. The data broker ecosystem has institutionalized what scholars term 'surveillance capitalism': the systematic extraction and monetization of behavioral data that deepens existing inequalities and exploits vulnerable populations, including children. In the AV context, the data that companies collect can easily enter these secondary markets. Recent investigations confirm that data brokers frequently traffic in this kind of sensitive information and even purposely create design tools to hide privacy violations-playing a 'cat and mouse' game to get the most sensitive information possible.",body_text,text,0.9298245614035088,54,82,chicago_law_review_children-and-cars-watch-them
"Law enforcement agencies also increasingly bypass warrant requirements by purchasing data directly from companies or data brokers, circumventing constitutional protections. In 2025, Montana became the first state to close this loophole by requiring warrants before government agencies can purchase electronic communications or other sensitive data. Such measures are the first step to protecting children's intimate privacy from exploitative secondary markets.",body_text,text,0.9978260869565218,56,84,chicago_law_review_children-and-cars-watch-them
"Most privacy scholars focus on access and control of data, but retention and deletion are important elements as well. Even when AV companies collect data for legitimate safety purposes, retention of that data poses a serious threat to children's privacy. The longer intimate data is stored, the more opportunities exist for abuse, theft, and misuse. There is the threat of hacking, often revealing very private information about individuals. Additionally, sharing a child's data with police presents separate dangers that I have thoroughly documented in previous work. Given these harms, regulations should require that companies delete in-cabin recordings, location histories, and other sensitive information related to child passengers as soon as the immediate operational purpose has been served.",body_text,text,0.9987484355444305,57,86,chicago_law_review_children-and-cars-watch-them
"Short retention limits are also key to prevent law enforcement abuses. Data for criminal investigations can be perpetually retained under current laws, with previously innocuous information revealing new insights in the future. This state of permanence stands in contrast to juvenile justice principles: While all states mandate juvenile record expungement or sealing, digital search data can persist indefinitely on law enforcement servers because most agencies lack data deletion policies. Without meaningful deletion policies, children face the risk of perpetual exposure, undermining their right to second chances and clean slates.",body_text,text,1.0,58,87,chicago_law_review_children-and-cars-watch-them
"The rise of AVs offers unprecedented mobility for children, yet it also brings the potential for unprecedented surveillance. In-cabin monitoring, location tracking, and the sale of all that data combine to create a digital dossier of children's lives. Young people cannot understand, opt-out, or meaningfully control the AV data collected about them. Our legal frameworks fail to keep pace-not just because of legislative inertia, but because the privacy laws we do have are built on a flawed foundation: the notice-and-choice paradigm and parental consent.",body_text,text,0.7666068222621185,59,89,chicago_law_review_children-and-cars-watch-them
"This Essay challenges that foundation. Children are not just extensions of their parents. Their privacy interests may be different. Surveillance, even when well intentioned, can undermine their developmental needs, chill exploration, and curb appropriate risktaking. For marginalized youth in particular, these risks are compounded by inequities that make surveillance not just invasive but punitive.",body_text,text,0.9987515605493134,60,90,chicago_law_review_children-and-cars-watch-them
"We must reorient privacy law to protect children as rightsholders in their own right. Until then, the cars that carry our children will continue to watch them-and worse, expose them-in ways they may not understand but will nonetheless feel.",body_text,text,0.9896049896049897,62,93,chicago_law_review_children-and-cars-watch-them
Nila Bala is an Acting Professor of Law (tenure track) at UC Davis School of Law.,body_text,text,1.0,64,95,chicago_law_review_children-and-cars-watch-them
