text,html_label,docling_label,similarity,html_index,pdf_index,document
"The San Francisco Standard reported that Chris's fifteen-yearold daughter has a new way of getting around: Waymo robotaxis. Chris and his wife describe it as the 'best thing that's ever happened' to them: 'It was instantly awesome,' remarked Chris, who used only his first name so that his Waymo account would not be banned. 'We don't have to worry about her getting home, ever.'",body_text,text,0.9354413702239789,1,5,chicago_law_review_children-and-cars-watch-them
"* Acting Professor of Law (tenure track), UC Davis School of Law. The author thanks Khalid Albutairi, Elizabeth Brandt, Simone Montgomery, Madeline Reed, and Lauren Yi for their assistance.",body_text,footnote,0.7884615384615384,0,7,chicago_law_review_children-and-cars-watch-them
"1 ""Passengers 17 and under can ride as your guests. For our little passengers under 8 years old, you'll need to bring a car or booster seat and secure it in the back seat according to the manufacturer's installation instructions. Children under the age of 8 cannot sit in the front. Learn more in our Help Center.""",footnote,footnote,0.9904458598726115,0,8,chicago_law_review_children-and-cars-watch-them
"autonomous vehicles (AVs) to public transportation, feeling a robot chauffeur is safer. Many parents like that they can track its location at all times. Additionally, robotaxis have cameras inside to record what is happening at all times, and Waymo support staff sometimes intervene when they see unsafe behavior. These cameras address a key concern for parents: Parents generally support AV use by their children, with a caveat. They want video surveillance that they can access at all times. While minors are not yet permitted to travel alone in Waymo vehicles, that policy is likely to change in the near future. Waymo has just announced the launch of a program for teen passengers, and there are parents who would welcome Waymo allowing even younger passengers.",body_text,text,0.8864426419466975,2,9,chicago_law_review_children-and-cars-watch-them
"This Essay considers the unique privacy issues that emerge based on the normalization of child ridership in AVs. As many scholars have argued, cars are not simply cars. They are used as spaces to have conversations, to engage in intimate activities, and even as homes. Cars are especially important as private spaces for adolescents as they develop their identities.",body_text,text,1.0,3,10,chicago_law_review_children-and-cars-watch-them
"Cars are also not simply cars in an additional way: They are a computer on wheels, collecting highly revealing location information. Following Dobbs v. Jackson Women's Health Organization (2021), minors face unprecedented restrictions on reproductive and genderaffirming healthcare access, car trips to access care could now carry potential criminal implications. In this environment, aggregating location information to clinics and medical facilities raises the danger of prosecutions. As the Supreme Court articulated in Carpenter v. United States (2017), knowledge of an individual's movements over 'public thoroughfares and into private residences, doctor's offices, political headquarters, and other potentially revealing locales' can paint an extraordinarily detailed and intimate picture of their lives. The Court was talking about cell site location data, but today's vehicles can provide much of the same.",body_text,text,0.9743028977583379,4,11,chicago_law_review_children-and-cars-watch-them
"Data collection is ubiquitous, and children are at particular risk. AVs (and smart vehicles in general) can collect and retain massive amounts of data, subjecting children to 'dataveillance' without their knowledge. This information-the child's location, actions, statements, imagery, and videos, can be shared with various parties, including law enforcement. AVs are part of a larger story of 'always-on' devices that constantly collect data from users, often without their knowledge or consent. The relentless data collection raises concerns about equity. Not all children will be subjected to privacy risks equally-those from marginalized communities with fewer transportation choices may suffer disproportionate surveillance.",body_text,text,0.9780521262002744,5,12,chicago_law_review_children-and-cars-watch-them
"These two failures reveal that meaningful privacy protection for children cannot be achieved through procedural reforms to notice-andchoice mechanisms. Instead, such protections require substantive legal safeguards that operate independently of parental authorization. By examining how AV surveillance systems threaten children's privacy, this work develops principles with broad applicability across various technologies that collect children's data.",body_text,text,0.9966777408637874,8,15,chicago_law_review_children-and-cars-watch-them
"Self-driving cars have long captivated the world's imagination. They were the stuff of dreams, but they are now a reality. Vehicles with some level of automation, namely some basic safety features like cruise control, have been available for the last fifty years. But higher levels of automation are a new phenomenon. SAE International, formerly the Society of Automotive Engineers, has created a taxonomy for defining these various levels of automation, from level 0 (no driving automation) up to level 5 (full driving automation). Only recently have manufacturers been able to make level 3 and 4 vehicles. Level 4, exemplified by Waymo, allows for something closer to full autonomy.",body_text,text,0.9985380116959064,11,21,chicago_law_review_children-and-cars-watch-them
"Advanced automation means much higher amounts of data collection and storage by AVs. AVs rely on more than a dozen cameras and sensors strategically positioned around the car. Today's AVs collect approximately one hundred times more data than a personal smartphone. While the primary purpose of this data collection is to enable safe and efficient autonomous driving, it inevitably captures personal information about individuals in the vehicle's vicinity. Cameras can potentially record identifiable faces, license plates, and even activities inside nearby buildings or homes. This footage could be placed through facial recognition software and could also be stored in perpetuity.",body_text,text,0.998533724340176,12,22,chicago_law_review_children-and-cars-watch-them
"The privacy implications of AVs extend beyond personal ownership. Especially while the technology is still nascent, most people are likely to encounter AVs through ridesharing and rentals, making these contexts the most likely sites of data collection. AV fleets, such as Waymo, and more traditional models that may incorporate AVs in the future, like Uber and Lyft, track not just pickup and dropoff locations but also entire route histories and other personal information. Rented AVs are likely to collect similar information but tend to engage in greater integration with users' smart devices, absorbing demographic details, entertainment preferences, and contact lists. Additionally, AVs might employ biometric systems for vehicle access, adding another layer of sensitive data collection.",body_text,text,0.9987389659520807,13,23,chicago_law_review_children-and-cars-watch-them
"concerns. Primary use refers to data collected for the express purpose of enabling the core function of the technology. But data rarely stays confined to its original purpose. Consider a vehicle company collecting information that allows their cars to safely and effectively transport passengers. However, this information is shared and sold to third parties, either directly or through data brokers, exposing passengers to secondary uses. Similarly, in the AV context, car companies might share behavioral data with third-party advertisers-for example, that an individual goes to a health clinic once a month. It is no surprise modern vehicles have been categorized as 'the worst performing product category for privacy protections.'",body_text,text,0.920075519194462,14,25,chicago_law_review_children-and-cars-watch-them
"In sum, the expansion of AVs, and the vast amounts of data they collect, raise urgent questions about the adequacy of existing privacy laws to protect consumers.",body_text,text,1.0,15,26,chicago_law_review_children-and-cars-watch-them
"AV regulations are limited at both the federal and state level, in a way that parallels the general inertia of legal responses to technological advances. This section first examines AV-specific legislation, followed by broader privacy laws relevant to the data AVs collect. Roughly thirty-five states have legislation responsive to current AV technology; however, most of these statutes focus mainly on safety, rather than privacy. Only a single state, Utah, has proposed legislation mentioning children. In 2020, the state tried to enact provisions regarding transporting minors in AVs for-hire, mainly around safety. In a similar vein, the state tried to establish a working group the following year on unaccompanied minors and AVs but failed.",body_text,text,1.0,16,28,chicago_law_review_children-and-cars-watch-them
"At the federal level, statutes or regulations are absent. In both 2017 and 2018, Congress failed to pass AV START, a bill aimed at regulating the safety and development of AVs. To date Congress has never passed legislation specific to automated driving. The National Highway Traffic Safety Administration (NHTSA) has issued guidance on cybersecurity best practices for AVs, which serve as recommendations for the industry but lack the force of law. Although broad privacy laws might provide some protection, they are not equipped to handle the data practices of AVs. For example, Children's Online Privacy Protection Act (COPPA), a federal law enacted in the 1990s to protect children who use online services, has a number of deficiencies. It protects only children under thirteen and relies upon notice and choice of parents. COPPA also may not cover data collected from AVs, since it is focused on personal information collected by websites and online services.",body_text,text,1.0,17,29,chicago_law_review_children-and-cars-watch-them
"Similarly, the Driver's Privacy Protection Act (DPPA) is focused on the driver's data and requires state agencies to obtain a driver's express consent before releasing any personal information obtained in connection with a motor vehicle record. However, the DPPA contains several exceptions that would seem to allow in-cabin monitoring to take place. These include legitimate needs by any government agency in carrying out its functions, and when there is a 'use in connection with matters of motor vehicle or driver safety and theft' and 'motor vehicle market research activities.' In-cabin recordings might also not be considered a 'motor vehicle record' in the first place, thus evading the DPPA's protections altogether. And like COPPA, express consent continues to function as a broad permission slip to disclosure.",body_text,text,0.9597560975609756,18,30,chicago_law_review_children-and-cars-watch-them
"There are a number of relevant state laws, though these too have limitations. California is one of the few states that provides consumers with limited protections around the personal information their vehicle is gathering about them. In 2023, the California Privacy Rights Act (CPRA) took effect and included geolocation within the definition of 'sensitive personal information,' opening up the possibility the CPRA could regulate AV data collection. Notably, the California Privacy Protection Agency has announced a review of data privacy practices of 'connected' vehicles, which have features like location sharing, smartphone integration, and cameras, signaling regulatory interest in this area. Another relevant California state law is the California Invasion of Privacy Act (CIPA), an anti-wiretapping and anti-eavesdropping statute that prohibits unauthorized interceptions of communications in order to protect the right of privacy. While CIPA offers protections against unauthorized recordings, its practical impact is limited in the AV context, in which parental consent has ostensibly been obtained.",body_text,text,0.9882777276825969,19,31,chicago_law_review_children-and-cars-watch-them
"Several states-Virginia, Colorado, Connecticut, and Utah-also have general data protection laws that require companies to get consent for processing sensitive data, including geolocation, and set modest limits on data flows. In addition, companies that also operate in the European Union must comply with the General Data Protection Regulation (GDPR) requirements that set standards for the collection, processing, and storing of personal data by AVs. These laws were not written specifically with AVs in mind, so regulatory gaps remain.",body_text,text,0.9962756052141527,20,32,chicago_law_review_children-and-cars-watch-them
"altogether. Given that children cannot drive, they face an even greater dependency on the adults in their life to travel. This dependency is particularly acute for children from low-income households, who often struggle to access school, extracurriculars, medical appointments, and social events. Transportation access thus represents more than convenience-it constitutes a prerequisite for educational mobility and social participation.",body_text,text,0.8051708217913204,21,35,chicago_law_review_children-and-cars-watch-them
"As AVs edge closer to widespread adoption, a number of public interest groups have begun to look at the unique challenges associated with child passengers. In 2018, the organization Safe Kids Worldwide created a Blue Ribbon Panel, Children in Autonomous Vehicles. The calls to action include increased safety standards, usability testing for families, inclusive design, appropriate supervision, and marketing safe transportation using restraints. Significantly, all of the Blue Ribbon Panel's recommendations focus on child safety rather than privacy. This narrow focus on physical safety is mirrored in much of the emerging literature, which tends to look at parents' attitudes and beliefs around AV safety for their children. Parents in particular have highlighted the need for more surveillance within the vehicle's cabin, including that a camera and microphone are requirements to their children to both monitor and communicate with their children. However, few studies have looked at children's attitudes, and none have focused specifically on children's privacy.",body_text,text,0.9953183520599251,22,36,chicago_law_review_children-and-cars-watch-them
"As AVs evolve, children are likely to use them not only for transit, but as temporary extensions of home, school, and social life. For children commuting alone or spending significant time in transit, AVs may become spaces where they complete homework, communicate with friends, nap, change clothes for extracurriculars, or process personal emotions. Survey data reveals that individuals already regularly engage in a wide range of intimate activities within their vehicles-from routine behaviors like eating and communicating to more private activities such as sleeping, changing clothes, and engaging in sexual activities. AVs will only amplify this trend, and make cars even more dwelling-like by freeing up passengers from tasks related to driving. This shift toward treating vehicles as personal living spaces heightens the need for privacy protections. Privacy concerns affect all vehicle occupants, but they become particularly acute for children, whose developmental stage makes them especially vulnerable to privacy intrusions. The next section takes up that concern.",body_text,text,0.9990706319702602,23,37,chicago_law_review_children-and-cars-watch-them
"As young people start to be alone in cars, safety concerns naturally arise for parents, car manufacturers, insurance companies, and government regulators. These concerns are legitimate. Some forms of in-cabin monitoring may not only be desirable, but necessary. For children who are unattended passengers, surveillance could assist in emergencies; for example, if the vehicle broke down and the child needed to call for help or was facing a medical emergency. Additionally, if a child is unattended, surveillance may help determine if the child is properly restrained during the journey. Surveillance could allow for automatic adjustment of safety systems based on passenger size and position and ensure the use of child safety restraints when appropriate.",body_text,text,1.0,24,39,chicago_law_review_children-and-cars-watch-them
"In some cases, the impetus for surveillance extends beyond child-specific concerns. In-cabin monitoring can serve broader interests-to protect companies from vandalism, misuse, and other misbehavior by occupants. Surveillance may help mitigate these risks. Yet any safety benefits must be weighed against developmental costs. Adolescence is a critical period of identity formation and growing independence, historically supported by private spaces, and undermined by constant monitoring. Part II of this Essay explores two distinct but related surveillance dynamics: The first section of this Part addresses the harms of parental surveillance, while the second section considers harms beyond parents-harms from law enforcement and other third parties monitoring children. While treated separately here, parental and third-party surveillance are closely linked. As I have argued in previous work, parental surveillance-and parental consent to surveillance-can facilitate and legitimize third-party monitoring of children.",body_text,text,0.9117647058823529,25,40,chicago_law_review_children-and-cars-watch-them
"AV surveillance does not just implicate spatial autonomy for youth, but control over their inner worlds-their thoughts and choices. Surveillance harms children's self-development during a time when they are particularly vulnerable. Yet today's young people face unprecedented surveillance across all domains of their lives. Unlike the past, when children could explore ideas in books and libraries without online tracking, today's surveillance denies children the ability to develop and express themselves without shame or judgment.",body_text,text,0.9924812030075187,26,42,chicago_law_review_children-and-cars-watch-them
"Increasingly, good parenting equals perpetual surveillance. Companies capitalize on parental anxieties about safety and success, suggesting that parents who don't embrace comprehensive monitoring technologies are somehow falling short of their duties, even though our children are not in greater danger, and in fact are far safer, than past generations. The marketing narrative transforms surveillance from an option into an obligation, reimagining the parent-child relationship through a lens of constant observation and data collection.",body_text,text,0.9981412639405205,28,45,chicago_law_review_children-and-cars-watch-them
"Constant monitoring of young people undermines developmental processes that require freedom from observation. These developmental processes include identity exploration, role experimentation, and the formation of a coherent self-concept. Privacy plays a crucial role in this process, as it provides adolescents with the space to experiment with different self-presentations and develop their unique identity away from constant adult scrutiny. This experimentation involves gradually taking on more responsibilities and making choices about their future, which requires a degree of freedom from parental control and often a shift in attachment to peers. Unfortunately, current research on teen technology often takes a misguided 'risk-centric' approach. But restricting children's participation in an effort to protect them may, ironically, lead to greater long-term risks. For children, surveillance instills a sense of mistrust and suspicion, conditions that can ultimately breed the very misbehavior that authorities are seeking to prevent. Children, feeling pre-judged as potential wrongdoers, may act out in rebellion against the very system meant to 'improve' their behavior.",body_text,text,0.9898305084745763,29,46,chicago_law_review_children-and-cars-watch-them
"The car is also a conduit to spaces that children may not have parental support to access. Specifically, vehicles may be the way young people access reproductive and gender-affirming healthcare. For children in the LGBTQ+ community, transportation may be a lifeline to finding communities where they can find acceptance and support. As Professor Danielle Citron explains, children's intimate privacydefined as control over access to their 'bodies, minds, health, sex, sexual orientation, gender identity, and close relationships'-is fundamental to their ability to thrive. In this context, vehicles function not merely as transportation, but as tools of empowerment toward intimate privacy and resistance against oppressive circumstances.",body_text,text,0.9153689911983751,31,49,chicago_law_review_children-and-cars-watch-them
"The loss of private space in vehicles not only undermines adolescents' development, it also opens the door to something more insidious: the systemic repurposing of children's data. Surveillance in AVs does not end with the gaze of a parent or the car company simply collecting information for safety; it becomes part of a larger infrastructure in which intimate details about a child's behavior, location, and associations can be retained, shared, and used in ways far removed from the original purpose. Monitoring for safety has its risks, but the harms go beyond these to policing, profiling, and punishment-especially for those who are already at the margins.",body_text,text,0.9939577039274925,32,50,chicago_law_review_children-and-cars-watch-them
"Information collected to ensure child safety in AVs and maintain AV performance will inevitably find its way to secondary uses-a pattern well established across digital domains. Nearly every automaker is already selling driver behavioral data, including where, when, and how fast individuals drive. AV-generated data, and specifically in-cabin monitoring, will almost certainly follow this same trajectory.",body_text,text,0.9975369458128078,33,52,chicago_law_review_children-and-cars-watch-them
"The consequences of surveillance creep will not fall equally across society. Black and Brown children, poor children, and disabled youth may be the most likely to be surveilled, with their data more frequently channeled to law enforcement. Easy access to digital evidence could create a net-widening effect of youth entering the carceral system. Even seemingly innocuous location data can create prosecutorial evidence for establishing patterns and documenting",body_text,text,0.7718120805369127,34,53,chicago_law_review_children-and-cars-watch-them
"Surveillance could also be used for new crimes that have emerged in the wake of Dobbs . Now, minors face increasing restrictions in accessing reproductive and gender-affirming health care. Location data from reproductive healthcare clinics has been targeted and sold by multiple data brokers. Law enforcement can bypass legal requirements and buy personal data in bulk from data brokers, regardless of any evidence of a crime. This practice allows police to circumvent the need for gathering evidence and obtaining a warrant based on probable cause, which is typically required to access such data.",body_text,text,0.999163179916318,35,55,chicago_law_review_children-and-cars-watch-them
"For police and the government, in-cabin monitoring in AVs is a surveillance opportunity. With storage costs plummeting, there's little incentive to delete anything. Information can be aggregated and stored in a database in perpetuity. We have already seen how surveillance databases, like those tracking alleged gang members, become powerful tools wielded against minority communities. It is likely that law enforcement use of AV surveillance will replicate this trend.",body_text,text,1.0,36,56,chicago_law_review_children-and-cars-watch-them
"Once car companies generate this data, it develops a life of its own. The Supreme Court's decision in Carpenter v. United States, which has been interpreted narrowly by lower courts, offers little protection. In Carpenter , the Supreme Court grappled with the continued viability of the third-party doctrine, which traditionally held that individuals have no reasonable expectation of privacy in information shared with third parties. The Court reconsidered this doctrine's application in the digital age and held that accessing a week's worth of cell location data requires a warrant, even though individuals shared this information with service providers who are third parties. This decision recognized that people still have a 'reasonable expectation of privacy' in certain types of digital information despite sharing it with a third party.",body_text,text,0.995850622406639,37,57,chicago_law_review_children-and-cars-watch-them
"Carpenter 's impact has been limited, with courts resolving a shockingly high rate of cases based on the 'good faith exception' to the exclusion rule and denying Fourth Amendment protections in 82.6% of postCarpenter cases. Policing agencies continue to defend third-party data access on the grounds that people have consented to third-party access by using these apps. Some courts have supported this logic, drawing the line between voluntary, affirmative acts and automatically generated information. When parents affirmatively consent to in-cabin surveillance to ease their anxiety, they likely",body_text,text,0.7777049180327869,38,58,chicago_law_review_children-and-cars-watch-them
