page_no,pdf_text,pdf_original_label,pdf_corrected_label,matched_html_body,matched_html_footnote,match_confidence,match_status
31,"149. Merrill, supra note 148. For a discussion of the evolution in judicial deference to agencies in this period, see Blake Emerson, Vindicating Public Rights , 26 U. P A . J. C ONST . L. 1424 (2024).",footnote,footnote,,"[149]. Merrill,supranote 148. For a discussion of the evolution in judicial deference to agencies in this period, seeBlake Emerson,Vindicating Public Rights, 26 U. Pa. J. Const. L. 1424 (2024).",95.26315789473684,matched
31,"150. Merrill, supra note 148, at 953-64; Ill. Cent. R.R. Co. v. Interstate Com. Comm'n, 206 U.S. 441 (1907); Interstate Com. Comm'n v. Ill. Cent. R.R. Co., 215 U.S. 452, 470 (1910).",footnote,footnote,,"[150]. Merrill,supranote 148, at 953–64; Ill. Cent. R.R. Co. v. Interstate Com. Comm’n, 206 U.S. 441 (1907); Interstate Com. Comm’n v. Ill. Cent. R.R. Co., 215 U.S. 452, 470 (1910).",98.87640449438202,matched
32,"and  Commission  decisions  are  'reached  ordinarily  upon  voluminous  and conflicting evidence, for the adequate appreciation of which acquaintance with many intricate facts of transportation is indispensable, and such acquaintance is commonly to be found only in a body of experts.' 151 Regulated firms did not regain their private right to bargain for whatever rate the market would bear, but they  did  find  a  judicial  forum  in  which  to  test  the  'reasonableness'  of  the commissioners' rates.",text,body_text,"As with adjudication, courts deferred to agencies for both pragmatic and statutory reasons. For example, courts often pointed out that the administrative “inquiry is essentially one of fact and of discretion in technical matters,” “uniformity can be secured only if its determination is left to the Commission,” and Commission decisions are “reached ordinarily upon voluminous and conflicting evidence, for the adequate appreciation of which acquaintance with many intricate facts of transportation is indispensable, and such acquaintance is commonly to be found only in a body of experts.”[151]Regulated firms did not regain their private right to bargain for whatever rate the market would bear, but they did find a judicial forum in which to test the “reasonableness” of the commissioners’ rates.",,97.88519637462235,matched
32,"As rate regulation became more complex and administrative records more voluminous,  courts  accepted  that  agencies  were  better  suited  to  weigh  in  on technical matters and to consider the enormous amount of evidence submitted in rate decisions. Surprisingly, however, courts did not impose a more searching standard of review for questions of law. In fact, by the 1920s, when upholding an ICC order, the Court acknowledged that 'what construction shall be given to a railroad tariff presents ordinarily a question of law which does not differ in character from those presented when the construction of any other document is in dispute.' 152 This mode of prudential reasoning justified judicial deference to agency interpretations of law:",text,body_text,"As rate regulation became more complex and administrative records more voluminous, courts accepted that agencies were better suited to weigh in on technical matters and to consider the enormous amount of evidence submitted in rate decisions. Surprisingly, however, courts did not impose a more searching standard of review for questions of law. In fact, by the 1920s, when upholding an ICC order, the Court acknowledged that “what construction shall be given to a railroad tariff presents ordinarily a question of law which does not differ in character from those presented when the construction of any other document is in dispute.”[152]This mode of prudential reasoning justified judicial deference to agency interpretations of law:",,98.4993178717599,matched
32,"But words are used sometimes in a peculiar meaning. Then extrinsic evidence  may  be  necessary  to  determine  the  meaning  of  words appearing  in  the  document.  This  is  true  where  technical  words  or phrases not commonly understood are employed, or extrinsic evidence may be necessary to establish a usage of trade or locality which attaches provisions not expressed in the language of the instrument. Where such a situation arises, and the peculiar meaning of words, or the existence of a  usage,  is  proved  by  evidence,  the  function  of  construction  is necessarily preceded by the determination of the matter of fact. Where the controversy over the writing arises in a case which is being tried before a jury, the decision of the question of fact is left to the jury, with instructions from the court as to how the document shall be construed, if the jury finds that the alleged peculiar meaning or usage is established. But where the document to be construed is a tariff of an interstate carrier, and before it can be construed it is necessary to determine upon evidence the peculiar meaning of words or the existence of incidents alleged to be attached by usage to the transaction, the preliminary determination must be made by the Commission; and not until this determination has been made, can a court take jurisdiction of the controversy. 153",text,body_text,"But words are used sometimes in a peculiar meaning. Then extrinsic evidence may be necessary to determine the meaning of words appearing in the document. This is true where technical words or phrases not commonly understood are employed, or extrinsic evidence may be necessary to establish a usage of trade or locality which attaches provisions not expressed in the language of the instrument. Where such a situation arises, and the peculiar meaning of words, or the existence of a usage, is proved by evidence, the function of construction is necessarily preceded by the determination of the matter of fact. Where the controversy over the writing arises in a case which is being tried before a jury, the decision of the question of fact is left to the jury, with instructions from the court as to how the document shall be construed, if the jury finds that the alleged peculiar meaning or usage is established. But where the document to be construed is a tariff of an interstate carrier, and before it can be construed it is necessary to determine upon evidence the peculiar meaning of words or the existence of incidents alleged to be attached by usage to the transaction, the preliminary determination must be made by the Commission; and not until this determination has been made, can a court take jurisdiction of the controversy.[153]",,97.83258594917787,matched
32,"Courts deferred to agencies about some questions of law because they recognized that agencies possessed specific expertise about railroad and energy rates, and",text,body_text,"Courts deferred to agencies about some questions of law because they recognized that agencies possessed specific expertise about railroad and energy rates, and because many questions of rate construction required uniformity across a regulated industry.[154]",,100.0,matched
32,"151. Great N. Ry. Co. v. Merch.'s Elevator Co., 259 U.S. 285, 291 (1922).",footnote,footnote,,"[151]. Great N. Ry. Co. v. Merch.’s Elevator Co., 259 U.S. 285, 291 (1922).",98.59154929577466,matched
32,152. Id.,footnote,footnote,,[152].Id.,100.0,matched
32,153. Id. at 291-92.,footnote,footnote,,[153].Id.at 291–92.,94.11764705882352,matched
33,because  many  questions  of  rate  construction  required  uniformity  across  a regulated industry. 154,text,body_text,"Courts deferred to agencies about some questions of law because they recognized that agencies possessed specific expertise about railroad and energy rates, and because many questions of rate construction required uniformity across a regulated industry.[154]",,95.52238805970148,matched
33,"Thus, most of what would today be fought about using a separation-ofpowers vocabulary was resolved by straightforward statutory construction. As late as 1936, in Saint Joseph Stock Yards , which Justice Gorsuch cited in Loper Bright , the Court would write:",text,body_text,"Thus, most of what would today be fought about using a separation-of-powers vocabulary was resolved by straightforward statutory construction. As late as 1936, inSaint Joseph Stock Yards, which Justice Gorsuch cited inLoper Bright,the Court would write:",,98.01587301587301,matched
33,"When the Legislature  itself  acts  within  the  broad  field  of  legislative discretion,  its  determinations  are  conclusive.  When  the  Legislature appoints an agent to act within that sphere of legislative authority, it may endow  the  agent  with  power  to  make  findings  of  fact  which  are conclusive,  provided  the  requirements  of  due  process  which  are specially applicable to such an agency are met, as in according a fair hearing and acting upon evidence and not arbitrarily. 155",text,body_text,"When the Legislature itself acts within the broad field of legislative discretion, its determinations are conclusive. When the Legislature appoints an agent to act within that sphere of legislative authority, it may endow the agent with power to make findings of fact which are conclusive, provided the requirements of due process which are specially applicable to such an agency are met, as in according a fair hearing and acting upon evidence and not arbitrarily.[155]",,93.39019189765459,matched
33,"This did not mean judicial review was at an end. On the question of the right to be free from a regulatory taking, courts owed no deference whatsoever to agencies' (or legislatures') factual or legal judgments about confiscation. 156 What today is a dispute over the allocation of power was then resolved as a matter of rights.",text,body_text,"This did not mean judicial review was at an end. On the question of the right to be free from a regulatory taking, courts owed no deference whatsoever to agencies’ (or legislatures’) factual or legal judgments about confiscation.[156]What today is a dispute over the allocation of power was then resolved as a matter of rights.",,100.0,matched
33,C. Separation of Powers as General Law,section_header,body_text,"Despite ongoing disagreement about how the Constitution allocates powers among the different branches, the two dominant schools of thought in American separation-of-powers debates—formalism and functionalism—agree on three premises: Certain powers inhere in certain government branches, some powers are vested exclusively in one or another branch, and the judiciary is the final arbiter of separation-of-powers disputes. Disagreement is largely about how powers should be parsed and which should be shared. Yet over the long lifespan of our constitutional tradition, momentous doctrinal upheavals are relatively commonplace. This Article describes four tectonic shifts in separation-of-powers doctrine: Founding-era debates about how to define and blend powers, nineteenth-century debates about the constitutionality of the nascent civil service,Lochner-era debates about legislatures’ authority to define and regulate public utilities, and mid-nineteenth-century debates about the sources of international law. The first, which we call the Inherency Theory, assumes that certain powers and functions are vested by force of the Constitution, are core to a single branch, and are discernible by the judiciary. This is a taxonomical theory of how the Constitution allocates powers, and it animates nearly all of today’s separation-of-powers debates. The second, an Antidomination Theory, denies that the words executive, legislative, and judicial imply any new or distinct powers and instead creates formal separation between the three branches based on the procedures federal actors deploy to enact, enforce, and interpret policy. The third, a rights-based Public Utility Theory, distinguishes between a public sphere that is subject to congressional, presidential, and administrative control, and a private sphere that is not. Recently, this public-private distinction has been marshalled to define the judicial power. Historically, however, it was used to deduce a whole panoply of structural limits, including the constitutionality of agency adjudication and deference. And the fourth, a General Law approach, discerns the limits of government power by reference to the eclectic authority of the common law and right reason. Recovering these theories reveals a rich set of tools for resolving interdepartmental disputes, highlights that current receptions of past settlements are nearly unintelligible without understanding the theoretical context in which they emerged, and suggests that, while different theories have risen and fallen, no one theory of separation of powers has been liquidated in our constitutional tradition.",,78.94736842105263,matched
33,"Today, functionalists and formalists often assume that they are expounding a Constitution whose legal force derives from the people's sovereign authority, and whose interpretive principles are both parochial to the American state and can prospectively apply to novel constitutional questions. In earlier periods of our constitutional history, however, constitutional interpretation included a form of  moral reasoning that transcended the text of the Constitution, our national borders, and our modern ideas about positive law. On this view, the Constitution, like other bodies of law, incorporated an 'unwritten law that was taken to be common throughout the nation rather than produced by any particular state.' 157",text,body_text,"Today, functionalists and formalists often assume that they are expounding a Constitution whose legal force derives from the people’s sovereign authority, and whose interpretive principles are both parochial to the American state and can prospectively apply to novel constitutional questions. In earlier periods of our constitutional history, however, constitutional interpretation included a form of moral reasoning that transcended the text of the Constitution, our national borders, and our modern ideas about positive law. On this view, the Constitution, like other bodies of law, incorporated an “unwritten law that was taken to be common throughout the nation rather than produced by any particular state.”[157]",,99.86033519553072,matched
33,"154. See  id. at  293-94  (describing Loomis  v.  Lehigh  Valley  R.R . Co. ,  240  U.S.  43  (1916), involving a tariff that was silent about who should bear the costs of ensuring certain safety devices were used, and deferring to the commission's judgment because the issue called for the uniform exercise of administrative discretion).",footnote,footnote,,"[154].See id.at 293–94 (describingLoomis v. Lehigh Valley R.R.Co., 240 U.S. 43 (1916), involving a tariff that was silent about who should bear the costs of ensuring certain safety devices were used, and deferring to the commission’s judgment because the issue called for the uniform exercise of administrative discretion).",95.9375,matched
33,"155. St. Joseph Stock Yards Co. v. United States, 298 U.S. 38, 51 (1936).",footnote,footnote,,"[155]. St. Joseph Stock Yards Co. v. United States, 298 U.S. 38, 51 (1936).",98.59154929577466,matched
33,156. See id. at 51-53 (describing the duty of the judiciary to make an 'independent judgment' on the takings question); see also id. at 53 ('The established principle which guides the court in the exercise of its judgment on the entire case is that the complaining party carries the burden of making a convincing showing and that the court will not interfere with the exercise of the rate-making power unless confiscation is clearly established.').,footnote,footnote,,[156].See id.at 51–53 (describing the duty of the judiciary to make an “independent judgment” on the takings question);see alsoid.at 53 (“The established principle which guides the court in the exercise of its judgment on the entire case is that the complaining party carries the burden of making a convincing showing and that the court will not interfere with the exercise of the rate-making power unless confiscation is clearly established.”).,99.0909090909091,matched
33,"157. The definition of the general law is a scholarly riddle in its own right. We take this definition from the latest explication of that theory. William Baude, Jud Campbell & Stephen E. Sachs, General Law and the Fourteenth Amendment ,  76  S TAN . L. R EV .  1185,  1185  (2024).  But  there  have  been  a number  of  modern  efforts  to  define  this  area  of  the  law,  principally  regarding  the  question  of incorporation  of  public  international  law. See Curtis  A.  Bradley  &  Jack  L.  Goldsmith, Customary International Law as Federal Common Law: A Critique of the Modern Position , 110 H ARV . L. R EV . 815, 822-24 (1997); see also Caleb Nelson, The Persistence of General Law , 106 C OLUM . L. R EV . 503,",footnote,footnote,,"[157]. The definition of the general law is a scholarly riddle in its own right. We take this definition from the latest explication of that theory. William Baude, Jud Campbell & Stephen E. Sachs,General Law and the Fourteenth Amendment, 76 Stan. L. Rev. 1185, 1185 (2024). But there have been a number of modern efforts to define this area of the law, principally regarding the question of incorporation of public international law.SeeCurtis A. Bradley & Jack L. Goldsmith,Customary International Law as Federal Common Law: A Critique of the Modern Position, 110 Harv. L. Rev. 815, 822–24 (1997);see alsoCaleb Nelson,The Persistence of General Law, 106 Colum. L. Rev. 503, 518–19 (2006); William A. Fletcher,The General Common Law and Section 34 of the Judiciary Act of 1789: The Example of Marine Insurance, 97 Harv. L. Rev. 1513, 1517–27 (1984).",95.85121602288984,matched
34,"Instead of the pluralism we have described among distinctive approaches to interpreting the Constitution's grants of power, the general law approach looks to  older  consensus  and  customary  understanding  to  try  to  discern  answers  to modern structural issues. Scholars, particularly those with originalist intuitions, increasingly refer to this intellectual tradition as the 'general law.' 158 Because it finds a customary consensus among a plurality of legal discourses, this theory could perhaps also be labelled the 'common law,' the 'natural' law, and, in our view, the 'law of nations.' 159",text,body_text,"Instead of the pluralism we have described among distinctive approaches to interpreting the Constitution’s grants of power, the general law approach looks to older consensus and customary understanding to try to discern answers to modern structural issues. Scholars, particularly those with originalist intuitions, increasingly refer to this intellectual tradition as the “general law.”[158]Because it finds a customary consensus among a plurality of legal discourses, this theory could perhaps also be labelled the “common law,” the “natural” law, and, in our view, the “law of nations.”[159]",,98.1418918918919,matched
34,"A core feature of this general law approach is that multiple sovereign and juridical entities engage in interpretive practices that give content to constitutional  rules  and  mores.  This  style  of  public  law  reasoning  was  a deductive enterprise that sought to identify the legal outcomes that follow from the exercise of 'right reason.' 160 The idea was that certain principles of public law are legally operable even though they 'are not under the control of any single jurisdiction' 161 -they 'instead reflect principles or practices common to many different jurisdictions.' 162 As one influential historian of this kind of argument explained, this theory could 'support the civil law like a military reserve, so that when  the  latter  has  failed  on  some  occurrence  which  altogether  demands  a decision in a human court of law, there is recourse to the laws of nature and to the analogy resulting from their comparison.' 163 Indeed, this body of law can 'take[] on the force of . . . law' when accurately interpreted by courts. 164",text,body_text,"A core feature of this general law approach is that multiple sovereign and juridical entities engage in interpretive practices that give content to constitutional rules and mores. This style of public law reasoning was a deductive enterprise that sought to identify the legal outcomes that follow from the exercise of “right reason.”[160]The idea was that certain principles of public law are legally operable even though they “are not under the control of any single jurisdiction”[161]—they “instead reflect principles or practices common to many different jurisdictions.”[162]As one influential historian of this kind of argument explained, this theory could “support the civil law like a military reserve, so that when the latter has failed on some occurrence which altogether demands a decision in a human court of law, there is recourse to the laws of nature and to the analogy resulting from their comparison.”[163]Indeed, this body of law can “take[] on the force of . . . law” when accurately interpreted by courts.[164]",,97.85783836416748,matched
34,"According to James Whitman, this type of legal reasoning was an amalgam of 'inconsistent jurisprudential systems, irreconcilable assumptions, and mismatched intellectual inheritances.' 165 After all, how could one speak of a law",text,body_text,"According to James Whitman, this type of legal reasoning was an amalgam of “inconsistent jurisprudential systems, irreconcilable assumptions, and mismatched intellectual inheritances.”[165]After all, how could one speak of a law that is bothderivedfrom “fixed principles of reason” andsurveyedfrom a body of practice?[166]",,100.0,matched
34,"518-19 (2006); William A. Fletcher, The General Common Law and Section 34 of the Judiciary Act of 1789: The Example of Marine Insurance , 97 H ARV . L. R EV . 1513, 1517-27 (1984).",footnote,footnote,,"[157]. The definition of the general law is a scholarly riddle in its own right. We take this definition from the latest explication of that theory. William Baude, Jud Campbell & Stephen E. Sachs,General Law and the Fourteenth Amendment, 76 Stan. L. Rev. 1185, 1185 (2024). But there have been a number of modern efforts to define this area of the law, principally regarding the question of incorporation of public international law.SeeCurtis A. Bradley & Jack L. Goldsmith,Customary International Law as Federal Common Law: A Critique of the Modern Position, 110 Harv. L. Rev. 815, 822–24 (1997);see alsoCaleb Nelson,The Persistence of General Law, 106 Colum. L. Rev. 503, 518–19 (2006); William A. Fletcher,The General Common Law and Section 34 of the Judiciary Act of 1789: The Example of Marine Insurance, 97 Harv. L. Rev. 1513, 1517–27 (1984).",98.28571428571429,matched
34,"158. See, e.g. , Jud Campbell, General Citizenship Rights ,  132 Y ALE L.J. 611, 616 (2023); cf. Joshua C. Macey, Ketan Ramakrishnan & Brian M. Richardson, Against General Law Constitutionalism , 93 U. C HI . L. R EV . (forthcoming 2026).",footnote,footnote,,"[158].See, e.g.,Jud Campbell,General Citizenship Rights, 132 Yale L.J. 611, 616 (2023);cf.Joshua C. Macey, Ketan Ramakrishnan & Brian M. Richardson,Against General Law Constitutionalism, 93 U. Chi. L. Rev. (forthcoming 2026).",94.5945945945946,matched
34,"159. See Ernest A. Young, Sorting Out the Debate Over Customary International Law , 42 V A . J. I NT ' L L. 365, 369 (2002) (describing customary international law as 'general law').",footnote,footnote,,"[159].SeeErnest A. Young,Sorting Out the Debate Over Customary International Law, 42 Va. J. Int’l L. 365, 369 (2002) (describing customary international law as “general law”).",95.90643274853801,matched
34,"160. See Jonathan Gienapp, The Foreign Founding: Rights, Fixity, and the Original Constitution , 97 T EX . L. R EV . O NLINE 115, 120 (2019) ('Carrying forward longstanding constitutional habits, [the founding  generation]  readily  presupposed  that  constitutions  were  comprised  of  a  seamless  field  of written and unwritten content. In some instances, constitutional text was the source of fundamental authority, but in others it was merely a reminder of a more fundamental authority outside of it. In some instances, text was understood to have enacted certain institutions or legal standards, but in others it was assumed that this text easily blended with other kinds of fundamental authority such as natural law, Magna Carta, 'right reason,' general law, the law of nations, or just the 'Laws of the Land.'').",footnote,footnote,,"[160].SeeJonathan Gienapp,The Foreign Founding: Rights, Fixity, and the Original Constitution, 97 Tex. L. Rev. Online 115, 120 (2019) (“Carrying forward longstanding constitutional habits, [the founding generation] readily presupposed that constitutions were comprised of a seamless field of written and unwritten content. In some instances, constitutional text was the source of fundamental authority, but in others it was merely a reminder of a more fundamental authority outside of it. In some instances, text was understood to have enacted certain institutions or legal standards, but in others it was assumed that this text easily blended with other kinds of fundamental authority such as natural law, Magna Carta, ‘right reason,’ general law, the law of nations, or just the ‘Laws of the Land.’”).",97.61606022584692,matched
34,"161. Caleb Nelson, The Persistence of General Law , 106 C OLUM . L. R EV . 503, 505 (2006).",text,footnote,,"[161]. Caleb Nelson,The Persistence of General Law, 106 Colum. L. Rev. 503, 505 (2006).",92.85714285714286,matched
34,162. Id.,text,footnote,,[162].Id.,100.0,matched
