page_no,pdf_text,pdf_original_label,pdf_corrected_label,matched_html_body,matched_html_footnote,match_confidence,match_status
17,"The  Antidomination  Theory  bears  a  superficial  resemblance  to  modern formalism. It insists on strict divisions between the different checking powers. It does not recognize blended powers in the interstices between branches: There are no quasi-legislative or quasi-judicial functions to worry about; there are only procedural  checks.  Indeed,  Antidomination  accepts  that  there  are  only  three branches of government, that formal distinctions separate the three branches, and that  it  is  unconstitutional  to  mix  or  blend  different  powers.  For  example, Congress  possesses  impeachment  and  appropriations  powers;  the  President possesses the commander-in-chief power; and the judiciary possesses the power to decide cases or controversies arising under the Constitution. 72 It would violate the separation of powers for impeachment to occur outside the process defined in Article I, for the judiciary to appropriate funds for a new courthouse, for the Senate to instruct the Navy to launch missiles at a foreign adversary, or for the President to issue a judgment in a pending judicial proceeding. These arrogations of power are straightforwardly foreclosed by the Constitution since they would deprive a branch of its capacity to check the others.",text,body_text,"The Antidomination Theory bears a superficial resemblance to modern formalism. It insists on strict divisions between the different checking powers. It does not recognize blended powers in the interstices between branches: There are no quasi-legislative or quasi-judicial functions to worry about; there are only procedural checks. Indeed, Antidomination accepts that there are only three branches of government, that formal distinctions separate the three branches, and that it is unconstitutional to mix or blend different powers. For example, Congress possesses impeachment and appropriations powers; the President possesses the commander-in-chief power; and the judiciary possesses the power to decide cases or controversies arising under the Constitution.[72]It would violate the separation of powers for impeachment to occur outside the process defined in Article I, for the judiciary to appropriate funds for a new courthouse, for the Senate to instruct the Navy to launch missiles at a foreign adversary, or for the President to issue a judgment in a pending judicial proceeding. These arrogations of power are straightforwardly foreclosed by the Constitution since they would deprive a branch of its capacity to check the others.",,97.57477768795472,matched
17,"But the resemblance to modern formalism is largely superficial. Under the Antidomination approach, the terms 'legislative' and 'executive' do not possess substantive content beyond (1) the specific grants of power enumerated in the Constitution and (2) the procedures the Constitution provides for enacting policy. No  constitutional  difficulties  arise  when  a  branch  exercises  its  enumerated powers-say, the power to legislate-to enable the other branches to act, at least so long as it respects relevant procedural checks.",text,body_text,"But the resemblance to modern formalism is largely superficial. Under the Antidomination approach, the terms “legislative” and “executive” do not possess substantive content beyond (1) the specific grants of power enumerated in the Constitution and (2) the procedures the Constitution provides for enacting policy. No constitutional difficulties arise when a branch exercises its enumerated powers—say, the power to legislate—to enable the other branches to act, at least so long as it respects relevant procedural checks.",,98.2725527831094,matched
17,"Thus, the reason Antidomination can accommodate legislative grants of rulemaking  authority  is  that  most  such  delegations  preserve  the  relevant distinctions between each branch's checking powers. On this account, 'delegation' means simply that Congress directed an agency to give effect to the statute by exercising discretion. So long as Congress (1) follows the procedures enumerated in the Constitution, and (2) respects specific allocative grants in the Constitution's text, no other formal constraint is breached. Conversely, agency rulemaking  is  not  a  'quasi-legislative'  act.  When  agencies  promulgate  rules, they  execute  a  statutory  grant  of  power;  in  such  cases,  Congress  decided  to require  the  agent  to  exercise  discretion  in  executing  the  law,  rather  than command a particular mode of enforcement. By definition, then, agencies are always engaged in law-execution, not law-making.",text,body_text,"Thus, the reason Antidomination can accommodate legislative grants of rulemaking authority is that most such delegations preserve the relevant distinctions between each branch’s checking powers. On this account, “delegation” means simply that Congress directed an agency to give effect to the statute by exercising discretion. So long as Congress (1) follows the procedures enumerated in the Constitution, and (2) respects specific allocative grants in the Constitution’s text, no other formal constraint is breached. Conversely, agency rulemaking is not a “quasi-legislative” act. When agencies promulgate rules, they execute a statutory grant of power; in such cases, Congress decided to require the agent to exercise discretion in executing the law, rather than command a particular mode of enforcement. By definition, then, agencies are always engaged in law-execution, not law-making.",,95.38288288288288,matched
17,"Removal restrictions, too, are legislative acts that underwent bicameralism and presentment and which the President must respect in performing the lawexecution function. Of course, a statute that, for example, prevented a President",text,body_text,"Removal restrictions, too, are legislative acts that underwent bicameralism and presentment and which the President must respect in performing the law-execution function. Of course, a statute that, for example, prevented a President from appointing their own cabinet by forbidding removal of the incumbents[73]may well prevent the President from “tak[ing] Care that the Laws be faithfully executed.”[74]But the express restraints imposed by the Take Care Clause provide more room for legislative restrictions on presidential removal than the positions defended by modern formalists.",,99.56709956709958,matched
17,"72. Of course, recognizing the existence of substantive grants does not provide much guidance about how to resolve issues of interbranch conflicts. For a thoughtful take on this issue, see generally Roisman, supra note 42.",footnote,footnote,,"[72]. Of course, recognizing the existence of substantive grants does not provide much guidance about how to resolve issues of interbranch conflicts. For a thoughtful take on this issue, see generally Roisman,supranote 42.",99.0909090909091,matched
18,from appointing their own cabinet by forbidding removal of the incumbents 73 may well prevent the President from 'tak[ing] Care that the Laws be faithfully executed.' 74 But the express restraints imposed by the Take Care Clause provide more room for legislative restrictions on presidential removal than the positions defended by modern formalists.,text,body_text,"Removal restrictions, too, are legislative acts that underwent bicameralism and presentment and which the President must respect in performing the law-execution function. Of course, a statute that, for example, prevented a President from appointing their own cabinet by forbidding removal of the incumbents[73]may well prevent the President from “tak[ing] Care that the Laws be faithfully executed.”[74]But the express restraints imposed by the Take Care Clause provide more room for legislative restrictions on presidential removal than the positions defended by modern formalists.",,100.0,matched
18,"In both removal and delegation, Congress exercised its lawmaking function through  bicameralism  and  presentment.  If  the  President  vetoed  the  relevant statute-empowering the President, in the case of delegation, or encumbering the President, in the case of removal-the crucial separation-of-powers question is whether Congress overcame the President's veto by the required supermajority. Whether an unspoken power of the President or Congress was alienated or arrogated, however, are nonsensical on this approach: Compliance with  the  constitutionally  provided  check  exhausts  the  relevant  separation-ofpowers constraint.",text,body_text,"In both removal and delegation, Congress exercised its lawmaking function through bicameralism and presentment. If the President vetoed the relevant statute—empowering the President, in the case of delegation, or encumbering the President, in the case of removal—the crucial separation-of-powers question is whether Congress overcame the President’s veto by the required supermajority. Whether an unspoken power of the President or Congress was alienated or arrogated, however, are nonsensical on this approach: Compliance with the constitutionally provided check exhausts the relevant separation-of-powers constraint.",,97.24473257698541,matched
18,"There  are,  of  course,  powers  necessary  for  governance  that  are  not enumerated in Article I and Article II. To determine whether such latent powers are  properly  allocated  to  one  or  another  branch,  one  follows  the  enumerated procedure to assess whether a particular government act is consistent with the Constitution's system of checks. To put it concretely, a principle of interdepartmental Antidomination, elaborated through various  enumerated constitutional checks, constitutes the basic model of separated powers. Constitutional checks serve important political theory ends, such as the goals of classical republican freedom and the avoidance of tyranny. On this account, the Constitution's decision to blend powers is a virtue. It is how the Constitution ensures that each branch is able to check the others.",text,body_text,"There are, of course, powers necessary for governance that are not enumerated in Article I and Article II. To determine whether such latent powers are properly allocated to one or another branch, one follows the enumerated procedure to assess whether a particular government act is consistent with the Constitution’s system of checks. To put it concretely, a principle of interdepartmental Antidomination, elaborated through various enumerated constitutional checks, constitutes the basic model of separated powers. Constitutional checks serve important political theory ends, such as the goals of classical republican freedom and the avoidance of tyranny. On this account, the Constitution’s decision to blend powers is a virtue. It is how the Constitution ensures that each branch is able to check the others.",,97.77777777777777,matched
18,The Antidomination approach is thus compatible with outcomes that today are  associated  with  functionalism.  But  that  is  not  because  it  accommodates blending or mixing of powers. It is instead because adherents of the Antidomination approach deny that any impermissible blending occurs when a government action follows constitutionally prescribed checks.,text,body_text,The Antidomination approach is thus compatible with outcomes that today are associated with functionalism. But that is not because it accommodates blending or mixing of powers. It is instead because adherents of the Antidomination approach deny that any impermissible blending occurs when a government action follows constitutionally prescribed checks.,,97.15099715099716,matched
18,"While  the  Antidomination  account  resists  the  idea  that  the  branches' content  can  be  definitively  revealed,  there  is  nevertheless  a  place  for  an 'essential' or 'immutable' separation of powers. But these essential powers are",text,body_text,"While the Antidomination account resists the idea that the branches’ content can be definitively revealed, there is nevertheless a place for an “essential” or “immutable” separation of powers. But these essential powers are enumerated in the Constitution’s text. Unless these checks are breached, there is little for courts to police. Almost everything else is left to statute. The constraints imposed by this checks-centric theory are therefore modest.[75]As Nikolas Bowie and Daphna Renan put this last point, “legislationconstitutesthe separation of powers; it offers a durable, though not immutable, means of state-building.”[76]",,95.70815450643777,matched
18,"73. See, e.g. , Tenure in Office Act, ch. 154, 14 Stat. 430 (1867) ('[E]very person holding any civil office to which he has been appointed by and with the advice and consent of the Senate . . . shall be entitled to hold such office until a successor shall have been in like manner appointed and duly qualified . . . .'). The Act exempted the 'Secretaries of State, of the Treasury, of War, of the Navy, and of the Interior, the Postmaster-General, and the Attorney General,' who hold their offices 'during the term of the [appointing] President . . . and for one month thereafter . . . .' Id. The amended Tenure in Office Act, passed two years later, deleted the removal restrictions on the Cabinet, see Act to Amend Tenure in Office Act, ch. 10, 16 Stat. 6 (1869), though the more extreme tenure restrictions would become central to the Taft Court's telling of this history in Myers . See Myers v. United States, 272 U.S. 52, 164-75 (1926).",footnote,footnote,,"[73].See, e.g., Tenure in Office Act, ch. 154, 14 Stat. 430 (1867) (“[E]very person holding any civil office to which he has been appointed by and with the advice and consent of the Senate . . . shall be entitled to hold such office until a successor shall have been in like manner appointed and duly qualified . . . .”). The Act exempted the “Secretaries of State, of the Treasury, of War, of the Navy, and of the Interior, the Postmaster-General, and the Attorney General,” who hold their offices “during the term of the [appointing] President . . . and for one month thereafter . . . .”Id.The amended Tenure in Office Act, passed two years later, deleted the removal restrictions on the Cabinet,seeAct to Amend Tenure in Office Act, ch. 10, 16 Stat. 6 (1869), though the more extreme tenure restrictions would become central to the Taft Court’s telling of this history inMyers.SeeMyers v. United States, 272 U.S. 52, 164–75 (1926).",99.03329752953813,matched
18,"74. U.S. C ONST . art. II, § 3.",footnote,footnote,,"[74]. U.S. Const. art. II, § 3.",93.10344827586206,matched
19,"enumerated in the Constitution's text. Unless these checks are breached, there is little for courts to police. Almost everything else is left to statute. The constraints imposed by this checks-centric theory are therefore modest. 75 As Nikolas Bowie and Daphna Renan put this last point, 'legislation constitutes the separation of powers; it offers a durable, though not immutable, means of state-building.' 76",text,body_text,"While the Antidomination account resists the idea that the branches’ content can be definitively revealed, there is nevertheless a place for an “essential” or “immutable” separation of powers. But these essential powers are enumerated in the Constitution’s text. Unless these checks are breached, there is little for courts to police. Almost everything else is left to statute. The constraints imposed by this checks-centric theory are therefore modest.[75]As Nikolas Bowie and Daphna Renan put this last point, “legislationconstitutesthe separation of powers; it offers a durable, though not immutable, means of state-building.”[76]",,99.75550122249389,matched
19,B. The Public Utility Theory: The Mixing of Rights and Structure,section_header,section_header,,,60.9375,unmatched
19,"Throughout U.S. constitutional history, strong property-rights protections, often  associated  with Lochner , 77 have  limited  the  reach  of  state  and  federal regulations  to  protect  private  property  rights.  The  principal  constitutional disputes  that  arose  during  this  period  are  typically  thought  to  implicate constitutional rights, not constitutional structure. Perhaps for that reason, they have not made their way into modern separation-of-powers debates. Nonetheless,  when  the  United  States  was  developing  a  powerful  federal bureaucracy in the late nineteenth and early twentieth centuries, issues that today implicate separation-of-powers concerns, such as the constitutionality of agency rulemaking and agency adjudication, were answered by asking whether an entity or  activity  was  'affected  with  the  public  interest,'  and  thus  amenable  to government control, or whether the regulation interfered with private rights, in which case it was largely immune from government interference. 78",text,body_text,"Throughout U.S. constitutional history, strong property-rights protections, often associated withLochner,[77]have limited the reach of state and federal regulations to protect private property rights. The principal constitutional disputes that arose during this period are typically thought to implicate constitutional rights, not constitutional structure. Perhaps for that reason, they have not made their way into modern separation-of-powers debates. Nonetheless, when the United States was developing a powerful federal bureaucracy in the late nineteenth and early twentieth centuries, issues that today implicate separation-of-powers concerns, such as the constitutionality of agency rulemaking and agency adjudication, were answered by asking whether an entity or activity was “affected with the public interest,” and thus amenable to government control, or whether the regulation interfered with private rights, in which case it was largely immune from government interference.[78]",,95.03042596348884,matched
19,"Modern rights analyses usually start by considering whether a particular government intervention interferes with an individual's constitutional rightsassuming the question whether the act was ultra vires under the Constitution's structural provisions. The constitutionally relevant question is the right of the individual, not whether the government policy has been enacted or adopted by the proper actor. 79 However, in the early twentieth century-as state and federal governments  began  to  regulate  public  utilities,  such  as  railroads,  electric suppliers, and telecommunications companies-questions of rights and questions  of  structure  traveled  in  tandem.  Treating  freedom  of  contract  and substantive due process as doctrines about rights, rather than about structure, ascribes the modern rights-structure binary on a doctrine that treated rights and",text,body_text,"Modern rights analyses usually start by considering whether a particular government intervention interferes with an individual’s constitutional rights—assuming the question whether the act was ultra vires under the Constitution’s structural provisions. The constitutionally relevant question is the right of the individual, not whether the government policy has been enacted or adopted by the proper actor.[79]However, in the early twentieth century—as state and federal governments began to regulate public utilities, such as railroads, electric suppliers, and telecommunications companies—questions of rights and questions of structure traveled in tandem. Treating freedom of contract and substantive due process as doctrines about rights, rather than about structure, ascribes the modern rights-structure binary on a doctrine that treated rights and structure as nearly synonymous. Substantive due process and freedom of contract delimited the powers of two relevant government actors: those who enacted policy (legislatures, the executive, and agencies) and those who protected against government overreach (judges).",,98.83855981416957,matched
19,"75. Cf. Bowie & Renan, supra note 56, at 2029 ('There is no essential or immutable separation of powers.'). We are more faint-hearted. We view some of the Constitution's enumerated procedural checks-which sometimes, in our history, have implicated rights concerns-as meaningful constraints, even on a nondomination view.",footnote,footnote,,"[75].Cf.Bowie & Renan,supranote 56, at 2029 (“There is no essential or immutable separation of powers.”). We are more faint-hearted. We view some of the Constitution’s enumerated procedural checks—which sometimes, in our history, have implicated rights concerns—as meaningful constraints, even on a nondomination view.",99.0506329113924,matched
19,76. Id.,footnote,footnote,,[76].Id.,100.0,matched
19,"77. In Lochner and Lochner Era  cases,  the  Supreme  Court  described  itself  as  protecting individual liberty, saying, for example, that '[t]here is no reasonable ground for interfering with the liberty of person or the right of free contract, by determining the hours of labor, in the occupation of a baker.' Lochner v. New York, 198 U.S. 45, 57 (1905).",footnote,footnote,,"[77]. InLochnerandLochnerEra cases, the Supreme Court described itself as protecting individual liberty, saying, for example, that “[t]here is no reasonable ground for interfering with the liberty of person or the right of free contract, by determining the hours of labor, in the occupation of a baker.” Lochner v. New York, 198 U.S. 45, 57 (1905).",96.81159420289856,matched
19,"78. See Joshua C. Macey & Brian Richardson, The Public Law of Public Utilities , 42 Y ALE J. R EGUL . 179, 191-95 (2025).",footnote,footnote,,"[78]. SeeJoshua C. Macey & Brian Richardson,The Public Law of Public Utilities, 42 Yale J. Regul. 179, 191–95 (2025).",94.73684210526316,matched
19,"79. There  is,  of  course,  considerable  overlap.  Consider  the  constitutionality  of  agency adjudication,  which  discerns  the  limits  of  nonjudicial  adjudication  by  looking  at  the  rights  of  the individual.",footnote,footnote,,"[79]. There is, of course, considerable overlap. Consider the constitutionality of agency adjudication, which discerns the limits of nonjudicial adjudication by looking at the rights of the individual.",89.44723618090453,matched
20,"structure as nearly synonymous. Substantive due process and freedom of contract delimited  the  powers  of  two  relevant  government  actors:  those  who  enacted policy (legislatures, the executive, and agencies) and those who protected against government overreach (judges).",text,body_text,"Modern rights analyses usually start by considering whether a particular government intervention interferes with an individual’s constitutional rights—assuming the question whether the act was ultra vires under the Constitution’s structural provisions. The constitutionally relevant question is the right of the individual, not whether the government policy has been enacted or adopted by the proper actor.[79]However, in the early twentieth century—as state and federal governments began to regulate public utilities, such as railroads, electric suppliers, and telecommunications companies—questions of rights and questions of structure traveled in tandem. Treating freedom of contract and substantive due process as doctrines about rights, rather than about structure, ascribes the modern rights-structure binary on a doctrine that treated rights and structure as nearly synonymous. Substantive due process and freedom of contract delimited the powers of two relevant government actors: those who enacted policy (legislatures, the executive, and agencies) and those who protected against government overreach (judges).",,98.14814814814815,matched
20,"Throughout  the Lochner Era,  an  exception  to  the  Court's  solicitude  for freedom of contract existed when courts accepted that certain firms or industries were 'affected with a public interest' under the nineteenth-century case Munn v. Illinois . 80 Courts found this affected-with-the-public-interest standard satisfied in three situations. The first was industries that had been regulated at common law. These included inns, ferries, wharfs, and other common carrier businesses. 81 What distinguished this first category from the others is that individuals had a justiciable claim against businesses that refused to serve them even when there was no legislative duty to serve.",text,body_text,"Throughout theLochnerEra, an exception to the Court’s solicitude for freedom of contract existed when courts accepted that certain firms or industries were “affected with a public interest” under the nineteenth-century caseMunn v. Illinois.[80]Courts found this affected-with-the-public-interest standard satisfied in three situations. The first was industries that had been regulated at common law. These included inns, ferries, wharfs, and other common carrier businesses.[81]What distinguished this first category from the others is that individuals had a justiciable claim against businesses that refused to serve them even when there was no legislative duty to serve.",,98.36065573770492,matched
