page_no,pdf_text,pdf_original_label,pdf_corrected_label,matched_html_body,matched_html_footnote,match_confidence,match_status
40,"To prevent the irreparable injuries of premature death and other physical harms, tort law uses negligence liability as the baseline rule governing accidental injury. This liability rule obligates duty-bearers to act reasonably, thereby prohibiting them from choosing to engage in unreasonably dangerous behaviors in exchange for the payment of (inherently inadequate) damages as compensation for any ensuing (irreparable) harms. A defendant who consciously disregards or intentionally violates the plaintiff's tort right is subject to punishment under both tort law and criminal law.",text,footnote,,Id.,100.0,matched
40,"First consider punitive damages, which, according to the courts, 'are aimedat deterrence and retribution.' 150 The deterrence rationale encompasses all cases in which the defendant's conduct was motivated by an expectation of avoiding full liability for the tortious behavior, requiring an extra compensatory penalty to eliminate the expected wrongful gain and thereby deter such behavior. 151 Byimplication, the retributive rationale unambiguously applies to cases in which the defendant expects to incur liability and pay compensatory damages. Retribution, as courts have widely recognized, can be justified by the defendant's decision to forego the exercise of reasonable care in exchange for the payment of compensatory damages. 152",text,footnote,,Id.,100.0,matched
40,"150. State Farm Mut. Auto. Ins. Co. v. Campbell, 538 U.S. 408, 416 (2003).",footnote,footnote,,"State Farm Mut. Auto. Ins. Co. v. Campbell, 538 U.S. 408, 416 (2003).",100.0,matched
40,"151. See generally A. Mitchell Polinsky & Steven Shavell, Punitive Damages: An Economic Analysis , 111 HARV. L. REV. 869 (1998) (rigorously specifying the deterrence rationale for punitive damages).",footnote,footnote,,"See generally A. Mitchell Polinsky & Steven Shavell, Punitive Damages: An Economic Analysis , 111 Harv. L. Rev. 869 (1998) (rigorously specifying the deterrence rationale for punitive damages).",100.0,matched
40,"152. See, e.g. , Man v. Raymark Indus., 728 F. Supp. 1461, 1467 (D. Haw. 1989) (quoting Campus Sweater & Sportswear Co. v. M.B. Kahn Constr. Co., 515 F. Supp. 64, 107 (D.S.C. 1979), aff'd , 644 F.2d 877 (4th Cir. 1981)) ('Punitive damages serve to deter manufacturers as, unlike",footnote,body_text,"First consider punitive damages, which, according to the courts, “are aimed at deterrence and retribution.” 150 State Farm Mut. Auto. Ins. Co. v. Campbell, 538 U.S. 408, 416 (2003). The deterrence rationale encompasses all cases in which the defendant’s conduct was motivated by an expectation of avoiding full liability for the tortious behavior, requiring an extra compensatory penalty to eliminate the expected wrongful gain and thereby deter such behavior. 151 See generally A. Mitchell Polinsky & Steven Shavell, Punitive Damages: An Economic Analysis , 111 Harv. L. Rev. 869 (1998) (rigorously specifying the deterrence rationale for punitive damages). By implication, the retributive rationale unambiguously applies to cases in which the defendant expects to incur liability and pay compensatory damages. Retribution, as courts have widely recognized, can be justified by the defendant’s decision to forego the exercise of reasonable care in exchange for the payment of compensatory damages. 152 See, e.g. , Man v. Raymark Indus., 728 F. Supp. 1461, 1467 (D. Haw. 1989) (quoting Campus Sweater & Sportswear Co. v. M.B. Kahn Constr. Co., 515 F. Supp. 64, 107 (D.S.C. 1979), aff’d , 644 F.2d 877 (4th Cir. 1981)) (“Punitive damages serve to deter manufacturers as, unlike with compensatory damages, the defendant is prevented from making the ‘coldblooded calculation’ that it is more profitable to pay claims than correct a defect.”); Fischer v. Johns-Manville Corps., 472 A.2d 577, 584 (N.J. Super. Ct. App. Div. 1984) (“Were punitive damages to be withheld, those entrepreneurs who act with flagrant disregard of the public safety would be able to write off the public’s injury as a cost of doing business by the payment of compensatory damages, for which there is typically insurance coverage.”), aff’d , 512 A.2d 466 (N.J. 1986).",,99.64028776978418,matched
41,"Once again, compensatory resource scarcity elucidates an important normative property of tort law. '[T]he legal culture lacks a full normative account of the relationship between retributive goals and punitive damages.' 153 The defendant's bad-faith rejection of the primary obligation to exercise reasonable care, even when coupled with the payment of compensatory damages for the breach, is reprehensible only because the compensatory damages remedy does not adequately protect the tort right in cases of irreparable injury. This inherent limitation of the compensatory damages remedy stems from the scarcity of compensatory resources and creates a retributive rationale for punitive damages-a property consistent with our earlier finding that perfectly compensatory damages obviate the need to punish injury-causing conduct. 154",text,footnote,,Id.,100.0,matched
41,"In these cases, criminal liability and tort liability for punitive damages combine to enforce the primary tort duty to exercise reasonable care. Punitive damages vindicate the plaintiff's underlying tort right by punishing the defendant for having reprehensibly rejected the normative perspective that the right requires: A good-faith effort to avoid injury by exercising reasonable care. 156 Criminal liability then addresses how this kind of reprehensible behavior threatens public peace-the fractures in the baseline of adequate physical security that would emerge if duty-bearers could flout their obligations to protect others from the irreparable injury of physical harm.",text,footnote,,Id.,100.0,matched
41,"Like compensatory damages, punitive damage awards are issued in ordinary money and are also subject to the inherently limited ways in which that medium of exchange can fairly redress wrongdoing. After all, if money were sufficient for retributive purposes, wealthy individuals could intentionally kill or sexually attack others and buy their way out of responsibility by paying monetary damages. These kinds of retributive problems create a complementary role for criminal liability, explaining why 'punitive or exemplary damages have been assessed . . . upon evidence of such [willfulness], recklessness or wickedness, on the part of the party at fault, as amounted to criminality.' ' 155",text,footnote,,Id.,100.0,matched
41,"In most cases, however, a punitive response is not merited. Due to its primary emphasis on preventing the irreparable injury of physical harm, the duty with compensatory damages, the defendant is prevented from making the 'coldblooded calculation' that it is more profitable to pay claims than correct a defect.'); Fischer v. Johns-Manville Corps., 472 A.2d 577, 584 (N.J. Super. Ct. App. Div. 1984) ('Were punitive damages to be withheld, those entrepreneurs who act with flagrant disregard of the public safety would be able to write off the public's injury as a cost of doing business by the payment of compensatory damages, for which there is typically insurance coverage.'), aff'd , 512 A.2d 466 (N.J. 1986).",text,footnote,,"See, e.g. , Man v. Raymark Indus., 728 F. Supp. 1461, 1467 (D. Haw. 1989) (quoting Campus Sweater & Sportswear Co. v. M.B. Kahn Constr. Co., 515 F. Supp. 64, 107 (D.S.C. 1979), aff’d , 644 F.2d 877 (4th Cir. 1981)) (“Punitive damages serve to deter manufacturers as, unlike with compensatory damages, the defendant is prevented from making the ‘coldblooded calculation’ that it is more profitable to pay claims than correct a defect.”); Fischer v. Johns-Manville Corps., 472 A.2d 577, 584 (N.J. Super. Ct. App. Div. 1984) (“Were punitive damages to be withheld, those entrepreneurs who act with flagrant disregard of the public safety would be able to write off the public’s injury as a cost of doing business by the payment of compensatory damages, for which there is typically insurance coverage.”), aff’d , 512 A.2d 466 (N.J. 1986).",90.24024024024024,matched
41,"153. Cass R. Sunstein, Daniel Kahneman & David Schkade, Assessing Punitive Damages (with Notes on Cognition and Valuation in Law) , 107 YALE L.J. 2071, 2085 (1998).",footnote,footnote,,Id.,100.0,matched
41,154. See supra Section II.B.,footnote,footnote,,See supra Section II.B.,100.0,matched
41,"155. Lake Shore & Mich. S. Ry. Co. v. Prentice, 147 U.S. 101, 114-15 (1893) (quoting Hagan v. Providence & Worcester R.R., 3 R.I. 88, 91 (1854)).",footnote,footnote,,Id.,100.0,matched
41,"156. See generally Mark A. Geistfeld, Punitive Damages, Retribution, and Due Process , 81 S. CAL. L. REV. 263 (2008) (showing how punitive damages fully vindicate the rights-violation by first eliminating the expected wrongful gains of the reprehensible behavior, and then by increasing the award in a constitutionally permissible amount to punish the defendant for having reprehensibly rejected the perspective the right requires).",footnote,footnote,,"See generally Mark A. Geistfeld, Punitive Damages, Retribution, and Due Process , 81 S. Cal. L. Rev. 263 (2008) (showing how punitive damages fully vindicate the rights-violation by first eliminating the expected wrongful gains of the reprehensible behavior, and then by increasing the award in a constitutionally permissible amount to punish the defendant for having reprehensibly rejected the perspective the right requires).",100.0,matched
42,"to exercise reasonable care often entails unrealistic behavioral obligations (always pay attention and do not exceed the speed limit on the highway even when others routinely do so). By not complying with an unrealistic behavioral demand, one can violate the duty without being personally blameworthy or at 'fault' as a matter of ordinary morality. In this critical respect, the objectively defined negligence rule often functions as a form of 'strict' or 'no fault' liability, which does not involve the type of blameworthy wrongdoing that merits punishment. 157",text,body_text,"In most cases, however, a punitive response is not merited. Due to its primary emphasis on preventing the irreparable injury of physical harm, the duty to exercise reasonable care often entails unrealistic behavioral obligations (always pay attention and do not exceed the speed limit on the highway even when others routinely do so). By not complying with an unrealistic behavioral demand, one can violate the duty without being personally blameworthy or at “fault” as a matter of ordinary morality. In this critical respect, the objectively defined negligence rule often functions as a form of “strict” or “no fault” liability, which does not involve the type of blameworthy wrongdoing that merits punishment. 157 See Geistfeld , supra note 20, at 180–91 (showing why duty-bearers who are unable to realistically comply with the objectively defined standard of reasonable care are fairly subject to no-fault or strict liability for creating a nonreciprocal risk that injured a right-holder).",,100.0,matched
42,"Throughout its varied elements, the negligence rule accounts for the important substantive implications flowing from the manner in which scarce compensatory resources lead to the problem of imperfect injury compensation and the concomitant need to prevent these irreparable harms. The resultant, behaviorally demanding standard of reasonable care effectively functions as a rule of no-fault or strict liability in many cases, explaining why one can breach that duty and cause irreparable injury without incurring any obligation beyond the duty to pay (inherently inadequate) compensatory damages. However, when a defendant reprehensibly breaches the duty, the payment of compensatory damages does not adequately correct for the injustice of wrongfully causing irreparable harm. The normative value of preventing these irreparable injuries accordingly justifies punishing the wrongdoer for a bad-faith breach of the duty to exercise reasonable care, warranting awards of punitive damages and, in some cases, the imposition of criminal negligence liability.",text,body_text,"Throughout its varied elements, the negligence rule accounts for the important substantive implications flowing from the manner in which scarce compensatory resources lead to the problem of imperfect injury compensation and the concomitant need to prevent these irreparable harms. The resultant, behaviorally demanding standard of reasonable care effectively functions as a rule of no-fault or strict liability in many cases, explaining why one can breach that duty and cause irreparable injury without incurring any obligation beyond the duty to pay (inherently inadequate) compensatory damages. However, when a defendant reprehensibly breaches the duty, the payment of compensatory damages does not adequately correct for the injustice of wrongfully causing irreparable harm. The normative value of preventing these irreparable injuries accordingly justifies punishing the wrongdoer for a bad-faith breach of the duty to exercise reasonable care, warranting awards of punitive damages and, in some cases, the imposition of criminal negligence liability.",,100.0,matched
42,D. Changes in the Normative Calculus of Strict Liability,section_header,body_text,"To make a contractual undertaking worthwhile, a seller must cover all costs of performing the contract, including those obligations incurred by virtue of tort law. Right-holders who bear the costs of a correlative duty essentially pay for their entitlement to compensatory damages, altering the normative calculus of tort law.",,77.22772277227723,matched
42,"Under conditions of scarce compensatory resources, the problem of irreparable injury justifies prioritizing ex ante prevention over ex post monetary compensation. To do so, tort law must prioritize the right-holder's interest in physical security (the protected object) over the duty-bearer's compensatory obligation and the associated burden on liberty. By justifying a relative interpersonal priority of the individual interest in physical security, the problem of scarce compensatory resources also creates two distinctive rationales for strict liability.",text,footnote,,Id.,100.0,matched
42,1. Deterrence and the Evidentiary Rationale for Strict Liability,section_header,footnote,,Id.,100.0,matched
42,"The difficulty of proving negligent misconduct predictably creates a deterrence problem. If the reasonable-care standard requires a particular safety precaution, but the plaintiff is unable to prove as much, the defendant will avoid negligence liability despite having acted unreasonably. 158 Evidentiary",text,footnote,,Id.,100.0,matched
42,"157. See GEISTFELD, supra note 20, at 180-91 (showing why duty-bearers who are unable to realistically comply with the objectively defined standard of reasonable care are fairly subject to no-fault or strict liability for creating a nonreciprocal risk that injured a right-holder).",footnote,footnote,,"See Geistfeld , supra note 20, at 180–91 (showing why duty-bearers who are unable to realistically comply with the objectively defined standard of reasonable care are fairly subject to no-fault or strict liability for creating a nonreciprocal risk that injured a right-holder).",99.81785063752277,matched
42,158. As one court observed:,footnote,body_text,"The difficulty of proving negligent misconduct predictably creates a deterrence problem. If the reasonable-care standard requires a particular safety precaution, but the plaintiff is unable to prove as much, the defendant will avoid negligence liability despite having acted unreasonably. 158 As one court observed: It is not doubted that due care might require the defendant to adopt some device that would afford [reasonable protection against the injury suffered by plaintiff.] Such a device, if it exists, is not disclosed by the record. The burden was upon the plaintiff to show its practicability. Since the burden was not sustained, a verdict should have been directed for the defendant. Cooley v. Pub. Serv. Co., 10 A.2d 673, 677 (N.H. 1940). Evidentiary problems can impair a duty-bearer’s financial incentive to exercise reasonable care. Why incur the costs of a precaution if there are no liability consequences for failing to do so?",,96.15384615384616,matched
43,problems can impair a duty-bearer's financial incentive to exercise reasonable care. Why incur the costs of a precaution if there are no liability consequences for failing to do so?,text,body_text,"The difficulty of proving negligent misconduct predictably creates a deterrence problem. If the reasonable-care standard requires a particular safety precaution, but the plaintiff is unable to prove as much, the defendant will avoid negligence liability despite having acted unreasonably. 158 As one court observed: It is not doubted that due care might require the defendant to adopt some device that would afford [reasonable protection against the injury suffered by plaintiff.] Such a device, if it exists, is not disclosed by the record. The burden was upon the plaintiff to show its practicability. Since the burden was not sustained, a verdict should have been directed for the defendant. Cooley v. Pub. Serv. Co., 10 A.2d 673, 677 (N.H. 1940). Evidentiary problems can impair a duty-bearer’s financial incentive to exercise reasonable care. Why incur the costs of a precaution if there are no liability consequences for failing to do so?",,100.0,matched
43,"Courts in the nineteenth century recognized this evidentiary rationale for strict liability. 161 In the early twentieth century, this deterrence reasoning helped justify workers' compensation statutes that displace negligence liability with a regime subjecting employers to no-fault or strict liability for work-related injuries. 162 Courts subsequently relied on this evidentiary rationale to justify strict products liability. 163",text,footnote,,Id.,100.0,matched
43,"Strict liability sidesteps this evidentiary problem. As Oliver Wendell Holmes explained, in these cases 'the safest way to secure care is to throw the risk upon the person who decides what precautions shall be taken.' 159 Rather than have the court make the safety decision based on the evidence a plaintiff presents, strict liability 'throws' that decision on duty-bearers. To minimize their total cost of acting safely and compensating residual harms, strictly liable actors will take any precaution that reduces their liability (injury costs) in a cost-effective manner. If these risky actors would forego any of these precautions in a negligence regime because of proof problems, the shift to strict liability would increase safety measures and reduce the incidence of irreparable injury. 160",text,footnote,,Id.,100.0,matched
43,"Strict liability in these cases is not ideal; its deterrence properties wholly depend on the (inherently inadequate) compensatory damages remedy. But strict liability can still improve upon the deterrence capabilities of an underenforced negligence rule. Like that baseline negligence rule, these strict liability rules are formulated to equitably prevent irreparable injuries like premature death.",text,footnote,,Id.,100.0,matched
43,"It is not doubted that due care might require the defendant to adopt some device that would afford [reasonable protection against the injury suffered by plaintiff.] Such a device, if it exists, is not disclosed by the record. The burden was upon the plaintiff to show its practicability. Since the burden was not sustained, a verdict should have been directed for the defendant.",text,footnote,,"As one court observed: It is not doubted that due care might require the defendant to adopt some device that would afford [reasonable protection against the injury suffered by plaintiff.] Such a device, if it exists, is not disclosed by the record. The burden was upon the plaintiff to show its practicability. Since the burden was not sustained, a verdict should have been directed for the defendant. Cooley v. Pub. Serv. Co., 10 A.2d 673, 677 (N.H. 1940).",100.0,matched
43,"Cooley v. Pub. Serv. Co., 10 A.2d 673, 677 (N.H. 1940).",text,footnote,,"As one court observed: It is not doubted that due care might require the defendant to adopt some device that would afford [reasonable protection against the injury suffered by plaintiff.] Such a device, if it exists, is not disclosed by the record. The burden was upon the plaintiff to show its practicability. Since the burden was not sustained, a verdict should have been directed for the defendant. Cooley v. Pub. Serv. Co., 10 A.2d 673, 677 (N.H. 1940).",100.0,matched
43,"OLIVER WENDELL HOLMES, JR., THE COMMON LAW 117 (Boston, Little, Brown & Co. 1881).",list_item,footnote,,"Oliver Wendell Holmes, Jr., The Common Law 117 (Boston, Little, Brown & Co. 1881).",100.0,matched
43,"See Steven Shavell, Strict Liability Versus Negligence , 9 J. LEGAL STUD. 1, 22 & n.28 (1980) (showing how strict liability can reduce risk by reducing 'activity' levels, where 'activity' is any aspect of risky behavior that is outside the ambit of negligence liability due to evidentiary limitations).",list_item,footnote,,Id.,100.0,matched
43,"See POLLOCK, supra note 98, at 393.",list_item,footnote,,"See Pollock , supra note 98, at 393.",97.05882352941177,matched
43,"See N.Y. Cent. R.R. v. White, 243 U.S. 188, 197 (1917).",list_item,footnote,,"See N.Y. Cent. R.R. v. White, 243 U.S. 188, 197 (1917).",100.0,matched
43,"See, e.g. , Cushing v. Rodman, 82 F.2d 864, 869 (D.C. Cir. 1936) (imposing liability without proof of fault in a defective food case by stating that '[r]estricting recovery by the injured member of the public to cases predicated upon negligence is a seriously inadequate means of securing the social interest in the individual safety, because of the great difficulty of proof for the plaintiff').",list_item,footnote,,Id.,100.0,matched
44,2. Compensatory Rules of Strict Liability,section_header,body_text,"In yet one more respect, then, the problem of scarce compensatory resources alters the normative calculus of tort law in a predictable way that conventional tort theories have not recognized. Like duty-bearers, right-holders do not have unlimited compensatory resources and accordingly have a reasonable interest in minimizing their injury compensation costs. For cases in which right-holders ultimately bear the costs of the correlative tort duties, a purely compensatory tort rule would be contrary to their interests; it would unduly increase the ordinary right-holder’s total costs of injury compensation. The relevant interests of these right-holders are best protected by deterrence-based liability rules obligating risky actors to prevent injuries through the exercise of reasonable care. Compensatory rules of strict liability can only fairly or reasonably protect right-holders who do not ultimately pay for their tort entitlements to compensation, providing another important example of how the scarcity of compensatory resources shapes substantive tort law.",,97.5609756097561,matched
44,"The discussion so far has shown why the scarcity of compensatory resources places deterrence at the center of tort law. Negligence is the liability default rule for good reason, strongly pulling tort law theories in that direction. A deterrence rationale for strict liability is complementary and comfortably fits within this conceptual framework. But by making deterrence and conductbased liability rules so vitally important, the problem of scarce compensatory resources masks the extent to which tort law is based on a compensatory norm.",text,body_text,"The discussion so far has shown why the scarcity of compensatory resources places deterrence at the center of tort law. Negligence is the liability default rule for good reason, strongly pulling tort law theories in that direction. A deterrence rationale for strict liability is complementary and comfortably fits within this conceptual framework. But by making deterrence and conduct-based liability rules so vitally important, the problem of scarce compensatory resources masks the extent to which tort law is based on a compensatory norm.",,99.81447124304268,matched
44,"This compensatory rule of strict liability is not dependent on fault or deterrence-based reasoning for an evident reason. If I hurt myself while pursuing my own ends, I incur the injury costs. Similarly, if while pursuing my ends I instead hurt you, I should still incur the injury costs as a matter of reciprocity or fairness: I should, in other words, pay you 'the value of an eye for an eye.' Such a reciprocity norm straightforwardly explains why there was 'a deep sense of early common law morality that one who hurts another should compensate him.' 166",text,footnote,,Id.,100.0,matched
44,"Consider the customary practices in the state of nature that first defined the common law. In this era, injury victims had the remedial alternatives of pursuing punishment-'an eye for an eye'-or receiving compensation-'the value of an eye for an eye.' As we have found, these two remedies are complementary responses to the scarcity of compensatory resources and the resultant problem of imperfect injury compensation. 164 The early common law then improved upon this remedial scheme by having the state exact punishment through the criminal law, enabling victims to pursue tort claims for compensation. 165 Despite this important legal development, the normative fact remained that the victim suffered grievous injury and deserved compensation embodied in the entitlement of the 'value of an eye for an eye.'",text,footnote,,Id.,100.0,matched
