page_no,pdf_text,pdf_original_label,pdf_corrected_label,matched_html_body,matched_html_footnote,match_confidence,match_status
22,"In the state of nature, full compensation could be attained for fatal injuries only because the entitlement was held by the family, clan, or tribe to which the decedent belonged. 68 In these ancient societies, as Henry Sumner Maine explained, the individual's status within 'the household of which he forms a part' largely determined 'the rules which he obeys,' leaving 'the very smallest room for Contract' or the ability of individuals to mutually agree upon the rights and duties governing their interactions. 69 As Maine then famously demonstrated, the development of 'progressive societies' involved 'a movement from Status to Contract .' 70 Onceindividuals were freed from the shackles of their status within the collective and could voluntarily create their own rights and duties, any entitlement to compensation was their own and not held by the collective to which they belonged. The development of individual rights had compensatory consequences-in the event of fatal injury, the decedent right-holder could never be compensated after the fact with monetary damages, an inherent compensatory problem that did not exist in the state of nature.",text,footnote,,Id.,100.0,matched
22,"ERNEST J. WEINRIB, CORRECTIVE JUSTICE 97 (2012).",list_item,footnote,,"Ernest J. Weinrib, Corrective Justice 97 (2012).",100.0,matched
22,"Ripstein, supra note 61, at 1966.",list_item,footnote,,"Ripstein, supra note 61, at 1966.",100.0,matched
22,See supra note 57 and accompanying text.,list_item,footnote,,See supra note 57 and accompanying text.,100.0,matched
22,"MAINE, supra note 58, at 311-12.",list_item,footnote,,"Maine , supra note 58, at 311–12.",96.7741935483871,matched
22,Id. at 170.,list_item,footnote,,Id.,100.0,matched
23,"kinds of injury-causing behaviors (like murder). These prohibitions-enforced with punitive measures-have always shaped both the common law of crimes and of torts. The use of punishment to correct for imperfect compensation traces further back into the state of nature, where the exchange of social currency could not attain equitable balance in cases of aggression. An aggressive attack instead merited a punitive response to protect the victim's honorthe 'eye for an eye.' Punishment has long been tied to the inadequacy of compensatory damages.",text,body_text,"Whereas perfect compensation eliminates a legal concern about preventing injuries, the inability to adequately compensate premature death and other irreparable injuries made it necessary for the common law to prohibit certain kinds of injury-causing behaviors (like murder). These prohibitions—enforced with punitive measures—have always shaped both the common law of crimes and of torts. The use of punishment to correct for imperfect compensation traces further back into the state of nature, where the exchange of social currency could not attain equitable balance in cases of aggression. An aggressive attack instead merited a punitive response to protect the victim’s honor—the “eye for an eye.” Punishment has long been tied to the inadequacy of compensatory damages.",,99.81651376146789,matched
23,"Changed social conditions also transformed social currency into ordinary money. The origins of money, though unknown, are connected to injury compensation. Economists emphasize the considerable advantages of utilizing money for trade as compared to the barter of goods, but these exchanges depend on the seller trusting the pocketed money can buy goods in future transactions. 71 On one account, social currency naturally fit this bill and evolved into the medium of exchange for trade between clans and other kinds of communities. 72 Another account locates the origins of money in the early state, which issued coins and the like as the means for subjects to pay taxes or tributes in exchange for services. 73 According to the 'dominant model of the origins of law and the state,' the most important service the early state provided was to protect individuals and provide them with legal avenues for injury redress. 74 Once mediated through the legal system, injury compensation was effectuated with the same money used to pay taxes and buy goods in the marketplace.",text,footnote,,Id.,100.0,matched
23,"Following the transition from the state of nature, the newly centralized government was able to sufficiently secure the public peace over time. Individuals no longer had to maintain their honor to deter others from attacking them. Today, the compensatory ideal does not strike an equitable balance between the honor of injurers and their victims-a fundamental alteration in the normative character of compensatory damages.",text,footnote,,Id.,100.0,matched
23,"After social currency merged into commercial or commodified money, its social meaning inexorably changed. 'What happens, for instance, when the same money once used to arrange marriages and settle affairs of honor can also be used to pay for the services of prostitutes?' 75 As the market economy developed and money became increasingly infused with the impersonal mo-",text,body_text,"After social currency merged into commercial or commodified money, its social meaning inexorably changed. “What happens, for instance, when the same money once used to arrange marriages and settle affairs of honor can also be used to pay for the services of prostitutes?” 75 Graeber , supra note 46, at 177. As the market economy developed and money became increasingly infused with the impersonal morality of commercial transactions, it could no longer fully embody the interpersonal morality of social currency. 76 See generally Graeber , supra note 46 (developing this theme at length). Money today is not the kind of social currency that can readily readjust social relations to obtain an equitable balance between the interacting parties.",,91.00817438692098,matched
23,"71. See SKIDELSKY, supra note 12, at 23-27.",section_header,footnote,,Id.,100.0,matched
23,"PAUL EINZIG, PRIMITIVE MONEY: IN ITS ETHNOLOGICAL, HISTORICAL AND ECONOMICASPECTS 380 (2d ed. 1966) ('The payment of blood money between tribes must have largely contributed towards the origin of inter-tribal currencies which, in turn, must have led to the development of currencies on a nation-wide scale. It provided probably the earliest inducement for the development of an agreed monetary unit between two communities.'); GRAEBER, supra note 46, at 45 ('The problem [with the claim that barter economies preceded the origins of money] is that history shows that without money, such vast barter systems do not occur.').",list_item,footnote,,Id.,100.0,matched
23,"73. SKIDELSKY, supra note 12, at 25-26.",footnote,footnote,,Id.,100.0,matched
23,"74. See Whitman, supra note 45, at 41-43.",footnote,footnote,,"See Whitman, supra note 45, at 41–43.",100.0,matched
23,"75. GRAEBER, supra note 46, at 177.",footnote,footnote,,"Graeber , supra note 46, at 177.",98.36065573770492,matched
24,"rality of commercial transactions, it could no longer fully embody the interpersonal morality of social currency. 76 Money today is not the kind of social currency that can readily readjust social relations to obtain an equitable balance between the interacting parties.",text,body_text,"After social currency merged into commercial or commodified money, its social meaning inexorably changed. “What happens, for instance, when the same money once used to arrange marriages and settle affairs of honor can also be used to pay for the services of prostitutes?” 75 Graeber , supra note 46, at 177. As the market economy developed and money became increasingly infused with the impersonal morality of commercial transactions, it could no longer fully embody the interpersonal morality of social currency. 76 See generally Graeber , supra note 46 (developing this theme at length). Money today is not the kind of social currency that can readily readjust social relations to obtain an equitable balance between the interacting parties.",,78.05907172995781,matched
24,"These changes in social conditions bring us into the modern world, where money is a scarce compensatory resource inherently incapable of attaining perfect injury compensation across all cases.",text,body_text,"These changes in social conditions bring us into the modern world, where money is a scarce compensatory resource inherently incapable of attaining perfect injury compensation across all cases.",,100.0,matched
24,"A. Torts, Crimes, and the Limits of Monetary Damages",section_header,section_header,,,69.23076923076923,unmatched
24,"In the state of nature, the exchange of social currency was not the only way to obtain equitable balance between injurers and their victims. Perfect compensation could also involve replacement in kind, an ideal embodied in the moral code known as Lex Talionis or the talion, 77 captured by the biblical passage commonly paraphrased as 'an eye for an eye, a tooth for a tooth.' 78 In cases of intentional wrongdoing, blinded victims could not regain their eyesight by gouging out the eyes of their injurers. Nevertheless, the remedy effectuated a normative replacement in kind-a blinded victim would restore their honor and attain equitable balance by intentionally inflicting the same indignity on the injurer.",text,footnote,,Id.,100.0,matched
24,"Ordinary money could serve this equitable function. For example, in discussing early Germanic cultures' compensatory practices involving the use of ordinary money, James Whitman refers to the way in which a compensatory 'payment could also belong, in a non-commercial way, to an economy of honor and shame.' 81 Here, Whitman is summarizing the historical conclusions of the German scholar Wilhelm Eduard Wilda, who observed that 'all Germanic legal systems' refer to '[c]ompensatory 'amends,' ' which means ' 'correction,' the making good of a wrong that has been done through payment of money or money's worth.' 82 Because the compensatory payment of money was infused with this normative meaning, it was 'an admission that the wrong",text,body_text,"Ordinary money could serve this equitable function. For example, in discussing early Germanic cultures’ compensatory practices involving the use of ordinary money, James Whitman refers to the way in which a compensatory “payment could also belong, in a non-commercial way, to an economy of honor and shame.” 81 Whitman, supra note 45, at 63 (summarizing the position of Wilhelm Eduard Wilda). Here, Whitman is summarizing the historical conclusions of the German scholar Wilhelm Eduard Wilda, who observed that “all Germanic legal systems” refer to “[c]ompensatory ‘amends,’ ” which means “ ‘correction,’ the making good of a wrong that has been done through payment of money or money’s worth.” 82 Id. (translating Wilhelm Eduard Wilda , Das Strafrecht der Germanen 314 (Halle, C.A. Schwetschke & Sohn 1842)) Because the compensatory payment of money was infused with this normative meaning, it was “an admission that the wrong had been committed, and to that degree a humiliation on the part of the payor, and accordingly to some degree a reestablishment of honor for the injured party.” 83 Id. (emphasis omitted).",,87.07015130674003,matched
24,"This normative calculus changed in cases of accidental harm, justifying a compensatory remedy-'the value of an eye for an eye.' 79 Compensation in cases of accidental harm would restore equitable balance-the injurer did not benefit at the expense of the victim's person or property-while deterring others from engaging in such risky conduct by sending the message: Don't expect to benefit at my expense! 80",text,footnote,,Id.,100.0,matched
24,"See generally GRAEBER, supra note 46 (developing this theme at length).",list_item,footnote,,"See generally Graeber , supra note 46 (developing this theme at length).",98.55072463768117,matched
24,"MILLER, supra note 54, at 20-21.",list_item,footnote,,"Miller , supra note 54, at 20–21.",96.7741935483871,matched
24,"See Exodus 21, 24.",list_item,footnote,,"See Exodus 21, 24.",100.0,matched
24,"See Mark A. Geistfeld, Hidden in Plain Sight: The Normative Source of Modern Tort Law , 91 N.Y.U. L. REV. 1517, 1517 (2016).",list_item,footnote,,Id.,100.0,matched
24,Id. at 1541-50 (discussing role of compensation in state of nature).,list_item,footnote,,Id.,100.0,matched
24,"Whitman, supra note 45, at 63 (summarizing the position of Wilhelm Eduard Wilda).",list_item,footnote,,"Whitman, supra note 45, at 63 (summarizing the position of Wilhelm Eduard Wilda).",100.0,matched
24,"Id. (translating WILHELM EDUARD WILDA, DAS STRAFRECHT DER GERMANEN 314 (Halle, C.A. Schwetschke & Sohn 1842))",list_item,footnote,,Id.,100.0,matched
25,"had been committed, and to that degree a humiliation on the part of the payor, and accordingly to some degree a reestablishment of honor for the injured party.' 83",text,body_text,"Ordinary money could serve this equitable function. For example, in discussing early Germanic cultures’ compensatory practices involving the use of ordinary money, James Whitman refers to the way in which a compensatory “payment could also belong, in a non-commercial way, to an economy of honor and shame.” 81 Whitman, supra note 45, at 63 (summarizing the position of Wilhelm Eduard Wilda). Here, Whitman is summarizing the historical conclusions of the German scholar Wilhelm Eduard Wilda, who observed that “all Germanic legal systems” refer to “[c]ompensatory ‘amends,’ ” which means “ ‘correction,’ the making good of a wrong that has been done through payment of money or money’s worth.” 82 Id. (translating Wilhelm Eduard Wilda , Das Strafrecht der Germanen 314 (Halle, C.A. Schwetschke & Sohn 1842)) Because the compensatory payment of money was infused with this normative meaning, it was “an admission that the wrong had been committed, and to that degree a humiliation on the part of the payor, and accordingly to some degree a reestablishment of honor for the injured party.” 83 Id. (emphasis omitted).",,100.0,matched
25,"These practices subsequently shaped the early common law in medieval England, which 'simply codified existing custom' in the preceding state of nature. 85 In this era:",text,body_text,"These practices subsequently shaped the early common law in medieval England, which “simply codified existing custom” in the preceding state of nature. 85 Whitman, supra note 45, at 53. In this era:",,96.91358024691358,matched
25,"By accepting monetary compensation, injury victims could retain their honor-and restore equitable balance with their injurers-because they always had the choice to exact revenge instead. As William Miller explains, '[r]evenge always coexisted with a compensation option. The conceptual underpinning was exactly the same in either case: both revenge and compensation were articulated solely in idioms of repayment of debts and of settling scores and accounts.' 84 The revenge option gave injury victims the means to attain equitable balance when compensation would not adequately restore their lost honor.",text,footnote,,Id.,100.0,matched
25,"The distinction between crime and tort was not a difference between two kinds of wrongful acts. In most instances, the same wrong could be prosecuted either as a crime or as a tort. Nor was the distinction a difference between the kinds of persons who could initiate the actions. Victims could initiate actions of both kinds. According to the lawyers, victims who preferred vengeance over compensation prosecuted their wrongdoers for crime. Victims who preferred compensation over vengeance sued their wrongdoers for tort. 86",text,body_text,"The distinction between crime and tort was not a difference between two kinds of wrongful acts. In most instances, the same wrong could be prosecuted either as a crime or as a tort. Nor was the distinction a difference between the kinds of persons who could initiate the actions. Victims could initiate actions of both kinds. According to the lawyers, victims who preferred vengeance over compensation prosecuted their wrongdoers for crime. Victims who preferred compensation over vengeance sued their wrongdoers for tort. 86 David J. Seipp, The Distinction Between Crime and Tort in the Early Common Law , 76 B.U. L. Rev. 59, 59–60 (1996) (paragraph structure eliminated).",,100.0,matched
25,"Over time, the criminal law became the exclusive province of the state, leaving the victims of crime with a tort claim for monetary compensation. The rise of punitive damages within tort law then became the injury victim's surrogate to obtain retribution for reprehensible misconduct that the compensatory damages remedy could not adequately redress. But unlike its counterpart in the state of nature, the punitive remedy is embodied in an award of monetary damages. This tort remedy enables an injured victim to exact financial revenge without engaging in any violence-a civilized attribute of the tort remedy which gained further value as the market economy developed. The only wayto punish a corporate wrongdoer-the cause of widespread injury in modern society-is by inflicting financial pain through a tort award of punitive damages. These developments have led to the now conventional understanding that the early common law 'approach[ed] the field of tort through the field of crime.' 87",text,footnote,,Id.,100.0,matched
25,Id. (emphasis omitted).,list_item,footnote,,Id.,100.0,matched
25,"MILLER, supra note 54, at 25.",list_item,footnote,,"Miller , supra note 54, at 20–21.",96.42857142857143,matched
25,"Whitman, supra note 45, at 53.",list_item,footnote,,"Whitman, supra note 45, at 53.",100.0,matched
25,"86. David J. Seipp, The Distinction Between Crime and Tort in the Early Common Law , 76 B.U. L. REV. 59, 59-60 (1996) (paragraph structure eliminated).",footnote,footnote,,Id.,100.0,matched
25,"87. 2 FREDERICK POLLOCK & FREDERIC WILLIAM MAITLAND, THE HISTORY OF ENGLISH LAW 530 (2d ed. 1968); see also DOBBS, HAYDEN & BUBLICK, supra note 5, § 4, at 3 ('American",footnote,body_text,"Over time, the criminal law became the exclusive province of the state, leaving the victims of crime with a tort claim for monetary compensation. The rise of punitive damages within tort law then became the injury victim’s surrogate to obtain retribution for reprehensible misconduct that the compensatory damages remedy could not adequately redress. But unlike its counterpart in the state of nature, the punitive remedy is embodied in an award of monetary damages. This tort remedy enables an injured victim to exact financial revenge without engaging in any violence—a civilized attribute of the tort remedy which gained further value as the market economy developed. The only way to punish a corporate wrongdoer—the cause of widespread injury in modern society—is by inflicting financial pain through a tort award of punitive damages. These developments have led to the now conventional understanding that the early common law “approach[ed] the field of tort through the field of crime.” 87 2 Frederick Pollock & Frederic William Maitland, The History of English Law 530 (2d ed. 1968); see also Dobbs, Hayden & Bublick , supra note 5, § 4, at 3 (“American common law, including tort law, grew out of English common law. In the development of early English law, tort law in turn grew out of criminal law.”).",,99.40119760479041,matched
26,"However, the premise that tort damages are the civilized outgrowth of punitive revenge (the province of criminal law) is belied by the historical practices that entwined the two remedies. We effectively disentangled the two in our earlier thought experiment, which demonstrated how perfect compensation obviates the need for criminal punishment. 88 By implication, the inherent inadequacy of monetary tort remedies generates the rationale for criminal liability: If the only legal response to murder and other forms of highly culpable injury-causing misconduct involved inadequate monetary sanctions, the public peace would be unduly threatened. Hence, the need to criminally punish injury-causing behavior stems from the failure of monetary damages to adequately protect basic tort rights-a relationship between these two fields of the common law opposite from the conventional account.",text,body_text,"However, the premise that tort damages are the civilized outgrowth of punitive revenge (the province of criminal law) is belied by the historical practices that entwined the two remedies. We effectively disentangled the two in our earlier thought experiment, which demonstrated how perfect compensation obviates the need for criminal punishment. 88 See supra Section II.B. By implication, the inherent inadequacy of monetary tort remedies generates the rationale for criminal liability: If the only legal response to murder and other forms of highly culpable injury-causing misconduct involved inadequate monetary sanctions, the public peace would be unduly threatened. Hence, the need to criminally punish injury-causing behavior stems from the failure of monetary damages to adequately protect basic tort rights—a relationship between these two fields of the common law opposite from the conventional account.",,97.29119638826185,matched
26,B. The Normative Duality of Monetary Damages,section_header,body_text,"Wealth would seem to be substantively irrelevant given the rule that excludes evidence concerning the defendant’s financial resources when determining breach or compensatory damages. The antecedent tort duty, however, depends on the burden it would impose on the ordinary duty-bearer across the general class of cases the duty governs. The reasonableness of this burden is affected by social facts such as per capita wealth, the replacement of debtor’s prison with bankruptcy, the availability of liability insurance, and the social meaning of monetary damages. These normatively relevant facts are largely absent from modern accounts of tort law, even though they contract or expand the scope of substantive tort duties for noncontroversial reasons grounded in widely recognized tort values. An extended historical and doctrinal analysis confirms as much, showing how the scarcity of compensatory resources has shaped the basic structure of tort law—why it employs a default rule of negligence liability, sometimes supplemented by strict liability, while also being limited for wide swaths of negligently caused harms involving economic loss and emotional distress.",,70.45454545454545,matched
26,"Having historically situated the monetary damages remedy, we can now see why it is supposed to retain at least some of social currency's normative properties. This duality is most apparent when monetary damages compensate the nonmonetary injuries of pain and suffering. Tort law recognizes that these damages 'cannot restore the injured person to his previous position' and instead are supposed to 'give to the injured person some pecuniary return for what he has suffered or is likely to suffer.' 89 '[S]ome pecuniary return' for pain and suffering can be adequately compensatory only if the monetary damages serve as social currency that adequately restores plaintiffs to the same normative positions they occupied prior to their injuries.",text,body_text,"Having historically situated the monetary damages remedy, we can now see why it is supposed to retain at least some of social currency’s normative properties. This duality is most apparent when monetary damages compensate the nonmonetary injuries of pain and suffering. Tort law recognizes that these damages “cannot restore the injured person to his previous position” and instead are supposed to “give to the injured person some pecuniary return for what he has suffered or is likely to suffer.” 89 Restatement (Second) of Torts § 903 cmt. a ( A.L.I. 1979). “[S]ome pecuniary return” for pain and suffering can be adequately compensatory only if the monetary damages serve as social currency that adequately restores plaintiffs to the same normative positions they occupied prior to their injuries.",,92.02702702702703,matched
