page_no,pdf_text,pdf_original_label,pdf_corrected_label,matched_html_body,matched_html_footnote,match_confidence,match_status
1,Michigan Law Review,section_header,section_header,,,63.1578947368421,unmatched
1,Volume 123 Issue 8,text,body_text,"* Thank you to my peers and friends in the Volume 122 Notes Office—Hannah Cohen Smith, Kassie Fotiadis, Ashley Munger, Katie Osborn, and Jordan Schuler—for making me a better writer and more empathetic person. Thank you to our successors, the Volume 123 Notes Office, for their incredible edits. Thank you to my research advisors—Evan Caminker and Daniel Deacon—for countless office hours discussing ridiculous spending hypotheticals. Thank you to my dad for his nearly illegible redline and my mother for her writing talent. And thank you to Grayson Metzger for her edits, support, and motivation to submit (and resubmit) this Note.",,72.22222222222221,matched
1,2025,text,body_text,"Within ARPA’s collection of relief programs are the CSLFRF. 33 American Rescue Plan Act, Pub. L. No. 117-2, § 9901, 135 Stat. 4, 223 (2021). The CSLFRF allot more than $200 billion for state, tribal, and territory governments to “mitigate the fiscal effects” of the COVID-19 pandemic. 34 42 U.S.C. § 802(a). This lofty goal was imbued with wide discretion, with recipients eligible to spend the CSLFRF on nearly anything related to the “negative economic impacts” of the pandemic until 2025. 35 Id. § 802(c)(1)(A)–(E). State and local governments have authorized diverse programs to revitalize communities, with the Treasury only once challenging those entities’ spending decisions. 36 See State and Local Fiscal Recovery Funds , U.S. Dep’t of the Treasury , https://home.treasury.gov/policy-issues/coronavirus/assistance-for-state-local-and-tribal-governments/state-and-local-fiscal-recovery-funds [ perma.cc/Z6AH-D624 ]; Alan Rappeport, Arizona Could Lose Relief Funds for Undermining School Mask Mandates , N.Y. Times (Oct. 14, 2021), https://nytimes.com/2021/10/05/us/politics/arizona-relief-funds-mask-mandates.html [ perma.cc/JLE6-FB2T ] (noting Treasury’s only challenge to a state program). For example, Michigan committed to much-needed state infrastructure projects $686.3 million of its relief funds. 37 See American Rescue Plan Funding , State Budget Off. (Dec. 2024), https://michigan.gov/budget/covid-federal-funding/american-rescue-plan-funding [ perma.cc/6C5B-EYGD ]; MI Clean Water Plan , Dep’t of Env’t, Great Lakes, & Energy , https://michigan.gov/egle/regulatory-assistance/funding/fd/mi-clean-water-plan [ perma.cc/7GHR-PMVW ]. Cities like Austin, Texas focused on addressing the social welfare maladies of the pandemic through rental assistance programs and projects to decrease homelessness, among others. 38 City of Austin Fin Servs. Dep’t , Recovery Plan: State and Local Fiscal Recovery Funds 2023 Report (July 1, 2022 – June 30, 2023) 77–80 (2023) https://assets.austintexas.gov/financeonline/downloads/2023SLFRFRecoveryPlanCityofAustin.pdf [ perma.cc/SE9J-788F ]. Furthermore, despite initially opposing ARPA’s hefty price tag, even Republican state governments—including some that challenged the Offset Provision in court—tapped into the CSLFRF for an array of infrastructure and public health investments. 39 Alan Rappeport, Republicans Who Assailed Biden’s Stimulus Bill Are Embracing the Money , N.Y. Times (Dec. 15, 2021), https://nytimes.com/2021/12/15/us/politics/biden-stimulus-bill-republicans.html [ perma.cc/CM5B-LW8U ].",,100.0,matched
1,Spending Clause Standing,section_header,body_text,"The Offset Provision cases define the terms of federalism’s future battleground. The Spending Contract and Tax Power injuries provide enterprising state attorneys general with the weapons to dismantle disfavored federal policy. Instead of adhering to standing doctrine’s core separation-of-powers principles, a majority of the involved circuit courts have enabled states to readily air their policy grievances in federal court. Because Congress increasingly relies on its spending power to pass legislation, when states can and cannot challenge federal policy has enormous implications for modern policymaking. When appropriate, Spending Clause standing doctrine should permit heightened scrutiny when a state unilaterally attempts to block a federal program.",,100.0,matched
1,Edward Webre Plaut University of Michigan Law School,text,text,,,66.66666666666667,unmatched
1,Follow this and additional works at: https://repository.law.umich.edu/mlr,text,text,,,53.333333333333336,unmatched
1,"Part of the Law and Economics Commons, Legislation Commons, and the Tax Law Commons",text,body_text,No,,100.0,matched
1,Recommended Citation,section_header,section_header,,,66.66666666666667,unmatched
1,"Edward W. Plaut, Spending Clause Standing, 123 MICH. L. REV. 1519 (2025). Available at: https://repository.law.umich.edu/mlr/vol123/iss8/4",text,text,,,66.66666666666667,unmatched
1,https://doi.org/10.36644/mlr.123.8.spending,section_header,section_header,,,54.54545454545454,unmatched
1,"This Note is brought to you for free and open access by the Michigan Law Review at University of Michigan Law School Scholarship Repository. It has been accepted for inclusion in Michigan Law Review by an authorized editor of University of Michigan Law School Scholarship Repository. For more information, please contact mlaw.repository@umich.edu.",text,body_text,No,,100.0,matched
2,NOTE,section_header,footnote,,"See Vladeck, supra note 15; Steve Vladeck, Bonus 35: The Lawlessness of Missouri’s Standing in Biden v. Nebraska, One First (July 13, 2023) [hereinafter Vladeck, Lawlessness ], https://stevevladeck.com/p/bonus-35-the-lawlessness-of-missouris [ perma.cc/6URZ-EV56 ].",100.0,matched
2,SPENDING CLAUSE STANDING,section_header,body_text,"The Offset Provision cases define the terms of federalism’s future battleground. The Spending Contract and Tax Power injuries provide enterprising state attorneys general with the weapons to dismantle disfavored federal policy. Instead of adhering to standing doctrine’s core separation-of-powers principles, a majority of the involved circuit courts have enabled states to readily air their policy grievances in federal court. Because Congress increasingly relies on its spending power to pass legislation, when states can and cannot challenge federal policy has enormous implications for modern policymaking. When appropriate, Spending Clause standing doctrine should permit heightened scrutiny when a state unilaterally attempts to block a federal program.",,100.0,matched
2,Edward Webre Plaut,section_header,section_header,,,61.111111111111114,unmatched
2,TABLE OF CONTENTS,section_header,body_text,"Despite Congress’s increasing reliance on the Spending Clause, the Offset Provision litigation was the first time that the standing issue had arisen. That is, until now, the Supreme Court has never had an opportunity to consider Spending Clause and state standing jurisprudence together. And for good reason: In cases applying Pennhurst ’s clear-notice requirement, nongovernmental plaintiffs (who were not involved in the grant of federal funds) were actively bringing suit and the defendants (recipients of federal funds) used the clear-notice rule as a defense to their liability. 158 Pennhurst State Sch. & Hosp. v. Halderman, 451 U.S. 1, 15–27 (1981); Arlington Cent. Sch. Dist. Bd. of Educ. v. Murphy, 548 U.S. 291, 295–300 (2006). Furthermore, in Dole and Sebelius , there was no question that the relevant legislation’s spending conditions directly affected and injured the state plaintiffs. 159 See Vladeck, supra note 25, at 862–63. The Eleventh Circuit opinion in the broader Sebelius litigation did consider a challenge to the state-plaintiffs’ standing, but not on the Spending Clause issue. Florida ex rel. Att’y Gen. v. U.S. Dep’t of Health & Hum. Servs., 648 F.3d 1235, 1243 (11th Cir. 2011). There was no uncertainty that the spending conditions had a concrete and particularized effect on the states in some way—the states had to act to get their money. As a result, standing was not the issue of contention.",,75.0,matched
3,NOTE,section_header,footnote,,"See Vladeck, supra note 15; Steve Vladeck, Bonus 35: The Lawlessness of Missouri’s Standing in Biden v. Nebraska, One First (July 13, 2023) [hereinafter Vladeck, Lawlessness ], https://stevevladeck.com/p/bonus-35-the-lawlessness-of-missouris [ perma.cc/6URZ-EV56 ].",100.0,matched
3,SPENDING CLAUSE STANDING,section_header,body_text,"The Offset Provision cases define the terms of federalism’s future battleground. The Spending Contract and Tax Power injuries provide enterprising state attorneys general with the weapons to dismantle disfavored federal policy. Instead of adhering to standing doctrine’s core separation-of-powers principles, a majority of the involved circuit courts have enabled states to readily air their policy grievances in federal court. Because Congress increasingly relies on its spending power to pass legislation, when states can and cannot challenge federal policy has enormous implications for modern policymaking. When appropriate, Spending Clause standing doctrine should permit heightened scrutiny when a state unilaterally attempts to block a federal program.",,100.0,matched
3,Edward Webre Plaut*,section_header,section_header,,,61.111111111111114,unmatched
3,"The Biden Administration's American Rescue Plan Act allotted almost $220 billion to state, local, and tribal governments to help combat the COVID-19 pandemic. This money, the Coronavirus State and Local Fiscal Recovery Fund, gave recipients wide spending discretion to address their struggling economies. But the legislation had one key limitation: Recipients could not use the money to 'directly or indirectly' cut their taxes. If a recipient violated this 'Offset Provision,' the Department of the Treasury might recoup the funds.",text,footnote,,Id.,100.0,matched
3,"Nearly two-dozen states alleged that the Offset Provision was unduly coercive and ambiguous, violating the Spending Clause. However, with no threatened recoupment looming, it was unclear whether the states had standing to sue at all. The five circuit courts that heard these cases did not reach consensus on the standing issue. Numerous opinions across six cases offered differing conceptions of 'sovereign' injuries and applied Massachusetts v. EPA 's command for 'special solicitude' to the state plaintiffs inconsistently.",text,footnote,,Id.,100.0,matched
3,"The Offset Provision cases provide the first opportunity to study the intersection of the Spending Clause and state standing. With no precedent on when states can challenge congressional spending legislation, the cases navigated standing's incoherent doctrine to craft new rules. The Offset Provision cases offer two novel categories of sovereign injuries-in-fact that states allegedly suffer in Spending Clause cases: the 'Spending Contract' and 'Tax Power' injuries. The former relates to an unconstitutionally ambiguous or coercive federal offer, while the latter describes an impermissible regulatory subject matter.",text,footnote,,Id.,100.0,matched
3,"The Offset Provision cases define the terms of federalism's future battleground. The Spending Contract and Tax Power injuries provide enterprising state attorneys general with the weapons to dismantle disfavored federal policy. Instead of adhering to standing doctrine's core separation-of-powers principles, a majority of the involved circuit courts have enabled states to readily air their policy grievances in federal court. Because Congress increasingly relies on its spending power to pass legislation, when states can and cannot challenge fed-",text,footnote,,Id.,100.0,matched
3,"* Thank you to my peers and friends in the Volume 122 Notes Office-Hannah Cohen Smith, Kassie Fotiadis, Ashley Munger, Katie Osborn, and Jordan Schuler-for making me a better writer and more empathetic person. Thank you to our successors, the Volume 123 Notes Office, for their incredible edits. Thank you to my research advisors-Evan Caminker and Daniel Deacon-for countless office hours discussing ridiculous spending hypotheticals. Thank you to my dad for his nearly illegible redline and my mother for her writing talent. And thank you to Grayson Metzger for her edits, support, and motivation to submit (and resubmit) this Note.",footnote,footnote,,Id.,100.0,matched
4,"eral policy has enormous implications for modern policymaking. When appropriate, Spending Clause standing doctrine should permit heightened scrutiny when a state unilaterally attempts to block a federal program.",text,body_text,"The Offset Provision cases define the terms of federalism’s future battleground. The Spending Contract and Tax Power injuries provide enterprising state attorneys general with the weapons to dismantle disfavored federal policy. Instead of adhering to standing doctrine’s core separation-of-powers principles, a majority of the involved circuit courts have enabled states to readily air their policy grievances in federal court. Because Congress increasingly relies on its spending power to pass legislation, when states can and cannot challenge federal policy has enormous implications for modern policymaking. When appropriate, Spending Clause standing doctrine should permit heightened scrutiny when a state unilaterally attempts to block a federal program.",,100.0,matched
4,INTRODUCTION,section_header,body_text,"The Offset Provision cases provide the first opportunity to study the intersection of the Spending Clause and state standing. With no precedent on when states can challenge congressional spending legislation, the cases navigated standing’s incoherent doctrine to craft new rules. The Offset Provision cases offer two novel categories of sovereign injuries-in-fact that states allegedly suffer in Spending Clause cases: the “Spending Contract” and “Tax Power” injuries. The former relates to an unconstitutionally ambiguous or coercive federal offer, while the latter describes an impermissible regulatory subject matter.",,75.0,matched
4,"Responding to the COVID-19 pandemic and the ensuing economic crisis, Congress passed the American Rescue Plan Act (ARPA). 1 The $1.9 trillion ARPA was meant to do more than stop the bleeding-it contained unemployment insurance, food assistance, child tax credit funding, and more programs meant to usher in a new era of robust public spending. 2 One such ARPA program, the Coronavirus State and Local Fiscal Recovery Funds (CSLFRF), provided certain non-federal government entities almost $220 billion to 'mitigate the fiscal effects' of the pandemic. 3 The CSLFRF empowered states and local governments to spend on programs of their own choosing 4 -granting recipients wide discretion, but not a blank check. Indeed, the program contained one key limitation: the tax 'Offset Provision.' Recipients could spend the new money on nearly anything, but they could not use it to 'directly or indirectly offset' their taxes. 5 If they did, the Department of the Treasury (Treasury) could 'recoup' the impermissibly spent funds. 6",text,footnote,,Id.,100.0,matched
4,"Given the states' race to the courthouse prior to any real threat of enforcement, the Offset Provision opinions focused on the state-plaintiffs' standing.",text,body_text,"Given the states’ race to the courthouse prior to any real threat of enforcement, the Offset Provision opinions focused on the state-plaintiffs’ standing. The sparse Spending Clause case law confirms that Congressional “offers”—extensions of federal funds with spending or regulatory strings attached—to the states cannot be ambiguous or coercive. 12 See Pennhurst State Sch. & Hosp. v. Halderman, 451 U.S. 1, 17 (1981); South Dakota v. Dole, 483 U.S. 203, 207, 211 (1987); Nat’l Fed’n of Indep. Bus. v. Sebelius, 567 U.S. 519, 580–81 (2012). But that case law never addresses standing—that is, when states have the power to challenge these congressional offers. Must states wait until something “happens” pursuant to their “contract” with the federal government? In the Offset Provision cases, that would have meant waiting until the Treasury actually threatened enforcement.",,100.0,matched
4,"This Offset Provision initiated a flood of litigation challenging Congress's use of its spending power. 7 Within weeks of ARPA's passage, twenty-one states brought suit to enjoin the Treasury's enforcement of the Offset Provision. 8 Several states, whether or not they had tax cuts planned, recoiled at a perceived coercive congressional limitation on their sovereign power. 9 The states also argued that the 'directly or indirectly' language was impermissibly ambiguous-what did it mean to 'indirectly' cut taxes? 10 Even before the Treasury threatened any recoupment action, the states wanted an injunction. 11",text,footnote,,Id.,100.0,matched
4,"American Rescue Plan Act of 2021, Pub. L. No. 117-2, 135 Stat. 4.",list_item,footnote,,"American Rescue Plan Act of 2021, Pub. L. No. 117-2, 135 Stat. 4.",100.0,matched
4,"See Giovanni Russonello, What Does $1.9 Trillion Buy? , N.Y. TIMES (Apr. 29, 2021), https://nytimes.com/2021/03/10/us/politics/whats-in-covid-bill.html [perma.cc/5VJX-A7GE].",list_item,footnote,,Id.,100.0,matched
4,"42 U.S.C. §§ 802(a), (c)(1).",list_item,footnote,,"42 U.S.C. §§ 802(a), (c)(1).",100.0,matched
4,42 U.S.C. §§ 802-806.,list_item,footnote,,42 U.S.C. §§ 802–806.,100.0,matched
4,42 U.S.C. § 802(c)(2)(A).,list_item,footnote,,42 U.S.C. § 802(c)(2)(A).,100.0,matched
4,Id. § 802(e).,list_item,footnote,,Id. § 802(e).,100.0,matched
4,"See infra Section I.A; U.S. CONST. art. I, § 8, cl. 1.",list_item,footnote,,"See infra Section I.A; U.S. Const. art. I, § 8, cl. 1.",100.0,matched
4,"See infra Section I.A; Missouri v. Yellen, 538 F. Supp. 3d 906 (E.D. Mo. 2021); Arizona v. Yellen, 550 F. Supp. 3d 791 (D. Ariz. 2021); West Virginia v. U.S. Dep't of Treasury, 571 F. Supp. 3d 1229 (N.D. Ala. 2021); Kentucky v. Yellen, 563 F. Supp. 3d 647 (E.D. Ky. 2021); Texas v. Yellen, 597 F. Supp. 3d 1005 (N.D. Tex. 2022); Ohio v. Yellen, 539 F. Supp. 3d 802 (S.D. Ohio 2021).",list_item,footnote,,"See infra Section I.A; Missouri v. Yellen, 538 F. Supp. 3d 906 (E.D. Mo. 2021); Arizona v. Yellen, 550 F. Supp. 3d 791 (D. Ariz. 2021); West Virginia v. U.S. Dep’t of Treasury, 571 F. Supp. 3d 1229 (N.D. Ala. 2021); Kentucky v. Yellen, 563 F. Supp. 3d 647 (E.D. Ky. 2021); Texas v. Yellen, 597 F. Supp. 3d 1005 (N.D. Tex. 2022); Ohio v. Yellen, 539 F. Supp. 3d 802 (S.D. Ohio 2021).",100.0,matched
4,"See, e.g. , Missouri v. Yellen, 39 F.4th 1063, 1069-70 (8th Cir. 2022).",list_item,footnote,,"See, e.g. , Missouri v. Yellen, 39 F.4th 1063, 1069–70 (8th Cir. 2022).",100.0,matched
4,"See, e.g. , Arizona v. Yellen, 34 F.4th 841, 848 (9th Cir. 2022).",list_item,footnote,,"See, e.g. , Arizona v. Yellen, 34 F.4th 841, 848 (9th Cir. 2022).",100.0,matched
4,"See, e.g. , Kentucky v. Yellen, 54 F.4th 325, 329 (6th Cir. 2022).",list_item,footnote,,"See, e.g. , Kentucky v. Yellen, 54 F.4th 325, 329 (6th Cir. 2022).",100.0,matched
5,"The sparse Spending Clause case law confirms that Congressional 'offers'extensions of federal funds with spending or regulatory strings attached-to the states cannot be ambiguous or coercive. 12 But that case law never addresses standing-that is, when states have the power to challenge these congressional offers. Must states wait until something 'happens' pursuant to their 'contract' with the federal government? In the Offset Provision cases, that would have meant waiting until the Treasury actually threatened enforcement.",text,body_text,No,,100.0,matched
5,"The Offset Provision cases are the perfect (and, currently, the only) experiment to study the intersection of state sovereign standing and the Spending Clause. The circuit courts are split in their first attempts to tie together these two jurisprudential threads. The Fifth, Sixth, Eighth, Ninth, and Eleventh Circuits came to different conclusions on these questions and the underlying merits. Two courts found no standing for sovereign injuries; 17 three found standing for sovereign injuries, 18 two of which enjoined the Offset Provision. 19",text,body_text,Enjoined the Offset Provision?,,100.0,matched
5,"Relatedly, under Massachusetts v. EPA , the Supreme Court mandated that in a federal court's standing analysis, state-plaintiffs' unique sovereign status entitled them to 'special solicitude.' 13 But how should a court apply special solicitude in Spending Clause cases, if at all? 14 By virtue of their sovereign status, can states challenge federal spending conditions the moment Congress offers them, as the states in the Offset Provision cases did? For increasingly litigious state governments, these threshold questions have enormous implications for the future of federal-state litigation. 15 And, although special solicitude technically retains its precedential value, the Supreme Court has neglected to support the doctrine-or even apply it-since Massachusetts v. EPA . 16",text,footnote,,Id.,100.0,matched
5,The disparate opinions help elucidate the contours of the sovereign 'injuries-in-fact'-one of the three requirements for Article III standing-that states suffer when Congress makes a coercive or ambiguous offer under the,text,footnote,,Id.,100.0,matched
5,"12. See Pennhurst State Sch. & Hosp. v. Halderman, 451 U.S. 1, 17 (1981); South Dakota v. Dole, 483 U.S. 203, 207, 211 (1987); Nat'l Fed'n of Indep. Bus. v. Sebelius, 567 U.S. 519, 58081 (2012).",footnote,footnote,,"See Pennhurst State Sch. & Hosp. v. Halderman, 451 U.S. 1, 17 (1981); South Dakota v. Dole, 483 U.S. 203, 207, 211 (1987); Nat’l Fed’n of Indep. Bus. v. Sebelius, 567 U.S. 519, 580–81 (2012).",99.73474801061008,matched
5,"13. Massachusetts v. EPA, 549 U.S. 497, 519-20 (2007).",footnote,footnote,,"Massachusetts v. EPA, 549 U.S. 497, 519–20 (2007).",100.0,matched
5,"See United States v. Texas, 143 S. Ct. 1964, 1977 (2023) (Gorsuch, J., concurring).",list_item,footnote,,"See United States v. Texas, 143 S. Ct. 1964, 1977 (2023) (Gorsuch, J., concurring).",100.0,matched
5,"15. See Steve Vladeck, 16. When Can States Sue the Federal Government? , ONE FIRST (Feb. 27, 2023), https://stevevladeck.com/p/16-when-can-states-sue-the-federal [perma.cc/XE9LNM97] (noting the frequency of state challenges to Biden administration policies); Our Story: About the Alliance , GOVERNORS SAFEGUARDING DEMOCRACY, https://govsfordemocracy.org/about-us [perma.cc/Z5FE-YKW5] (reflecting the same litigious ambition of Democratic Governors J.B. Pritzker and Jared Polis in the second Trump administration).",footnote,footnote,,Id.,100.0,matched
5,"16. United States v. Texas, 143 S. Ct. at 1977 (Gorsuch, J., concurring).",footnote,footnote,,"United States v. Texas, 143 S. Ct. at 1977 (Gorsuch, J., concurring).",100.0,matched
5,"Missouri v. Yellen, 39 F.4th 1063, 1070 (8th Cir. 2022); Kentucky v. Yellen, 54 F.4th 325, 329 (6th Cir. 2022); Ohio v. Yellen, 53 F.4th 983, 993 (6th Cir. 2022). The Sixth Circuit in Kentucky v. Yellen held that Tennessee had standing for a compliance cost injury. 54 F.4th at 342.",list_item,footnote,,"Missouri v. Yellen, 39 F.4th 1063, 1070 (8th Cir. 2022); Kentucky v. Yellen, 54 F.4th 325, 329 (6th Cir. 2022); Ohio v. Yellen, 53 F.4th 983, 993 (6th Cir. 2022). The Sixth Circuit in Kentucky v. Yellen held that Tennessee had standing for a compliance cost injury. 54 F.4th at 342.",100.0,matched
5,"Arizona v. Yellen, 34 F.4th 841, 852 (9th Cir. 2022); West Virginia ex rel. Morrisey v. U.S. Dep't of the Treasury, 59 F.4th 1124, 1136 (11th Cir. 2023); Texas v. Yellen, 105 F.4th 755, 767 (5th Cir. 2024).",list_item,footnote,,"Arizona v. Yellen, 34 F.4th 841, 852 (9th Cir. 2022); West Virginia ex rel. Morrisey v. U.S. Dep’t of the Treasury, 59 F.4th 1124, 1136 (11th Cir. 2023); Texas v. Yellen, 105 F.4th 755, 767 (5th Cir. 2024).",100.0,matched
5,"19. Morrisey , 59 F.4th at 1148-49; Texas v. Yellen, 105 F.4th at 774.",footnote,footnote,,"Morrisey , 59 F.4th at 1148–49; Texas v. Yellen, 105 F.4th at 774.",100.0,matched
6,"Spending Clause. The Offset Provision cases produced two general categories of sovereign injuries, styled here as the 'Spending Contract' injury and the 'Tax Power' injury. The Spending Contract injury, the asserted basis for standing in the Fifth, Ninth, and Eleventh Circuits, 20 focuses on the offer : Congress offends state sovereignty when it offers federal funds with coercive or ambiguous spending conditions. 21 The Tax Power injury-a 'plus factor' for standing in the Ninth and Eleventh Circuits-focuses on the subject matter : States can challenge congressional exercises of the Spending Clause that constrain certain sovereign prerogatives, like the power to tax. 22",text,body_text,Plus Factor,,100.0,matched
6,"States should not have the power to hold federal law hostage. State standing under the Spending Clause should not depend on arbitrary determinations of sovereign prerogatives or hypothetical federal enforcement. By expanding state standing to challenge federal law, the Offset Provision cases risk breathing unneeded life into Massachusetts v. EPA . While some legal commentators have argued that expansive state standing offers states a meaningful policy platform, 26 federal courts should not accept incoherent doctrine that",text,body_text,No,,100.0,matched
