page_no,pdf_text,pdf_original_label,pdf_corrected_label,matched_html_body,matched_html_footnote,match_confidence,match_status
1,Michigan Law Review,section_header,section_header,,,63.1578947368421,unmatched
1,Volume 124 Issue 1,text,text,,,55.55555555555556,unmatched
1,2025,text,footnote,,"See Abbe R. Gluck, Elizabeth Chamblee Burch & Adam S. Zimmerman, Against Bankruptcy: Public Litigation Values Versus the Endless Quest for Global Peace in Mass Litigation , 133 Yale L.J.F. 525, 527–28 (2024) (describing the “unprecedented number” of tort defendants, many of which “are not even financially distressed,” that have filed for bankruptcy “to compensate for what their court filings call the ‘failure’ of traditional litigation to expeditiously extinguish all lawsuits”); see also Luke Sperduto, Three and a Half Rules for Tort Claims in (and out of) Chapter 11 , 95 Am. Bankr. L.J. 127, 129–30 (2021) (“When a corporation files for bankruptcy due to tort liabilities, tort claimants often recover a smaller share of what they are owed than the company’s secured creditors. This is because tort claims are general unsecured claims, which are subordinate to secured claims under state law and the United States Bankruptcy Code.”).",75.0,matched
1,Tort Law in a World of Scarce Compensatory Resources,section_header,body_text,"But in a world of scarce compensatory resources, this account does not persuasively describe tort law. Contra Ripstein, there is no “adequate compensation” for wrongful death or severe bodily injuries which “can enable a person to have (almost) the same range of options” they had prior to the injury. The damages remedy for these irreparable harms cannot “make it as if the wrong had never happened.” Rather than rely on the inherently inadequate monetary damages remedy, tort law strives to prevent these irreparable injuries by incorporating their social values into the obligation to exercise reasonable care—contrary to Weinrib’s claim that “deterrence plays no role in defining the nature of the wrong.” The inadequacy of compensatory damages makes deterrence especially valuable. Deterrence is an essential property for understanding tort law that is overlooked by formulations of corrective justice which assume that compensatory damages can always normatively correct for wrongdoing and fully restore normative equilibrium.",,90.9090909090909,matched
1,Mark A. Geistfeld New York University School of Law,text,body_text,"* Sheila Lubetsky Birnbaum Professor of Civil Litigation, New York University School of Law. Copyright 2024 Mark A. Geistfeld. I’m grateful for the many helpful comments I received from Barry Adler, participants in the Yale Private Law Colloquium, and my colleagues at the NYU Law Faculty Workshop. Financial support was provided by the Filomen D’Agostino and Max E. Greenberg Research Fund of the New York University School of Law.",,83.14606741573034,matched
1,Follow this and additional works at: https://repository.law.umich.edu/mlr,text,text,,,51.5625,unmatched
1,"Part of the Common Law Commons, and the Torts Commons",text,text,,,66.03773584905662,unmatched
1,Recommended Citation,section_header,section_header,,,65.0,unmatched
1,"Mark A. Geistfeld, Tort Law in a World of Scarce Compensatory Resources, 124 MICH. L. REV. 59 (2025). Available at: https://repository.law.umich.edu/mlr/vol124/iss1/3",text,text,,,62.22222222222222,unmatched
1,https://doi.org/10.36644/mlr.124.1.tort,section_header,section_header,,,64.1025641025641,unmatched
1,"This Article is brought to you for free and open access by the Michigan Law Review at University of Michigan Law School Scholarship Repository. It has been accepted for inclusion in Michigan Law Review by an authorized editor of University of Michigan Law School Scholarship Repository. For more information, please contact mlaw.repository@umich.edu.",text,text,,,66.66666666666667,unmatched
2,TORTLAWINAWORLDOFSCARCE COMPENSATORYRESOURCES,section_header,body_text,"But in a world of scarce compensatory resources, this account does not persuasively describe tort law. Contra Ripstein, there is no “adequate compensation” for wrongful death or severe bodily injuries which “can enable a person to have (almost) the same range of options” they had prior to the injury. The damages remedy for these irreparable harms cannot “make it as if the wrong had never happened.” Rather than rely on the inherently inadequate monetary damages remedy, tort law strives to prevent these irreparable injuries by incorporating their social values into the obligation to exercise reasonable care—contrary to Weinrib’s claim that “deterrence plays no role in defining the nature of the wrong.” The inadequacy of compensatory damages makes deterrence especially valuable. Deterrence is an essential property for understanding tort law that is overlooked by formulations of corrective justice which assume that compensatory damages can always normatively correct for wrongdoing and fully restore normative equilibrium.",,86.66666666666667,matched
2,Mark A. Geistfeld,section_header,footnote,,"Once a loss has already occurred, “whatever benefit might be derived from repairing the fortunes of one person is exactly offset by the harm caused through taking that amount away from another.” Id. at 4. Consequently, in the absence of any legal priority of the plaintiff’s impaired interest over the defendant’s conflicting interest, a defendant subject to liability could then sue to re-shift the loss back onto the plaintiff on the ground that the plaintiff caused the defendant to suffer this harm. In principle, the cycle would recur endlessly for any arbitrary shifting of the loss. “Hence, a shifting of loss is justified only when there exists special reason for requiring the defendant to bear it rather than the plaintiff on whom it happens to have fallen.” Id. These special reasons justify a legal priority of the plaintiff’s protected, injured interest over the defendant’s conflicting interest, with the priority providing the mechanism for shifting the loss in a nonarbitrary manner. The burden of proof then maintains the integrity of this priority. The plaintiff must prove the elements of the prima facie case by a preponderance of the evidence. When the evidence is in equipoise, showing that there is a fifty-percent chance that the plaintiff is entitled to recovery and a fifty-percent chance that the defendant is not responsible, then the respective interests of the two parties are normatively indistinguishable, and the plaintiff must bear the loss. See Mark A. Geistfeld, Tort Law: The Essentials 109–11 (2008).",100.0,matched
2,TABLE OF CONTENTS,section_header,body_text,"Once again, this compensatory property can explain leading corrective-justice accounts of tort law. On this view, “[p]unitive damages are inconsistent with corrective justice for reasons both of structure and of content.” 66 Ernest J. Weinrib, Corrective Justice 97 (2012). By relying on a normative ideal of full and perfect compensation, this formulation of corrective justice renders both deterrence and punishment irrelevant. Punitive damages also cannot convey any expressive message, because the payment of perfectly compensatory damages already “make[s] it as if the wrong had never happened.” 67 Ripstein, supra note 61, at 1966.",,70.58823529411764,matched
3,CONCLUSION............................................................................................................124,text,text,,,66.66666666666667,unmatched
4,TORTLAWINAWORLDOFSCARCE COMPENSATORYRESOURCES,section_header,body_text,"But in a world of scarce compensatory resources, this account does not persuasively describe tort law. Contra Ripstein, there is no “adequate compensation” for wrongful death or severe bodily injuries which “can enable a person to have (almost) the same range of options” they had prior to the injury. The damages remedy for these irreparable harms cannot “make it as if the wrong had never happened.” Rather than rely on the inherently inadequate monetary damages remedy, tort law strives to prevent these irreparable injuries by incorporating their social values into the obligation to exercise reasonable care—contrary to Weinrib’s claim that “deterrence plays no role in defining the nature of the wrong.” The inadequacy of compensatory damages makes deterrence especially valuable. Deterrence is an essential property for understanding tort law that is overlooked by formulations of corrective justice which assume that compensatory damages can always normatively correct for wrongdoing and fully restore normative equilibrium.",,86.66666666666667,matched
4,Mark A. Geistfeld*,section_header,footnote,,"Once a loss has already occurred, “whatever benefit might be derived from repairing the fortunes of one person is exactly offset by the harm caused through taking that amount away from another.” Id. at 4. Consequently, in the absence of any legal priority of the plaintiff’s impaired interest over the defendant’s conflicting interest, a defendant subject to liability could then sue to re-shift the loss back onto the plaintiff on the ground that the plaintiff caused the defendant to suffer this harm. In principle, the cycle would recur endlessly for any arbitrary shifting of the loss. “Hence, a shifting of loss is justified only when there exists special reason for requiring the defendant to bear it rather than the plaintiff on whom it happens to have fallen.” Id. These special reasons justify a legal priority of the plaintiff’s protected, injured interest over the defendant’s conflicting interest, with the priority providing the mechanism for shifting the loss in a nonarbitrary manner. The burden of proof then maintains the integrity of this priority. The plaintiff must prove the elements of the prima facie case by a preponderance of the evidence. When the evidence is in equipoise, showing that there is a fifty-percent chance that the plaintiff is entitled to recovery and a fifty-percent chance that the defendant is not responsible, then the respective interests of the two parties are normatively indistinguishable, and the plaintiff must bear the loss. See Mark A. Geistfeld, Tort Law: The Essentials 109–11 (2008).",100.0,matched
4,"Large corporations facing extensive tort liabilities have often gone into bankruptcy, forcing tort plaintiffs to accept pennies on the dollar as compensation for their injuries. Bankruptcy painfully illustrates the social fact that the compensatory properties of tort law depend on the availability of compensatory resources. Although this feature of tort law is self-evident, no one has adequately analyzed whether it matters for substantive tort doctrine, and if so, how.",text,footnote,,Id.,100.0,matched
4,"Wealth would seem to be substantively irrelevant given the rule that excludes evidence concerning the defendant's financial resources when determining breach or compensatory damages. The antecedent tort duty, however, depends on the burden it would impose on the ordinary duty-bearer across the general class of cases the duty governs. The reasonableness of this burden is affected by social facts such as per capita wealth, the replacement of debtor's prison with bankruptcy, the availability of liability insurance, and the social meaning of monetary damages. These normatively relevant facts are largely absent from modern accounts of tort law, even though they contract or expand the scope of substantive tort duties for noncontroversial reasons grounded in widely recognized tort values. An extended historical and doctrinal analysis confirms as much, showing how the scarcity of compensatory resources has shaped the basic structure of tort law-why it employs a default rule of negligence liability, sometimes supplemented by strict liability, while also being limited for wide swaths of negligently caused harms involving economic loss and emotional distress.",text,footnote,,Id.,100.0,matched
4,"Accounting for the availability of compensatory resources reveals normative properties of substantive tort law that are often quite different from the ones modern tort theories depict, including the relation between tort law and criminal law and the vital role deterrence plays in a rights-based tort system. An adequate account of tort law must comprehend how the scarcity of compensatory resources alters substantive tort doctrine in principled ways.",text,body_text,"Accounting for the availability of compensatory resources reveals normative properties of substantive tort law that are often quite different from the ones modern tort theories depict, including the relation between tort law and criminal law and the vital role deterrence plays in a rights-based tort system. An adequate account of tort law must comprehend how the scarcity of compensatory resources alters substantive tort doctrine in principled ways.",,100.0,matched
4,INTRODUCTION,section_header,footnote,,"Different theories of justice disagree about “which specific kind of equality is required by the more abstract idea of treating people as equals.” Will Kymlicka , Contemporary Political Philosophy: An Introduction 4 ( 2d ed. 2001). Put differently, “the fundamental argument is not whether to accept equality, but how best to interpret it.” Id.",100.0,matched
4,"The relationship between tort law and bankruptcy has garnered considerable attention. Faced with widespread tort liabilities, large corporations have",text,footnote,,Id.,100.0,matched
4,"* Sheila Lubetsky Birnbaum Professor of Civil Litigation, New York University School of Law. Copyright 2024 Mark A. Geistfeld. I'm grateful for the many helpful comments I received from Barry Adler, participants in the Yale Private Law Colloquium, and my colleagues at the NYU Law Faculty Workshop. Financial support was provided by the Filomen D'Agostino and Max E. Greenberg Research Fund of the New York University School of Law.",footnote,footnote,,Id.,100.0,matched
5,"often declared bankruptcy, forcing tort claimants to accept pennies on the dollar as compensation for their injuries. 1 This compensatory problem is brought into sharp relief by the Supreme Court's recent decision involving Purdue Pharma L.P.'s bankruptcy after it faced at least $40 trillion of potential tort liabilities for manufacturing and distributing Oxycontin, the highly addictive pain killer largely responsible for triggering the opioid-overdose crisis. 2 Although the case turned on the statutory powers of federal bankruptcy courts, 3 it painfully illustrates how bankruptcy affects tort compensation. Under the plan the bankruptcy court approved, 'if people experienced a potentially deadly addiction that could be linked to a Purdue prescription, they may receive the minimum payout, $3,500-a paltry sum.' 4 Cases like this underscore the self-evident proposition that the compensatory properties of tort law depend on the availability of compensatory resources.",text,footnote,,Id.,100.0,matched
5,"To be sure, this kind of problem supplies the subject matter of economics, which seeks to identify the efficient allocation of scarce resources. But the scarcity of compensatory resources does not entail the need to formulate tort rules in an efficient manner. Scarcity can be normatively relevant for other reasons, though the question remains open because no one has seriously pursued this line of analysis.",text,footnote,,Id.,100.0,matched
5,"Perhaps because it is so obvious, this property of tort law has been largely ignored. 'Compensation of persons injured by wrongdoing is one of the generally accepted aims of tort law.' 5 Compensation is a guiding concern of tort law, yet no one has rigorously analyzed whether substantive tort law should be affected by the scarcity of compensatory resources, and if so, how.",text,footnote,,Id.,100.0,matched
5,"This surprising lacuna in torts scholarship finds expression in Kenneth Abraham and Catherine Sharkey's recent, provocative claim that there is a 'glaring gap in tort theory' involving 'its failure to take adequate account of",text,body_text,"This surprising lacuna in torts scholarship finds expression in Kenneth Abraham and Catherine Sharkey’s recent, provocative claim that there is a “glaring gap in tort theory” involving “its failure to take adequate account of liability insurance” beyond its “being a mere source of funding.” 6 Kenneth S. Abraham & Catherine M. Sharkey, The Glaring Gap in Tort Theory , 133 Yale L.J. 2165, 2169 (2024). In their view, a satisfactory theoretical account must “recognize the centrality of liability insurance for the doctrinal evolution of tort and . . . incorporate . . . liability insurance as a prominent normative factor driving tort liability.” 7 Id. at 2235–36. This “glaring gap” extends beyond liability insurance and implicates the deeper question concerning the available resources for compensating tortiously caused injuries: Whereas liability insurance increases compensatory resources, bankruptcy reduces them. Any “glaring gap” in tort theory involving liability insurance necessarily extends to the more fundamental question of how the availability of compensatory resources substantively shapes tort law.",,100.0,matched
5,"1. See Abbe R. Gluck, Elizabeth Chamblee Burch & Adam S. Zimmerman, Against Bankruptcy: Public Litigation Values Versus the Endless Quest for Global Peace in Mass Litigation , 133 YALE L.J.F. 525, 527-28 (2024) (describing the 'unprecedented number' of tort defendants, many of which 'are not even financially distressed,' that have filed for bankruptcy 'to compensate for what their court filings call the 'failure' of traditional litigation to expeditiously extinguish all lawsuits'); see also Luke Sperduto, Three and a Half Rules for Tort Claims in (and out of) Chapter 11 , 95 AM. BANKR. L.J. 127, 129-30 (2021) ('When a corporation files for bankruptcy due to tort liabilities, tort claimants often recover a smaller share of what they are owed than the company's secured creditors. This is because tort claims are general unsecured claims, which are subordinate to secured claims under state law and the United States Bankruptcy Code.').",footnote,footnote,,"See Abbe R. Gluck, Elizabeth Chamblee Burch & Adam S. Zimmerman, Against Bankruptcy: Public Litigation Values Versus the Endless Quest for Global Peace in Mass Litigation , 133 Yale L.J.F. 525, 527–28 (2024) (describing the “unprecedented number” of tort defendants, many of which “are not even financially distressed,” that have filed for bankruptcy “to compensate for what their court filings call the ‘failure’ of traditional litigation to expeditiously extinguish all lawsuits”); see also Luke Sperduto, Three and a Half Rules for Tort Claims in (and out of) Chapter 11 , 95 Am. Bankr. L.J. 127, 129–30 (2021) (“When a corporation files for bankruptcy due to tort liabilities, tort claimants often recover a smaller share of what they are owed than the company’s secured creditors. This is because tort claims are general unsecured claims, which are subordinate to secured claims under state law and the United States Bankruptcy Code.”).",100.0,matched
5,"2. Harrington v. Purdue Pharma L.P., 144 S. Ct. 2071, 2098 (2024) (Kavanaugh, J., dissenting). For further discussion of this case, see infra notes 186-187 and accompanying text.",footnote,footnote,,"Harrington v. Purdue Pharma L.P., 144 S. Ct. 2071, 2098 (2024) (Kavanaugh, J., dissenting). For further discussion of this case, see infra notes 186–187 and accompanying text.",100.0,matched
5,3. Id. at 2084.,footnote,footnote,,Id. at 2084.,100.0,matched
5,"4. Ryan Hampton, The Sacklers Are Walking Off into the Sunset. Reform the System , N.Y. TIMES (Sept. 11, 2021), https://nytimes.com/2021/09/11/opinion/purdue-sacklers-opioids-oxycontin-settlement.html [perma.cc/F46C-KET2].",footnote,footnote,,Id.,100.0,matched
5,"5. DAN B. DOBBS, PAUL T. HAYDEN & ELLEN M. BUBLICK, THE LAW OF TORTS § 13, at 26-27 (2d ed. 2011).",footnote,footnote,,"Dan B. Dobbs, Paul T. Hayden & Ellen M. Bublick, The Law of Torts § 13, at 26–27 (2d ed. 2011).",100.0,matched
6,"liability insurance' beyond its 'being a mere source of funding.' 6 In their view, a satisfactory theoretical account must 'recognize the centrality of liability insurance for the doctrinal evolution of tort and . . . incorporate . . . liability insurance as a prominent normative factor driving tort liability.' 7 This 'glaring gap' extends beyond liability insurance and implicates the deeper question concerning the available resources for compensating tortiously caused injuries: Whereas liability insurance increases compensatory resources, bankruptcy reduces them. Any 'glaring gap' in tort theory involving liability insurance necessarily extends to the more fundamental question of how the availability of compensatory resources substantively shapes tort law.",text,body_text,"This surprising lacuna in torts scholarship finds expression in Kenneth Abraham and Catherine Sharkey’s recent, provocative claim that there is a “glaring gap in tort theory” involving “its failure to take adequate account of liability insurance” beyond its “being a mere source of funding.” 6 Kenneth S. Abraham & Catherine M. Sharkey, The Glaring Gap in Tort Theory , 133 Yale L.J. 2165, 2169 (2024). In their view, a satisfactory theoretical account must “recognize the centrality of liability insurance for the doctrinal evolution of tort and . . . incorporate . . . liability insurance as a prominent normative factor driving tort liability.” 7 Id. at 2235–36. This “glaring gap” extends beyond liability insurance and implicates the deeper question concerning the available resources for compensating tortiously caused injuries: Whereas liability insurance increases compensatory resources, bankruptcy reduces them. Any “glaring gap” in tort theory involving liability insurance necessarily extends to the more fundamental question of how the availability of compensatory resources substantively shapes tort law.",,94.53809844908967,matched
6,"Instead of tackling these issues, Abraham and Sharkey sidestep them by arguing that courts pretend to abide by these tort principles while ignoring them: '[C]ourts often honor the frequently followed fiction that common-law decisions are to be based on precedent and principle, not on policy considerations. Mentioning the availability of liability insurance as a factor in decisions about the proper scope of tort liability would conflict with this fiction.' 10",text,footnote,,Id.,100.0,matched
6,"This basic question has never been adequately addressed, making it mysterious why liability insurance-and, by extension, bankruptcy-both implicates issues of funding and appropriately factors into substantive tort law. A large part of the difficulty arises from the firmly established rule that a defendant's financial ability to pay for a judgment 'is not alone sufficient to justify legal responsibility . . . and this overarching principle must be taken into account' within substantive tort law. 8 Liability insurance and other factors like bankruptcy affect the availability of compensatory resources and would seem to have obvious importance for tort law, but incorporating those concerns into substantive doctrine would apparently require courts to depart from timehonored tort principles. 9",text,body_text,"This basic question has never been adequately addressed, making it mysterious why liability insurance—and, by extension, bankruptcy—both implicates issues of funding and appropriately factors into substantive tort law. A large part of the difficulty arises from the firmly established rule that a defendant’s financial ability to pay for a judgment “is not alone sufficient to justify legal responsibility . . . and this overarching principle must be taken into account” within substantive tort law. 8 Ira S. Bushey & Sons, Inc. v. United States, 398 F.2d 167, 171 (2d Cir. 1968) (citation omitted) (discussing the proper formulation of vicarious liability); see also, e.g. , Fed. R. Evid. 411 (“Evidence that a person was or was not insured against liability is not admissible to prove whether the person acted negligently or otherwise wrongfully.”). Liability insurance and other factors like bankruptcy affect the availability of compensatory resources and would seem to have obvious importance for tort law, but incorporating those concerns into substantive doctrine would apparently require courts to depart from time-honored tort principles. 9 Cf. Ernest J. Weinrib, The Insurance Justification and Private Law , 14 J. Legal Stud. 681, 683 (1985) (“Attention to activity and passivity in the context of a given harm precludes consideration of the litigants’ wealth, virtue, or need: whatever the relevance of these factors for distribution or moral assessment, they are not elements in the parties’ immediate interaction as such.”).",,81.0930576070901,matched
