page_no,pdf_text,pdf_original_label,pdf_corrected_label,matched_html_body,matched_html_footnote,match_confidence,match_status
31,"them from the federal government-a completely unworkable standard that would be based entirely on a judge's own understanding of sovereign interests. The quarantined policy space is also underinclusive. It is hard to imagine that, in a world where states have standing to challenge federal regulation that touched on tax, they would lack standing for regulations that pertained to a national healthcare program. Further, given the Fifth Circuit's categorical prohibition on using the Spending Clause to prohibit tax cuts, it is possible that legislative subject matter could be decisive on the merits as well. 236 Returning to the environmental bill hypothetical discussed above: Even with precise, unambiguous language, a bill that regulates a state's environment or land could also intrude on some sovereign prerogative (as it seemed to in Massachusetts v. EPA ). States could rattle off any number of sacred sovereign subject matters (taxes, the environment, education, abortion-the sky is really the limit) to essentially reverse-preempt federal legislation on those questions. 237 Onany of these subjects, states would be insulated from federal pressure and citizens might be marooned without federal solutions to pressing concerns.",text,body_text,"Judge Nalbandian’s conception of a Tax Power injury, however, is completely at odds with the Supreme Court’s modern approach to congressional lawmaking. For decades, the Supreme Court has dispensed with dividing regulatory areas into “state” and “federal” buckets. 235 See Garcia v. S.A. Metro. Transit Auth., 469 U.S. 528 (1985) (overruling Nat’l League of Cities v. Usery, 426 U.S. 833 (1976)). Judge Nalbandian’s approach separates from more ancillary, nonsovereign regulation certain policies based on some set of core sovereign subject matters and quarantines them from the federal government—a completely unworkable standard that would be based entirely on a judge’s own understanding of sovereign interests. The quarantined policy space is also underinclusive. It is hard to imagine that, in a world where states have standing to challenge federal regulation that touched on tax, they would lack standing for regulations that pertained to a national healthcare program. Further, given the Fifth Circuit’s categorical prohibition on using the Spending Clause to prohibit tax cuts, it is possible that legislative subject matter could be decisive on the merits as well. 236 Texas v. Yellen, 105 F.4th 755 (5th Cir. 2024). Returning to the environmental bill hypothetical discussed above: Even with precise, unambiguous language, a bill that regulates a state’s environment or land could also intrude on some sovereign prerogative (as it seemed to in Massachusetts v. EPA ). States could rattle off any number of sacred sovereign subject matters (taxes, the environment, education, abortion—the sky is really the limit) to essentially reverse-preempt federal legislation on those questions. 237 Cf. Metzger, supra note 143, at 2038–39 (arguing that standing for these issues is desirable). On any of these subjects, states would be insulated from federal pressure and citizens might be marooned without federal solutions to pressing concerns.",,91.74757281553399,matched
31,"Like the no-imminence-required approach to the Spending Contract injury, Judge Nalbandian's articulation of the Tax Power injury coincides with Bulman-Pozen's justification for special solicitude. 238 For Bulman-Pozen, states have a role in 'vindicating the public interest' to the same extent as federal lawmakers. 239 The haphazard piling of Judge Nalbandian's inferences aside, a state's economic health would likely fall under this public interest umbrella. Although both arrive at the same legal conclusion-state standingBulman-Pozen does not equate special solicitude with the protection of the state-plaintiff's 'residuary and inviolable sovereignty' as Judge Nalbandian does. 240 Instead, Bulman-Pozen argues, consistent with the new process federalism perspective on state servants in a federal regulatory system, Massachusetts v. EPA suggests the loss of state sovereignty: The 'lodging' of the state's sovereign prerogatives into the federal government 'gave the state a cognizable interest in ensuring the EPA's compliance with federal law.' 241 Nonetheless, as Bulman-Pozen and Judge Nalbandian conceive it, federal courts-not Congress-are the appropriate forums to hash out policy differences and sovereign interests. 242",text,footnote,,Id.,100.0,matched
31,"236. Texas v. Yellen, 105 F.4th 755 (5th Cir. 2024).",footnote,footnote,,"Texas v. Yellen, 105 F.4th 755 (5th Cir. 2024).",100.0,matched
31,"237. Cf. Metzger, supra note 143, at 2038-39 (arguing that standing for these issues is desirable).",footnote,footnote,,"Cf. Metzger, supra note 143, at 2038–39 (arguing that standing for these issues is desirable).",100.0,matched
31,238. See supra Section I.B.1.,footnote,footnote,,See supra Section I.B.1.,100.0,matched
31,"239. Bulman-Pozen, supra note 26, at 1750.",footnote,footnote,,"Bulman-Pozen, supra note 26, at 1750.",100.0,matched
31,"240. Kentucky v. Yellen, 54 F.4th 325, 359 (6th Cir. 2022) (Nalbandian, J., concurring in part) (quoting THE FEDERALIST NO. 39, at 245 (James Madison) (Clinton Rossiter ed., 1961)).",footnote,body_text,No,,100.0,matched
31,"241. Bulman-Pozen, supra note 26, at 1747.",footnote,footnote,,"Bulman-Pozen, supra note 26, at 1747.",100.0,matched
31,"242. See id. at 1748. Little legal scholarship exists offering a defense of special solicitude from Judge Nalbandian's perspective-that states have a sovereign interest that should be protected from federal overreach. Scholars seem to divide into two, relatively non-ideological camps: (i) end special solicitude and (ii) new process federalist special solicitude. Compare Vladeck, supra note 25, and Crocker, supra note 128, with Bulman-Pozen, supra note 26.",footnote,footnote,,Id.,100.0,matched
32,3. No Tax Power Injury,section_header,body_text,No,,100.0,matched
32,"The Sixth Circuit majority (from which Judge Nalbandian dissented on this issue) otherwise had a more constrained view of the Tax Power injury. 243 The court explained that before the Treasury's final rule, the Offset Provision's constraint of Kentucky and Tennessee's 'sovereign authority to tax . . . sufficed for standing.' 244 However, after the final rule, the states no longer had Tax Power standing because they failed to identify a 'specific course of conduct' that would lead to recoupment. 245 The court reasoned that the final rule 'subsequently disavowed the States' interpretation of the Offset Provision,' leaving them with an outdated fear of losing the CSLFRF. 246 The court reached a similar conclusion in Ohio v. Yellen : Ohio suffered no injury from the mere 'subjective chill' the Offset Provision had on its taxing authority. 247 Likewise, the Eighth Circuit held that where there was no imminent threat to Missouri's 'constitutional right to set taxes,' there was no Tax Power injury. 248",text,footnote,,Id.,100.0,matched
32,"As with the Spending Contract injury, the circuit courts disagreed on whether the Tax Power injury required an impending constraint of state tax authority. What's more, the courts were divided on how the two sovereign injuries interacted with each other and where special solicitude played a part in their analysis, if at all. Nonetheless, the courts believed that the two injuries,",text,footnote,,Id.,100.0,matched
32,"The Fifth Circuit did not explicitly discuss the Tax Power injury at all. 249 Instead, the court discussed the 'surrendering [of the plaintiffs'] ability to set state tax policy' as part of the Spending Contract injury-the power to tax is simply part of the consideration in a coercive contractual offer. 250 It is entirely possible that the court would treat its analysis of ambiguity and coercion in the Offset Provision differently if the state were foregoing something pedestrian (and not sovereign) like contractual rights with a private party, but there is no specific discussion of how the sovereign nature of the tax power elevates plaintiffs' standing.",text,footnote,,Id.,100.0,matched
32,"243. Judge Bush did appear to incorporate Judge Nalbandian's analysis in his statement denying rehearing en banc in Kentucky . See Kentucky v. Yellen, 67 F.4th 322, 323 (mem.) (6th Cir. 2023) (denying rehearing en banc ) (calling the Offset Provision a 'violent assumption of power') (quoting THE FEDERALIST NO. 32, at 154 (Alexander Hamilton) (George W. Carey & James McClellan eds., 2001)).",footnote,footnote,,Id.,100.0,matched
32,"244. Kentucky v. Yellen, 54 F.4th at 336.",footnote,footnote,,"Kentucky v. Yellen, 54 F.4th at 336.",100.0,matched
32,245. Id. at 338-39.,footnote,footnote,,Id.,100.0,matched
32,246. Id. at 339.,footnote,footnote,,Id.,100.0,matched
32,"247. Ohio v. Yellen, 53 F. 4th 983, 990-91 (6th Cir. 2022) (quoting Laird v. Tatum, 408 U.S. 1, 13-14 (1972)).",footnote,footnote,,"Ohio v. Yellen, 53 F. 4th 983, 990–91 (6th Cir. 2022) (quoting Laird v. Tatum, 408 U.S. 1, 13–14 (1972)).",100.0,matched
32,"248. Missouri v. Yellen, 39 F.4th 1063, 1069-70 (8th Cir. 2022).",footnote,footnote,,"Missouri v. Yellen, 39 F.4th 1063, 1069–70 (8th Cir. 2022).",100.0,matched
32,"249. Texas v. Yellen, 105 F.4th 755, 764 (5th Cir. 2024). In finding that the final rule did not moot the challenge, the court does mention the constraint of the state's sovereign powers but does not otherwise mention the constraint of that power as an independent basis for standing. Id. at 767.",footnote,footnote,,Id.,100.0,matched
32,250. See id. at 764.,footnote,footnote,,Id.,100.0,matched
33,"in one form or another, reflected the sovereign injuries states suffer when Congress violates the Spending Clause. The following Part attempts to reconcile these injuries with existing law to offer a clearer picture of the danger in allowing expansive state standing.",text,body_text,No,,100.0,matched
33,III. BETTER SPENDING CLAUSE STANDING,section_header,body_text,"Part I outlines the Offset Provision and provides doctrinal background for the Spending Clause, standing, and special solicitude. Part II dives into the cases themselves, defining and explaining the Spending Contract and Tax Power injuries. Part III demonstrates the danger of the circuit courts’ expansive approach to Spending Clause standing and prescribes better rules for future cases—ones that do not rely on special solicitude or illusory, novel theories of injury.",,80.55555555555556,matched
33,"States should, in some cases, have standing to challenge unconstitutional congressional exercises of the Spending Clause. But when? Prior Spending Clause cases required states plaintiffs to have suffered some injury to have standing to challenge the unduly coercive or ambiguous spending conditions. The Offset Provision cases were a mixed, first attempt at articulating those injuries. Conceptually, the courts were not far off the mark: States suffer some form of the Spending Contract and Tax Power sovereign injuries when Congress spends impermissibly.",text,body_text,No,,100.0,matched
33,"The Spending Clause and standing doctrine should demand more. State attorneys general should not be able to dismantle federal policy so easily. Instead, the Spending Contract and Tax Power injuries should adhere to the touchstones of other standing injuries-in-fact, requiring objective imminence and concreteness, respectively. As standing doctrine is theoretically supposed to ensure, the Spending Clause has historically been free from federal courts' excessive meddling in highly sensitive political areas. 251 Instead, with the Offset Provision cases, the majority of the circuit courts hearing those cases have welcomed the crushing weight of 'juristocracy' to yet another policy vehicle, inviting disruptive judicial activism to infect another Article I power. 252",text,body_text,No,,100.0,matched
33,"However, if future Spending Clause cases follow the majority of circuit courts, the Offset Provision cases will have lowered pleading standards for states. As this Part explains, the injuries create two new approaches for states to unilaterally block federal policy: searching and destroying ambiguity and quarantining 'sovereign' powers from federal influence. Without any requirements of imminence or concreteness, states that sniff out qualifying spending conditions will always find their way into federal court.",text,body_text,"However, if future Spending Clause cases follow the majority of circuit courts, the Offset Provision cases will have lowered pleading standards for states. As this Part explains, the injuries create two new approaches for states to unilaterally block federal policy: searching and destroying ambiguity and quarantining “sovereign” powers from federal influence. Without any requirements of imminence or concreteness, states that sniff out qualifying spending conditions will always find their way into federal court.",,100.0,matched
33,A. No Search and Destroy,section_header,body_text,No,,100.0,matched
33,"Spending Contract injuries should not give states a freestanding right to challenge every federal spending offer. The Fifth, Ninth, and Eleventh Circuits' liberal Spending Contract injury would seemingly include any instance",text,body_text,No,,100.0,matched
33,"Gould, supra note 24, at 269.",list_item,footnote,,"Gould, supra note 24, at 269.",100.0,matched
33,"252. See Moyn, supra note 27. Although the merits (or existence) of judicial activism is subject to academic debate, modern judicial involvement in these kinds of federalist disputes tends to bias conservative policymakers. See generally , Jonathan S. Gould & David E. Pozen, Structural Biases in Structural Constitutional Law , 97 N.Y.U. L. REV. 59 (2022) (describing the proliferation of policymaking 'veto points').",footnote,footnote,,Id.,100.0,matched
34,"of ambiguity in federal spending legislation. 253 The Eleventh Circuit's articulation in particular-that states have a live claim to 'adjudicate [the] terms' of the Offset Provision-grants open-ended standing. 254 States could hunt for ambiguity in any new grant of federal money, insist that they 'cannot determine at what point a breach will occur' because of that ambiguity, and get standing to enjoin that provision. 255 This conception undermines the separation-of-powers principles at the heart of standing. 256 Federal courts should not serve as the 'councils of revision' Article III standing is meant to constrain. 257 Instead, the broad conception of the Spending Contract injury weaponizes Article III courts against all legislative ambiguity, inviting attorneys general to search and destroy even 'dormant' spending conditions like the Offset Provision.",text,body_text,No,,100.0,matched
34,"With spending conditions like the Offset Provision, the Spending Contract injury should require greater imminence. Open-ended spending conditions-you can pick how to spend this money-do not guarantee some form of federal or agency enforcement. In the Offset Provision cases, the Treasury actively disclaimed any enforcement against the state-plaintiffs' proposed conduct. 262 The states see a ghost: No agency action is 'certainly impending,' and",text,body_text,No,,100.0,matched
34,"Nonetheless, states should have Spending Contract standing in some cases. Federal courts should be available to serve as 'mediators' when states face actual coercion to ensure a healthy federalism. 258 The best way to achieve this balance of federalism and the separation of powers is to look to Spending Clause jurisprudence. In cases like Dole and Sebelius , there was no question that states had standing to sue given the legislation's immediate obligations. 259 There, the federal offers required legislation from the states-you don't get this money unless you raise the legal drinking age. 260 The states had to undertake immediate and definite compliance as a condition of receiving the money and risked losing existing federal funds if they failed to comply. 261 In such cases that require near-immediate action for money, states would not be able to complete the required act if Congress's expectations were ambiguous, or they would be unfairly forced to act if the bargaining was coercive or ambiguous. States have Spending Contract standing in these cases to challenge potentially ambiguous or coercive offers.",text,body_text,No,,100.0,matched
34,"253. See Texas , 105 F.4th at 764; Arizona v. Yellen, 34 F.4th 841, 852 (9th Cir. 2022); West Virginia ex rel. Morrisey v. U.S. Dep't of the Treasury, 59 F.4th 1124, 1136 (11th Cir. 2023).",footnote,footnote,,"See Texas , 105 F.4th at 764; Arizona v. Yellen, 34 F.4th 841, 852 (9th Cir. 2022); West Virginia ex rel. Morrisey v. U.S. Dep’t of the Treasury, 59 F.4th 1124, 1136 (11th Cir. 2023).",100.0,matched
34,"254. See Morrisey , 59 F.4th at 1140.",footnote,footnote,,"See Morrisey , 59 F.4th at 1140.",100.0,matched
34,Id. at 1138.,list_item,footnote,,Id.,100.0,matched
34,256. See supra Section I.C.,footnote,footnote,,See supra Section I.C.,100.0,matched
34,"257. See Vladeck, supra note 25, at 872; Raines v. Byrd, 521 U.S. 811, 826-28 (1997).",footnote,footnote,,"See Vladeck, supra note 25, at 872; Raines v. Byrd, 521 U.S. 811, 826–28 (1997).",100.0,matched
34,"258. WRIGHT & MILLER, supra note 90, § 3531.11.1.",footnote,body_text,No,,100.0,matched
34,259. See supra Section I.C.,footnote,footnote,,See supra Section I.C.,100.0,matched
34,"260. South Dakota v. Dole, 483 U.S. 203, 205 (1987).",footnote,footnote,,"South Dakota v. Dole, 483 U.S. 203, 205 (1987).",100.0,matched
34,"261. See Nat'l Fed'n of Indep. Bus. v. Sebelius, 567 U.S. 519, 581-82 (2012); Bagenstos, supra note 83, at 870.",footnote,footnote,,"See Nat’l Fed’n of Indep. Bus. v. Sebelius, 567 U.S. 519, 581–82 (2012); Bagenstos, supra note 83, at 870.",100.0,matched
34,"262. See, e.g. , Kentucky v. Yellen, 54 F.4th 325, 329 (6th Cir. 2022).",footnote,footnote,,"See, e.g. , Kentucky v. Yellen, 54 F.4th 325, 329 (6th Cir. 2022).",100.0,matched
35,"'fears of hypothetical future harm' should not be enough for standing. 263 Particularly in cases like these where a court would have to weigh in on congressional action (and the hypothetical actions of an executive agency), the separation-of-powers concerns underpinning standing doctrine are at their apex. 264 Courts should be wary to decide such cases involving coordinate branches of the federal government where any actual squabble has yet to materialize.",text,footnote,,Id.,100.0,matched
35,"No Article I power-let alone spending-demands linguistic perfection. Pennhurst does not provide this sort of substantive attack on ambiguity; it and Arlington applied a clear-statement rule of statutory construction that ensures states have fair notice of their duties and obligations after accepting federal funds. 269 The rule does not create any substantive limit on federal power, 270 so it should not give states a nebulous, ambiguity-challenging cause of action.",text,footnote,,Id.,100.0,matched
35,"The Fifth, Ninth, and Eleventh Circuits overstepped this circumscribed role. In those circuits, the courts' standing analyses went off track in part because they misapplied the substantive Spending Clause precedent. The Fifth and Eleventh Circuits did not treat Pennhurst 's clear-statement rule as a rule of statutory construction to protect the states from unexpected duties and suits. 265 Instead, as the Eleventh Circuit explained, they believed the Pennhurst requirement incorporated in the Dole rule 'is a binding constitutional command.' 266 Following the 'search and destroy' theme, the Fifth Circuit further argued that the Constitution imposes an affirmative 'bar on ambiguous spending conditions and provid[es] grounds for an injunction against the enforcement of such conditions.' 267 Ignoring the Supreme Court's reasoning in Bennett v. Kentucky Department of Education , which provides that Congress is not required to 'prospectively resolve every possible ambiguity concerning particular applications' of its spending conditions, 268 the Fifth and Eleventh Circuits effectively eliminated any interpretive wiggle room. Forget about standing: States would win every Spending Clause ambiguity challenge under that conception of the Pennhurst rule.",text,footnote,,Id.,100.0,matched
35,"States should have standing for coercive and ambiguous federal offers under the Spending Clause, but those offers must present an imminent affront to state sovereignty. Federal courts can, as they did in Sebelius , step in when",text,footnote,,Id.,100.0,matched
35,"263. Clapper v. Amnesty Int'l USA, 568 U.S. 398, 409, 416 (2013).",footnote,footnote,,"Clapper v. Amnesty Int’l USA, 568 U.S. 398, 409, 416 (2013).",100.0,matched
35,"264. Id. at 408 (quoting Raines v. Byrd, 521 U.S. 811, 819-20 (1997)).",footnote,footnote,,Id.,100.0,matched
35,"265. See Arlington Cent. Sch. Dist. Bd. of Educ. v. Murphy, 548 U.S. 291, 296 (2006) (explaining that under Pennhurst , courts interpreting spending statutes must ask whether conditions on spending are such that a state official deciding whether to accept funds would clearly understand the obligations that accompany them).",footnote,footnote,,Id.,100.0,matched
35,"266. West Virginia ex rel. Morrisey v. U.S. Dep't of the Treasury, 59 F.4th 1124, 1142 (11th Cir. 2023) (citing Benning v. Georgia, 391 F.3d 1299, 1303 (11th Cir. 2004)).",footnote,footnote,,"West Virginia ex rel. Morrisey v. U.S. Dep’t of the Treasury, 59 F.4th 1124, 1142 (11th Cir. 2023) (citing Benning v. Georgia, 391 F.3d 1299, 1303 (11th Cir. 2004)).",100.0,matched
35,"267. Texas v. Yellen, 105 F.4th 755, 771 (5th Cir. 2024).",footnote,footnote,,"Texas v. Yellen, 105 F.4th 755, 771 (5th Cir. 2024).",100.0,matched
35,"268. Bennett v. Ky. Dep't of Educ., 470 U.S. 656, 669 (1985).",footnote,footnote,,"Bennett v. Ky. Dep’t of Educ., 470 U.S. 656, 669 (1985).",100.0,matched
35,"269. See Pasachoff, supra note 201, at 589.",footnote,footnote,,"See Pasachoff, supra note 201, at 589.",100.0,matched
35,270. Id.,footnote,footnote,,Id.,100.0,matched
36,"Congress's offer is a 'gun to the head' of the states that would immediately change state policy on an issue. 271 But for mere discretionary spending conditions like the Offset Provision, particularly one designed to ensure maintenance-of-effort, 272 states should not have standing without imminent federal enforcement.",text,body_text,No,,100.0,matched
36,B. No Sovereign Power Quarantines,section_header,body_text,No,,100.0,matched
36,"Several of the Offset Provision opinions crafted an expansive Tax Power injury even if none attributed standing to that injury alone. 273 Judge Nalbandian's conception in Kentucky v. Yellen , that states have standing whenever legislation subjectively 'intrude[s]' or 'chill[s]' a state's sovereign authority to make laws (or broader yet, has 'negative effects' on a state's economy), 274 would grant near-absolute state standing to challenge federal spending. As Judge Bush explains in the majority opinion, ' any law could be said to 'limit the range,' in an abstract sense, of a plaintiff's legitimate behavior.' 275 Federal legislation 'cast[ing] a pall over legislators' abilities to contemplate' lawmaking is far too subjective and abstract an injury for standing. 276 States could always suggest that anything other than no limitations on federal funds would step on their sovereign toes.",text,footnote,,Id.,100.0,matched
36,"Instead, the Tax Power injury-or, better named, the Regulatory Power injury, as it would not be subject-matter specific-should apply a similar distinction as outlined in the previous Section. If a federal spending program restrains a state's ability to regulate -a state may not pass any tax cuts for two",text,body_text,No,,100.0,matched
36,"Furthermore, states should not have standing based on the subject matter of the federal regulation alone. Both the Ninth and Eleventh Circuits appear to treat the subject matter of the Offset Provision, which implicates a state's ability to create and cut taxes, as a plus factor in finding standing. 277 Although the Fifth Circuit did not discuss the Tax Power injury directly, its reasoning on the merits is also troubling on this front, as anytime Congress 'require[s] the States to accept policy changes, [it] triggers the [Spending Clause's] coercion analysis.' 278 This rule is unworkable for standing: Standing should not be based on whether the spending condition at issue touches something 'too sovereign-y' because that standard provides judges too much unfettered discretion.",text,footnote,,Id.,100.0,matched
36,"Nat'l Fed'n of Indep. Bus. v. Sebelius, 567 U.S. 519, 581 (2012).",list_item,footnote,,"Nat’l Fed’n of Indep. Bus. v. Sebelius, 567 U.S. 519, 581 (2012).",100.0,matched
36,"See Clarke & Fox, supra note 45, at 1362.",list_item,footnote,,"See Clarke & Fox, supra note 45, at 1362.",100.0,matched
36,See supra Section I.B.,list_item,footnote,,See supra Section I.B.1.,100.0,matched
36,"Kentucky v. Yellen, 54 F.4th 325, 360-61 (6th Cir. 2022) (Nalbandian, J., concurring in part and dissenting in part).",list_item,footnote,,"Kentucky v. Yellen, 54 F.4th 325, 360–61 (6th Cir. 2022) (Nalbandian, J., concurring in part and dissenting in part).",100.0,matched
36,275. Id. at 339 n.8 (majority opinion).,footnote,footnote,,Id.,100.0,matched
