page_no,pdf_text,pdf_original_label,pdf_corrected_label,matched_html_body,matched_html_footnote,match_confidence,match_status
,,,,The contractual approach is the most concrete and direct way for states to implement the fiduciary theory of sovereignty in constructing IIAs. The premise is simple: Insert specific provisions into new IIAs that better enables a state to regulate in protection of its population’s human rights.,,0,html_body_unmatched
,,,,"Specific treaty provisions could incorporate the fiduciary theory into IIAs. This approach fits well within current trends in international investment law, with some reformers pinning their hopes on new IIAs entering into force. 96 UNCTAD, Trends in the Investment Treaty Regime and a Reform Toolbox for the Energy Transition , supra note 65, at 4. The fiduciary theory could serve as a guiding framework for treaty drafting, even if the treaty does not explicitly incorporate the theory. Exceptions clauses in new-generation IIAs specify situations where the IIA could apply but does not. By contrast, treaty provisions enacting the fiduciary theory of sovereignty would specify situations where a state’s obligations to its people prevent it from contracting at all.",,0,html_body_unmatched
,,,,"These provisions would be a redundancy measure, or a “belt and suspenders” approach, given that an explicit provision would merely affirm rather than create the state’s fiduciary duty to its people. Redundancy measures, however, are used in both international and domestic law. 97 For an example in the domestic administrative law context, see Ethan J. Leib & James J. Brudney, The Belt-and-Suspenders Canon , 105 Iowa L. Rev. 735 (2020). Often, treaties merely codify existing international law and obligations that previously existed only through customary international law. 98 Greenwood , supra note 36, at 3–4. To include such a provision in IIAs, which reflect an existing notion of sovereignty, would be in line with the logic of treaties in general—memorializing obligations, preexisting or otherwise, to ensure that states receive the benefits of their bargains.",,0,html_body_unmatched
,,,,"The contractual approach is helpful because it can constrain arbitrators and give clearer effect to a state’s intention in negotiating IIAs. If states are better able to give effect to their rights and intentions at the treaty-drafting phase, there is lower risk of those intentions being distorted through the obtuse process of judicial interpretation. Furthermore, when negotiating new-generation IIAs, states may consider imposing reciprocal obligations on investors, especially as they concern the protection of human and environmental rights. 102 Indeed, in recent years some states have already incorporated investor obligations in their IIAs. See Increasing Dichotomy , supra note 94, at 5. For an example of these obligations in current agreements, see Supplementary Act A/SA.3/12/08 Adopting Community Rules on Investment and the Modalities for their Implementation with ECOWAS, Dec. 18, 2008, https://investmentpolicy.unctad.org/international-investment-agreements/treaty-files/3266/download [ perma.cc/3KC9-ABYZ ]. To act as a fiduciary is to act affirmatively as a protector and only in the best interest of one’s beneficiaries. Thus, it may be appropriate for the state to impose reciprocal obligations onto investors to adequately satisfy its fiduciary obligations.",,0,html_body_unmatched
,,,,"Yet, a contractual approach is far from a panacea. While exception clauses have worked well in international trade matters, they have had mixed results in the ISDS context. 103 Julian Arato, The Institutions of Exceptions , 47 Mich. J. Int’l L. (forthcoming) (manuscript at 5), http://dx.doi.org/10.2139/ssrn.5176248 . Tribunals often interpret provisions narrowly or in a way that does not provide true relief for the state.",,0,html_body_unmatched
,,,,"While the contractual approach can empower states to give more concrete effect to their intended bargains, tribunals may still find ways to interpret them narrowly or even in apparent contradiction of their express terms. Grounding the provisions in the fiduciary theory may help resolve some of these weaknesses. By fortifying these exception-style clauses with the fiduciary theory’s familiar philosophical thrust, arbitrators may be able to better understand the state’s intent to protect its population’s human rights. Exceptions clauses do not typically give background information as to why a certain sector or measure is being excepted or excluded. 110 See, e.g. , Free Trade Agreement Between the Government of Australia and the Government of the People’s Republic of China , June 17, 2015, [2015] ATS 15 (entered into force 20 Dec. 2015) art 9.8. This dearth of context may be part of the reason that tribunals occasionally interpret these provisions counterintuitively. A preamble or chapeau provides much-needed context, especially where exceptions clauses have had comparatively little to ground their meaning.",,0,html_body_unmatched
,,,,"The contractual approach also requires negotiating parties to agree to the insertion of these provisions. It is difficult to imagine a state that is not interested in confirming its ability to comply with its international human rights obligations. But as noted above, certain countries are predominantly home to claimants; accordingly, these states may have different incentives and interests to vindicate than states that serve as repeat respondents. 111 See supra Section I.B. Nonetheless, claimant home states are still periodically targets of ISDS. For example, Canadian investors brought a claim against the United States, seeking $15 billion for denying the permits necessary to build the Keystone Pipeline. 112 TransCanada Corp. v. Government of the United States of America, ICSID Case No. ARB/16/21, Request for Arbitration, ¶¶ 9–15, 91 (June 24, 2016), https://www.italaw.com/ sites/default/files/case-documents/italaw7407.pdf [ perma.cc/8965-HHQ4 ]. Aside from the fact that all countries have an obligation to their citizenry to protect its human rights, all countries have an incentive to protect the exercise of their sovereignty.",,0,html_body_unmatched
,,,,"The contractual approach attempts to give states more power as they negotiate IIAs and better constrain arbitrators whose perspectives on the parties’ human rights obligations may differ, resulting in inconsistent rulings. Keeping the lesson of Eco Oro in mind, states should highlight the ideological thrust behind these new provisions where possible, referring to their role as fiduciaries to inform the object and purpose of their international agreements. As the only plenary subjects under international law, 113 See Damrosch, Murphy & Arato, supra note 101, at 259–60. the state owes a protectorate duty to its population, and this approach accordingly prioritizes the state. Through the contractual approach, a state can take control of its bargain to ensure that it is satisfying its core duty as a fiduciary: to protect the human rights of its population.",,0,html_body_unmatched
,,,,"The fiduciary theory can also inform arbitrators’ interpretations of IIAs already in force. By using the theory as a background understanding of what the state can contract away in negotiating an IIA, arbitrators can interpret existing fair and equitable treatment (FET) clauses in accordance with human rights obligations.",,0,html_body_unmatched
,,,,"Most ISDS claims relate to breach of an FET clause. 114 Maria Rocha, Martin Dietrich Brauch & Tehtena Mebratu-Tsegaye, Advocates Say ISDS Is Necessary Because Domestic Courts Are ‘Inadequate,’ but Claims and Decisions Don’t Reveal Systemic Failings , Colum. Ctr. on Sustainable Inv. ( Nov. 29, 2021), https://ccsi.columbia.edu/news/advocates-say-isds-necessary-because-domestic-courts-are-inadequate-claims-and-decisions-dont [ perma.cc/2DET-62MB ]. FET clauses provide a base level of protection to foreign investors. 115 See Florencia Sarmiento & Suzy Nikièma , Fair and Equitable Treatment: Why It Matters and What Can Be Done 2 (2022), https://www.iisd.org/system/files/2022-11/fair-equitable-treatment-en.pdf [ perma.cc/T5TB-CX3C ]. It can be unclear, however, what standard of treatment these clauses promise as they are often vaguely worded, especially in older generation IIAs. 116 Ratner, supra note 29, at 572; Sarmiento & Nikièma , supra note 115, at 1–3. Tribunals have hewed to the notion that FET clauses protect a foreign investor’s “legitimate expectations.” 117 Ratner, supra note 29, at 572–73. Put differently, if an investor had a legitimate reason to expect one course of action and the state takes another, the investor may have a valid claim under the constituent treaty’s FET clause. 118 Ugale Anastasiya & Knoll-Tudor Ioana, Legitimate Expectations , Jus Mundi (July 25, 2025), https://jusmundi.com/en/document/publication/en-legitimate-expectations [ perma.cc/ N3QT-E6WM ]. American jurists may understand this most readily as a reliance doctrine. This simply exchanges one vague set of terms for another. Some arbitral tribunals require a clear promise from a government official to establish a legitimate expectation. 119 Id. Other tribunals, by contrast, have taken a more relaxed approach in determining whether a state has committed itself to regulatory stability, going so far as to consider preexisting regulation sufficient to give investors a reasonable expectation that the state’s regulatory framework will remain in place. 120 Id.",,0,html_body_unmatched
,,,,"Legitimate expectations are meant to be objective, and not simply the result of an investor’s wishful thinking. Murphy v. Ecuador held that to sustain an FET claim, investors must take an objective look at a host state’s legal framework when forming legitimate expectations. 126 Murphy Exploration & Prod. Co. Int’l. v. Republic of Ecuador, PCA Case Repository No. 2012-16, Partial Final Award, ¶ 248 (May 6, 2016). Assessing this legal framework, tribunals have suggested there may be an incidental incentive that investors perform their due diligence, as the standard when forming legitimate expectations is what a prudent investor would have reason to know. 127 See, e.g. , Parkerings-Compagniet AS v. Republic of Lith., ICSID Case No. ARB/05/8, Award, ¶¶ 329–33 (Sep. 11, 2007), https://icsidfiles.worldbank.org/icsid/ ICSIDBLOBS/OnlineAwards/C252/DC682_En.pdf [ perma.cc/F5JN-UPR6 ]; SolEs Badajoz GmbH v. Kingdom of Spain, ICSID Case No. ARB/15/38, Award, ¶ 331 (July 31, 2019), https://www.italaw.com/sites/default/files/case-documents/italaw10836.pdf [ perma.cc/J6K6-SBUS ]; InfraRed Env’t Infrastructure GP Ltd. v. Kingdom of Spain, ICSID Case No. ARB/14/12, Award, ¶¶ 370–71 (Aug. 2, 2019), https://www.italaw.com/sites/default/files/case-documents/ italaw11360.pdf [ perma.cc/47JK-FTMH ].",,0,html_body_unmatched
,,,,"The fiduciary theory can help clarify what constitutes a legitimate expectation for investors. Human rights are just as much a part of a host state’s legal framework as any other international obligation, as they come from the same sources: treaties, jus cogens , and customary international law. 128 International Human Rights Law , United Nations Off. of the High Comm’r on Hum. Rts. , https://www.ohchr.org/en/instruments-and-mechanisms/international-human-rights-law [ perma.cc/H9QG-‍JZ4T ]. First, investors must identify existing human rights obligations when performing their due diligence. Second, they must understand the state’s role in protecting human rights.",,0,html_body_unmatched
,,,,"Addressing the first prong, human rights obligations are indeed identifiable before an investor enters a host state. One option is that investors perform a “human rights audit” before investing in a host state. 129 Simma, supra note 22, at 594. This way a state’s existing, binding obligations to its population will inform an investor’s legitimate expectations. This type of audit would certainly be best practice. But even without such an explicit endeavor, most, if not all, of the human rights the state is fiduciarily obligated to protect are well known. Human rights have been identified through widely ratified treaties dating back at least seventy years. 130 The Foundation of International Human Rights Law , United Nations , https://www.un.org/en/about-us/udhr/foundation-of-international-human-rights-law [ perma.cc/7SJQ-RJQY ]; see supra note 56.",,0,html_body_unmatched
,,,,"Particularly relevant for corporations, the International Labor Organization (ILO) Declaration on Fundamental Principles and Rights at Work requires the right to freedom of association, collective bargaining, elimination of forced and child labor, elimination of employment and occupation discrimination, and a safe and healthy working environment. 131 Fundamental Principles and Rights at Work , Int’l Lab. Org. , https://www.ilo.org/projects-and-partnerships/projects/fundamental-principles-and-rights-work [ perma.cc/RZ3Q-5ZQW ]. The ILO has 187 states in its membership and considers",,0,html_body_unmatched
,,,,"all Members, even if they have not ratified the Conventions in question, [to] have an obligation, arising from the very fact of membership in the Organization, to respect, to promote and to realize, in good faith and in accordance with the Constitution, the principles concerning the fundamental rights which are the subject of those Conventions . . . . 132 Int’l Lab. Org. , The Text of the Declaration and Its Follow-Up (2022), https://www.ilo.org/ilo-declaration-fundamental-principles-and-rights-work/about-declaration/text-declaration-and-its-follow [ perma.cc/23SY-RQX4 ].",,0,html_body_unmatched
,,,,"Thus, these human rights obligations are easily discoverable and bind most states. Additionally, for a corporation to satisfy the United Nations Guiding Principles Pillar II responsibility to respect human rights, corporations should already be aware of them. 133 In 2011, the United Nations Human Rights Council endorsed the “Responsibility to Protect” framework developed by Professor John Ruggie. Background & History of the Guiding Principles , Bus. & Hum. Rts. Res. Ctr. , https://www.business-humanrights.org/en/big-issues/governing-business-human-rights/background-history-of-guiding-principles [ perma.cc/7HFX-P8FB ]. This three-pillar framework emphasizes the state’s obligation to protect human rights (Pillar I) and the corporation’s responsibility to respect them (Pillar II). Pillar II characterizes the responsibility to protect as merely “avoid[ing] infringing on the human rights of others.” John Ruggie (Special Representative of the Secretary-General), Guiding Principles on Business and Human Rights: Implementing the United Nations “Protect, Respect and Remedy” Framework , art. 11, Hum. Rts. Council, U.N. Doc. A/HRC/17/31 (Mar. 21, 2011) [hereinafter UN Guiding Principles ]. Therefore, a human rights audit would not place new burdens on corporations to identify the specific obligations of the states in which they invest.",,0,html_body_unmatched
,,,,"Under a legitimate expectations analysis, the Bear Creek tribunal would have been required to determine whether a prudent investor would have had reason to believe that Peru would preserve the concession in those circumstances, as the case law is clear that legitimate expectations must be sensitive to the situation at hand. 135 See, e.g. , Pawlowski AG v. Czech Republic, ICSID Case No. ARB/17/11, Award, ¶ 290 (Nov. 1, 2021), https://icsidfiles.worldbank.org/icsid/ICSIDBLOBS/OnlineAwards/ C6327/DS16910_En.pdf [ perma.cc/C9NF-ZLQG ]. Given Indigenous communities’ right to consultation, codified in the widely ratified ILO Convention 169, a prudent investor must know this human right exists. As a fiduciary, the government was under an express obligation to affirmatively protect this right. Outreach to four out of the over thirty relevant communities in a language that was not their mother tongue fails to satisfy these communities’ right to consultation. Therefore, a prudent investor would expect that, given its inadequate attempt at consultation, the Peruvian government would protect the Aymara people’s right to consultation.",,0,html_body_unmatched
,,,,"Once investors and arbitral tribunals understand the state’s role as a fiduciary and the resulting constraints on its sovereignty, there can be no legitimate expectation that an IIA would preclude a state from protecting its population’s human rights.",,0,html_body_unmatched
,,,,"The contractual and judicial implementations of the fiduciary theory are narrow and concrete. By contrast, the atmospheric approach seeks to change the norms of international investment by putting the logic of the fiduciary theory into the “atmosphere.” This approach thus focuses on equipping all key participants with the elements required to incorporate the theory into their international investment engagements. If the fiduciary approach can inform how academics, investors, states, and practitioners think about international investment law and the state’s role, it may also help to reduce the previously discussed structural barriers to the contractual and judicial approaches.",,0,html_body_unmatched
,,,,"A far more abstract approach than the former two, the atmospheric approach can be enacted in a myriad of ways by essentially any stakeholder. States can reference the fiduciary theory in treaty preambles, in statements made to the international community, or in IIA negotiations with other states; academics can continue to reference the theory in their scholarship; and nongovernmental and civil society actors can feature the theory in their advocacy work targeted at states, arbitrators, and investors. Additionally, any of these parties can argue the fiduciary theory through amici submissions in other ISDS cases. 136 ICSID allows for submissions by non-disputing parties when the tribunal gives permission. Non-Disputing Party and Non-Disputing Treaty Party Submissions—ICSID Convention Arbitration (2022 Rules) , ICSID , https://icsid.worldbank.org/procedures/arbitration/convention/ndp-submissions/2022 [ perma.cc/6MXV-ZNHC ]. This has been part of a trend toward greater transparency in ISDS, enabling outside stakeholders to play a greater role and often allowing for additional “big picture” policy arguments to be made. Svetlana Portman & Nusaybah Muti, Increased Transparency Under the New ICSID Rules: A Way Forward for ISDS Legitimacy , Daily Jus (July 1, 2022), https://dailyjus.com/world/2022/07/increased-transparency-under-the-new-icsid-rules-a-way-forward-for-isds-legitimacy [ perma.cc/NG8V-7UHY ]. For an example of an NGO amicus submission flagging human rights concerns that were not raised by the disputing parties, see Pac Rim Cayman LLC v. Republic of El Salvador, ICSID Case No. ARB/09/12, Submission of Amicus Curiae Brief (May 20, 2011), https://icsidfiles.worldbank.org/icsid/ICSIDBLOBS/OnlineAwards/C661/DC4255_En.pdf [ perma.cc/QX2R-TUE3 ]. This is the exact kind of medium through which the atmospheric approach could be particularly effective. Perhaps most importantly, investors can consider the fiduciary theory when interacting with host state populations and when deciding whether to bring ISDS claims.",,0,html_body_unmatched
,,,,"As discussed earlier, arbitrators often hesitate to extinguish obligations owed to investors when considering a state’s human rights obligations. 137 See supra Part II. The contractual and judicial approaches are thus only as effective as arbitrators allow them to be. As seen in Eco Oro , a treaty provision can be interpreted narrowly and in seeming contradiction to its plain meaning and purpose. 138 See supra notes 104–109 and accompanying text. The effectiveness of interpretive tools such as article 31(3)(c) of the Vienna Convention on the Law of Treaties 139 This article commands that treaty provisions should be read in context with “any relevant rules of international law applicable in the relations between the parties.” VCLT, supra note 99, art. 31(3)(c). further depends on the willingness of a tribunal to recognize both that (a) human rights obligations constitute rules, and (b) that they are relevant to the present dispute. 140 See Simma, supra note 22, at 584–85. Even when a tribunal acknowledges a human right’s existence, as observed in Suez , 141 See supra notes 41–43 and accompanying text. a tribunal may still enforce conflicting obligations owed to an investor. An integral part of the solution is to reshape internationally shared norms by advancing theoretical frameworks, such as the fiduciary theory, through which more robust human rights protections can be justified.",,0,html_body_unmatched
,,,,"The atmospheric approach is not exclusively beneficial to state’s human rights obligations but also empowers investors. It is the only approach of the three that does not rely entirely on either the state or an arbitral tribunal. As critical stakeholders in the system, investors are just as able as states and arbitrators to influence norms, the main thrust of the atmospheric approach. The fiduciary theory through this approach would allow investors to influence and solidify the legal framework to which they are bound.",,0,html_body_unmatched
,,,,"Additionally, by understanding the overarching theory at the atmospheric level, investors are incentivized to modify their own behavior to avoid infringing on the human rights of the local population. Looking again to Bear Creek , 142 See supra notes 121–125 and accompanying text. the right to consultation has reached a clear consensus in international law, as ILO Convention No. 169 demonstrates. 143 See Indigenous and Tribal Peoples Convention, 1989, supra note 67. Investors can honor this right by setting up effective community outreach mechanisms—such as operating in the population’s native language and engaging all relevant communities—and thus avoid implicating the state’s known fiduciary duty.",,0,html_body_unmatched
,,,,"Thinking of the state as a fiduciary may also open the door to new ways of thinking about international investors and ISDS. As a fiduciary to its people, the state has an affirmative obligation to further its population’s best interests and protect its population’s inalienable rights. This is confirmed through Pillar I of the United Nations Guiding Principles, which charges states with the responsibility to protect human rights. 144 UN Guiding Principles , supra note 133, art. 1. To fulfill this obligation, states may need to take positive action, such as imposing explicit obligations on foreign investors, rather than just passive protection of its population against potential human rights abuses.",,0,html_body_unmatched
,,,,"The second pillar of the United Nations Guiding Principles states that all businesses have a responsibility to respect human rights. 145 Id. art. 11. A responsibility is less binding than an obligation, and respecting human rights is far more passive than affirmatively protecting human rights. This is a relatively lax “do no harm” 146 See David Birchall, The Consequentialism of the UN Guiding Principles on Business and Human Rights: Towards the Fulfilment of ‘Do No Harm’ , 24 Elec. J. Bus. Ethics & Org. Stud. , no. 1, 2019, at 28. standard, and critics have argued that Pillar II is inadequate. 147 David Bilchitz & Surya Deva, The Human Rights Obligations of Business: A Critical Framework for the Future , in Human Rights Obligations of Business: Beyond the Corporate Responsibility to Respect? 1 (Surya Deva & David Bilchitz eds., 2013); UN Human Rights Council: Weak Stance on Business Standards , Hum. Rts. Watch (June 16, 2011), https://www.hrw.org/news/2011/06/16/un-human-rights-council-weak-stance-business-standards [ perma.cc/TV8X-53JW ]; René Wolfsteller & Yingru Li, Business and Human Rights Regulation After the UN Guiding Principles—A Critical Assessment , Rts. as Usual (July 20, 2022), https://rightsasusual.com/2022/07/20/business-and-human-rights-regulation-after-the-un-guiding-principles-a-critical-assessment [ perma.cc/BSQ7-TRGY ]; Brigitte Hamm, The Struggle for Legitimacy in Business and Human Rights Regulation—A Consideration of the Processes Leading to the UN Guiding Principles and an International Treaty , 23 Hum. Rts. Rev. 103, 106 (2021). Under the fiduciary theory, the state might need to demand more. To perform its fiduciary duty, the state could use IIAs to impose more demanding human rights obligations on international investors rather than merely attempting to defend against legal claims.",,0,html_body_unmatched
