page_no,pdf_text,pdf_original_label,pdf_corrected_label,matched_html_body,matched_html_footnote,match_confidence,match_status
63,"In a recent state-of-the-art opinion dismissing plaintiffs' tort claims for this type of economic loss, the California Supreme Court discussed a prior case in which it had explained why the tort duty does not encompass these foreseeable injuries:",text,body_text,"In a recent state-of-the-art opinion dismissing plaintiffs’ tort claims for this type of economic loss, the California Supreme Court discussed a prior case in which it had explained why the tort duty does not encompass these foreseeable injuries:",,100.0,matched
63,Id. § 47 cmt. b.,list_item,footnote,,Id.,100.0,matched
63,"DOBBS, HAYDEN & BUBLICK, supra note 5, § 390, at 572.",list_item,footnote,,"Dobbs, Hayden & Bublick , supra note 5, § 390, at 571.",98.07692307692307,matched
63,"See E. River S.S. Corp. v. Transamerica Delaval Inc., 476 U.S. 858 (1986).",list_item,footnote,,"See E. River S.S. Corp. v. Transamerica Delaval Inc., 476 U.S. 858 (1986).",100.0,matched
63,"250. See generally Mark A. Geistfeld, The Contractually Based Economic Loss Rile in Tort Law: Endangered Consumers and the Error of East River Steamship, 65 DEPAUL L. REV. 393 (2016) (demonstrating that courts properly limit recovery for pure economic losses in product cases when consumers do not have enough information about product risks and safety to adequately protect their interests by contracting).",footnote,footnote,,"See generally Mark A. Geistfeld, The Contractually Based Economic Loss Rile in Tort Law: Endangered Consumers and the Error of East River Steamship, 65 DePaul L. Rev. 393 (2016) (demonstrating that courts properly limit recovery for pure economic losses in product cases when consumers do not have enough information about product risks and safety to adequately protect their interests by contracting).",100.0,matched
64,"[W]e pointed to a hypothetical scenario similar in many ways to the case now before us. We considered a situation where 'a defendant negligently causes an automobile accident that blocks a major traffic artery such as a bridge or tunnel.' That defendant would of course be liable for 'personal injuries and property damage suffered in such an accident.' But would 'any court,' we continued, 'allow recovery by the myriad [other] third parties who might claim [purely] economic losses because the bridge or tunnel' was blocked? Based on concerns about limitless liability and unending litigation, as well as on long-standing legal consensus, we considered that prospect 'doubtful.' 251",text,footnote,,Id.,100.0,matched
64,The court then cited opinions from 'across the country' in which other courts had 'rejected recovery for purely economic losses stemming from manmade calamity' based on concerns 'about line-drawing problems and potentially overwhelming liability.' 252 Relying on these cases and explaining why these same concerns applied to the case at hand-a months-long massive leakage of natural gas in a suburb outside Los Angeles-the court dismissed the claims of several small businesses in the area seeking recovery for their lost profits not proximately caused by any damage to their real or tangible property. 253,text,footnote,,Id.,100.0,matched
64,"Anexclusive focus on the defendant's interests only implicates the defendant's unreasonable exercise of liberty. The defendant negligently caused all these foreseeable harms, and insolvency would not lead to debtor's prison. An unreasonable liberty interest is not plausibly prioritized over the conflicting interests of foreseeable accident victims, whether those interests involve physical security or economic harms. Like the now outdated concern about culpability, the defendant's interests do not provide a principled justification for substantively limiting the tort duty to fend off bankruptcy.",text,footnote,,Id.,100.0,matched
64,"As is true for the cases on which it relied, the court did not mention the problem of insolvency and the associated need to prioritize the claims of physically harmed victims. The tort duty encompassed physical harms, just like it did in the hypothetical automobile accident the court discussed in which the 'defendant would of course be liable for 'personal injuries and property damage.' ' If the duty in these cases were expanded to encompass both the physically harmed victim(s) and those who might suffer foreseeable economic losses, there would be a massive increase in the number of tort claimants, as the California Supreme Court recognized. That liability would be excessive insofar as insolvency would be a predictable consequence, leading to the question of why insolvency provides a principled reason to limit the substantive tort duty.",text,footnote,,Id.,100.0,matched
64,"The principled concern about bankruptcy instead derives from the security interests of right-holders, which have priority over the conflicting economic interests of the other accident victims. This priority-'the worst should",text,footnote,,Id.,100.0,matched
64,"251. S. Cal. Gas Co. v. Superior Ct. L.A. Cnty. (S. Cal. Gas Leak Cases), 441 P.3d 881, 888 (Cal. 2019) (citations omitted).",footnote,footnote,,"S. Cal. Gas Co. v. Superior Ct. L.A. Cnty. (S. Cal. Gas Leak Cases), 441 P.3d 881, 888 (Cal. 2019) (citations omitted).",100.0,matched
64,252. Id. at 889.,footnote,footnote,,Id.,100.0,matched
64,253. Id. at 888-96.,footnote,footnote,,Id.,100.0,matched
65,"go first'-provides a normatively defensible reason to limit the duty to those with physical harms. As in the case of stand-alone emotional harms, the physical-harm requirement substantially increases the likelihood that there are enough assets to compensate those with the irreparable injuries of physical harm.",text,footnote,,Id.,100.0,matched
65,"For these same reasons, courts can defensibly permit recovery for economic loss outside contractual settings when the negligence does not threaten any foreseeable physical harms. For example, courts permit recovery for pure economic losses if there is 'some special relation between the parties' such as 'a telegraph company's negligent transmission of a message,' the 'negligent failure to perform a gratuitous promise to obtain insurance, and the negligent delay in acting upon an application for insurance.' 257 The negligent misconduct in these cases does not threaten any foreseeable physical harm, eliminating the need to limit the duty so that the 'worst go first.' Courts have also departed from the physical-harm requirement to award damages for the reasonable medical costs of monitoring for future bodily injuries, such as cancer. Like the ordinary duty governing physical harms, the substantive duty encompassing the financial costs of medical monitoring is grounded in the equitable concern to prevent these irreparable bodily injuries from happening. 258",text,footnote,,Id.,100.0,matched
65,"In an asbestos case, the Supreme Court of the United States recognized this equitable problem, 254 and a few other courts have followed suit in the context of a mass tort. 255 Like the asbestos cases, mass torts have become a synonym for bankruptcy within tort adjudication. 256 A focus on the problem of bankruptcy quickly leads to the insight that tort liability must be limited by the physical-harm requirement so that the 'worst can go first.'",text,text,,,68.54942233632862,unmatched
65,"Like the tort rules recognizing claims for stand-alone emotional harms in exceptional cases, courts permit similar recoveries for pure economic loss when they do not unduly exhaust the ordinary duty-bearer's financial resources for compensating physically harmed victims. These exceptions to the",text,body_text,"Like the tort rules recognizing claims for stand-alone emotional harms in exceptional cases, courts permit similar recoveries for pure economic loss when they do not unduly exhaust the ordinary duty-bearer’s financial resources for compensating physically harmed victims. These exceptions to the physical-harm requirement further demonstrate why and how substantive tort rules are shaped by the availability of compensatory resources.",,100.0,matched
65,"254. See Metro-N. Commuter R.R. v. Buckley, 521 U.S. 424, 442 (1997).",text,footnote,,"See Metro-N. Commuter R.R. v. Buckley, 521 U.S. 424, 442 (1997).",100.0,matched
65,"See Caronia v. Philip Morris USA, Inc., 5 N.E.3d 11, 18 (N.Y. 2013) (invoking this equitable concern in a tobacco case); Henry v. Dow Chem. Co., 701 N.W.2d 684, 685, 694 (Mich. 2005) (invoking this equitable concern for a case in which '173 plaintiffs . . . have asked to represent a putative class of thousands in an action against defendant'); Hinton v. Monsanto Co., 813 So. 2d 827, 828, 831 (Ala. 2001) (invoking this equitable concern for a case brought by the plaintiff on 'behalf of himself and a putative class of persons similarly situated, . . . asserting that he and others similarly situated have been exposed to polychlorinated biphenyls ('PCBs'), a known hazardous substance, released into the environment in the Anniston area by the defendant').",list_item,footnote,,"See Caronia v. Philip Morris USA, Inc., 5 N.E.3d 11, 18 (N.Y. 2013) (invoking this equitable concern in a tobacco case); Henry v. Dow Chem. Co., 701 N.W.2d 684, 685, 694 (Mich. 2005) (invoking this equitable concern for a case in which “173 plaintiffs . . . have asked to represent a putative class of thousands in an action against defendant”); Hinton v. Monsanto Co., 813 So. 2d 827, 828, 831 (Ala. 2001) (invoking this equitable concern for a case brought by the plaintiff on “behalf of himself and a putative class of persons similarly situated, . . . asserting that he and others similarly situated have been exposed to polychlorinated biphenyls (‘PCBs’), a known hazardous substance, released into the environment in the Anniston area by the defendant”).",100.0,matched
65,"256. Cf. Jack B. Weinstein & Eileen B. Hershenov, The Effect of Equity on Mass Tort Law , 1991 U. ILL. L. REV. 269, 290 (1991) ('The actuality or imminent probability of bankruptcy has increasingly come to dominate most mass tort, or at least mega-mass tort, litigation. Our view is that from the beginning mass torts should be treated similarly to a bankruptcy proceeding.').",text,footnote,,"Cf. Jack B. Weinstein & Eileen B. Hershenov, The Effect of Equity on Mass Tort Law , 1991 U. Ill. L. Rev. 269, 290 (1991) (“The actuality or imminent probability of bankruptcy has increasingly come to dominate most mass tort, or at least mega-mass tort, litigation. Our view is that from the beginning mass torts should be treated similarly to a bankruptcy proceeding.”).",100.0,matched
65,"257. Union Oil Co. v. Oppen, 501 F.2d 558, 565 (9th Cir. 1974) (citation and internal quotes omitted).",text,footnote,,"Union Oil Co. v. Oppen, 501 F.2d 558, 565 (9th Cir. 1974) (citation and internal quotes omitted).",100.0,matched
65,"258. See generally Geistfeld, supra note 221 (arguing that the equitable maxim of the 'worst goes first' does not defensibly limit the medical-monitoring cause of action).",footnote,footnote,,"See generally Geistfeld, supra note 221 (arguing that the equitable maxim of the “worst goes first” does not defensibly limit the medical-monitoring cause of action).",100.0,matched
66,physical-harm requirement further demonstrate why and how substantive tort rules are shaped by the availability of compensatory resources.,text,body_text,"Like the tort rules recognizing claims for stand-alone emotional harms in exceptional cases, courts permit similar recoveries for pure economic loss when they do not unduly exhaust the ordinary duty-bearer’s financial resources for compensating physically harmed victims. These exceptions to the physical-harm requirement further demonstrate why and how substantive tort rules are shaped by the availability of compensatory resources.",,100.0,matched
66,D. The Limits of Procedure,section_header,section_header,,,69.23076923076923,unmatched
66,The 'worst goes first' equitable rationale for the physical-harm requirement might seem to be an implausibly blunt legal instrument for managing the problem of insolvency. Perhaps the appropriate set of procedural rules would provide a much more sensible way to fairly distribute a defendant's limited pool of assets across multiple tort claimants. 259 Such a procedural solution would make limiting the substantive duty unnecessary to give the physically harmed victims a reasonable opportunity to obtain full recovery.,text,footnote,,Id.,100.0,matched
66,"These constraints on judicial power are not limited to the now discarded writ system. The modern procedural alternative, a limited-fund class action, cannot equitably distribute a tort defendant's limited assets to provide full recovery for physically harmed victims and less than full recovery for any remaining tort claimants. 262 By contrast, the federal bankruptcy statute supplies the type of jurisdictional power a court would need to fairly distribute the assets of an insolvent tort defendant across multiple tort claimants. Bankruptcy",text,footnote,,Id.,100.0,matched
66,"Although a legislature could enact such a procedural scheme, a commonlaw court does not have that kind of power. The common law developed in the writ system, a highly individualized form of adjudication. A single claimant could bring only a single claim for relief by way of a single writ. 260 The prevailing tort plaintiff in each individual case would have a debt claim against the defendant for the full amount of compensatory damages. Multiple plaintiffs would have multiple debt claims against the same defendant. To equitably distribute an insolvent defendant's assets across all these claims, a court would have to reduce the defendant's debt owed to some or all the individual plaintiffs. Within the United States, common-law courts did not have such power. 261",text,footnote,,Id.,100.0,matched
66,"259. Cf. DOBBS, HAYDEN & BUBLICK, supra note 5, § 383, at 540 n.7 (suggesting that 'it would be possible to expand interpleader or otherwise provide for common distribution system when claims exceed assets').",footnote,footnote,,Id.,100.0,matched
66,"260. See SIR JOHN H. BAKER, AN INTRODUCTION TO ENGLISH LEGAL HISTORY 63 (5th ed. 2019) ('The choice of original writ governed the whole course of litigation from beginning to end, since the procedures and methods of trial available in an action commenced by one kind of writ were not necessarily available in another.').",footnote,footnote,,"See Sir John H. Baker, An Introduction to English Legal History 63 (5th ed. 2019) (“The choice of original writ governed the whole course of litigation from beginning to end, since the procedures and methods of trial available in an action commenced by one kind of writ were not necessarily available in another.”).",100.0,matched
66,"261. See Sturges v. Crowninshield, 17 U.S. (4 Wheat.) 122 (1819) (holding that it is unconstitutional for states to discharge preexisting debts); see also Ogden v. Saunders, 2 U.S. (12 Wheat.) 213 (1827) (holding that it is unconstitutional for states to discharge the debts owing to a citizen of another state).",footnote,footnote,,"See Sturges v. Crowninshield, 17 U.S. (4 Wheat.) 122 (1819) (holding that it is unconstitutional for states to discharge preexisting debts); see also Ogden v. Saunders, 2 U.S. (12 Wheat.) 213 (1827) (holding that it is unconstitutional for states to discharge the debts owing to a citizen of another state).",100.0,matched
66,"262. '[W]hen the limited fund is the company itself . . . [t]here is no basis . . . for allowing only one group of creditors,' such as physically harmed tort claimants, 'to pursue the fund' and leave 'others with no recovery, or for making only one group of creditors accept less than full paymentwhile reserving sufficient assets to pay everyone else in full.' S. ELIZABETH GIBSON, CASE STUDIES OF MASS TORT LIMITED FUND CLASS ACTION SETTLEMENTS & BANKRUPTCY REORGANIZATIONS 28 (2000), https://uscourts.gov/sites/default/files/masstort_1.pdf [perma.cc/W4SJ-CRE7].",footnote,footnote,,"“[W]hen the limited fund is the company itself . . . [t]here is no basis . . . for allowing only one group of creditors,” such as physically harmed tort claimants, “to pursue the fund” and leave “others with no recovery, or for making only one group of creditors accept less than full payment while reserving sufficient assets to pay everyone else in full.” S. Elizabeth Gibson, Case Studies of Mass Tort Limited Fund Class Action Settlements & Bankruptcy Reorganizations 28 (2000), https://uscourts.gov/sites/default/files/masstort_1.pdf [ perma.cc/W4SJ-CRE7 ].",99.82014388489209,matched
67,"courts 'are the only courts that . . . have the power to commandeer both state and federal litigants into a single forum and halt all other civil litigation, no matter what court it is in.' 263",text,body_text,"These constraints on judicial power are not limited to the now discarded writ system. The modern procedural alternative, a limited-fund class action, cannot equitably distribute a tort defendant’s limited assets to provide full recovery for physically harmed victims and less than full recovery for any remaining tort claimants. 262 “[W]hen the limited fund is the company itself . . . [t]here is no basis . . . for allowing only one group of creditors,” such as physically harmed tort claimants, “to pursue the fund” and leave “others with no recovery, or for making only one group of creditors accept less than full payment while reserving sufficient assets to pay everyone else in full.” S. Elizabeth Gibson, Case Studies of Mass Tort Limited Fund Class Action Settlements & Bankruptcy Reorganizations 28 (2000), https://uscourts.gov/sites/default/files/masstort_1.pdf [ perma.cc/W4SJ-CRE7 ]. By contrast, the federal bankruptcy statute supplies the type of jurisdictional power a court would need to fairly distribute the assets of an insolvent tort defendant across multiple tort claimants. Bankruptcy courts “are the only courts that . . . have the power to commandeer both state and federal litigants into a single forum and halt all other civil litigation, no matter what court it is in.” 263 Gluck, Burch & Zimmerman, supra note 1, at 528.",,100.0,matched
67,"Within the Bankruptcy Code, 'a significant part of its distributional scheme is oriented toward establishing priorities among creditors.' 264 Secured creditors are prioritized over unsecured creditors, and all tort claimants are lumped together as unsecured creditors. 265 Outside bankruptcy-that is, within the common law of torts-the only way for courts to prioritize among tort claimants is by substantively limiting the tort duty to effectively implement the equitable principle, the 'worst should go first.' This substantive solution to managing the problem of insolvency is crude compared to an idealized procedural alternative, but it is the only one that has been and continues to be available to courts in tort cases.",text,footnote,,Id.,100.0,matched
67,CONCLUSION,section_header,footnote,,"This conclusion holds even for wrongful death if potential victims can be compensated prior to the risk imposition. See Mark Geistfeld, Placing a Price on Pain and Suffering: A Method for Helping Juries Determine Tort Damages for Nonmonetary Injuries, 83 Calif. L. Rev. 773, 804–05, 819 (1995) (defining, respectively, the amount of compensatory damages in contractual or noncontractual settings that would equate the right-holder’s welfare in the injured and noninjured states of the world prior to the imposition of the risk).",100.0,matched
67,"The characteristic tort remedy for both compensatory and punitive purposes is a monetary damages award, which on one view is a defining attribute of tort law: '[N]o civil injury is to be classed as a tort unless the appropriate remedy for it is an action for damages. Such an action is an essential characteristic of every true tort.' 266 The tort remedy depends on the scarce resource of money, yet no one has comprehensively analyzed how the associated scarcity of compensatory resources affects substantive tort law.",text,body_text,"The characteristic tort remedy for both compensatory and punitive purposes is a monetary damages award, which on one view is a defining attribute of tort law: “[N]o civil injury is to be classed as a tort unless the appropriate remedy for it is an action for damages. Such an action is an essential characteristic of every true tort.” 266 Sir John W. Salmond, The Law of Torts: A Treatise on the English Law of Liability for Civil Injuries 2 (6th ed. 1924). The tort remedy depends on the scarce resource of money, yet no one has comprehensively analyzed how the associated scarcity of compensatory resources affects substantive tort law.",,82.85714285714285,matched
67,"Aside from this Article, to my knowledge, the only other extended analysis of this question asks how courts should formulate tort rules in an 'age of austerity.' 267 An interesting question for sure. If a future wracked by climate change is one of increased scarcity, courts will 'have to make choices as to which violations of someone's basic rights should be remedied by the state.' 268 Rather than doing so by a 'ranking order of basic wrongs,' 269 courts, for reasons of principle, should rely on the same normative calculus which has shaped tort law from its origins in the customary practices in the state of nature up to its current incarnation. For principled reasons, a substantial reduction in compensatory resources will substantially contract substantive duties, significantly limiting liability in a manner akin to what tort law looked like in the earlier stages of industrialization. The contraction will not be that severefortunately, there is no debtor's prison this time around. But substantive tort",text,footnote,,Id.,100.0,matched
67,"263. Gluck, Burch & Zimmerman, supra note 1, at 528.",footnote,footnote,,"Gluck, Burch & Zimmerman, supra note 1, at 528.",100.0,matched
67,"264. Elizabeth Warren, Bankruptcy Policy , 54 U. CHI. L. REV. 775, 785-86 (1987).",footnote,footnote,,"Elizabeth Warren, Bankruptcy Policy , 54 U. Chi. L. Rev. 775, 785–86 (1987).",100.0,matched
67,"265. Sperduto, supra note 1, at 129-30.",footnote,footnote,,"Sperduto, supra note 1, at 129–30.",100.0,matched
67,"266. SIR JOHN W. SALMOND, THE LAW OF TORTS: A TREATISE ON THE ENGLISH LAW OF LIABILITY FOR CIVIL INJURIES 2 (6th ed. 1924).",footnote,footnote,,"Sir John W. Salmond, The Law of Torts: A Treatise on the English Law of Liability for Civil Injuries 2 (6th ed. 1924).",100.0,matched
67,"267. Nicholas J. McBride, Tort Law and Criminal Law in an Age of Austerity , in UNRAVELLING TORT AND CRIME 58 (Matthew Dyson ed., 2014).",footnote,footnote,,Id.,100.0,matched
67,268. Id. at 70.,footnote,footnote,,Id.,100.0,matched
67,269. Id. at 71.,footnote,footnote,,Id.,100.0,matched
68,law depends on the availability of compensatory resources for myriad reasons that will remain normatively relevant for the foreseeable future.,text,body_text,"Aside from this Article, to my knowledge, the only other extended analysis of this question asks how courts should formulate tort rules in an “age of austerity.” 267 Nicholas J. McBride, Tort Law and Criminal Law in an Age of Austerity , in Unravelling Tort and Crime 58 (Matthew Dyson ed., 2014). An interesting question for sure. If a future wracked by climate change is one of increased scarcity, courts will “have to make choices as to which violations of someone’s basic rights should be remedied by the state.” 268 Id. at 70. Rather than doing so by a “ranking order of basic wrongs,” 269 Id. at 71. courts, for reasons of principle, should rely on the same normative calculus which has shaped tort law from its origins in the customary practices in the state of nature up to its current incarnation. For principled reasons, a substantial reduction in compensatory resources will substantially contract substantive duties, significantly limiting liability in a manner akin to what tort law looked like in the earlier stages of industrialization. The contraction will not be that severe—fortunately, there is no debtor’s prison this time around. But substantive tort law depends on the availability of compensatory resources for myriad reasons that will remain normatively relevant for the foreseeable future.",,100.0,matched
69,126 Michigan Law Review [Vol. 124:59,text,text,,,55.55555555555556,unmatched
,,,,"Large corporations facing extensive tort liabilities have often gone into bankruptcy, forcing tort plaintiffs to accept pennies on the dollar as compensation for their injuries. Bankruptcy painfully illustrates the social fact that the compensatory properties of tort law depend on the availability of compensatory resources. Although this feature of tort law is self-evident, no one has adequately analyzed whether it matters for substantive tort doctrine, and if so, how.",,0,html_body_unmatched
