page_no,pdf_text,pdf_original_label,pdf_corrected_label,matched_html_body,matched_html_footnote,match_confidence,match_status
,,,,"Despite the long leash, the funding came with one notable limitation: the Tax Offset Provision. 40 42 U.S.C. § 802(c)(2)(A). Consistent with most of the relevant cases and discussion, I refer to this condition as the “Offset Provision” throughout this Note. Other sources have called this condition the “tax condition,” “tax mandate,” or “offset restriction.” These all refer to the same condition. See, e.g. , Sean M. Stiff, Cong. Rsch. Serv. , LSB10588, Spending Clause Conditions and the Coronavirus State Fiscal Recovery Fund (2021). The more contentious of two specified CSLFRF restrictions, 41 42 U.S.C. § 802(c)(2)(B) (preventing states from using the CSLFRF in pension funds). the Offset Provision provides:",,0,html_body_unmatched
,,,,"A State or territory shall not use the funds provided under this section . . . to either directly or indirectly offset a reduction in the net tax revenue of such State or territory resulting from a change in law, regulation, or administrative interpretation during the covered period that reduces any tax . . . or delays the imposition of any tax or tax increase. 42 Id. § 802(c)(2)(A).",,0,html_body_unmatched
,,,,"If a state violates the Offset Provision, the statute authorizes the Treasury to recoup the lesser of “the amount of the applicable reduction to net tax revenue attributable to such violation” and the amount of money the state or territory received from the CSLFRF. 43 Id. § 802(e). Essentially, states would have to pay back any of this federal money that they used to subsidize their tax cuts. 44 See Press Release, Janet L. Yellen, Treasury Secretary, Response to State Attorneys General Inquiries on Implementation of Section 9901 of the American Rescue Plan Act (Mar. 23, 2021), https://home.treasury.gov/news/press-releases/jy0075 [ perma.cc/5KVM-VQ2L ] [hereinafter Yellen Letter]. For example, a state could not cut its property taxes and use the CSLFRF funds to make up the difference. As professors Conor Clarke and Edward Fox explain, the Offset Provision is a variation on “maintenance-of-effort” provisions common in federal education programs designed to ensure that federal money “supplements and not supplants” state spending. 45 See Conor Clarke & Edward Fox, No New Tax Cuts? Examining the Rescue Plan’s New State Tax Limits , 103 Tax Notes State 1361, 1362 (2022). Interestingly enough, unlike other maintenance-of-effort provisions, Clarke and Fox argue that the Offset Provision is a far more flexible constraint than those in prior versions of the provision, ensuring that more federal dollars are used to support state and local governments than an equivalent “earmarked” spending program. 46 See id. at 1364–66.",,0,html_body_unmatched
,,,,"Amidst this litigation, the Treasury issued an interim rule implementing the Offset Provision in May 2021, 56 Coronavirus State and Local Fiscal Recovery Funds, 86 Fed. Reg. 26786 (May 17, 2021) (codified at 31 C.F.R. § 35). and the final rule in 2022. 57 See 31 C.F.R. § 35.8 (2024). The rule reasserted that recipients of the CSLFRF “shall not use funds to either directly or indirectly offset a reduction in the net tax revenue” during the covered period and explained precisely how the provision would function. 58 Id. § 35.8(a). In plain language: States must open their ledger and show that they paid for a tax cut themselves, not with federal money. 59 Id. § 35.8(b). And if a state funds a tax cut with CSLFRF money, the Treasury can recoup the funds. 60 42 U.S.C. § 802(e). Notably, the final rule’s explanation does not distinguish between direct or indirect offsets.",,0,html_body_unmatched
,,,,"That clarification did not deter the states, which pursued litigation anyway. Following its final rule, the Treasury argued that the state plaintiffs lacked standing for a pre-enforcement injunction. Specifically, the Treasury argued that because the states had not alleged a course of conduct that would violate the final rule’s interpretation of the Offset Provision, the states faced no imminent injury as required by Article III. 61 E.g. , West Virginia ex rel. Morrisey v. U.S. Dep’t of the Treasury, 59 F.4th 1124, 1135 (11th Cir. 2023). This and the Treasury’s other arguments have yielded mixed results. 62 See infra Figure 1. For the first time, federal courts had to answer the question: When do states have standing to challenge under the Spending Clause?",,0,html_body_unmatched
,,,,"The state-plaintiffs’ central argument in the Offset Provision cases was that the Provision exceeded Congress’s power under the Spending Clause. 63 See supra Section I.A. In short, the states argued that the Offset Provision was unconstitutionally ambiguous and unconstitutionally coercive. 64 See, e.g. , Arizona v. Yellen, 34 F.4th 841, 847 (9th Cir. 2022). Understanding how these constitutional limits manifested as the necessary sovereign injuries for standing purposes requires a brief explanation of the Spending Clause.",,0,html_body_unmatched
,,,,"Congress has the power to tax and spend. 65 U.S. Const. art. I, § 8, cl. 1. Where the Constitution’s other grants of legislative power circumscribe the limits of Congress’s lawmaking, the Spending Clause allows Congress to “spend money in any way that advances the general welfare.” 66 Gould, supra note 24, at 217 (citing United States v. Butler, 297 U.S. 1, 66 (1936)). In recent decades, in the midst of worsening congressional gridlock and judicial constraints on other powers, the spending power has become Congress’s most versatile legislative tool. 67 See id. ; Mitchell N. Berman, Coercion Without Baselines: Unconstitutional Conditions in Three Dimensions , 90 Geo. L.J. 1, 50–51 (2001). Akin to entering into a contract, Congress can use its spending to incentivize or discourage specific state action and effectuate its national policy goals. 68 See Pennhurst State Sch. & Hosp. v. Halderman, 451 U.S. 1, 17 (1981); Lynn A. Baker & Mitchell N. Berman, Getting off the Dole : Why the Court Should Abandon Its Spending Doctrine, and How a Too-Clever Congress Could Provoke It to Do So , 78 Ind. L.J. 459, 472 (2003).",,0,html_body_unmatched
,,,,"Of greatest significance to the Offset Provision cases (and most Spending Clause litigation) are the second and “fifth” prongs of this test: Congress’s conditions must be unambiguous, and it may not unduly coerce the states. As articulated in Pennhurst v. Halderman , courts evaluate the second prong according to the “clear notice” canon of statutory interpretation. 75 See Pennhurst , 451 U.S. at 17; see also Arlington Cent. Sch. Dist. Bd. of Educ. v. Murphy, 548 U.S. 291, 300 (2006). The solution is not for courts to entirely strike down ambiguous provisions. 76 Bennett v. Ky. Dep’t of Educ., 470 U.S. 656, 669 (1985) (holding that the federal government simply cannot “prospectively resolve every possible ambiguity” in the structure of a grant program). Instead, when interpreting relevant spending conditions, a court must fill the shoes of the funds’ recipient (here, a state) at the time it chose to accept the deal and ask whether the state “would clearly understand” its statutory obligations and liabilities. 77 Arlington , 548 U.S. at 296. The spending condition is still enforced but in a way that the states could have fairly anticipated. The Court’s clear notice rule for the second prong helps facilitate federalism by ensuring the spending conditions are enforced in unsurprising ways.",,0,html_body_unmatched
,,,,"The “fifth” prong—the prohibition against coercion—can affirmatively invalidate an unconstitutional spending condition. The bar on congressional coercion was decisive in dismantling the Affordable Care Act’s (ACA) Medicaid expansion provisions in National Federation of Independent Businesses v. Sebelius . 78 Nat’l Fed’n of Indep. Bus. v. Sebelius, 567 U.S. 519 (2012). There, “ for the first time ever ,” 79 Id. at 625 (Ginsburg, J., concurring in part and dissenting in part). the Court held that Congress could not threaten the loss of existing Medicaid funds if states did not accept the new Medicaid funds. 80 Rotunda et al. , supra note 69, § 5.7(a)(ii)(6). Chief Justice Roberts’s opinion for the Court explained that although the congressional spending power is broad, the “financial inducement” to encourage state participation in expanded Medicaid was an unconstitutional “gun to the head.” 81 Sebelius , 567 U.S. at 580–81 (quoting South Dakota v. Dole, 483 U.S. 203, 211 (1987)) (internal quotation marks omitted). Roberts was not precise as to what exactly was the decisive, coercive factor that pushed the ACA over the constitutional limit, 82 E.g. , id. at 581–82 (highlighting the significant percentage existing Medicaid funding makes up in state budgets). but the prevailing hypothesis is that it was Congress’s choice to leverage existing , as opposed to new , funding. 83 See Samuel R. Bagenstos, The Anti-Leveraging Principle and the Spending Clause After NFIB, 101 Geo. L.J. 861, 865 (2013).",,0,html_body_unmatched
,,,,"Nonetheless, given the Spending Clause’s flexibility, Congress increasingly relies on appropriating funds to achieve its policymaking goals in lieu of other Article I powers subject to the Senate filibuster, political polarization, and other constitutional impediments. 84 See Gould, supra note 24, at 220–31. Congressional reliance on spending should not be mistaken for abuse. Professor Jonathan Gould explains that in recent decades, Congress’s ability to regulate through other Article I powers has faced greater challenges under judicial review, with the Supreme Court crafting limitations on Congress’s interstate commerce power and in other constitutional doctrines such as anticommandeering and nondelegation. 85 Id. at 250–52. For better or worse, the Spending Clause is one of the federal government’s few remaining means to reliably effectuate welfarist policies on a national scale. Furthermore, even in the hands of a Congress uninterested in redistributive policies, the fourth prong of Dole —that spending conditions cannot require states to engage in unconstitutional behavior—prevents serious threats against individual liberties. 86 South Dakota v. Dole, 483 U.S. 203, 210 (1987).",,0,html_body_unmatched
,,,,"Although the relevant cases place some limits on congressional spending, the Supreme Court has been “less interested” in policing exercises of the Spending Clause, possibly to avoid overreaching into a highly political negotiation process. 87 Gould, supra note 24, at 270. The Court’s disinterest in enforcement likely results from the greater agency a state has when Congress creates a spending program as opposed to exercising another federal power: Instead of simple preemption by federal fiat, a state can say no to the contract. 88 See Dole , 483 U.S. at 210. Politics at both state and federal governing levels—not Article III courts—decide whether a state adopts a policy. Rather than involving itself in every political disagreement, the federal judiciary should step in only when necessary to ensure “healthy federalism”—when Congress has actually violated Dole (or Sebelius ). This separation-of-powers issue counseling for judicial restraint in striking down appropriations, coincidentally, is the precise doctrinal value underpinning Article III standing doctrine.",,0,html_body_unmatched
,,,,"A relatively modern doctrine, 89 See Cass R. Sunstein, What’s Standing After Lujan ? Of Citizen Suits, “Injuries,” and Article III , 91 Mich. L. Rev. 163, 179–86 (1992). standing is rooted in Article III’s vague articulation of the “judicial Power” of the United States. 90 13A Wright & Miller’s Federal Practice and Procedure § 3531 n.12 (ed. Ed. 1998) [hereinafter Wright & Miller ]; U.S. Const. art. III, § 2, cl. 1. The Constitution extends the judicial power to specified “Cases” and “Controversies,” a phrase the Supreme Court has interpreted to limit the jurisdiction of federal courts to only “ actual cases or controversies.” 91 U.S. Const. art. III, § 2, cl. 1; Raines v. Byrd, 521 U.S. 811, 818 (1997) (emphasis added) (quoting Simon v. E. Ky. Welfare Rts. Org., 426 U.S. 26, 37 (1976)). State judicial systems typically have their own standing rules. Wright & Miller , supra note 90, § 3531 n.1. Federal courts do not issue advisory opinions, 92 See Gene R. Nichol, Jr., Rethinking Standing , 72 Calif. L. Rev. 68, 91–92 (1984); Felix Frankfurter, A Note on Advisory Opinions , 37 Harv. L. Rev. 1002 (1924). and there is no standing “when there are no adverse parties with personal interest in the matter.” 93 Antonin Scalia, The Doctrine of Standing as an Essential Element of the Separation of Powers , 17 Suffolk U. L. Rev. 881, 882 (1983). To eliminate plaintiffs and disputes without “proper” stakes, plaintiffs must demonstrate that (1) they have suffered an “injury in fact,” (2) the injury is “fairly traceable” to the defendant’s challenged conduct, and (3) the injury is “likely to be redressed by a favorable judicial decision.” 94 Spokeo, Inc. v. Robins, 578 U.S. 330, 338 (2016) (citing Lujan v. Defs. of Wildlife, 504 U.S. 555, 560–61 (1992)).",,0,html_body_unmatched
,,,,"At its core, standing is rooted in separation-of-powers concerns. 95 Scalia, supra note 93, at 881. Standing circumscribes “what activities are appropriate” for Article III courts, an “irreducible constitutional minimum” for when a federal judge can grant jurisdiction and get involved. 96 Lujan v. Defs. of Wildlife, 504 U.S. 555, 559–60 (1992). A court must refuse to resolve even a potentially meritorious claim if the plaintiff is “not properly situated to be entitled to its judicial determination.” 97 Wright & Miller , supra note 90. As then-Judge Scalia phrased it in his influential article on the subject, standing “is an answer to the very first question that is sometimes rudely asked when one person complains of another’s actions: ‘What’s it to you?’ ” 98 Scalia, supra note 93, at 882.",,0,html_body_unmatched
,,,,"Injury in fact is standing’s “[f]irst and foremost” element, 99 Steel Co. v. Citizens for a Better Env’t, 523 U.S. 83, 103 (1998). and requires plaintiffs to show the “invasion of a legally protected interest.” 100 Ariz. State Legislature v. Ariz. Indep. Redistricting Comm’n, 576 U.S. 787, 799–800 (2015) (quoting Arizonans for Off. Eng. v. Arizona, 520 U.S. 43, 64 (1997)). The Supreme Court has described the requirements for injury in myriad ways, 101 E.g. , Steel Co. , 523 U.S. at 103–04 (injury in fact); Massachusetts v. Mellon, 262 U.S. 447, 488 (1923) (direct injury); Lewis v. Casey, 518 U.S. 343, 349 (1996) (actual injury). boiling the concept down to a number of essential characteristics: The plaintiff’s injury must be “concrete,” “particularized,” and sufficiently “actual or imminent, not conjectural or hypothetical.” 102 Spokeo, Inc. v. Robins, 578 U.S. 330, 339–40 (2016) (quoting Lujan v. Defs. Of Wildlife, 504 U.S. 555, 560 (1992)).",,0,html_body_unmatched
,,,,"Future injuries may be “concrete” where plaintiffs have demonstrated sufficient risk. 103 See GEO Grp., Inc. v. Newsom, 50 F.4th 745, 753–54 (9th Cir. 2022); In re Equifax Inc. Customer Data Sec. Breach Litig., 999 F.3d 1247, 1261–64 (11th Cir. 2021). The question of risk is most relevant where there is a hypothetical, illegal government enforcement of a law—but no actual enforcement. Plaintiffs have “pre-enforcement” standing for such threatened injuries when they allege “an intention to engage in a course of conduct arguably affected with a constitutional interest,” and there is a “credible threat” that a governmental actor will stop them from doing so. 104 Susan B. Anthony List v. Driehaus, 573 U.S. 149, 159 (2014) (quoting Babbitt v. Farm Workers, 442 U.S. 289, 298 (1979)). A threat is credible when it is “certainly impending” or there is a “substantial risk” of future harm. 105 Id. at 158 (quoting Clapper v. Amnesty Int’l USA, 568 U.S. 398, 414 n.5 (2013)). Justice Alito’s Clapper opinion initially relegated the pre-enforcement standard of “substantial risk” of harm to the footnote later cited in Driehaus , relying instead on the heftier “certainly impending” standard. See Clapper , 568 U.S. at 409–14. Like so many areas of standing doctrine, the cases in this “future injury” vein are messy: Precisely when the harm is certain 106 See, e.g. , Clapper , 568 U.S. at 410; City of Los Angeles v. Lyons, 461 U.S. 95, 101–03 (1983); Friends of the Earth, Inc. v. Laidlaw Env’t Servs. (TOC), Inc., 528 U.S. 167, 183–84 (2000). or the curtailing of a constitutional right is chilled 107 See, e.g. , Laird v. Tatum, 408 U.S. 1, 10–15 (1972); Meese v. Keene, 481 U.S. 465, 467, 473–75 (1987). enough for standing is highly case(and pleading-) specific. 108 See supra notes 101–102; Richard H. Fallon, Jr., The Fragmentation of Standing , 93 Tex. L. Rev. 1061, 1077–79 (2015).",,0,html_body_unmatched
,,,,"State governments asserting claims in federal courts possess unique standing opportunities as opposed to private plaintiffs. 109 See generally Wright, Miller & Cooper , supra note 90, § 3531.11.1 (comparing state standing to private standing). When asserting proprietary or private injuries, states are held to the same tripartite standing rule as all plaintiffs. 110 See id. But, by virtue of their independent character, states can also assert “sovereign” and “quasi-sovereign” injuries otherwise unavailable to private individuals. 111 Alfred L. Snapp & Son, Inc. v. Puerto Rico ex rel. Barez, 458 U.S. 592, 601–02 (1982). A state’s quasi-sovereign interests and injuries arise from its citizens’ wellbeing. 112 Id. at 602. The state, in those instances, asserts parens patriae standing on behalf of its citizens. 113 Id. at 600–02. Parens patriae means “parent of the country.” States may not assert these quasi-sovereign injuries, however, against the federal government in federal court, as the federal government “represents [the state’s people] as parens patriae [] when such representation becomes appropriate.” Massachusetts v. Mellon, 262 U.S. 447, 485–86 (1923). States, however, also directly suffer sovereign injuries as a result of their unique character and not as a result of broader injuries to their citizens. 114 Alfred L. Snapp , 458 U.S. at 601. The earliest recognized examples of such direct sovereign interests include “the exercise of sovereign power over individuals and entities” and “the demand for recognition from other sovereigns,” including other states. 115 Id.",,0,html_body_unmatched
,,,,"The Court disagreed, holding Massachusetts’s asserted injury—that “rising seas” would “swallow Massachusetts’ coastal land”—was sufficiently concrete and particularized for standing. 122 Id. at 521–23. Although the Court did credit the proprietary, non-sovereign ramifications of coastal flooding vis-a-vis Massachusetts as a landowner, 123 Id. at 523. Justice Stevens’s majority opinion also factored Massachusetts’s status as a state into the Court’s standing analysis. 124 See Fallon, supra note 108, at 1104, 1110. Distinguishing previous environmental cases where private plaintiffs lacked standing, Stevens asserted that “States are not normal litigants for the purposes of invoking federal jurisdiction.” 125 Massachusetts v. EPA, 549 U.S. at 518. Because the states “surrender[ed] certain sovereign prerogatives” to the federal government when they entered the Union, they are “entitled to special solicitude in [the Court’s] standing analysis.” 126 Id. at 519–20 (emphasis added). A bare majority thereafter held that Massachusetts had standing and ruled for the state on the merits—four justices dissented. 127 Id. at 526, 535.",,0,html_body_unmatched
,,,,"Precisely how to apply special solicitude (or even how it functioned in Massachusetts ) 128 Professor Katherine Crocker discusses the many doctrinal issues with Massachusetts v. EPA and special solicitude, including, among other things: (1) Massachusetts’s coastal injury was arguably proprietary, theoretically not requiring any special solicitude; (2) the majority conflated sovereign and quasi-sovereign injuries throughout its explanation of special solicitude. See Katherine Mims Crocker, Not-So-Special Solicitude , 109 Minn. L. Rev. 815, 827–31, 836–37, 843 (2024). has vexed scholars ever since. 129 See, e.g. , id. at 831 nn.70–71. Does special solicitude mean that states can broadly shirk any of standing’s general requirements? 130 See id. at 832 n.74 (collecting scholarly perspectives on the different forms of standing extra-credit special solicitude offers). Does it create an ever-expanding list of sovereign and quasi-sovereign injuries unavailable to private plaintiffs? 131 See id. at 831–32. Since 2007, the Supreme Court has not explicitly granted a state standing on special solicitude grounds, despite a number of close calls. 132 See id. at 841–43; United States v. Texas, 579 U.S. 547 (2016) (mem.) (per curiam).",,0,html_body_unmatched
,,,,"In his concurring opinion in United States v. Texas , Justice Gorsuch addressed head-on the Court’s protracted silence on the question. 133 United States v. Texas, 143 S. Ct. 1964, 1977 (2023). Gorsuch pointed out that special solicitude had not “played a meaningful role in this Court’s decisions in the years since [ Massachusetts v. EPA ].” 134 Id. at 1977–78. Further, he continued, “it’s hard not to think, too, that lower courts should just leave that idea on the shelf . . . .” 135 Id. In dissent, Justice Alito, relying on Massachusetts to support Texas’s standing claim, questioned if the majority opinion had “quietly interred” special solicitude. 136 Id. at 1997 (Alito, J., dissenting) (citing Justice Gorsuch’s concurring opinion).",,0,html_body_unmatched
,,,,"Special solicitude, then, appears on its way out. Since Massachusetts v. EPA , scholars have failed to characterize what special solicitude was or should be. 137 See, e.g. , Fallon, supra note 108, at 1104–10 (arguing that standing’s “fragmentation” had created a diverse array of distinct doctrines, including for state standing rules in the wake of Massachusetts v. EPA ); Bulman-Pozen, supra note 26, at 1745. Professor Katherine Crocker argues that this is for the best: Special solicitude lacked serious doctrinal rigor and has not been the source of the “extraordinary scope that some cases accord sovereign and quasi-sovereign interests.” 138 See Crocker supra note 128. Professor Crocker collected all of the circuit cases after Massachusetts v. EPA until the end of June 2023, analyzing them to show that special solicitude did not play a decisive role in any case.",,0,html_body_unmatched
,,,,"With the explosion of state suits against the federal government since 2007, however, Massachusetts v. EPA has arguably still left its mark on public law litigation. In recent decades, state attorneys general have ramped up their attacks on federal law. 139 See Note, An Abdication Approach to State Standing , 132 Harv. L. Rev. 1301, 1306–08 (2019). For politically motivated state officials, expansive state standing postMassachusetts v. EPA has been perfect for state plaintiffs to levy challenges that would otherwise be nonjusticiable. 140 See id. (noting Trump v. Hawaii, 138 S. Ct. 2392 (2018) and United States v. Texas, 579 U.S. 547 (2016) (mem.) (per curiam)); Mark L. Earley, “Special Solicitude”: The Growing Power of State Attorneys General , 52 U. Rich. L. Rev. 561, 562–63 (2018). Although the precise role that special solicitude is playing in this increase is up for debate, the implicit pressure felt by federal courts to protect state policies and facilitate state lawsuits may come from special solicitude operating in the background. 141 See Crocker, supra note 128, at 815–16.",,0,html_body_unmatched
,,,,"When states are given a standing inch, they take a policy mile. Although not discussing special solicitude or Massachusetts v. EPA directly, the Supreme Court’s decision in Biden v. Nebraska reveals that the Court still has a soft-spot for state plaintiffs. 148 Biden v. Nebraska, 143 S. Ct. 2355 (2023). There, a 6–3 Court found that Missouri had standing to challenge President Biden’s student loan forgiveness program for the harm that program would do to an independent government corporation (which itself had no interest in challenging the forgiveness plan), because that corporation was a “public instrumentality” of the state. 149 Id. at 2365–68. Despite the corporation’s “financial and legal independence” 150 Id. at 2388. from Missouri—and the corporation’s ability to bring suit itself—the Court’s analysis ignored the core limitations that have animated standing doctrine for decades. 151 Id. at 2400 (Kagan, J., dissenting). As Justice Kagan explained in dissent, the Court’s standing decision circumvented the political process and resolved a controversial policy matter itself. 152 Id. Reaching the merits, the Court found that the plan was invalid because it exceeded the language of the relevant statute under the Court’s major questions doctrine. 153 Id. at 2373–75 (opinion of Roberts, C.J.).",,0,html_body_unmatched
