page_no,pdf_text,pdf_original_label,pdf_corrected_label,matched_html_body,matched_html_footnote,match_confidence,match_status
54,"weapons  have  been  broadly  deregulated  statutorily  and  constitutionally, fourteen states do still restrict assault weapons, high-capacity magazines, or both. 319",text,body_text,"The market and the law have changed dramatically since then. Some argue that many if not most guns today are sold with high-capacity magazines, whose manufacture, again, would have been legally forbidden as recently as 2004. [317] (Such claims are hard to evaluate, since federal law does not require gun dealers to report sales information. [318] ) And while such weapons have been broadly deregulated statutorily and constitutionally, fourteen states do still restrict assault weapons, high-capacity magazines, or both. [319]",,97.5609756097561,matched
54,"Those restrictions have been subject to constitutional challenges, and although most have been upheld, some judges-citing the language from Bruen above-have  indicated a willingness to extend constitutional protection to these new forms of weapons, while subjecting restrictions on them to an asymmetrically strict test. Striking down California's prohibition on assault weapons and high-capacity magazines, one district court judge concluded that the law had 'no historical pedigree' because '[p]rior to the 1990's, there was no national history of banning weapons because they were equipped with furniture like pistol grips, collapsible stocks, flash hiders, flare launchers, or threaded barrels' 320 -disregarding or distinguishing a range of historical restrictions as inapposite. And yet the court found it easy to connect assault weapons with their ancestors, musing:",text,footnote,,. Id.,100.0,matched
54,"[A]  semiautomatic  pistol  with  a  threaded  barrel  ( i.e ,  an  'assault weapon') is is [sic] not much of a technological advancement over an 1868 navy revolver with  a  smooth  barrel.  And  is  a  semiautomatic shotgun  with  a  pistol  grip  and  adjustable  stock  ( i.e ,  an  'assault weapon') really a dramatic technological advancement over common multi-shot shotguns from the 1800s? 321",text,body_text,"[A] semiautomatic pistol with a threaded barrel ( i.e , an “assault weapon”) is is [sic] not much of a technological advancement over an 1868 navy revolver with a smooth barrel. And is a semiautomatic shotgun with a pistol grip and adjustable stock ( i.e , an “assault weapon”) really a dramatic technological advancement over common multi-shot shotguns from the 1800s? [321]",,93.8337801608579,matched
54,"In fact, the court opened its opinion by comparing assault weapons to 'the Bowie Knife which was commonly carried by citizens and soldiers in the 1800s,' 322 and yet rejected the relevance of historical restrictions of bowie knives and other bladed weapons because they are not firearms. 323",text,body_text,"In fact, the court opened its opinion by comparing assault weapons to “the Bowie Knife which was commonly carried by citizens and soldiers in the 1800s,” [322] and yet rejected the relevance of historical restrictions of bowie knives and other bladed weapons because they are not firearms. [323]",,99.1394148020654,matched
54,"In another case involving Illinois' prohibition on large-capacity magazines,  defined  as  those  able  to  accept  'more  than  10  rounds  of ammunition  for  long  guns  and  more  than  15  rounds  of  ammunition  for handguns,' 324 a  district court concluded that it was 'not even a close call' that such magazines are '[A]rms' for purposes of the Second Amendment, and enjoined the law. 325 The Seventh Circuit later lifted that injunction, over a dissent arguing that 'the Act's ban on magazines holding more than ten",text,body_text,"In another case involving Illinois’ prohibition on large-capacity magazines, defined as those able to accept “more than 10 rounds of ammunition for long guns and more than 15 rounds of ammunition for handguns,” [324] a district court concluded that it was “not even a close call” that such magazines are “[A]rms” for purposes of the Second Amendment, and enjoined the law. [325] The Seventh Circuit later lifted that injunction, over a dissent arguing that “the Act’s ban on magazines holding more than ten rounds for rifles and more than fifteen rounds for handguns effectively bans firearms that come standard with magazines over the limit.” [326]",,97.3811833171678,matched
54,"319. Large  Capacity  Magazines ,  GIFFORDS  L.  CTR.  https://giffords.org/lawcenter/gun-laws /policy-areas/hardware-ammunition/large-capacity-magazines/ [https://perma.cc/ECW9-9QVU].",footnote,footnote,,". Large Capacity Magazines , Giffords L. Ctr. https://giffords.org/lawcenter/gun-laws /policy-areas/hardware-ammunition/large-capacity-magazines/ [https://perma.cc/ECW9-9QVU].",97.07602339181287,matched
54,"320.  Miller v. Bonta, 690 F. Supp. 3d 956, 974 (S.D. Cal. 2023).",footnote,footnote,,". Miller v. Bonta, 690 F. Supp. 3d 956, 974 (S.D. Cal. 2023).",100.0,matched
54,321. Id. at 988.,footnote,footnote,,. Id.,100.0,matched
54,322. Id. at 965.,footnote,footnote,,. Id.,100.0,matched
54,"323. Id. at 994 ('But dirks, daggers, and bowie knives were not guns. (Pistols are addressed separately below.) They were bladed instruments; they were not firearms. Knife laws may not be completely irrelevant, but they are pretty close.'). The court was quick to add that '[t]his is not to say that bowie knives are not 'arms' imbued with Second Amendment protection.' Id. at 995.",footnote,footnote,,. Id.,100.0,matched
54,324.  720 Ill. COMP. STAT. 5/24-1.10(a) (2024).,footnote,footnote,,. 720 Ill. Comp. Stat . 5/24-1.10(a) (2024).,98.73417721518987,matched
54,"325.  Barnett  v.  Raoul,  671  F.  Supp.  3d  928,  943  (S.D.  Ill.  2023)  (quoting  challengers' complaint), vacated sub nom . Bevis v. City of Naperville, 85 F.4th 1175 (7th Cir. 2023).",footnote,footnote,,". Barnett v. Raoul, 671 F. Supp. 3d 928, 943 (S.D. Ill. 2023) (quoting challengers’ complaint), vacated sub nom . Bevis v. City of Naperville, 85 F.4th 1175 (7th Cir. 2023).",93.49112426035504,matched
55,rounds for rifles and more than fifteen rounds for handguns effectively bans firearms that come standard with magazines over the limit.' 326,text,body_text,"In another case involving Illinois’ prohibition on large-capacity magazines, defined as those able to accept “more than 10 rounds of ammunition for long guns and more than 15 rounds of ammunition for handguns,” [324] a district court concluded that it was “not even a close call” that such magazines are “[A]rms” for purposes of the Second Amendment, and enjoined the law. [325] The Seventh Circuit later lifted that injunction, over a dissent arguing that “the Act’s ban on magazines holding more than ten rounds for rifles and more than fifteen rounds for handguns effectively bans firearms that come standard with magazines over the limit.” [326]",,99.28571428571429,matched
55,"The point here is not to argue that high-capacity magazines (or, for that matter, magazines in general 327 )  do  or  do  not  fall  within  the  scope  of  the Second Amendment. There is a perfectly plausible argument that they do, as a  necessary  concomitant to the effective  use of  a modern weapon. 328 The point  is  to  highlight  that  this  line  of  reasoning  is  itself  predicated  on  the current state  of  the  technology  of  violence;  it  defines  the  scope  of  a constitutional right based on modern markets and innovation. One could do the same for other innovative forms of gun technology such as 'ghost gun' kits, which defenders describe as being part of the 'American tradition of self-made arms.' 329 Whether or not unfinished receivers can be legitimately analogized to  gunsmithing  in  1791,  3D  printing  and  other  technological developments have radically changed the ways in which people can make and/or  finish  guns  at  home. 330 Opponents  of  ghost  gun  restrictions  want modern technology, not access to an 18th century smithy.",text,body_text,"The point here is not to argue that high-capacity magazines (or, for that matter, magazines in general [327] ) do or do not fall within the scope of the Second Amendment. There is a perfectly plausible argument that they do, as a necessary concomitant to the effective use of a modern weapon. [328] The point is to highlight that this line of reasoning is itself predicated on the current state of the technology of violence; it defines the scope of a constitutional right based on modern markets and innovation. One could do the same for other innovative forms of gun technology such as “ghost gun” kits, which defenders describe as being part of the “American tradition of self-made arms.” [329] Whether or not unfinished receivers can be legitimately analogized to gunsmithing in 1791, 3D printing and other technological developments have radically changed the ways in which people can make and/or finish guns at home. [330] Opponents of ghost gun restrictions want modern technology, not access to an 18th century smithy.",,94.73170731707316,matched
55,"In any event, there is a great deal of uncertainty about what Bruen allows and prohibits, even in the aftermath of Rahimi . For the meantime, the Court's framework is being deployed by some judges in ways that asymmetrically invite some kinds of gun-related innovation while discouraging others. Gun manufacturers  and  owners  can  be  reasonably  confident  that  new  types  of firearms will be recognized as 'Arms' entitled to constitutional protection. By contrast, some courts have essentially concluded that governments trying to address gun safety issues are limited to the kinds of solutions that were available in the 18th century.",text,footnote,,. Id.,100.0,matched
55,Conclusion,section_header,body_text,"Our story is largely one of frustration and failure, but we hope that there are some positive lessons to be gleaned from it. The Conclusion offers a variety of policy levers that are still available to address some aspects of gun violence. There are important roles for policymakers and innovators to play in the future development of violence technologies.",,100.0,matched
55,Technologies of violence are not given; they are shaped by markets and by law. Both the kinds of weapons that Americans have and the technologies they have created to respond to those weapons are products of market and legal  factors  that  influence  the  pace  and  direction  of  innovation.  Only  by understanding  the  interactions  between  these  factors  can  scholars  and policymakers accurately evaluate the possibilities for reform.,text,body_text,Technologies of violence are not given; they are shaped by markets and by law. Both the kinds of weapons that Americans have and the technologies they have created to respond to those weapons are products of market and legal factors that influence the pace and direction of innovation. Only by understanding the interactions between these factors can scholars and policymakers accurately evaluate the possibilities for reform.,,95.52941176470588,matched
55,"326. Bevis , 85 F.4th at 1209 (Brennan, J., dissenting).",footnote,footnote,,". Bevis , 85 F.4th at 1209 (Brennan, J., dissenting).",100.0,matched
55,327. See supra note 273 and sources cited therein.,footnote,footnote,,. See supra note 273 and sources cited therein.,100.0,matched
55,"328.  Ass'n of N.J. Rifle & Pistol Clubs, Inc. v. Att'y Gen. of N. J., 910 F.3d 106, 116 (3d Cir. 2018).",footnote,footnote,,". Ass’n of N.J. Rifle & Pistol Clubs, Inc. v. Att’y Gen. of N. J., 910 F.3d 106, 116 (3d Cir. 2018).",100.0,matched
55,"329. See Greenlee, supra note 274, at 80-82 (arguing that no federal law restricts arms built for personal use).",footnote,footnote,,". See Greenlee, supra note 274, at 80–82 (arguing that no federal law restricts arms built for personal use).",100.0,matched
55,"330.  McWilliam, supra note 274, at 2 ('Some still engage in th[e] historical process of firearm building. Today, though, the prospective firearm manufacturer has less laborious options for doing so.' (internal citation omitted)).",footnote,footnote,,". McWilliam, supra note 274, at 2 (“Some still engage in th[e] historical process of firearm building. Today, though, the prospective firearm manufacturer has less laborious options for doing so.” (internal citation omitted)).",100.0,matched
56,"Supply  and  demand  in  the  market  for  firearms  are  meaningfully different than they are for smart phones or automobiles. Innovators will find it harder to bring such firearms products to market, because some investors, established firms, and retailers are wary of them. Moreover, a small cohort of deeply committed consumers can radically alter the market for everyone. The threat of boycotts over smart guns delayed, if not completely destroyed, a  meaningful  market  for  those  products.  Innovation  incentives  can  also backfire, as with New Jersey's attempt to boost the market for smart gun innovations by mandating them.",text,body_text,"Supply and demand in the market for firearms are meaningfully different than they are for smart phones or automobiles. Innovators will find it harder to bring such firearms products to market, because some investors, established firms, and retailers are wary of them. Moreover, a small cohort of deeply committed consumers can radically alter the market for everyone. The threat of boycotts over smart guns delayed, if not completely destroyed, a meaningful market for those products. Innovation incentives can also backfire, as with New Jersey’s attempt to boost the market for smart gun innovations by mandating them.",,97.57281553398059,matched
56,"But  failures  in  one  direction  may  have  led  to  growth  in  others. America's  inability  to  diminish  mass  shootings  has  generated  a  colossal market in environmental safety measures. Here, the innovation incentive that boosts demand by requiring new technology and paying for it has been an enormous  success,  at  least  in  terms  of  market  growth.  But  different innovation incentives come with distinct sets of tradeoffs. With environmental innovations like these, safety is paid for by taxpayers rather than  gun  owners  and  manufacturers,  and  decisions  are  broadly  made  by government officials rather than a private market.",text,footnote,,. Id.,100.0,matched
56,"Depending on one's point of view, much of this story is disheartening. Various efforts to address gun violence have failed due to unique market and legal forces. But others will see these failures as successes. Again, our goal in this Article is not to support or oppose any particular approach. Our hope is that by bringing together scholarship on innovation and firearms law, we can  identify  and  explain  some  of  the  upstream  features  that  shape  the uniquely American technologies of violence.",text,footnote,,. Id.,100.0,matched
56,"But  we  also  believe  that  the  effort  suggests  some  paths  toward addressing gun violence through innovation. Firearms manufacturers' unique immunities from regulation and tort liability are troubling. While regulation and litigation are necessarily costly for any industry whose products cause harm, the pharmaceutical and automotive industries face intense regulatory and litigation scrutiny and yet remain innovative. As of this writing, efforts are underway to pass federal legislation that would give CPSC power to issue safety warnings and even recalls for defective guns. 331 And further litigation in this area may increase the incentives that gunmakers and gun owners face to  invest  in  safer  technologies.  Perhaps  just  as  importantly,  litigation",text,body_text,"But we also believe that the effort suggests some paths toward addressing gun violence through innovation. Firearms manufacturers’ unique immunities from regulation and tort liability are troubling. While regulation and litigation are necessarily costly for any industry whose products cause harm, the pharmaceutical and automotive industries face intense regulatory and litigation scrutiny and yet remain innovative. As of this writing, efforts are underway to pass federal legislation that would give CPSC power to issue safety warnings and even recalls for defective guns. [331] And further litigation in this area may increase the incentives that gunmakers and gun owners face to invest in safer technologies. Perhaps just as importantly, litigation promises to divulge important information about gunmakers’ innovation and marketing strategies. [332]",,98.62114248194354,matched
56,"331.  Press  Release,  Congresswoman  Debbie  Dingell,  Dingell  Reintroduces  Legislation  to Address Safety Defects that Allow Firearms to Discharge Without Pulling the Trigger (June 22, 2023), https://debbiedingell.house.gov/news/documentsingle.aspx?DocumentID=4333 [https:// perma.cc/W3XV-FD6M]; see also Cavataro, supra note 250 (urging Congress to 'authorize the CPSC to exercise product safety regulatory authority over the firearms industry').",footnote,footnote,,. Id.,100.0,matched
57,promises to divulge important information about gunmakers' innovation and marketing strategies. 332,text,body_text,"But we also believe that the effort suggests some paths toward addressing gun violence through innovation. Firearms manufacturers’ unique immunities from regulation and tort liability are troubling. While regulation and litigation are necessarily costly for any industry whose products cause harm, the pharmaceutical and automotive industries face intense regulatory and litigation scrutiny and yet remain innovative. As of this writing, efforts are underway to pass federal legislation that would give CPSC power to issue safety warnings and even recalls for defective guns. [331] And further litigation in this area may increase the incentives that gunmakers and gun owners face to invest in safer technologies. Perhaps just as importantly, litigation promises to divulge important information about gunmakers’ innovation and marketing strategies. [332]",,98.98989898989899,matched
57,"If smart guns are going to succeed, they will likely need institutional backers like police departments and the military to increase the size of the market and to assuage concerns about reliability. Giving money to firms to develop smart guns is not sufficient if no market for them ever arises. Perhaps if  more  police  departments  equipped  their  officers  with  smart  guns,  they could  dramatically  increase  demand  for  the  firearms,  presumably  making them cheaper to produce at scale. More importantly, people who are anxious that smart guns will not work when needed would likely be reassured to see them being carried by police or military.",text,body_text,"If smart guns are going to succeed, they will likely need institutional backers like police departments and the military to increase the size of the market and to assuage concerns about reliability. Giving money to firms to develop smart guns is not sufficient if no market for them ever arises. Perhaps if more police departments equipped their officers with smart guns, they could dramatically increase demand for the firearms, presumably making them cheaper to produce at scale. More importantly, people who are anxious that smart guns will not work when needed would likely be reassured to see them being carried by police or military.",,97.17868338557993,matched
57,"Environmental  innovations  can  be  valuable,  especially  because  their benefits can be spread over large populations. Communities need flexibility to determine how they want to spend security dollars. Some might choose metal  detectors  and  bulletproof  blackboards;  others  will  prioritize  mental health resources.",text,body_text,"Environmental innovations can be valuable, especially because their benefits can be spread over large populations. Communities need flexibility to determine how they want to spend security dollars. Some might choose metal detectors and bulletproof blackboards; others will prioritize mental health resources.",,95.43973941368078,matched
57,"Finally, Second Amendment doctrine should not asymmetrically protect innovations in lethality while prohibiting innovations in regulation. Rahimi provides  some  hope  for  course  correction  in  that  regard,  but  its  ultimate impact remains uncertain.",text,footnote,,. Id.,100.0,matched
57,"In any event, our primary goal here is not to convince anyone of these specific prescriptions but to excavate and shine light on the underlying and under-explored  market  and  legal  forces  that  shape  the  technologies  of violence. By bringing together scholarship on innovation and firearms law, we hope to surface some particularly knotty problems in the gun debate and also  to  show  those  scholarly  approaches  have  an  essential-and,  yes, innovative-role to play in resolving them.",text,body_text,"In any event, our primary goal here is not to convince anyone of these specific prescriptions but to excavate and shine light on the underlying and under-explored market and legal forces that shape the technologies of violence. By bringing together scholarship on innovation and firearms law, we hope to surface some particularly knotty problems in the gun debate and also to show those scholarly approaches have an essential—and, yes, innovative—role to play in resolving them.",,96.22641509433963,matched
57,"332.  For  example,  the  Sandy  Hook  settlement  mentioned  above  included  an  agreement  to release thousands of pages of Remington's internal corporate documents. As of September 2023, at least, that information had not yet been released. Michael Steinberger, The Lawyer Trying to Hold Gunmakers Responsible for Mass Shootings , N.Y. TIMES (Sept. 29, 2023), https:// www.nytimes.com/2023/09/29/magazine/the-lawyer-trying-to-hold-gunmakers-responsible-formass-shootings.html [https://perma.cc/8GWH-KXHZ].",footnote,footnote,,". For example, the Sandy Hook settlement mentioned above included an agreement to release thousands of pages of Remington’s internal corporate documents. As of September 2023, at least, that information had not yet been released. Michael Steinberger, The Lawyer Trying to Hold Gunmakers Responsible for Mass Shootings , N.Y. Times (Sept. 29, 2023), https:// www.nytimes.com/2023/09/29/magazine/the-lawyer-trying-to-hold-gunmakers-responsible-for-mass-shootings.html [https://perma.cc/8GWH-KXHZ].",97.9633401221996,matched
,,,,"Guns play a variety of roles in American life—as tools of crime and self-defense, political symbols, markers of individual identity, instruments of recreation, and more. But at the most basic level, guns are a technology designed to inflict violence, whether for good (as in justified self-defense) or for ill (as in criminal or negligent misuse). And because guns are so effective in that task, their prevalence helps account for the disproportionate deadliness of violence in the United States. [1] In 2021, nearly 50,000 Americans died of gun shots—the highest number ever recorded by the CDC. [2] Those harms are not randomly distributed—men and people of color are especially likely to die [3] —and they come in different forms with different causes, including homicides, [4] impulsive suicides, [5] officer-involved killings, [6] school shootings, [7] and shootings by and of children (for whom gunshots are now the single leading cause of death). [8]",,0,html_body_unmatched
,,,,"Centering the importance of technology and innovation in the gun debate opens up new ways of thinking not only about potential solutions but also more broadly about the respective roles of law and markets in providing public safety. The gun debate has generally focused on governmental efforts to restrict gun ownership, which raises familiar and difficult questions regarding the effectiveness, [26] political plausibility, [27] and constitutionality [28] of gun regulation. Could markets and law instead harness private demand in ways that would spur safety-enhancing innovation for guns, [29] including the prospect of innovative “upstream” solutions that do not rely on the machinery of the criminal law and carceralization? [30]",,0,html_body_unmatched
,,,,"But other changes to violence technology seem to have a more unambiguously positive role in making guns safer while preserving their functionality, for example by decreasing the likelihood of accidental or criminal misuse. Safety switches were first created in the 1880s and are now ubiquitous. [41] Recent technological advances have enhanced safe storage devices (which federal law requires licensed dealers to provide with all handgun sales [42] and which some states require to be used in certain contexts [43] ) and led to the creation of “smart” guns that, like modern phones, can only be operated by authorized users. [44] Perhaps they will eventually be as effective and widespread as safety switches.",,0,html_body_unmatched
