page_no,pdf_text,pdf_original_label,pdf_corrected_label,matched_html_body,matched_html_footnote,match_confidence,match_status
19,"105.  Peter Overby, NRA: 'Only Thing That Stops a Bad Guy with a Gun Is a Good Guy with a Gun , ' NPR (Dec. 21, 2012, 3:00 PM), http://www.npr.org/2012/12/21/167824766/nra-only-thingthat-stops-a-bad-guy-with-a-gun-is-a-good-guy-with-a-gun [https://perma.cc/43KA-9JDW].",footnote,footnote,,". Peter Overby, NRA: ‘Only Thing That Stops a Bad Guy with a Gun Is a Good Guy with a Gun , ’ NPR (Dec. 21, 2012, 3:00 PM), http://www.npr.org/2012/12/21/167824766/nra-only-thing-that-stops-a-bad-guy-with-a-gun-is-a-good-guy-with-a-gun [https://perma.cc/43KA-9JDW].",99.80806142034548,matched
20,"primary question for firearms, then, is not whether the technology 'works' but the relative prevalence of their misuse. 106",text,body_text,"In many contexts involving innovations, one might conceptualize the underlying tension as being between desirable primary functions and undesirable side effects. New pharmaceuticals might treat one disease while simultaneously causing other health problems. But with firearms, it is harder to separate the primary function from the side effects since—as far as the instrument is concerned—the point is to threaten or inflict violence either way. The context, not the technology, determines whether the effect is good or bad, like a mis-prescribed drug rather than one with bad side effects. The primary question for firearms, then, is not whether the technology “works” but the relative prevalence of their misuse. [106]",,99.1869918699187,matched
20,"The challenge is unlocking the fact that private demand drives the very innovations that others seek to regulate. This is the awful symmetry at the heart  of  the  gun  debate.  Both  sides  generally  begin  with  some  shared premises: that unjustified gun violence is bad and public safety is good. But they have fundamentally contradictory prescriptions about how to get less of the bad and more of the good, since the product one side sees as the problem, the other side sees as the solution. 107 That makes the debate difficult but not necessarily intractable. Guns have their own political and legal baggage, to be sure, but they fit within a broader category of products that are inherently dangerous-where  some  degree  of  danger  is  part  of  the  function-and nonetheless should be made as safely as possible. The same is true of table saws,  meat  slicers,  and  even  chemotherapy  drugs.  Just  as  chemotherapy should kill cancerous cells while harming as few healthy cells as possible, guns should be dangerous (in the sense of being powerful and effective) when appropriately used in justified self-defense, and safe (ineffective) when in the hands of an unsupervised toddler.",text,footnote,,. Id.,100.0,matched
20,"And indeed, it is not hard to imagine various forms of safety-promoting gun innovation that should be embraced by all sides of the gun debate-that are, in that sense, akin to a disease-ending medicine, or one that serves its purpose without side effects. Nobody  benefits from guns that fire accidentally, 108 jam  when  needed, 109 or  are  prone  to  misuse  by  children, criminals, or other unauthorized users. While guns' basic function requires them to be dangerous, there is no particular benefit to their being unusually, unpredictably, or overwhelmingly so. 110 Most gun owners today report that",text,footnote,,. Id.,100.0,matched
20,"106.  In  any  event,  if  one  were  to  characterize  the  high  toll  of  American  gun  death  as  an undesirable  side  effect  of  guns'  desirable  primary  functions,  the  attractiveness  of  technological solutions is even more apparent. After all, the point of nearly every safety-promoting invention is to limit undesirable side effects while preserving desirable functions.",footnote,footnote,,. Id.,100.0,matched
20,"107. See, e.g. , Donald Braman & Dan M. Kahan, Overcoming the Fear of Guns, the Fear of Gun Control, and the Fear of Cultural Politics: Constructing a Better Gun Debate , 55 EMORY L.J 569, 570-71 (2006) (arguing that 'competing cultural visions' of the good  society, rather than empirical questions of safety, 'are what drive the gun control debate').",footnote,footnote,,". See, e.g. , Donald Braman & Dan M. Kahan, Overcoming the Fear of Guns, the Fear of Gun Control, and the Fear of Cultural Politics: Constructing a Better Gun Debate , 55 Emory L.J 569, 570–71 (2006) (arguing that “competing cultural visions” of the good society, rather than empirical questions of safety, “are what drive the gun control debate”).",99.70845481049562,matched
20,"108. E.g. , Champe Barton & Tom Jackman, Popular Handgun Fires Without Anyone Pulling the  Trigger,  Victims  Say ,  WASH. POST (Apr. 11,  2023,  7:00  AM), https://www.washingtonpost .com/dc-md-va/2023/04/11/sig-sauer-p320-fires-on-own/ [https://perma.cc/CC85-CV73].",footnote,footnote,,". E.g. , Champe Barton & Tom Jackman, Popular Handgun Fires Without Anyone Pulling the Trigger, Victims Say , Wash. Post (Apr. 11, 2023, 7:00 AM), https://www.washingtonpost .com/dc-md-va/2023/04/11/sig-sauer-p320-fires-on-own/ [https://perma.cc/CC85-CV73].",97.23320158102767,matched
20,"109.  Alex Yablon, New Jersey Attorney General Says Gunmaker Sold Defective Guns to Police , TRACE  (May  17,  2017),  https://www.thetrace.org/2017/05/gunmaker-sig-sauer-sold-defectiveguns-police/ [https://perma.cc/QEN4-MFME].",footnote,footnote,,". Alex Yablon, New Jersey Attorney General Says Gunmaker Sold Defective Guns to Police , Trace (May 17, 2017), https://www.thetrace.org/2017/05/gunmaker-sig-sauer-sold-defective-guns-police/ [https://perma.cc/QEN4-MFME].",98.14814814814815,matched
20,"110.  Strains  of  this  reasoning  come  through  in  Second  Amendment  doctrine,  which  denies constitutional  protection  to  'dangerous  and  unusual'  weapons. See  infra notes  310-315  and accompanying text.",footnote,footnote,,". Strains of this reasoning come through in Second Amendment doctrine, which denies constitutional protection to “dangerous and unusual” weapons. See infra notes 310–315 and accompanying text.",91.005291005291,matched
21,"self-defense is their primary reason for owning a gun, 111 but few would claim a legitimate interest in owning land mines, which are surely effective as an area-denial self-defense weapon but also present massive safety concerns. 112",text,body_text,"And indeed, it is not hard to imagine various forms of safety-promoting gun innovation that should be embraced by all sides of the gun debate—that are, in that sense, akin to a disease-ending medicine, or one that serves its purpose without side effects. Nobody benefits from guns that fire accidentally, [108] jam when needed, [109] or are prone to misuse by children, criminals, or other unauthorized users. While guns’ basic function requires them to be dangerous, there is no particular benefit to their being unusually, unpredictably, or overwhelmingly so. [110] Most gun owners today report that self-defense is their primary reason for owning a gun, [111] but few would claim a legitimate interest in owning land mines, which are surely effective as an area-denial self-defense weapon but also present massive safety concerns. [112]",,98.71244635193133,matched
21,"Which innovations  could serve that function-preserving  violent features while limiting violent bugs-is, as with any new technology, deeply contested, and it is not our goal here to endorse one or another. It could be better trigger locks, or smart gun technology that renders guns responsive only  to  a  registered  owner,  or  a  variety  of  other  technological  features designed to decrease the likelihood of a gun being misused in ways that harm either  its  owner  or  others.  Our  more  fundamental  interest  is  whether innovations in violence technology,  whatever they might be, are likely to emerge in the current economic and legal environment. Such innovations are not 'gun control'; they do not deprive anyone of a weapon, and in that sense are entirely consistent with the desire of some Americans to have and use guns for self-defense, while enhancing public safety overall. To return to LaPierre's aphorism: Wouldn't it be even better if the good guy is armed with a  functional  smart  gun,  while  the  bad  guy's  stolen  smart  gun  is  locked because he is not an authorized user?",text,body_text,"Which innovations could serve that function—preserving violent features while limiting violent bugs—is, as with any new technology, deeply contested, and it is not our goal here to endorse one or another. It could be better trigger locks, or smart gun technology that renders guns responsive only to a registered owner, or a variety of other technological features designed to decrease the likelihood of a gun being misused in ways that harm either its owner or others. Our more fundamental interest is whether innovations in violence technology, whatever they might be, are likely to emerge in the current economic and legal environment. Such innovations are not “gun control”; they do not deprive anyone of a weapon, and in that sense are entirely consistent with the desire of some Americans to have and use guns for self-defense, while enhancing public safety overall. To return to LaPierre’s aphorism: Wouldn’t it be even better if the good guy is armed with a functional smart gun, while the bad guy’s stolen smart gun is locked because he is not an authorized user?",,96.73202614379085,matched
21,"It is easy enough to dismiss the 'good guy with a gun' trope. But it does usefully  capture  a  deep  market  logic  regarding  the  relationship  between public  safety  and  the  technology  of  violence  that  deserves  to  be  taken seriously. Consider the 'marketplace of ideas' metaphor that has fundamentally shaped First Amendment  law  and  scholarship. 113 The underlying supposition of that metaphor is that, as Justice Louis Brandeis put it,  the  proper  remedy  for  bad  ideas  is  not  legal  intervention  but  'more",text,footnote,,. Id.,100.0,matched
21,"111.  Kate Masters, Fear of Other People Is Now the Primary Motivation for American Gun Ownership,  a  Landmark  Survey  Finds ,  TRACE  (Sept.  19,  2016),  https://www.thetrace.org/ 2016/09/harvard-gun-ownership-study-self-defense/ [https://perma.cc/TGD8-CHFY].",footnote,footnote,,". Kate Masters, Fear of Other People Is Now the Primary Motivation for American Gun Ownership, a Landmark Survey Finds , Trace (Sept. 19, 2016), https://www.thetrace.org/ 2016/09/harvard-gun-ownership-study-self-defense/ [https://perma.cc/TGD8-CHFY].",96.34146341463415,matched
21,"112.  Indeed, if a non-lethal weapon could effectively provide self-defense-the stun-gun phaser of science fiction, for example-it would be harder to articulate a legitimate self-defense reason for traditional  firearms. See Joseph  Blocher  &  Darrell  A.H.  Miller, Lethality,  Public  Carry,  and Adequate Alternatives , 53 HARV. J. LEGIS. 279, 297-98 (2016) ('A person is only permitted to use force when necessary to prevent a harm, and then only proportional force . . . .'); see also Craig S. Lerner  &  Nelson  Lund,  Heller and  Nonlethal  Weapons ,  60  HASTINGS  L.J.  1387,  1404  (2009) (considering  the  phasers  example);  Eugene  Volokh, Nonlethal  Self-Defense , (Almost  Entirely) Nonlethal Weapons, and the Rights to Keep and Bear Arms and Defend Life , 62 STAN. L. REV. 199, 237 (2009) ('Yet the crime control arguments for gun bans do not apply with anywhere near the same force to stun guns and to irritant sprays.').",footnote,footnote,,. Id.,100.0,matched
21,"113.  Abrams v. United States, 250 U.S. 616, 630 (1919) (Holmes, J., dissenting) ('[T]he best test of truth is the power of the thought to get itself accepted in the competition of the market, and . . . truth is the only ground upon which [people's] wishes safely can be carried out.'); William P. Marshall, In Defense of the Search for Truth as a First Amendment Justification , 30 GA. L. REV. 1,  12  (1995)  ('[T]raditional  Speech  Clause  jurisprudence  asserts  that  freedom  of  expression promotes truth by fostering a 'marketplace of ideas' which allows truth to ultimately prevail over falsity.').",footnote,footnote,,. Id.,100.0,matched
22,"speech.' 114 Though  expressed  more  like  a  bumper  sticker,  LaPierre's statement essentially picks up the same logic. In this marketplace of violence, desirable gun use will ultimately win out over gun misuse, in much the same way that good ideas are thought to beat out bad ideas in the marketplace of ideas. 115",text,footnote,,. Id.,100.0,matched
22,"There are many reasons to contest the analogy, of course. Even speech 'markets' permit regulation to prevent immediate physical harm, after all, and  the  brutal  logic  of  the  arms  race  casts  plenty  of  doubt  on  whether unmediated  individual  choice  would  lead  to  a  desirable  equilibrium  as opposed to a Hobbesian war of all against all. For our purposes here, though, what stands out is the suggestion that government should stay out of the field and that decisions about which guns are made and which innovations take place should be made 'by the market.' 116",text,footnote,,. Id.,100.0,matched
22,"But there has never been a 'market' for violence technology free of government  intervention.  For  example,  Samuel  Colt's  early  repeater  rifle succeeded in part because he convinced Congress to grant him a seven-year patent extension. 117 All of the major current players-Colt, Smith & Wesson, Winchester, and Remington-have received massive government support for their  creations. 118 And  all  manufacturers  are  insulated,  statutorily  and constitutionally,  from  the  kinds  of  tort  liability  and  regulation  that  have incentivized  safety-promoting  innovations  in  other  fields. 119 In  short,  the good guys and the bad guys have the guns they have not just because of individual choice, but because of markets that themselves are shaped by law.",text,footnote,,. Id.,100.0,matched
22,"To put the  point  in  innovation  policy  terms,  the  question  is  whether society is getting the optimal amount of gun safety in light of a complex and sometimes conflicting set of preferences. Are guns being made as safe as they can be in light of their intrinsic dangerousness? In the next two Parts, we identify and evaluate some of the economic and legal forces at work.",text,footnote,,. Id.,100.0,matched
22,"II. Innovation, Markets, and Incentives for Firearms",section_header,section_header,,,66.66666666666667,unmatched
22,"Firearms technology is the product of centuries of innovation that has consistently  increased  guns'  reliability,  accuracy,  rate  of  fire,  and  overall",text,body_text,"Firearms technology is the product of centuries of innovation that has consistently increased guns’ reliability, accuracy, rate of fire, and overall capacity to inflict violence. Such innovations have come both from government grants, especially via military spending, and the private market, bolstered by patent protection. [120] We begin this Part by describing the historical role of innovation in the gun industry, and then show in recent years how the industry—faced with the prospect of selling durable goods in a largely saturated and shrinking market—has emphasized innovations in cosmetic design and regulation-avoidance.",,97.04918032786885,matched
22,"114.  Whitney v. California, 274 U.S. 357, 377 (Brandeis, J., concurring).",footnote,footnote,,". Whitney v. California, 274 U.S. 357, 377 (Brandeis, J., concurring).",100.0,matched
22,"115.  Joseph Blocher & Darrell A.H. Miller, What Is Gun Control? Direct Burdens, Incidental Burdens, and the Boundaries of the Second Amendment , 83 U. CHI. L. REV. 295, 352-54 (2016).",footnote,footnote,,. Id.,100.0,matched
22,"116.  Anthony Davies & James R. Harrigan, Let Markets Solve the Gun Problem , U.S. NEWS (Mar.  1,  2018,  3:00  PM),  https://www.usnews.com/opinion/economic-intelligence/articles/201803-01/how-markets-can-solve-americas-gun-problem [https://perma.cc/7B3A-GQ82].",footnote,footnote,,". Anthony Davies & James R. Harrigan, Let Markets Solve the Gun Problem , U.S. News (Mar. 1, 2018, 3:00 PM), https://www.usnews.com/opinion/economic-intelligence/articles/2018-03-01/how-markets-can-solve-americas-gun-problem [https://perma.cc/7B3A-GQ82].",98.0,matched
22,"117.  Colt v. Young, 6 F. Cas 171, 171-72 (S.D.N.Y. 1852).",footnote,footnote,,". Colt v. Young, 6 F. Cas 171, 171–72 (S.D.N.Y. 1852).",100.0,matched
22,"118.  PAMELA HAAG, THE GUNNING OF AMERICA: BUSINESS AND THE MAKING OF AMERICAN GUN CULTURE 16-18 (2016) (detailing the subsidies that gun manufacturers received throughout the nineteenth century).",footnote,footnote,,". Pamela Haag, The Gunning of America: Business and the Making of American Gun Culture 16–18 (2016) (detailing the subsidies that gun manufacturers received throughout the nineteenth century).",100.0,matched
22,119. See infra subpart III(A).,footnote,footnote,,. See infra subpart III(A).,100.0,matched
23,"capacity  to  inflict  violence.  Such  innovations  have  come  both  from government grants, especially via military spending, and the private market, bolstered  by  patent  protection. 120 We  begin  this  Part  by  describing  the historical role of innovation in the gun industry, and then show in recent years how  the  industry-faced  with  the  prospect  of  selling  durable  goods  in  a largely  saturated  and  shrinking  market-has  emphasized  innovations  in cosmetic design and regulation-avoidance.",text,footnote,,. Id.,100.0,matched
23,"Drawing on the market-based and policy factors laid out in Part I, we then turn to the puzzling story of smart guns-those designed to be fired only by  an  authorized  user.  Despite  plausible  supply  and  demand,  no  viable market for these guns has yet to emerge. We first identify some economic explanations, then show how  one particular governmental effort to incentivize the  market  had  the opposite effect, triggering  a  marketsmothering backlash.",text,footnote,,. Id.,100.0,matched
23,"We then contrast the stunted growth of smart guns with an area where innovation incentives have been remarkably successful at establishing a new market  for  violence  technology-the  market  for  products  that  'harden' schools against active shooters. Here, federal, state, and local governments have spent billions on innovations like gun-detecting cameras, bulletproof whiteboards,  and  metal  detectors  in  an  effort  to  curtail  school  shootings. While we do not endorse one form of technology or another, we do highlight a  variety  of  reasons  to  doubt  that  these  markets  are  delivering  socially optimal results.",text,body_text,"We then contrast the stunted growth of smart guns with an area where innovation incentives have been remarkably successful at establishing a new market for violence technology—the market for products that “harden” schools against active shooters. Here, federal, state, and local governments have spent billions on innovations like gun-detecting cameras, bulletproof whiteboards, and metal detectors in an effort to curtail school shootings. While we do not endorse one form of technology or another, we do highlight a variety of reasons to doubt that these markets are delivering socially optimal results.",,95.36423841059603,matched
23,A. The Past and Present of Firearms Innovation,section_header,section_header,,,67.3913043478261,unmatched
23,It  is  far  beyond the scope of this Article to summarize the history of gun-related  innovation-a  tale  ably  told  by  other  scholars. 121 Our  more limited goal is to emphasize that the production of firearms in many ways fits a familiar model of incentives and technological breakthroughs.,text,body_text,It is far beyond the scope of this Article to summarize the history of gun-related innovation—a tale ably told by other scholars. [121] Our more limited goal is to emphasize that the production of firearms in many ways fits a familiar model of incentives and technological breakthroughs.,,96.85314685314685,matched
23,"The history of firearms is full of striking innovations, such that one can essentially track the lineage of modern weapons. Some examples include the evolution from John Browning's mastery of self-loading mechanisms 122  to John Garand's creation of the M1 rifle 123 to the M1's eventual replacement",text,body_text,"The history of firearms is full of striking innovations, such that one can essentially track the lineage of modern weapons. Some examples include the evolution from John Browning’s mastery of self-loading mechanisms [122] to John Garand’s creation of the M1 rifle [123] to the M1’s eventual replacement by the M16 (the military version of the AR-15 [124] ), and Mikhail Kalashnikov’s adaptation of the M1 and other technologies for increased reliability and cheaper production, resulting in the AK-47, which some say “ranks as the deadliest, most prevalent and most game-changing individually wielded weapon in the history of military armament.” [125]",,98.99665551839465,matched
23,"120.  HAAG, supra note 118, at 16-18, 22, 26.",footnote,footnote,,". Haag , supra note 118, at 16–18, 22, 26.",98.7012987012987,matched
23,"121.  For broader histories, see generally id. ; IAN V. HOGG, STORY OF THE GUN (1996); PRIYA SATIA, EMPIRE OF GUNS: THE VIOLENT MAKING OF THE INDUSTRIAL REVOLUTION (2018); DAVID J.  SILVERMAN,  THUNDERSTICKS:  FIREARMS  AND  THE  VIOLENT  TRANSFORMATION  OF  NATIVE AMERICA (2016); and DeLay, supra note 31.",footnote,footnote,,. Id.,100.0,matched
23,"122.  John  Keilers, Arming  the  Army,  John  M.  Browning ,  U.S.  ARMY  (Jan.  12,  2009), https://www.army.mil/article/15705/arming_the_army_john_m_browning [https://perma.cc/23P8CACS].",footnote,footnote,,". John Keilers, Arming the Army, John M. Browning , U.S. Army (Jan. 12, 2009), https://www.army.mil/article/15705/arming_the_army_john_m_browning [https://perma.cc/23P8-CACS].",94.15204678362574,matched
23,"123. John  Garand ,  NAT.  PARK  SERV.  (Mar.  25,  2023),  https://www.nps.gov/spar/learn/ historyculture/john-c-garand.htm [https://perma.cc/7NSK-ZLX8].",footnote,footnote,,". John Garand , Nat. Park Serv. (Mar. 25, 2023), https://www.nps.gov/spar/learn/ historyculture/john-c-garand.htm [https://perma.cc/7NSK-ZLX8].",94.96402877697841,matched
24,"by the M16  (the military version of the AR-15 124 ), and Mikhail Kalashnikov's  adaptation  of  the  M1  and  other  technologies  for  increased reliability and cheaper production, resulting in the AK-47, which some say 'ranks as the deadliest, most prevalent and most game-changing individually wielded weapon in the history of military armament.' 125",text,footnote,,. Id.,100.0,matched
24,"A huge proportion of gun-related innovation has been in response to military  demand  (a  prime  form  of  the  kinds  of  demand  side  incentive discussed above 126 )-though, as with other innovations, many such technologies eventually find their way into the civilian market. 127  The AR15, for example, was largely the result of engineer Eugene Stoner's private tinkering while an employee at Armalite. 128 Colt later purchased the patents and developed the gun (named the M-16 for military use) with major support from the  U.S.  Air  Force  and  Army in  the  leadup  to  the  Vietnam  War. 129 Today,  the  AR-15  is  the  most  popular  rifle  on  the  American  civilian market. 130",text,footnote,,. Id.,100.0,matched
24,"It  would be an understatement to say that there is deep disagreement about whether new firearms technologies have been a net social good, but there can be no reasonable disagreement that modern firearms are drastically different and more lethal than their forebears. Founding-Era muskets were capable of firing perhaps a few times per minute, with a muzzle velocity of 1,000 feet per second and an effective range of 50 meters. 131  A modern AR15 can fire 45 rounds per minute at 3,260 feet per second with an effective",text,body_text,"It would be an understatement to say that there is deep disagreement about whether new firearms technologies have been a net social good, but there can be no reasonable disagreement that modern firearms are drastically different and more lethal than their forebears. Founding-Era muskets were capable of firing perhaps a few times per minute, with a muzzle velocity of 1,000 feet per second and an effective range of 50 meters. [131] A modern AR-15 can fire 45 rounds per minute at 3,260 feet per second with an effective range of 550 feet. [132] Some downplay the scale of change [133] and embrace what historian Brian DeLay calls “the myth of continuity.” [134] But most gun owners probably celebrate these innovations as characteristic American ingenuity, [135] and few would accept the suggestion that the Second Amendment only protects muskets. Understandably, gun owners want the benefits of technological innovation, even if they also want to analogize AR-15s to muskets in terms of being “Arms” protected by the Second Amendment.",,99.61538461538461,matched
24,"124.  Daniel  T.  McElrath, The  ArmaLite  Story ,  AM.  RIFLEMAN  (July  29,  2021),  https:// www.americanrifleman.org/content/the-armalite-story/ [https://perma.cc/68PP-8V6K].",footnote,footnote,,". Daniel T. McElrath, The ArmaLite Story , Am. Rifleman (July 29, 2021), https:// www.americanrifleman.org/content/the-armalite-story/ [https://perma.cc/68PP-8V6K].",95.0,matched
