page_no,pdf_text,pdf_original_label,pdf_corrected_label,matched_html_body,matched_html_footnote,match_confidence,match_status
49,"What, however, is historically significant is that the NEPA amendments in question were part of a legislative budget bill drafted by Democrats in power in both the White House and the Senate at the time. 195  The Democratic party, which has long championed more stringent environmental protection requirements, was willing to accept significant amendments to NEPA -one of the nation's most important environmental laws -in exchange for Republican votes for the budget bill. Past efforts to amend NEPA had consistently failed. 196 But, NEPA was now clearly on the table to be negotiated away.",text,body_text,"What, however, is historically significant is that the NEPA amendments in question were part of a legislative budget bill drafted by Democrats in power in both the White House and the Senate at the time. [195] The Democratic party, which has long championed more stringent environmental protection requirements, was willing to accept significant amendments to NEPA―one of the nation’s most important environmental laws―in exchange for Republican votes for the budget bill. Past efforts to amend NEPA had consistently failed. [196] But, NEPA was now clearly on the table to be negotiated away.",,99.49152542372882,matched
49,"Part of the reason for this major shift in policy was the apparently growing sentiment among some Democrats and perhaps even some environmentalists that NEPA had become a mixed bag because its insistence on rigorous environmental review risked slowing down the transformation of the nation's system of delivering electricity required to address climate change. 197 A slowing down of the infrastructure necessary to grid transformation, moreover, was no neutral matter given",text,footnote,,. Id.,100.0,matched
49,"(2025). Furthermore, any environmental impact statement for which such a fee has been paid 'shall be completed not later than 1 year after the date of publication of the notice of intent to prepare the environmental impact statement.' Id.",footnote,footnote,,. Id.,100.0,matched
49,"195. See Jennifer Scholtes, Caitlin Emma, Meredith Lee Hill & Josh Siegel, Here are the 6 must-know provisions of the new debt ceiling deal , POLITICO  (May  28,  2023,  at  12:17  AM  ET),  https://www.politico.com/news/2023/05/28/6-pillars-of-the-debt-ceiling-deal00099108 [https://perma.cc/5XBS-WFL5].",footnote,footnote,,". See Jennifer Scholtes, Caitlin Emma, Meredith Lee Hill & Josh Siegel, Here are the 6 must-know provisions of the new debt ceiling deal , Politico (May 28, 2023, at 12:17 AM ET), https://www.politico.com/news/2023/05/28/6-pillars-of-the-debt-ceiling-deal-00099108 [https://perma.cc/5XBS-WFL5].",97.24137931034483,matched
49,"196. Daniels et al., supra note 82, at 873.",footnote,footnote,,". Daniels et al., supra note 82, at 873.",100.0,matched
49,"197. See, e.g. , J.B. Ruhl & James Salzman, What Happens When the Green New Deal Meets the Old Green Laws? ,  44  VT.  L.  REV.  693,  696 -97, 716 -18 (2020).",footnote,footnote,,". See, e.g. , J.B. Ruhl & James Salzman, What Happens When the Green New Deal Meets the Old Green Laws? , 44 Vt. L. Rev. 693, 696–97, 716–18 (2020).",95.13888888888889,matched
50,"the longer it takes to reduce greenhouse gas emissions, the exponentially harder it is to do so. 198",text,body_text,"Part of the reason for this major shift in policy was the apparently growing sentiment among some Democrats and perhaps even some environmentalists that NEPA had become a mixed bag because its insistence on rigorous environmental review risked slowing down the transformation of the nation’s system of delivering electricity required to address climate change. [197] A slowing down of the infrastructure necessary to grid transformation, moreover, was no neutral matter given the longer it takes to reduce greenhouse gas emissions, the exponentially harder it is to do so. [198]",,99.0,matched
50,"The Seven County Court understood this and understandably used it to its advantage for making the case that NEPA had 'hindered' important infrastructure. The Court stressed that '[i]ndeed,  certain project opponents have relied on NEPA to fight even clean-energy projects -from wind farms to hydroelectric dams, from solar farms to geothermal wells.' 199 It  is  a valid point. With the perception that NEPA may now be interfering with climate goals, a bipartisan agreement was reached in 2023 to amend the law, even if amending only part of the law makes little  sense  in  light  of  the  rest  of  the  law  left  unchanged. Ironically, in the case of Seven County , an immediate cost of NEPA's cutback is a loss of EIS consideration of upstream and downstream impacts on climate change.",text,footnote,,. Id.,100.0,matched
50,"198. This apparent shift in public sentiment regarding the efficacy of procedural  requirements  like  NEPA  to  the  extent  that  those  requirements are seen as hindering needed growth are reflected in the recent  book Abundance ,  which  was  published  months  after Seven County was briefed  and  argued. See  generally Ezra  Klein  &  Derek Thompson,  ABUNDANCE  (2025)  (contending  that  ambitious  and  important public projects can be unduly hindered by laws like NEPA that require government agencies to consider the consequences of their actions before they act). More concretely, such a shift in public attitudes  is  r eflected  by  California's  decision  a  month  after Seven County to roll back its own state environmental assessment law, the California Environmental Quality Act, over environmentalist objections, based on an emerging consensus that such environmental review requirements interfere with the siting and construction of necessary  affordable  housing. See Lauren  Rosenhall,  Soumya  Karlamangla & Adam Nagourney, California Rolls Back Its Landmark Environmental  Law , N.Y.  TIMES  (June  30,  2025),  https://www.nytimes.com/2025/06/30/us/california-environment-newsomceqa.html [https://perma.cc/2D5D-BSBP].",footnote,footnote,,. Id.,100.0,matched
50,"Seven  Cnty.  Infrastructure  Coal.  v.  Eagle  County,  145  S.  Ct.  1497, 1513 (2025).",list_item,footnote,,". Seven Cnty. Infrastructure Coal. v. Eagle County, 145 S. Ct. 1497, 1513 (2025).",88.88888888888889,matched
51,Conclusion,section_header,body_text,"The Court’s granting of the stay accordingly sent a strong signal to the D.C. Circuit that the Justices thought the EPA interstate air pollution rule was likely unlawful. That rule is one of the Agency’s most important and challenging rules because it seeks to resolve one of the hardest pollution control issues: how to allocate the respective air pollution reduction responsibilities of dozens of upwind states that are causing downwind states to fail to meet the Clean Air Act National Ambient Air Quality Standards, which has serious consequences for public health of their populations. The Court’s 2014 six-to-two majority upholding EPA’s similarly designed previous Good Neighbor Rule in EPA v. EME Homer City Generation, L.P. [118] has long been a high-water mark for environmentalists who strongly supported EPA’s rule. For that same reason, however, the Court’s conclusion in Ohio underscored how much the Court had changed since then, including by adding a Justice (Kavanaugh) whose opinion for the D.C. Circuit had been overturned by the Court a decade earlier in EME Homer. [119]",,100.0,matched
51,"The Court's reversal of the D.C. Circuit's judgment in Seven County was not, standing alone, breaking news. More akin to same-old, same-old. But viewed not in isolation but in the broader context of our times, the ruling may well prove to be symptomatic of an ongoing devolving of environmental law. It is too soon to know for sure. That is necessarily true about discerning historical, evolutionary trends. No one isolated moment tells the full story. For those, however, who, like me, believe that environmenta l law has been one of law's great success stories in the United States over the past half century, the suggestion of such an unraveling is discouraging.",text,body_text,"The Court’s reversal of the D.C. Circuit’s judgment in Seven County was not, standing alone, breaking news. More akin to same-old, same-old. But viewed not in isolation but in the broader context of our times, the ruling may well prove to be symptomatic of an ongoing devolving of environmental law. It is too soon to know for sure. That is necessarily true about discerning historical, evolutionary trends. No one isolated moment tells the full story. For those, however, who, like me, believe that environmental law has been one of law’s great success stories in the United States over the past half century, the suggestion of such an unraveling is discouraging.",,99.84917043740573,matched
51,"Certainly, environmental law is being tested as never before. As described, it is being tested by the changing priorities of the current Supreme Court in areas of law that cross-cut with environmental law. It is being tested by a Congress that paradoxically passes a law that reduces environmental protections for the supposed purpose of addressing climate change more expeditiously but then fails to enact any substantive legislation directed to the climate issue itself. And, of course, it is being tested to an unprecedented extent by a President who, unable to erase the federal environmental statutes on the books, seeks to create a legal revolution akin to the antithesis of that which created environmental law in the 1970s -by destroying the federal government agencies' ability to administer that law through massive freezing of previously appropriated funding, future budget cuts, layoffs, and destruction of career employee morale, 200 and by relying on the Court's recent rulings to justify eliminating all Clean Air Act authority to regulate greenhouse gas emissions. 201 The Seven County opinion provides more reason still to worry with the obvious loss of much of the moral and legal force of one of the nation's most important laws -NEPA.",text,footnote,,. Id.,100.0,matched
52,"See, e.g. , Lisa Friedman, Trump Administration to End Protections for 58  Million  Acres  of  National  Forests , N.Y.  TIMES  (June  23,  2025), https://www.nytimes.com/2025/06/23/climate/trump-end-protec-",list_item,footnote,,". See, e.g. , Lisa Friedman, Trump Administration to End Protections for 58 Million Acres of National Forests , N.Y. Times (June 23, 2025), https://www.nytimes.com/2025/06/23/climate/trump-end-protections-for-58-million-acres-of-national-forests.html [https://perma.cc/LV3F-TS4M]; Lisa Friedman, EPA Axes Biden’s Climate and Pollution Limits on Power Plants , N.Y. Times (June 11, 2025), https://www.nytimes.com/2025/06/11/climate/epa-power-plants-mercury-carbon-trump.html [https://perma.cc/CX35-8NRE]; Hiroko Tabuchi, E.P.A. Set to Cancel Grants Aimed at Protecting Children From Toxic Chemicals , N.Y. Times (Apr. 21, 2025), https://www.nytimes.com/2025/04/21/climate/epa-cuts-forever-chemicals-grants.html [https://perma.cc/H2TT-ZGLC]; Lisa Friedman, Trump Aims to Eliminate to Eliminate E.PA.’s Scientific Research Arm , N.Y. Times (Mar. 17, 2025), https://www.nytimes.com/2025/03/17/climate/trump-eliminates-epa-science.html [https://perma.cc/B6J3-CG2W].",97.76674937965261,matched
52,"tions-for-58-million-acres-of-national-forests.html [https://perma.cc/LV3F-TS4M]; Lisa Friedman, EPA Axes Biden's Climate and Pollution Limits on Power Plants , N.Y. TIMES (June 11, 2025), https://www.nytimes.com/2025/06/11/climate/epa-power-plantsmercury-carbon-trump.html [https://perma.cc/CX35-8NRE]; Hiroko Tabuchi, E.P.A.  Set  to  Cancel  Grants  Aimed  at  Protecting  Children From Toxic Chemicals , N.Y. TIMES (Apr. 21, 2025), https://www.nytimes.com/2025/04/21/climate/epa-cuts-forever-chemicalsgrants.html  [https://perma.cc/H2TT-ZGLC];  Lisa  Friedman, Trump Aims to Eliminate to Eliminate E.PA.'s Scientific Research Arm , N.Y. TIMES  (Mar.  17,  2025),  https://www.nytimes.com/2025/03/17/climate/trump-eliminates-epa-science.html [https://perma.cc/B6J3CG2W].",list_item,footnote,,. Id.,100.0,matched
52,"Reconsideration of 2009 Endangerment Finding and Greenhouse Gas Vehicle Standards, 90 Fed. Reg. 36288, 36289 -91, 36299 (proposed Aug. 1, 2025) (to be codified at 40 C.F.R. pts. 85, 86, 600, 1036, 1037, 1039) ('The Agency did not have the benefit of the Court's decisions in Loper Bright and West Virginia . . . when issuing the Endangerment Finding in 2009.').",list_item,footnote,,. Id.,100.0,matched
,,,,"Seven County is also the first major loss that may have occurred partly as a result of the enactment of recent legislation instead of, as with all the others, being the product of the absence of such legislation. In the latter circumstance, the Court held that existing statutory language, passed decades earlier, did not provide the necessary clear congressional authorization for ambitious federal environmental protection programs supported by environmentalists. [13] In Seven County , it was the passage of bipartisan legislation amending NEPA for the first time in more than fifty years that seemed to help persuade the Justices to erode the Act’s requirements. [14]",,0,html_body_unmatched
,,,,"Part I describes the Seven County litigation and the Court’s ruling. This includes both its immediate and long-term significance reflected in the majority’s reasoning. Part II relates the Seven County decision to the other recent major environmental losses at the Court. Finally, Part III considers the portent of all six cases for what appears to be an accelerating devolution of environmental law in the United States.",,0,html_body_unmatched
,,,,"Case background . In many respects, Seven County was a straightforward NEPA case. NEPA requires that federal agencies prepare environmental impact statements (EISs) for any proposals for “major federal actions significantly affecting the quality of the human environment.” [18] There was no dispute here that an EIS was required. There was the requisite federal agency (the Surface Transportation Board). That agency was proposing a major federal action (permitting the 88-mile extension of an existing freight rail line in Utah to facilitate development and production of waxy crude oil in the Uinta Basin—the geographic area to be served by that rail line). [19] And that railway line, if permitted, would result in significant adverse environmental effects. [20] There was similarly no dispute under established Supreme Court precedent that the EIS need not consider all the “but for” adverse consequences of the proposed Board action to be adequate. [21]",,0,html_body_unmatched
,,,,The issue raised by Seven County was whether the Board EIS had adequately considered the proposed action’s environmental effects. [22] The D.C. Circuit had ruled the Board had not. [23] And the parties differed on what subset of but-for consequences fell within the required scope of an EIS. [24],,0,html_body_unmatched
,,,,"The but-for environmental effects of the proposed railway line range from the most immediate to the most distant in time and space. The most immediate effects included the construction and operation of the railroad itself bounded by its 88-mile length. That these effects were included was uncontested. [25] Less immediate effects—but effects with an obvious tie to the railroad project—included the adverse environmental effects caused by the increased oil production activities in the Uinta Basin area that the new railway line was designed to service. These are “upstream” consequences. [26] After all, the very purpose of the railway line was to promote that increased oil production activity. [27] Looking outside the geographic boundaries of the project, other possible adverse environmental effects would be to look “downstream” of the project to the increased railway traffic the new railway line might cause outside its own 88-mile length, including railway accidents and oil spills. [28] Finally, even further removed in time and space, the effects might include the increased greenhouse gas emissions and air pollution caused by the refining of the crude oil once it reached its final destination hundreds of miles away in the Gulf States. [29]",,0,html_body_unmatched
,,,,"The Surface Transportation Board EIS considered impacts that the railway extension construction and operation would have on water resources, sage grouse, ambient levels of noise, and existing land uses. [30] The EIS considered some upstream consequences as well, including some of the impact of oil production where it would take place, and some downstream consequences, including whether there would be increased greenhouse gas emissions and climate change impacts from refining in the Gulf States. [31] The EIS also estimated the number of increased oil wells likely generated upstream by the railroad extension and some of the downstream consequences. [32] The Board held six public meetings on the project and received more than 1,900 comments on its Draft EIA. [33] The Board’s final EIS, when combined with supporting documentation, was more than 3,600 pages long. [34] The Board considered the findings of the EIS and other statutorily required factors in deciding whether to permit the railway line, which the Board approved for construction and operation. [35]",,0,html_body_unmatched
,,,,"The Solicitor General’s opposition to the industry cert petition would normally be fatal to another party’s cert petition, especially where, as here, the federal government was taking the position that the ruling below was not sufficiently important to warrant review. [44] A sufficient number of Justices, however―it requires a minimum of four to grant review―apparently agreed with the industry petitioners that Seven County provided a good enough vehicle to rein in the D.C. Circuit, which petitioners argued had taken an unduly expansive view of environmental effects in a series of rulings. [45]",,0,html_body_unmatched
,,,,"In these circumstances, once Supreme Court plenary review was secured, the primary strategy of the industry petitioners was to secure the broadest and most significant ruling possible. They were confident they were going to win, and they did not want to waste that win by having it based on narrow rather than broad grounds. [46] Industry petitioners’ briefs reflected that confidence and ambition. With their new counsel of record, Paul Clement, they swung for the fences. They had no interest in embracing the Solicitor General’s sharply contrasting effort to secure a win for the federal Surface Transportation Board on narrow, case-specific grounds only. [47]",,0,html_body_unmatched
,,,,"Petitioners instead made a series of far-reaching arguments that sought to categorically exclude from NEPA EIS consideration of adverse environmental effects that had long been understood to be within the Act’s reach, including all upstream and downstream consequences outside the project area itself. [48] This was not an argument they had made below, and the Surface Transportation Board had considered some, but not all, of those upstream and downstream consequences. [49] Nor was it an argument that was raised even by their petition for a writ of certiorari, [50] so it arguably was not even fairly before the Court. This categorical argument repeatedly relied on Congress’s 2023 amendment of NEPA―even though the amendment was made years after the EIS was completed―as making clear that Congress did not support the D.C. Circuit’s expansive reading of what constituted “reasonably foreseeable” environmental consequences that an EIS must consider. [51]",,0,html_body_unmatched
,,,,"Congress in the 2023 amendments had provided that final EISs should generally not be more than 150 pages long, [52] even though the average EIS had historically been more than 600 pages long. [53] The amendments further provided that preparation of the final EIS should take no more than two years, [54] when the average length of time had been between four and five years. [55] The implication, petitioners argued, was clear. The new congressional limits could not be squared with the kind of sweeping EISs contemplated by respondents and the D.C. Circuit. Here, the respondents were arguing, and the D.C. Circuit had held, that an EIS related to an 88-mile railway line had failed to consider all the reasonably foreseeable consequences—when the Surface Transportation Board’s EIS was itself more than 600 pages long, and supplemented by almost 3,000 additional pages of appendices and responses to public comments. [56] Absent a significant cutback on what was considered a reasonably foreseeable consequence of a proposed major federal action, federal agencies could not possibly realize Congress’s clear understanding, at least as of 2023, of the more limited role that NEPA should play.",,0,html_body_unmatched
,,,,"The Court faulted the D.C. Circuit ruling on two grounds. The first was the D.C. Circuit’s failure to “afford the Board the substantial judicial deference required in NEPA cases.” [58] The Court sidestepped its recent ruling in Loper Bright Enterprises v. Raimondo , [59] providing that judicial review of an agency interpretation of a statute is “de novo,” on the ground that here the Board was not interpreting a statute but was “exercis[ing] discretion . . . granted by a statute,” which was governed by the Administrative Procedure Act’s highly deferential “arbitrary and capricious” standard of judicial review. [60] The meaning of “detailed” in NEPA’s requirement that an EIS be a “detailed statement” may be a question of law, the Court reasoned, but how much “detail” must be in a particular EIS is a question of fact to which judicial deference to the agency’s assessment is warranted. [61]",,0,html_body_unmatched
,,,,The Court also grounded its decision on its ruling that the lower “court incorrectly interpreted NEPA to require the Board to consider environmental effects of upstream and downstream projects that are separate in time or place from the Uinta Basin Railway.” [64] The agency need consider “only the effects of the 88-mile railroad line.” [65],,0,html_body_unmatched
,,,,"The practical impact on NEPA of the majority’s ruling is potentially enormous. Whether one thinks the Court was correct or incorrect on its legal ruling, it cannot be gainsaid that this is a sea change of what had long been settled NEPA law. To be sure, there had been lots of litigation of to what extent upstream and downstream consequences could be considered “reasonably foreseeable,” which all agreed was the governing legal touchstone. [70] And those debates had certainly intensified during the past decade when the issue extended to whether those upstream or downstream consequences extended to greenhouse gas emissions. [71] But no court, including the Supreme Court in any of its prior seventeen NEPA cases, had ever suggested that agencies basically had carte blanche to exclude all downstream and upstream effects in drawing “manageable” boundaries for what environmental effects an EIS must discuss.",,0,html_body_unmatched
,,,,"Nor is NEPA toothless if the federal agency chooses to ignore the teachings of their own EIS. True, their actions do not violate NEPA. But that is not the end of the story. They can be readily found to violate other statutory requirements that do have substantive bite on the agency’s decision, such as the federal Administrative Procedure Act. As has happened not infrequently, a court may strike down the federal agency action as arbitrary and capricious for failing to adequately consider the adverse environmental effects revealed, because of NEPA, in the administrative record before the agency. [75]",,0,html_body_unmatched
,,,,"Seven County as Number Six. With the Seven County case, environmentalists lost their sixth big case in only four years before the Court. [96] In 2022, in West Virginia v. EPA , [97] the Court effectively upheld President Trump’s repeal of the Clean Air Act’s Clean Power Plan, President Obama’s signature regulatory achievement for reducing greenhouse gases from the nation’s coal-fired power plants. [98] In 2023, in Sackett v. EPA , [99] the Court sharply cut back on the geographic reach of the Clean Water Act in a manner imperiling the federal government’s ability to protect the nation’s waterways from destructive pollution. [100]",,0,html_body_unmatched
,,,,"In Loper Bright , the Court upset a program designed by the National Marine Fisheries Service to ensure that fishing vessels complied with federally mandated fishing quotas. [109] Based on its many years of experience administering fishing quotas, the agency concluded that what was needed to meet those quotas was to mandate that the Atlantic herring fishery fund the costs for on-board observers to monitor for possible violations. [110] Yet, by overturning Chevron , the Court ruled that the validity of the monitoring program no longer turned on whether the expert agency’s judgment amounted to a reasonable construction of otherwise ambiguous governing statutory language. [111] A court’s own view of the “best” interpretation of that language should instead be controlling. [112]",,0,html_body_unmatched
