page_no,pdf_text,pdf_original_label,pdf_corrected_label,matched_html_body,matched_html_footnote,match_confidence,match_status
36,"Of  these  environmental  innovations,  none  has  been  more  significant than the massive  bipartisan effort to  motivate  the  development  and implementation of school security technology. Prior to the 1999 shooting at Columbine High School, most schools had relatively little formal security.",text,body_text,"Of these environmental innovations, none has been more significant than the massive bipartisan effort to motivate the development and implementation of school security technology. Prior to the 1999 shooting at Columbine High School, most schools had relatively little formal security. Few required staff to wear ID badges, and even fewer had security cameras. [217]",,97.75474956822107,matched
36,"213.  Buccafusco, supra note 45, at 958.",footnote,footnote,,". Buccafusco, supra note 45, at 958.",100.0,matched
36,214. Id. at 999-1000.,footnote,footnote,,. Id.,100.0,matched
36,"215.  Erica  Goode, Shots  Fired,  Pinpointed and Argued Over ,  N.Y. TIMES (May 28, 2012), https://www.nytimes.com/2012/05/29/us/shots-heard-pinpointed-and-argued-over.html [https:// perma.cc/58PT-MZK7].",footnote,footnote,,". Erica Goode, Shots Fired, Pinpointed and Argued Over , N.Y. Times (May 28, 2012), https://www.nytimes.com/2012/05/29/us/shots-heard-pinpointed-and-argued-over.html [https:// perma.cc/58PT-MZK7].",97.91666666666666,matched
36,"216. See Justin Agrelo, Chicago Trades One Controversial Gun Surveillance Technology for Another , TRACE (Oct. 10, 2024), https://www.thetrace.org/2024/10/chicago-transit-zeroeyes-gunshotspotter/ [https://perma.cc/P7TY-CZAB] ('As Chicago's ShotSpotter microphones shut down following years of controversy about the gunshot detection device, the Chicago Transit Authority is  trying  out  a  new  tool  designed  to  detect  the  presence  of  firearms-this  time,  through  video surveillance [provided by ZeroEyes].').",footnote,footnote,,. Id.,100.0,matched
37,"Few  required  staff  to  wear  ID  badges,  and  even  fewer  had  security cameras. 217",text,footnote,,. Id.,100.0,matched
37,"In  the  subsequent  quarter  century,  school  security  has  become  a $3 billion  industry. 218 Many schools  have  adopted  older  technologies  like metal detectors, but firms also offer more sophisticated options. 219 At a recent industry convention, firms touted the value of 'surveillance cameras with facial  recognition  capability,  automated  door  locks,  gunshot  detection sensors, and software that scans social media platforms in search of the next shooter.' 220 Other  firms  sell  bulletproof  glass,  doors,  and  even  dry  erase boards that children can hide behind or under if a shooter enters the building. For $5000 per month, a high school can purchase the services of ZeroEyes, which uses 200 cameras and machine learning to identify assault rifles on video  feeds. 221 Former  military  and  law  enforcement  personnel  review images  the  system  detects  and  notify  school  administrators  if  there  is  a weapon on campus. 222",text,footnote,,. Id.,100.0,matched
37,"Architects and builders have, at great cost, designed school campuses that are meant to prevent access by shooters and to minimize harm if they enter. The new Sandy Hook Elementary School building, which replaced the site  of  the  2012  shooting  of  twenty  students  and  six  staff  members,  cost $50 million  and  was  built  according  to  principles  of  'crime  prevention through  environmental  design,'  which  focus  on  detecting  and  deterring shooters through the layout of the building and other spaces, the materials used in construction, and the implementation of surveillance technologies throughout. 223 According  to  one of the school's designers, 'All the",text,body_text,"Architects and builders have, at great cost, designed school campuses that are meant to prevent access by shooters and to minimize harm if they enter. The new Sandy Hook Elementary School building, which replaced the site of the 2012 shooting of twenty students and six staff members, cost $50 million and was built according to principles of “crime prevention through environmental design,” which focus on detecting and deterring shooters through the layout of the building and other spaces, the materials used in construction, and the implementation of surveillance technologies throughout. [223] According to one of the school’s designers, “All the components of the school, from parking, walking, playing, now we have to think about how to make those things safer than you would if you didn’t have the societal issues we have.” [224]",,97.52066115702479,matched
37,"217. See Alex Yablon, We Already Turned Schools into Fortresses: Kids Are Dying Anyway , CURBED (May 27, 2022), https://www.curbed.com/2022/05/school-hardening-industry-fails-texasuvalde.html [https://perma.cc/WG83-9S4C] ('Before Columbine, school security focused more on preventing petty vandalism and drug use.').",footnote,footnote,,. Id.,100.0,matched
37,"218.  Charlotte Morabito, The School Security Industry Is Valued at $3.1 Billion. Here's Why That May Not Be Enough , CNBC (July 6, 2022, 12:46 PM), https://www.cnbc.com/2022/07/06/theschool-security-industry-was-valued-at-3point1-billion-in-2021.html [https://perma.cc/RWW3ER3E].",footnote,footnote,,". Charlotte Morabito, The School Security Industry Is Valued at $3.1 Billion. Here’s Why That May Not Be Enough , CNBC (July 6, 2022, 12:46 PM), https://www.cnbc.com/2022/07/06/the-school-security-industry-was-valued-at-3point1-billion-in-2021.html [https://perma.cc/RWW3-ER3E].",99.63369963369964,matched
37,"219. See Emily Baumgaertner & Alex Kalman, Bulletproofing America's Classrooms ,  N.Y. TIMES (Sept. 18, 2024),  https://www.nytimes.com/interactive/2024/09/18/science/bulletproofingschools.html [https://perma.cc/MC8J-XTL9] (describing bulletproof hoodies, clipboards, backpack inserts, binders, and more).",footnote,footnote,,". See Emily Baumgaertner & Alex Kalman, Bulletproofing America’s Classrooms , N.Y. Times (Sept. 18, 2024), https://www.nytimes.com/interactive/2024/09/18/science/bulletproofing-schools.html [https://perma.cc/MC8J-XTL9] (describing bulletproof hoodies, clipboards, backpack inserts, binders, and more).",99.32659932659934,matched
37,"220.  Mark Keierleber, School-Security Companies Are Thriving in the Era of Mass Shootings , ATLANTIC (Aug. 9, 2018), https://www.theatlantic.com/education/archive/2018/08/school-security -mass-shootings/567080/ [https://perma.cc/99N9-VASP].",footnote,footnote,,". Mark Keierleber, School-Security Companies Are Thriving in the Era of Mass Shootings , Atlantic ( Aug. 9, 2018), https://www.theatlantic.com/education/archive/2018/08/school-security -mass-shootings/567080/ [https://perma.cc/99N9-VASP].",99.78586723768737,matched
37,"221.  Natasha Singer, Schools Are Spending Billions on High-Tech Defense for Mass Shootings , N.Y. TIMES (June 22, 2023), https://www.nytimes.com/2022/06/26/business/school-safetytechnology.html [https://perma.cc/5P64-P77J].",footnote,footnote,,". Natasha Singer, Schools Are Spending Billions on High-Tech Defense for Mass Shootings , N.Y. Times (June 22, 2023), https://www.nytimes.com/2022/06/26/business/school-safety-technology.html [https://perma.cc/5P64-P77J].",99.76905311778292,matched
37,222. Id.,footnote,footnote,,. Id.,100.0,matched
37,"223.  Tim Newcomb, After Sandy Hook Massacre, Designing Schools for Safety , 74 MILLION (Nov. 6, 2017), https://www.the74million.org/article/after-sandy-hook-massacre-designing-",footnote,footnote,,". Tim Newcomb, After Sandy Hook Massacre, Designing Schools for Safety , 74 Million (Nov. 6, 2017), https://www.the74million.org/article/after-sandy-hook-massacre-designing-schools-for-safety/ [https://perma.cc/W442-FZH9]; Crime Prevention Through Environmental Design (CPTED) School Assessment , U.S. Dep’t of Health & Hum. Servs. , https://www .schoolsafety.gov/resource/crime-prevention-through-environmental-design-cpted-school-assessment [https://perma.cc/BWW7-5KWW].",98.26589595375722,matched
38,"components of the school, from parking, walking, playing, now we have to think about how to make those things safer than you would if you didn't have the societal issues we have.' 224",text,footnote,,. Id.,100.0,matched
38,"School violence is  enormously salient,  and efforts  to  harden  schools appeal to voters across the political spectrum, 225 so it is perhaps unsurprising that federal, state, and local governments have provided more than $1 billion in tax dollars for these innovations. 226  For example, between 2021 and 2022, Florida approved more than $60 million for its School Hardening Program, with eligible expenditures including bullet-resistant glass, metal detectors, security cameras, and steel doors. 227 In  2023,  Georgia  allocated  a  total  of $115 million for $50,000 school safety grants for every K-12 school in the state. 228 Georgia's  school  safety  law  directs  the  government  to  provide funding  for  school  safety  improvements  and  initiatives,  including  'the installation  of  safety  equipment,  including,  but  not  limited  to,  video surveillance  cameras,  metal  detectors,  alarms,  communications  systems, building access controls, and other similar security devices.' 229   New York and Massachusetts have also allocated funding for video surveillance and other high-tech security features. 230",text,footnote,,. Id.,100.0,matched
38,"The STOP School Violence Act of 2018 made $350 million available for  new  school  security  measures,  including  the  kinds  of  innovations discussed above. 231 It  also  redirected  the  entire  $75  million  budget  of  the Comprehensive School Safety Initiative, a federal grant program that was",text,body_text,"The STOP School Violence Act of 2018 made $350 million available for new school security measures, including the kinds of innovations discussed above. [231] It also redirected the entire $75 million budget of the Comprehensive School Safety Initiative, a federal grant program that was created after the Sandy Hook massacre, to this cause. [232] While the earlier program funded a wide variety of programs related to school safety, including those dedicated to school police, bullying prevention, and comprehensive safety plans, the new legislation does not emphasize research and evaluation and has a narrower list of acceptable funding priorities. [233] Research-based programs have now been replaced with commitments to spend tax dollars on school hardening technology, most of which has no empirical support.",,96.58703071672356,matched
38,"schools-for-safety/  [https://perma.cc/W442-FZH9]; Crime  Prevention  Through  Environmental Design  (CPTED)  School  Assessment ,  U.S.  DEP'T  OF  HEALTH  &  HUM.  SERVS.,  https://www .schoolsafety.gov/resource/crime-prevention-through-environmental-design-cpted-schoolassessment [https://perma.cc/BWW7-5KWW].",footnote,footnote,,". Tim Newcomb, After Sandy Hook Massacre, Designing Schools for Safety , 74 Million (Nov. 6, 2017), https://www.the74million.org/article/after-sandy-hook-massacre-designing-schools-for-safety/ [https://perma.cc/W442-FZH9]; Crime Prevention Through Environmental Design (CPTED) School Assessment , U.S. Dep’t of Health & Hum. Servs. , https://www .schoolsafety.gov/resource/crime-prevention-through-environmental-design-cpted-school-assessment [https://perma.cc/BWW7-5KWW].",97.52883031301482,matched
38,"224.  Newcomb, supra note 223.",footnote,footnote,,". Newcomb, supra note 223.",100.0,matched
38,"225.  Gabriel R. Sanchez & Carly Bennett, Voters Want Congress to Address Gun Violence and Mass  Shootings ,  BROOKINGS  (Jan.  23,  2023),  https://www.brookings.edu/articles/voters-wantcongress-to-address-gun-violence-and-mass-shootings/ [https://perma.cc/EA2P-MD3Y].",footnote,footnote,,". Gabriel R. Sanchez & Carly Bennett, Voters Want Congress to Address Gun Violence and Mass Shootings , Brookings (Jan. 23, 2023), https://www.brookings.edu/articles/voters-want-congress-to-address-gun-violence-and-mass-shootings/ [https://perma.cc/EA2P-MD3Y].",97.65625,matched
38,"226.  Mark  Keierleber, Inside  the  $3  Billion  School  Security  Industry:  Companies  Market Sophisticated Technology to 'Harden' Campuses, But Will It Make Us Safe? , 74 MILLION (Aug. 9, 2018), https://www.the74million.org/article/inside-the-3-billion-school-security-industrycompanies-market-sophisticated-technology-to-harden-campuses-but-will-it-make-us-safe/ [https://perma.cc/KG8K-LYK4].",footnote,footnote,,. Id.,100.0,matched
38,"227.  2022 FLA. LAWS 1055, 1088; see also Memorandum from Timothy Hay, Fla. Dep't of Educ.  on  School  Hardening  Grant  2  (Oct.  15,  2022),  https://info.fldoe.org/docushare/dsweb /Get/Document-9341/dps-2021-108.pdf [https://perma.cc/XL5S-J2EN] (describing the 2021 school hardening budget and eligible expenditures).",footnote,footnote,,". 2022 Fla. Laws 1055, 1088; see also Memorandum from Timothy Hay, Fla. Dep’t of Educ. on School Hardening Grant 2 (Oct. 15, 2022), https://info.fldoe.org/docushare/dsweb /Get/Document-9341/dps-2021-108.pdf [https://perma.cc/XL5S-J2EN] (describing the 2021 school hardening budget and eligible expenditures).",97.03947368421053,matched
38,228.  2023 Ga. Laws 40.,text,footnote,,. 2023 Ga. Laws 40.,100.0,matched
38,229.  GA. CODE ANN. § 20-2-1185(b) (2023).,text,footnote,,. Ga. Code Ann. § 20-2-1185(b) (2023).,100.0,matched
38,"230.  N.Y.  EDUC.  LAW  § 3641(16)(a)(8)  (McKinney  2024); Healey-Driscoll  Administration Awards  Nearly  $3  Million  to  Improve  Public  School  Security ,  MASS.GOV  (July  11,  2023), https://www.mass.gov/news/healey-driscoll-administration-awards-nearly-3-million-to-improvepublic-school-security [https://perma.cc/SZB8-8SUN].",footnote,footnote,,". N.Y. Educ. Law § 3641(16)(a)(8) (McKinney 2024); Healey-Driscoll Administration Awards Nearly $3 Million to Improve Public School Security , Mass.gov (July 11, 2023), https://www.mass.gov/news/healey-driscoll-administration-awards-nearly-3-million-to-improve-public-school-security [https://perma.cc/SZB8-8SUN].",95.14563106796116,matched
38,"231.  Student,  Teachers,  and  Officers  Preventing  School  Violence  Act  of  2018,  34  U.S.C. §§ 10551-10556.",footnote,footnote,,". Student, Teachers, and Officers Preventing School Violence Act of 2018, 34 U.S.C. §§ 10551–10556.",89.58333333333334,matched
39,"created after the Sandy Hook massacre, to this cause. 232 While the earlier program  funded  a  wide  variety  of  programs  related  to  school  safety, including those dedicated to school police, bullying prevention, and comprehensive safety plans, the new legislation does not emphasize research and evaluation and has a narrower list of acceptable funding priorities. 233 Research-based  programs  have  now  been  replaced  with  commitments  to spend tax  dollars  on  school  hardening  technology,  most  of  which  has  no empirical support.",text,footnote,,. Id.,100.0,matched
39,"Government spending on school safety technologies is a demand side incentive  for  innovation-it  affects  consumers'  willingness  and  ability  to pay. 234 However  much  schools  would  have  been  willing  to  pay  for surveillance cameras with facial recognition or gunshot detection sensors, in the  absence  of  the  subsidy,  many  likely  could  not  have  afforded  them, especially given the many other demands on their limited funding. Once the school system has the money, though, it can purchase new school security innovations. Moreover, some  school safety laws require schools to implement  various  safety  measures, 235 generating  demand  for  new  safety technology.",text,footnote,,. Id.,100.0,matched
39,"Firms, seeing massive increases in ability and willingness to pay, now enter the market. Some of those firms will seek to develop new technology for  which  there  was  previously  insufficient  demand,  such  as  gunshot detection sensors. Other firms may instead seek innovations like bulletproof doors that lower the cost of safety technology, because schools will try to comply  with  their  obligations  as  cheaply  as  possible.  In  either  case,  the existence of the government subsidy increases demand for safety innovations, which thereby increases their supply.",text,footnote,,. Id.,100.0,matched
39,"232.  Evie  Blad, Federal  School  Safety  Research  Eliminated  to  Fund  New  School  Security Measures ,  ED  WEEK (Mar. 27, 2018), https://www.edweek.org/leadership/federal-school-safetyresearch-eliminated-to-fund-new-school-security-measures/2018/03 [https://perma.cc/R2Q3PABG].",footnote,footnote,,". Evie Blad, Federal School Safety Research Eliminated to Fund New School Security Measures , Ed Week (Mar. 27, 2018), https://www.edweek.org/leadership/federal-school-safety-research-eliminated-to-fund-new-school-security-measures/2018/03 [https://perma.cc/R2Q3-PABG].",95.84905660377359,matched
39,233. Id.,footnote,footnote,,. Id.,100.0,matched
39,"234. See Buccafusco, supra note 45, at 954-55 (discussing the difference between demand side and supply side innovation incentives); see also Rebecca S. Eisenberg & W. Nicholson Price II, Promoting  Healthcare  Innovation  on  the  Demand  Side ,  4  J.  L.  &  BIOSCIENCES  3,  5  (2017) (describing the demand side benefits of health innovation); Rachel E. Sachs, Prizing Insurance: Prescription  Drug  Insurance as  Innovation  Incentive ,  30  HARV. J.L. & TECH . 153,  169  (2016) (discussing how perception of risk affects individual valuation of medical innovations); Mark A. Lemley, Lisa Larrimore Ouellette & Rachel E. Sachs, The Medicare Innovation Subsidy , 95 N.Y.U. L.  Rev.  75,  78  (2020)  (describing  the  effect  of  the  Medicare  innovation  incentive  on  the pharmaceutical market).",footnote,footnote,,. Id.,100.0,matched
39,"235. See,  e.g. ,  Alyssa's  Law,  2019  N.J.  Laws  153  (requiring  schools  in  New  Jersey  to implement  silent  panic  alarm  systems).  Similar  legislation  mandating  silent  alarm  systems  in schools has been enacted in Florida, New York, Texas, Tennessee, Utah, and Oklahoma. ALYSSA'S LAW, https://alyssas-law.com/#:~:text=Alyssa's%20Law%20is%20legislation%20to,that%20 directly%20notify%20law%20enforcement [https://perma.cc/QM92-4BNY].",footnote,footnote,,. Id.,100.0,matched
40,"The effectiveness of these innovations in improving the physical safety of  students-or  for  that  matter  even  their  sense  of  safety-is  deeply contested. Clearly they are popular with many relevant decisionmakers, and seem to have been effective in some well-reported incidents. 236 And yet one recent study of metal detectors, surveillance cameras, and security officers 'found no evidence that any pattern of visible security measure utilization was consistently associated with reduced exposure to crime or violence at school.' 237 School hardening might in fact undermine important relationships between  students  and  faculty,  thereby  increasing  the  risk  of  violence. According to scholars, 'A hardened environment frames children and youth not as learners but as potential threats to be policed, controlled, and, in some sense, feared.' 238",text,footnote,,. Id.,100.0,matched
40,"Our goal is not to endorse any particular form of environmental safety technology  but  to  highlight  the  market  and  legal  forces  that  shape  their adoption and how those forces differ from those at play with regard to the gun-level innovations described above. There, patents, government mandates, and federal grants played the leading roles in setting incentives. For  example,  smart  gun  technologies  are  covered  by  patents,  and  those products are likely to cost more simply because the patent allows charging supracompetitive prices. If microstamping were required, 239 gun manufacturers  would  have  to  redesign  firearms  to  accommodate  the technology, increasing their cost. Of course, these are precisely the reasons why some gun owners and lobbyists object to gun-level safety requirements. 240",text,body_text,"Our goal is not to endorse any particular form of environmental safety technology but to highlight the market and legal forces that shape their adoption and how those forces differ from those at play with regard to the gun-level innovations described above. There, patents, government mandates, and federal grants played the leading roles in setting incentives. For example, smart gun technologies are covered by patents, and those products are likely to cost more simply because the patent allows charging supracompetitive prices. If microstamping were required, [239] gun manufacturers would have to redesign firearms to accommodate the technology, increasing their cost. Of course, these are precisely the reasons why some gun owners and lobbyists object to gun-level safety requirements. [240]",,96.35678391959799,matched
40,"By contrast, the market for environmental safety innovations like those in schools is driven by different decisionmakers and a different cost-benefit analysis. Unlike patents, where the size and direction of the incentive are determined by consumers and markets, the value of demand side incentives depends  on  whether  the  government  is  making  good  decisions  about  its spending. And just as the former might not lead to optimal public safety, so too  with  the  latter.  In  other  innovation  contexts,  research  has  shown  that",text,footnote,,. Id.,100.0,matched
40,"236.  Melissa Chan, New Panic Alarm System at Georgia H.S. Saved Lives During Shooting, Officials Say. Advocates Want It Nationwide. , NBC  NEWS  (Sept.  5, 2024, 2:31 PM), https://www.nbcnews.com/news/us-news/new-panic-alarm-system-georgia-high-school-savedlives-shooting-offici-rcna169754 [https://perma.cc/4EYU-VK77].",footnote,footnote,,. Id.,100.0,matched
40,"237.  Emily E. Tanner-Smith, Benjamin W. Fisher, Lynn A. Addington & Joseph H. Gardelia, Adding  Security,  but  Subtracting  Safety?  Exploring  Schools'  Use  of  Multiple  Visible  Security Measures , 43 AM. J. CRIM. JUST. 102, 113 (2017).",footnote,footnote,,". Emily E. Tanner-Smith, Benjamin W. Fisher, Lynn A. Addington & Joseph H. Gardelia, Adding Security, but Subtracting Safety? Exploring Schools’ Use of Multiple Visible Security Measures , 43 Am. J. Crim. Just. 102, 113 (2017).",95.06726457399103,matched
40,"238.  Bryan R. Warnick & Ryan Kapa, Protecting Students from Gun Violence , 19 EDUC. NEXT 23, 26 (2019).",footnote,footnote,,". Bryan R. Warnick & Ryan Kapa, Protecting Students from Gun Violence , 19 Educ. Next 23, 26 (2019).",100.0,matched
40,239. See infra notes 288-291 and accompanying text.,footnote,footnote,,. See infra notes 288–291 and accompanying text.,100.0,matched
40,"240.  Miniter, supra note  208  (quoting  a  gun  industry  lobbyist  as  saying  'most  firearms manufacturers have been reluctant to invest R&D dollars in smart-gun technology because guncontrol advocates want to make the technology mandatory. If that happens, new guns will become prohibitively expensive, which is part of what these groups want').",footnote,footnote,,". Miniter, supra note 208 (quoting a gun industry lobbyist as saying “most firearms manufacturers have been reluctant to invest R&D dollars in smart-gun technology because gun-control advocates want to make the technology mandatory. If that happens, new guns will become prohibitively expensive, which is part of what these groups want”).",96.996996996997,matched
41,"intermediaries can distort innovation incentives in inefficient directions. In the pharmaceutical context, doctors and insurance companies make decisions about which drugs patients take and how much they pay for them, 241 and their goals may not be well-aligned with patient welfare.",text,body_text,"By contrast, the market for environmental safety innovations like those in schools is driven by different decisionmakers and a different cost-benefit analysis. Unlike patents, where the size and direction of the incentive are determined by consumers and markets, the value of demand side incentives depends on whether the government is making good decisions about its spending. And just as the former might not lead to optimal public safety, so too with the latter. In other innovation contexts, research has shown that intermediaries can distort innovation incentives in inefficient directions. In the pharmaceutical context, doctors and insurance companies make decisions about which drugs patients take and how much they pay for them, [241] and their goals may not be well-aligned with patient welfare.",,99.29078014184397,matched
41,"It is also worth considering who pays for school security innovations. In many innovation contexts, where patents play the primary incentive role, consumers  of  new  technology  pay  for  the  incentive  via  higher  prices  for patented  goods. 242 Patents  act  as  a  shadow  tax  on consumers of  new innovations. 243 In  other  contexts, such as those supported by grants or tax incentives, the public foots the bill. 244 That is what is happening with school security. Legislative requirements spend taxpayer money on ballistic doors, facial recognition cameras, and gunshot detection systems.",text,footnote,,. Id.,100.0,matched
