page_no,pdf_text,pdf_original_label,pdf_corrected_label,matched_html_body,matched_html_footnote,match_confidence,match_status
1,ADRIAN VERMEULE,section_header,footnote,,"Adrian Vermeule is the Ralph S. Tyler, Jr. Professor of Constitutional Law at Harvard Law School.",100.0,matched
1,THE OLD REGIME AND THE LOPER BRIGHT ' REVOLUTION ',section_header,body_text,"But it is already possible to see how Loper Bright both grew out of pre-existing legal doctrines, principles, and trends, and also to see how the chastening of the Loper Bright revolution could occur, leaving in place much of the old Chevron regime under different labels. Indeed, I will argue, the beginning of that process is already visible within the four corners of the majority opinion itself. Writing for the Court, its leading Girondin or moderate revolutionary, the Chief Justice, already attempts to temper the Loper Bright revolution, writing a roadmap for a broad recharacterization of “ Chevron deference” as “ Loper Bright delegation.” 10 In some potentially broad range of the cases that would previously have been covered by the Chevron doctrine, courts will now say that Congress has explicitly or implicitly delegated discretionary policymaking authority to the agencies. In this framework, much of the review of the outer bounds of agency discretion that previously took place under the Chevron label will take place under the label of arbitrary-and-capricious review, but it is at best unclear how much will change in any operative sense, especially given that Chevron and arbitrariness review have long been held to overlap in part. 11 Furthermore, even apart from delegation, the Chief Justice’s opinion for the Court leaves in place a robust Skidmore doctrine of “respect” for persuasive agency interpretations; 12 it also backhandedly confirms the idea associated with NLRB v. Hearst Publications, Inc. that courts owe agencies a form of deference as to “mixed questions,” or the application of legal standards to facts, which is a form of policymaking discretion. 13 It is difficult, at least in the abstract, to identify with certainty any clear category of cases that will come out differently under the new regime than under the old one.",,75.0,matched
1,"On June 28, 2024, the Supreme Court decided Loper Bright Enterprises v. Raimondo and Relentless, Inc. v. Department of Commerce , 1 companion cases presenting the same question: whether Chevron, U.S.A., Inc. v. Natural Resources Defense Council, Inc. 2 should be overruled. The Court said ' yes, ' and did overrule Chevron . 3 Anumber of popular articles and legal commentators immediately called the decision ' revolutionary ' 4 or, in a variant, the culmination of a ' conservative counterrevolution ' 5 against the administrative state. Others",text,body_text,"On June 28, 2024, the Supreme Court decided Loper Bright Enterprises v. Raimondo and Relentless, Inc. v. Department of Commerce , 1 companion cases presenting the same question: whether Chevron, U.S.A., Inc. v. Natural Resources Defense Council, Inc. 2 should be overruled. The Court said “yes,” and did overrule Chevron . 3 A number of popular articles and legal commentators immediately called the decision “revolutionary” 4 or, in a variant, the culmination of a “conservative counterrevolution” 5 against the administrative state. Others insisted that the central “grand narrative” of administrative law has now become, for better or for worse, the narrative propounded by libertarian and originalist critics of the administrative state. 6",,99.35602575896965,matched
1,"Adrian Vermeule is the Ralph S. Tyler, Jr. Professor of Constitutional Law at Harvard Law School.",footnote,footnote,,"Adrian Vermeule is the Ralph S. Tyler, Jr. Professor of Constitutional Law at Harvard Law School.",100.0,matched
1,Author ' s note: Thanks to Sam Delmer for excellent research assistance and to multiple colleagues and friends for extensive discussion of these issues.,footnote,footnote,,Author’s note: Thanks to Sam Delmer for excellent research assistance and to multiple colleagues and friends for extensive discussion of these issues.,98.65771812080537,matched
1,1 144 S. Ct. 2244 (2024).,footnote,footnote,,1 144 S. Ct. 2244 (2024).,100.0,matched
1,2 467 U.S. 837 (1984).,footnote,footnote,,2 467 U.S. 837 (1984).,100.0,matched
1,"3 Loper Bright , 144 S. Ct. at 2273.",footnote,footnote,,"3 Loper Bright , 144 S. Ct. at 2273.",100.0,matched
1,"4 See, e.g. , Adeola Adeosun, Neil Gorsuch Leading ' Revolution ' in Supreme Court Ruling , Newsweek ( June 30, 2024, 6:19 PM EDT), https://www.newsweek.com/neil-gorsuch-lead ing-revolution-supreme-court-ruling-shan-wu-1919288; Squire Patton Boggs, The 2024 Revolution in Administrative Law : Chevron and Beyond , YouTube ( July 19, 2024), https://www.you tube.com/watch?v p XiR8ytgeBYY. For a large collection of varying initial responses to the decision ranging from skeptical to dramatic, see generally Cary Coglianese & Daniel E. Walters, The Great Unsettling: Administrative Governance After Loper Bright, 77 Admin. L. Rev. 1 (2025).",footnote,footnote,,"4 See, e.g. , Adeola Adeosun, Neil Gorsuch Leading ‘Revolution’ in Supreme Court Ruling , Newsweek (June 30, 2024, 6:19 PM EDT), https://www.newsweek.com/neil-gorsuch-leading-revolution-supreme-court-ruling-shan-wu-1919288 ; Squire Patton Boggs, The 2024 Revolution in Administrative Law : Chevron and Beyond , YouTube (July 19, 2024), https://www.youtube.com/watch?v=XiR8ytgeBYY . For a large collection of varying initial responses to the decision ranging from skeptical to dramatic, see generally Cary Coglianese & Daniel E. Walters, The Great Unsettling: Administrative Governance After Loper Bright, 77 Admin. L. Rev. 1 (2025).",98.73015873015873,matched
1,"5 See David L. Franklin, This Supreme Court Has Betrayed Antonin Scalia ' s Legacy , Slate ( June 28, 2024, 4:36 PM), https://slate.com/news-and-politics/2024/06/supreme-court-opinions-antonin",footnote,footnote,,"5 See David L. Franklin, This Supreme Court Has Betrayed Antonin Scalia’s Legacy , Slate (June 28, 2024, 4:36 PM), https://slate.com/news-and-politics/2024/06/supreme-court-opinions-antonin-scalia-betrayal.html (describing Loper Bright both as part of a “conservative counterrevolution” and as a “revolution” that betrays the legacy of Justice Antonin Scalia as a proponent of Chevron ).",99.21259842519686,matched
1,"The Supreme Court Review , 2025. q 2025 The University of Chicago. All rights reserved. Published by The University of Chicago Press. https://doi.org/10.1086/735545",footnote,body_text,© 2025 The University of Chicago. All rights reserved.,,100.0,matched
2,"insisted that the central ' grand narrative ' of administrative law has now become, for better or for worse, the narrative propounded by libertarian and originalist critics of the administrative state. 6",text,body_text,"On June 28, 2024, the Supreme Court decided Loper Bright Enterprises v. Raimondo and Relentless, Inc. v. Department of Commerce , 1 companion cases presenting the same question: whether Chevron, U.S.A., Inc. v. Natural Resources Defense Council, Inc. 2 should be overruled. The Court said “yes,” and did overrule Chevron . 3 A number of popular articles and legal commentators immediately called the decision “revolutionary” 4 or, in a variant, the culmination of a “conservative counterrevolution” 5 against the administrative state. Others insisted that the central “grand narrative” of administrative law has now become, for better or for worse, the narrative propounded by libertarian and originalist critics of the administrative state. 6",,99.5049504950495,matched
2,"My own immediate reaction, published the day the decision came down, was different and more skeptical: Loper Bright , it seemed to me, was in large part a relabeling of Chevron deference as delegated agency discretion, rather than a dramatic change in the law. 7 I will expand on that view here, update it in light of later developments, and put it in a larger frame, offering a more general thesis -if you like, a different ' grand narrative ' -about Loper Bright , and about the broader libertarian and originalist attempt to curtail the administrative state through expanded judicial review of agency action.",text,body_text,"My own immediate reaction, published the day the decision came down, was different and more skeptical: Loper Bright , it seemed to me, was in large part a relabeling of Chevron deference as delegated agency discretion, rather than a dramatic change in the law. 7 I will expand on that view here, update it in light of later developments, and put it in a larger frame, offering a more general thesis—if you like, a different “grand narrative”—about Loper Bright , and about the broader libertarian and originalist attempt to curtail the administrative state through expanded judicial review of agency action.",,99.33993399339934,matched
2,"The thesis runs this way. A commonplace of revolutions, and counterrevolutions, is that however dramatic they may be in the short run, in the long run they often produce less change than their proponents hope and their opponents fear. Sometimes revolutions or counterrevolutions even serve to cement into place, or indeed augment, the very structures and norms that the revolutionaries found most objectionable. Such a thesis was suggested as to the most dramatic upheaval of them all: the French Revolution of 1789. In The Ancien Régime and the French Revolution , 8 written in 1856 after a long series of revolutions and counterrevolutions of varying description, Alexis de Tocqueville argued not only that the Revolution was as much an outgrowth of earlier laws, institutions, and norms as a departure",text,body_text,"The thesis runs this way. A commonplace of revolutions, and counterrevolutions, is that however dramatic they may be in the short run, in the long run they often produce less change than their proponents hope and their opponents fear. Sometimes revolutions or counterrevolutions even serve to cement into place, or indeed augment, the very structures and norms that the revolutionaries found most objectionable. Such a thesis was suggested as to the most dramatic upheaval of them all: the French Revolution of 1789. In The Ancien Régime and the French Revolution , 8 written in 1856 after a long series of revolutions and counterrevolutions of varying description, Alexis de Tocqueville argued not only that the Revolution was as much an outgrowth of earlier laws, institutions, and norms as a departure from them, but also that those laws, institutions and norms largely survived the Revolution; indeed, they were in a sense confirmed and strengthened by it, albeit clothed in new outward forms. For Tocqueville, the Revolution had “a first phase during which the French seemed to want to abolish everything from their past, and a second in which they would recover part of what they had left behind. Many of the laws and political traditions of the Ancien Régime suddenly disappeared in 1789 only to reappear a few years later, much as certain rivers plunge underground only to reemerge somewhat farther on, bringing the same waters to new shores.” 9",,100.0,matched
2,-scalia-betrayal.html (describing Loper Bright both as part of a ' conservative counterrevolution ' and as a ' revolution ' that betrays the legacy of Justice Antonin Scalia as a proponent of Chevron ).,footnote,footnote,,"5 See David L. Franklin, This Supreme Court Has Betrayed Antonin Scalia’s Legacy , Slate (June 28, 2024, 4:36 PM), https://slate.com/news-and-politics/2024/06/supreme-court-opinions-antonin-scalia-betrayal.html (describing Loper Bright both as part of a “conservative counterrevolution” and as a “revolution” that betrays the legacy of Justice Antonin Scalia as a proponent of Chevron ).",98.9795918367347,matched
2,"6 See Cass R. Sunstein, Administrative Law ' s Grand Narrative (Harvard Pub. L. Working Paper No. 24-21, 2024), https://ssrn.com/abstract p 4986085 [hereinafter Sunstein, Administrative Law ' s Grand Narrative ]; see also Cass R. Sunstein, The Consequences of Loper Bright 13 (Harvard Pub. L. Working Paper No. 24-29, 2024), https://ssrn.com/abstract p 4881501 ( ' Loper Bright is a leading exhibit in the rise (and rise) of libertarian administrative law. . . . ' ).",footnote,footnote,,"6 See Cass R. Sunstein, Administrative Law’s Grand Narrative (Harvard Pub. L. Working Paper No. 24-21, 2024), https://ssrn.com/abstract=4986085 [hereinafter Sunstein, Administrative Law’s Grand Narrative ]; see also Cass R. Sunstein, The Consequences of Loper Bright 13 (Harvard Pub. L. Working Paper No. 24-29, 2024), https://ssrn.com/abstract=4881501 (“ Loper Bright is a leading exhibit in the rise (and rise) of libertarian administrative law… .”).",97.98206278026906,matched
2,"7 See Adrian Vermeule, Chevron by Any Other Name: From ' Chevron Deference ' to ' Loper Bright Delegation, ' New Dig. ( June 28, 2024), https://thenewdigest.substack.com/p/chevron -by-any-other-name. For a similarly skeptical view, although one focused on Skidmore deference rather than delegation, see Jonathan H. Adler, From Deference to Respect -The Real Import of Loper Bright, Reason ( July 3, 2024, 1:36 PM), https://reason.com/volokh/2024/07 /03/from-deference-to-respect-the-real-import-of-loper-bright. And for some suggestive remarks of Justice Kavanaugh along similar lines, see infra note 51 and accompanying text. For a piece that propounds essentially the same thesis on Loper Bright delegation as Vermeule, supra , see Thomas W. Merrill, Case Comment, The Demise of Deference -and the Rise of Delegation to Interpret? , 138 Harv. L. Rev. 227 (2024).",footnote,footnote,,"7 See Adrian Vermeule, Chevron by Any Other Name: From ‘Chevron Deference’ to ‘Loper Bright Delegation,’ New Dig. (June 28, 2024), https://thenewdigest.substack.com/p/chevron-by-any-other-name . For a similarly skeptical view, although one focused on Skidmore deference rather than delegation, see Jonathan H. Adler, From Deference to Respect – The Real Import of Loper Bright, Reason (July 3, 2024, 1:36 PM), https://reason.com/volokh/2024/07/03/from-deference-to-respect-the-real-import-of-loper-bright . And for some suggestive remarks of Justice Kavanaugh along similar lines, see infra note 51 and accompanying text. For a piece that propounds essentially the same thesis on Loper Bright delegation as Vermeule, supra , see Thomas W. Merrill, Case Comment, The Demise of Deference—and the Rise of Delegation to Interpret? , 138 Harv. L. Rev. 227 (2024).",98.94859813084112,matched
2,"8 Alexis de Tocqueville, The Ancien Régime and the French Revolution (Arthur Goldhammer trans., Cambridge Univ. Press 2011) (1856).",footnote,footnote,,"8 Alexis de Tocqueville, The Ancien Régime and the French Revolution (Arthur Goldhammer trans., Cambridge Univ. Press 2011) (1856).",100.0,matched
3,"from them, but also that those laws, institutions and norms largely survived the Revolution; indeed, they were in a sense con /uniFB01 rmed and strengthened by it, albeit clothed in new outward forms. For Tocqueville, the Revolution had ' a /uniFB01 rst phase during which the French seemed to want to abolish everything from their past, and a second in which they would recover part of what they had left behind. Many of the laws and political traditions of the Ancien Régime suddenly disappeared in 1789 only to reappear a few years later, much as certain rivers plunge underground only to reemerge somewhat farther on, bringing the same waters to new shores. ' 9",text,body_text,"The thesis runs this way. A commonplace of revolutions, and counterrevolutions, is that however dramatic they may be in the short run, in the long run they often produce less change than their proponents hope and their opponents fear. Sometimes revolutions or counterrevolutions even serve to cement into place, or indeed augment, the very structures and norms that the revolutionaries found most objectionable. Such a thesis was suggested as to the most dramatic upheaval of them all: the French Revolution of 1789. In The Ancien Régime and the French Revolution , 8 written in 1856 after a long series of revolutions and counterrevolutions of varying description, Alexis de Tocqueville argued not only that the Revolution was as much an outgrowth of earlier laws, institutions, and norms as a departure from them, but also that those laws, institutions and norms largely survived the Revolution; indeed, they were in a sense confirmed and strengthened by it, albeit clothed in new outward forms. For Tocqueville, the Revolution had “a first phase during which the French seemed to want to abolish everything from their past, and a second in which they would recover part of what they had left behind. Many of the laws and political traditions of the Ancien Régime suddenly disappeared in 1789 only to reappear a few years later, much as certain rivers plunge underground only to reemerge somewhat farther on, bringing the same waters to new shores.” 9",,98.4006092916984,matched
3,"In what follows, I will suggest the possibility of a similar thesis, of course on a much smaller scale, as to the Loper Bright ' revolution ' and indeed the administrative law ' revolution ' more generally. (This point is equally relevant for those who describe Loper Bright as a counterrevolution against the administrative state; counterrevolutions also chronically promise more than they deliver, as the supporters of the Bourbon Restoration discovered after 1815.) There is a difference to be noted right away: In the case of Loper Bright , in contrast to the French Revolution, we do not yet have the advantage of time and hence of hindsight. We are still in the /uniFB01 rst of Tocqueville ' s two phases, in which revolutionaries hope and believe that the old regime of absolutism can be entirely extirpated. For the Court ' s radical critics of the administrative state, such as Justices Gorsuch and Thomas, we are in the bright dawn of the Year Zero, which is also (as the French revolutionaries themselves hoped) a restoration of the classical republic.",text,body_text,"In what follows, I will suggest the possibility of a similar thesis, of course on a much smaller scale, as to the Loper Bright “revolution” and indeed the administrative law “revolution” more generally. (This point is equally relevant for those who describe Loper Bright as a counterrevolution against the administrative state; counterrevolutions also chronically promise more than they deliver, as the supporters of the Bourbon Restoration discovered after 1815.) There is a difference to be noted right away: In the case of Loper Bright , in contrast to the French Revolution, we do not yet have the advantage of time and hence of hindsight. We are still in the first of Tocqueville’s two phases, in which revolutionaries hope and believe that the old regime of absolutism can be entirely extirpated. For the Court’s radical critics of the administrative state, such as Justices Gorsuch and Thomas, we are in the bright dawn of the Year Zero, which is also (as the French revolutionaries themselves hoped) a restoration of the classical republic.",,98.47182425978987,matched
3,"But it is already possible to see how Loper Bright both grew out of pre-existing legal doctrines, principles, and trends, and also to see how the chastening of the Loper Bright revolution could occur, leaving in place much of the old Chevron regime under different labels. Indeed, I will argue, the beginning of that process is already visible within the four corners of the majority opinion itself. Writing for the Court, its leading Girondin or moderate revolutionary, the Chief Justice, already attempts to temper the Loper Bright revolution, writing a roadmap for a broad recharacterization of ' Chevron deference ' as ' Loper Bright delegation. ' 10 In some potentially broad range of the cases that would previously have been covered by the Chevron doctrine,",text,body_text,"But it is already possible to see how Loper Bright both grew out of pre-existing legal doctrines, principles, and trends, and also to see how the chastening of the Loper Bright revolution could occur, leaving in place much of the old Chevron regime under different labels. Indeed, I will argue, the beginning of that process is already visible within the four corners of the majority opinion itself. Writing for the Court, its leading Girondin or moderate revolutionary, the Chief Justice, already attempts to temper the Loper Bright revolution, writing a roadmap for a broad recharacterization of “ Chevron deference” as “ Loper Bright delegation.” 10 In some potentially broad range of the cases that would previously have been covered by the Chevron doctrine, courts will now say that Congress has explicitly or implicitly delegated discretionary policymaking authority to the agencies. In this framework, much of the review of the outer bounds of agency discretion that previously took place under the Chevron label will take place under the label of arbitrary-and-capricious review, but it is at best unclear how much will change in any operative sense, especially given that Chevron and arbitrariness review have long been held to overlap in part. 11 Furthermore, even apart from delegation, the Chief Justice’s opinion for the Court leaves in place a robust Skidmore doctrine of “respect” for persuasive agency interpretations; 12 it also backhandedly confirms the idea associated with NLRB v. Hearst Publications, Inc. that courts owe agencies a form of deference as to “mixed questions,” or the application of legal standards to facts, which is a form of policymaking discretion. 13 It is difficult, at least in the abstract, to identify with certainty any clear category of cases that will come out differently under the new regime than under the old one.",,99.86876640419948,matched
3,9 Id. at 3.,footnote,footnote,,9 Id. at 3.,100.0,matched
3,"10 As previously argued in Vermeule, supra note 7.",footnote,footnote,,"10 As previously argued in Vermeule, supra note 7.",100.0,matched
4,"courts will now say that Congress has explicitly or implicitly delegated discretionary policymaking authority to the agencies. In this framework, much of the review of the outer bounds of agency discretion that previously took place under the Chevron label will take place under the label of arbitrary-and-capricious review, but it is at best unclear how much will change in any operative sense, especially given that Chevron and arbitrariness review have long been held to overlap in part. 11 Furthermore, even apart from delegation, the Chief Justice ' s opinion for the Court leaves in place a robust Skidmore doctrine of ' respect ' for persuasive agency interpretations; 12 it also backhandedly con /uniFB01 rms the idea associated with NLRBv. Hearst Publications, Inc. that courts owe agencies a form of deference as to ' mixed questions, ' or the application of legal standards to facts, which is a form of policymaking discretion. 13 It is dif /uniFB01 cult, at least in the abstract, to identify with certainty any clear category of cases that will come out differently under the new regime than under the old one.",text,body_text,"But it is already possible to see how Loper Bright both grew out of pre-existing legal doctrines, principles, and trends, and also to see how the chastening of the Loper Bright revolution could occur, leaving in place much of the old Chevron regime under different labels. Indeed, I will argue, the beginning of that process is already visible within the four corners of the majority opinion itself. Writing for the Court, its leading Girondin or moderate revolutionary, the Chief Justice, already attempts to temper the Loper Bright revolution, writing a roadmap for a broad recharacterization of “ Chevron deference” as “ Loper Bright delegation.” 10 In some potentially broad range of the cases that would previously have been covered by the Chevron doctrine, courts will now say that Congress has explicitly or implicitly delegated discretionary policymaking authority to the agencies. In this framework, much of the review of the outer bounds of agency discretion that previously took place under the Chevron label will take place under the label of arbitrary-and-capricious review, but it is at best unclear how much will change in any operative sense, especially given that Chevron and arbitrariness review have long been held to overlap in part. 11 Furthermore, even apart from delegation, the Chief Justice’s opinion for the Court leaves in place a robust Skidmore doctrine of “respect” for persuasive agency interpretations; 12 it also backhandedly confirms the idea associated with NLRB v. Hearst Publications, Inc. that courts owe agencies a form of deference as to “mixed questions,” or the application of legal standards to facts, which is a form of policymaking discretion. 13 It is difficult, at least in the abstract, to identify with certainty any clear category of cases that will come out differently under the new regime than under the old one.",,98.78542510121457,matched
