page_no,pdf_text,pdf_original_label,pdf_corrected_label,matched_html_body,matched_html_footnote,match_confidence,match_status
7,"The barest acquaintance with the Court ' s case law, however, suggests that something has gone badly wrong here. I refer not to Chevron , nor even to the case law of the 1940s, but rather to case law decided well before the full /uniFB02 owering of the administrative state. Consider a few of the Court ' s earlier and emphatic statements, none of which appear in the majority opinion.",text,body_text,"The barest acquaintance with the Court’s case law, however, suggests that something has gone badly wrong here. I refer not to Chevron , nor even to the case law of the 1940s, but rather to case law decided well before the full flowering of the administrative state. Consider a few of the Court’s earlier and emphatic statements, none of which appear in the majority opinion. [W]here Congress has committed to the head of a department certain duties requiring the exercise of judgment and discretion, his action thereon, whether it involve questions of law or fact , will not be reviewed by the courts unless he has exceeded his authority or this Court should be of opinion that his action was clearly wrong… . [W]here the decision of questions of fact is committed by Congress to the judgment and discretion of the head of a department, his decision thereon is conclusive; and that even upon mixed questions of law and fact, or of law alone , his action will carry with it a strong presumption of its correctness, and the courts will not ordinarily review it, although they may have the power, and will occasionally exercise the right of so doing. 20 Whether [the executive officer] decided right or wrong, is not the question. Having jurisdiction to decide at all, he had necessarily jurisdiction, and it was his duty to decide as he thought the law was , and the courts have no power whatever under those circumstances to review his determination by mandamus or injunction . 21 In all cases of ambiguity, the contemporaneous construction, not only of the courts but of the departments, and even of the officials whose duty it is to carry the law into effect, is universally held to be controlling . 22",,98.28269484808455,matched
7,"[W]here Congress has committed to the head of a department certain duties requiring the exercise of judgment and discretion, his action thereon, whether it involve questions of law or fact , will not be reviewed by the courts unless he has exceeded his authority or this Court should be of opinion that his action was clearly wrong. . . . [W]here the decision of questions of fact is committed by Congress to the judgment and discretion of the head of a department, his decision thereon is conclusive; and that even upon mixed questions of law and fact, or of law alone , his action will carry with it a strong presumption of its correctness, and the courts will not ordinarily be expected from a geographically and politically diverse judiciary encountering the hardest . . . issues. . . . ' ).",text,body_text,"[W]here Congress has committed to the head of a department certain duties requiring the exercise of judgment and discretion, his action thereon, whether it involve questions of law or fact , will not be reviewed by the courts unless he has exceeded his authority or this Court should be of opinion that his action was clearly wrong… . [W]here the decision of questions of fact is committed by Congress to the judgment and discretion of the head of a department, his decision thereon is conclusive; and that even upon mixed questions of law and fact, or of law alone , his action will carry with it a strong presumption of its correctness, and the courts will not ordinarily review it, although they may have the power, and will occasionally exercise the right of so doing. 20",,93.40584636301836,matched
7,"19 Loper Bright Enters. v. Raimondo, 144 S. Ct. 2244, 2261 (2024) ( ' The APA . . . speci /uniFB01 es that courts, not agencies, will decide ' all relevant questions of law ' arising on review of agency action . . . even those involving ambiguous laws . . . and set aside any such action inconsistent with the law as they interpret it. ' ).",footnote,footnote,,"12 Loper Bright Enters. v. Raimondo, 144 S. Ct. 2244, 2263 (2024).",96.875,matched
8,"review it, although they may have the power, and will occasionally exercise the right of so doing. 20",text,body_text,"The barest acquaintance with the Court’s case law, however, suggests that something has gone badly wrong here. I refer not to Chevron , nor even to the case law of the 1940s, but rather to case law decided well before the full flowering of the administrative state. Consider a few of the Court’s earlier and emphatic statements, none of which appear in the majority opinion. [W]here Congress has committed to the head of a department certain duties requiring the exercise of judgment and discretion, his action thereon, whether it involve questions of law or fact , will not be reviewed by the courts unless he has exceeded his authority or this Court should be of opinion that his action was clearly wrong… . [W]here the decision of questions of fact is committed by Congress to the judgment and discretion of the head of a department, his decision thereon is conclusive; and that even upon mixed questions of law and fact, or of law alone , his action will carry with it a strong presumption of its correctness, and the courts will not ordinarily review it, although they may have the power, and will occasionally exercise the right of so doing. 20 Whether [the executive officer] decided right or wrong, is not the question. Having jurisdiction to decide at all, he had necessarily jurisdiction, and it was his duty to decide as he thought the law was , and the courts have no power whatever under those circumstances to review his determination by mandamus or injunction . 21 In all cases of ambiguity, the contemporaneous construction, not only of the courts but of the departments, and even of the officials whose duty it is to carry the law into effect, is universally held to be controlling . 22",,100.0,matched
8,"Whether [the executive of /uniFB01 cer] decided right or wrong, is not the question. Having jurisdiction to decide at all, he had necessarily jurisdiction, and it was his duty to decide as he thought the law was , and the courts have no power whatever under those circumstances to review his determination by mandamus or injunction . 21",text,body_text,"The barest acquaintance with the Court’s case law, however, suggests that something has gone badly wrong here. I refer not to Chevron , nor even to the case law of the 1940s, but rather to case law decided well before the full flowering of the administrative state. Consider a few of the Court’s earlier and emphatic statements, none of which appear in the majority opinion. [W]here Congress has committed to the head of a department certain duties requiring the exercise of judgment and discretion, his action thereon, whether it involve questions of law or fact , will not be reviewed by the courts unless he has exceeded his authority or this Court should be of opinion that his action was clearly wrong… . [W]here the decision of questions of fact is committed by Congress to the judgment and discretion of the head of a department, his decision thereon is conclusive; and that even upon mixed questions of law and fact, or of law alone , his action will carry with it a strong presumption of its correctness, and the courts will not ordinarily review it, although they may have the power, and will occasionally exercise the right of so doing. 20 Whether [the executive officer] decided right or wrong, is not the question. Having jurisdiction to decide at all, he had necessarily jurisdiction, and it was his duty to decide as he thought the law was , and the courts have no power whatever under those circumstances to review his determination by mandamus or injunction . 21 In all cases of ambiguity, the contemporaneous construction, not only of the courts but of the departments, and even of the officials whose duty it is to carry the law into effect, is universally held to be controlling . 22",,97.32142857142857,matched
8,"In all cases of ambiguity, the contemporaneous construction, not only of the courts but of the departments, and even of the of /uniFB01 cials whose duty it is to carry the law into effect, is universally held to be controlling . 22",text,body_text,"The barest acquaintance with the Court’s case law, however, suggests that something has gone badly wrong here. I refer not to Chevron , nor even to the case law of the 1940s, but rather to case law decided well before the full flowering of the administrative state. Consider a few of the Court’s earlier and emphatic statements, none of which appear in the majority opinion. [W]here Congress has committed to the head of a department certain duties requiring the exercise of judgment and discretion, his action thereon, whether it involve questions of law or fact , will not be reviewed by the courts unless he has exceeded his authority or this Court should be of opinion that his action was clearly wrong… . [W]here the decision of questions of fact is committed by Congress to the judgment and discretion of the head of a department, his decision thereon is conclusive; and that even upon mixed questions of law and fact, or of law alone , his action will carry with it a strong presumption of its correctness, and the courts will not ordinarily review it, although they may have the power, and will occasionally exercise the right of so doing. 20 Whether [the executive officer] decided right or wrong, is not the question. Having jurisdiction to decide at all, he had necessarily jurisdiction, and it was his duty to decide as he thought the law was , and the courts have no power whatever under those circumstances to review his determination by mandamus or injunction . 21 In all cases of ambiguity, the contemporaneous construction, not only of the courts but of the departments, and even of the officials whose duty it is to carry the law into effect, is universally held to be controlling . 22",,97.79735682819384,matched
8,"Note that these cases are not subject to the Court ' s basic maneuver of treating all previous references to deference-like principles as no more than references to Skidmore ' respect ' or ' weight ' avant la lettre . 23 Instead these cases refer quite expressly to a stronger version of deference, under which delegated statutory discretion carries with it a presumption that agency legal interpretations are ' controlling, ' even as to ' law alone, ' unless they clearly exceed the boundaries of the agency ' s statutory authority -a decent short summary of what later would be called the Chevron framework. Indeed, ironically enough, it is also a decent short summary of one of the main holdings of Loper Bright itself, which at least to some large degree recreates the Chevron framework while claiming to overrule it, as I will suggest shortly. The truth is that there have always been multiple strands jostling in the Court ' s case law, 24 and these multiple strands reappeared within the Chevron framework itself. The opinion in Loper Bright elides this messy history in order to portray Chevron as a kind of fall from grace, an inexplicable departure from an original and longstanding baseline approach of de novo judicial interpretation in search of the single right answer.",text,body_text,"Note that these cases are not subject to the Court’s basic maneuver of treating all previous references to deference-like principles as no more than references to Skidmore “respect” or “weight” avant la lettre . 23 Instead these cases refer quite expressly to a stronger version of deference, under which delegated statutory discretion carries with it a presumption that agency legal interpretations are “controlling,” even as to “law alone,” unless they clearly exceed the boundaries of the agency’s statutory authority—a decent short summary of what later would be called the Chevron framework. Indeed, ironically enough, it is also a decent short summary of one of the main holdings of Loper Bright itself, which at least to some large degree recreates the Chevron framework while claiming to overrule it, as I will suggest shortly. The truth is that there have always been multiple strands jostling in the Court’s case law, 24 and these multiple strands reappeared within the Chevron framework itself. The opinion in Loper Bright elides this messy history in order to portray Chevron as a kind of fall from grace, an inexplicable departure from an original and longstanding baseline approach of de novo judicial interpretation in search of the single right answer.",,98.81610102604577,matched
8,"Overruling Chevron is thus not a simple exercise, and it has been made less simple by the Court ' s transparently selective account of the history of deference law. Are cases such as the ones I have quoted",text,body_text,"Overruling Chevron is thus not a simple exercise, and it has been made less simple by the Court’s transparently selective account of the history of deference law. Are cases such as the ones I have quoted here still good law? One might think the answer is a straightforward “no,” but it is not so obvious that they are not. After all, the Court does not expressly overrule or even mention them, and they might even now be described as cases of statutory delegation. Still, one may expect that either they will be folded into the Skidmore doctrine or else treated as implicitly overruled by the Court’s holding that de novo judicial interpretation is commanded by the text of the APA—even though one does not usually treat subsequently enacted statutes as overruling large swathes of prior case law unless they do so expressly. 25 In any case, however, what is clear is that the Court’s failure to even address such problems, in the service of a simplistic narrative, is a failure not only of candor but of legal craft.",,99.50980392156863,matched
8,"20 Bates & Guild Co. v. Payne, 194 U.S. 106, 108 -10 (1904) (emphasis added).",footnote,footnote,,"20 Bates & Guild Co. v. Payne, 194 U.S. 106, 108–10 (1904) (emphasis added).",98.64864864864865,matched
8,"21 U.S. ex rel. Riverside Oil Co. v. Hitchcock, 190 U.S. 316, 324 -25 (1903) (emphasis added).",footnote,footnote,,"21 U.S. ex rel. Riverside Oil Co. v. Hitchcock, 190 U.S. 316, 324–25 (1903) (emphasis added).",98.9010989010989,matched
8,"22 Schell v. Fauché, 138 U.S. 562, 572 (1891) (emphasis added).",footnote,footnote,,"22 Schell v. Fauché, 138 U.S. 562, 572 (1891) (emphasis added).",100.0,matched
8,"23 Loper Bright , 144 S. Ct. at 2258 -59 ( ' But the Court did not extend similar deference to agency resolutions of questions of law. . . . [S]uch deferential review . . . was cabined to factbound determinations. . . . ' ).",footnote,footnote,,"3 Loper Bright , 144 S. Ct. at 2273.",95.65217391304348,matched
8,"24 As the Court noted expressly as early as Bates & Guild Co. , 194 U.S. at 108 -10.",footnote,footnote,,"24 As the Court noted expressly as early as Bates & Guild Co. , 194 U.S. at 108–10.",98.78048780487805,matched
9,"here still good law? One might think the answer is a straightforward ' no, ' but it is not so obvious that they are not. After all, the Court does not expressly overrule or even mention them, and they might even now be described as cases of statutory delegation. Still, one may expect that either they will be folded into the Skidmore doctrine or else treated as implicitly overruled by the Court ' s holding that de novo judicial interpretation is commanded by the text of the APA -even though one does not usually treat subsequently enacted statutes as overruling large swathes of prior case law unless they do so expressly. 25 In any case, however, what is clear is that the Court ' s failure to even address such problems, in the service of a simplistic narrative, is a failure not only of candor but of legal craft.",text,body_text,"Overruling Chevron is thus not a simple exercise, and it has been made less simple by the Court’s transparently selective account of the history of deference law. Are cases such as the ones I have quoted here still good law? One might think the answer is a straightforward “no,” but it is not so obvious that they are not. After all, the Court does not expressly overrule or even mention them, and they might even now be described as cases of statutory delegation. Still, one may expect that either they will be folded into the Skidmore doctrine or else treated as implicitly overruled by the Court’s holding that de novo judicial interpretation is commanded by the text of the APA—even though one does not usually treat subsequently enacted statutes as overruling large swathes of prior case law unless they do so expressly. 25 In any case, however, what is clear is that the Court’s failure to even address such problems, in the service of a simplistic narrative, is a failure not only of candor but of legal craft.",,99.57081545064378,matched
9,b. continuity,section_header,body_text,"Does Monaghan’s logic, adopted by the Court, cover implied delegations as well as express delegations? I believe that it does. As such, Loper Bright should be read as a “hermeneutic of continuity” with the preceding law. Recall that both Mead and Chevron recognized the possibility of implied delegations. And the logic of doing so seems airtight even under the “single best reading” approach. After all, if judges conclude, all things considered, that Congress implicitly but unmistakably delegated a space of lawmaking discretion to the agency, that too just is the best reading.",,84.61538461538461,matched
9,"Just as Tocqueville argued, shockingly, that the Revolution had as much built upon prior institutions and policies as departed from them, so too with Loper Bright . I will argue in Part II below that the deference and quasi-deference doctrines that Loper Bright retains as part of the current law cover much or most of the Chevron terrain, especially insofar as Loper Bright relabels Chevron ' deference ' as ' delegation, ' express or implied. Here, it suf /uniFB01 ces merely to point out that Loper Bright ' s emphasis on delegation is not some sudden aboutface by the Court. Rather it is best seen as a continuation and expansion of themes from Chevron itself -and from a notorious epicycle on Chevron , the United States v. Mead Corporation decision in 2001. 26",text,body_text,"Just as Tocqueville argued, shockingly, that the Revolution had as much built upon prior institutions and policies as departed from them, so too with Loper Bright . I will argue in Part II below that the deference and quasi-deference doctrines that Loper Bright retains as part of the current law cover much or most of the Chevron terrain, especially insofar as Loper Bright relabels Chevron “deference” as “delegation,” express or implied. Here, it suffices merely to point out that Loper Bright ’s emphasis on delegation is not some sudden about-face by the Court. Rather it is best seen as a continuation and expansion of themes from Chevron itself—and from a notorious epicycle on Chevron , the United States v. Mead Corporation decision in 2001. 26",,98.00796812749005,matched
9,"The original Chevron opinion had of course framed its approach partly (but only partly) in terms of delegation, saying:",text,body_text,"The original Chevron opinion had of course framed its approach partly (but only partly) in terms of delegation, saying: If Congress has explicitly left a gap for the agency to fill, there is an express delegation of authority to the agency to elucidate a specific provision of the statute by regulation. Such legislative regulations are given controlling weight unless they are arbitrary, capricious, or manifestly contrary to the statute. Sometimes the legislative delegation to an agency on a particular question is implicit rather than explicit. In such a case, a court may not substitute its own construction of a statutory provision for a reasonable interpretation made by the administrator of an agency. 27 As we will see, this sounds rather strikingly like the crucial analysis of delegation in Loper Bright —at least if we carry out the essentially semantic trick of saying that the delegation-space of agency authority to which the Chevron Court refers 28 is itself the “one right answer” demanded by Loper Bright ; and especially if, as I will argue, implicit as well as explicit delegations are and must be recognized by Loper Bright ’s logic. Comparing this passage from Chevron with Loper Bright , one might be forgiven for wondering what, exactly, all the shouting is about, putting aside the fact that the two opinions speak about essentially the same legal situation in somewhat different language.",,100.0,matched
9,"If Congress has explicitly left a gap for the agency to /uniFB01 ll, there is an express delegation of authority to the agency to elucidate a speci /uniFB01 c provision of the statute by regulation. Such legislative regulations are given controlling weight unless they are arbitrary, capricious, or manifestly contrary to the statute. Sometimes the legislative delegation to an agency on a particular question is implicit rather than explicit. In such a case, a court may not",text,body_text,"If Congress has explicitly left a gap for the agency to fill, there is an express delegation of authority to the agency to elucidate a specific provision of the statute by regulation. Such legislative regulations are given controlling weight unless they are arbitrary, capricious, or manifestly contrary to the statute. Sometimes the legislative delegation to an agency on a particular question is implicit rather than explicit. In such a case, a court may not substitute its own construction of a statutory provision for a reasonable interpretation made by the administrator of an agency. 27",,97.96791443850267,matched
9,"25 Cf. 5 U.S.C. § 559 ( ' [The subchapter of the Administrative Procedure Act (APA)] . . . do[es] not limit or repeal additional requirements imposed by statute or otherwise recognized by law. . . . [A s]ubsequent statute may not be held to supersede or modify this subchapter, [or] chapter 7 . . . except to the extent that it does so expressly. ' ).",footnote,footnote,,"25 Cf. 5 U.S.C. § 559 (“[The subchapter of the Administrative Procedure Act (APA)] … do[es] not limit or repeal additional requirements imposed by statute or otherwise recognized by law…. [A s]ubsequent statute may not be held to supersede or modify this subchapter, [or] chapter 7 … except to the extent that it does so expressly.”).",95.45454545454545,matched
9,26 533 U.S. 218 (2001).,footnote,footnote,,26 533 U.S. 218 (2001).,100.0,matched
10,substitute its own construction of a statutory provision for a reasonable interpretation made by the administrator of an agency. 27,text,body_text,"The original Chevron opinion had of course framed its approach partly (but only partly) in terms of delegation, saying: If Congress has explicitly left a gap for the agency to fill, there is an express delegation of authority to the agency to elucidate a specific provision of the statute by regulation. Such legislative regulations are given controlling weight unless they are arbitrary, capricious, or manifestly contrary to the statute. Sometimes the legislative delegation to an agency on a particular question is implicit rather than explicit. In such a case, a court may not substitute its own construction of a statutory provision for a reasonable interpretation made by the administrator of an agency. 27 As we will see, this sounds rather strikingly like the crucial analysis of delegation in Loper Bright —at least if we carry out the essentially semantic trick of saying that the delegation-space of agency authority to which the Chevron Court refers 28 is itself the “one right answer” demanded by Loper Bright ; and especially if, as I will argue, implicit as well as explicit delegations are and must be recognized by Loper Bright ’s logic. Comparing this passage from Chevron with Loper Bright , one might be forgiven for wondering what, exactly, all the shouting is about, putting aside the fact that the two opinions speak about essentially the same legal situation in somewhat different language.",,100.0,matched
