page_no,pdf_text,pdf_original_label,pdf_corrected_label,matched_html_body,matched_html_footnote,match_confidence,match_status
16,"This reading is reinforced by a background principle of legal interpretation and a point of administrative law doctrine. The background interpretive principle posits that absent some special rule of clear statement, legal instruments may speak either expressly or by implication, so long as the ordinary meaning of the instrument, all things considered, is best read to so indicate. Ordinarily, absent some",text,body_text,"This reading is reinforced by a background principle of legal interpretation and a point of administrative law doctrine. The background interpretive principle posits that absent some special rule of clear statement, legal instruments may speak either expressly or by implication, so long as the ordinary meaning of the instrument, all things considered, is best read to so indicate. Ordinarily, absent some special canon of interpretation, what a legislature may do explicitly, it may do implicitly. The foundation of that principle is sheer common sense. After all, in every other sort of human communication, we often understand by implication something that has not been expressly said. Indeed, in any normal communicative context, it is impossible that everything should be expressly said.",,100.0,matched
16,"48 The next few paragraphs draw upon material initially published as Adrian Vermeule, Implied Delegations After Loper, Yale J. on Regul.: Notice & Comment ( July 9, 2024), https:// www.yalejreg.com/nc/implied-delegations-after-loper-by-adrian-vermeule.",footnote,footnote,,"48 The next few paragraphs draw upon material initially published as Adrian Vermeule, Implied Delegations After Loper, Yale J. on Regul.: Notice & Comment (July 9, 2024), https://www.yalejreg.com/nc/implied-delegations-after-loper-by-adrian-vermeule .",99.19678714859438,matched
16,"49 As the Court likes to remind us, we are not to read judicial opinions as though they are comprehensive statutes. See, e.g. , Nat ' l Pork Producers Council v. Ross, 598 U.S. 356, 373 (2023); Brown v. Davenport, 596 U.S. 118, 141 (2022); Borden v. United States, 593 U.S. 420, 443 n.9 (2021) (plurality opinion). See generally Margaret H. Lemos, Should Judicial Opinions Be Read Like Statutes? (Duke L. Sch. Pub. L. & Legal Theory Working Paper No. 2024-51, 2024), https://ssrn.com/abstract p 4911985 (collecting cases).",footnote,footnote,,"49 As the Court likes to remind us, we are not to read judicial opinions as though they are comprehensive statutes. See, e.g. , Nat’l Pork Producers Council v. Ross, 598 U.S. 356, 373 (2023); Brown v. Davenport, 596 U.S. 118, 141 (2022); Borden v. United States, 593 U.S. 420, 443 n.9 (2021) (plurality opinion). See generally Margaret H. Lemos, Should Judicial Opinions Be Read Like Statutes? (Duke L. Sch. Pub. L. & Legal Theory Working Paper No. 2024-51, 2024), https://ssrn.com/abstract=4911985 (collecting cases).",99.2248062015504,matched
16,"50 Loper Bright , 144 S. Ct. at 2265 ( ' Chevron cannot be reconciled with the APA . . . by presuming that statutory ambiguities are implicit delegations to agencies. ' ).",footnote,footnote,,"50 Loper Bright , 144 S. Ct. at 2265 (“ Chevron cannot be reconciled with the APA … by presuming that statutory ambiguities are implicit delegations to agencies.”).",96.875,matched
17,"special canon of interpretation, what a legislature may do explicitly, it may do implicitly. The foundation of that principle is sheer commonsense. After all, in every other sort of human communication, we often understand by implication something that has not been expressly said. Indeed, in any normal communicative context, it is impossible that everything should be expressly said.",text,body_text,"This reading is reinforced by a background principle of legal interpretation and a point of administrative law doctrine. The background interpretive principle posits that absent some special rule of clear statement, legal instruments may speak either expressly or by implication, so long as the ordinary meaning of the instrument, all things considered, is best read to so indicate. Ordinarily, absent some special canon of interpretation, what a legislature may do explicitly, it may do implicitly. The foundation of that principle is sheer common sense. After all, in every other sort of human communication, we often understand by implication something that has not been expressly said. Indeed, in any normal communicative context, it is impossible that everything should be expressly said.",,99.73958333333334,matched
17,"Thepoint of administrative law doctrine is that to read Loper Bright to require that all delegations be express would threaten to make the major questions doctrine redundant. That doctrine requires (roughly speaking) that delegations must be express when, but only when, they authorize the agency to decide a question of major economic or political signi /uniFB01 cance. It does not, however, say that all delegations must be express, period. In other words, to read Loper Bright as erecting a heretofore unknown global clear statement rule against all delegated authority, one requiring that all delegations (not just major delegations) must be express, would go even farther than the Court has gone with the major questions doctrine. This seems an implausible reading, at least until the Justices inform us otherwise. After all, as I mention shortly, the discussion in Loper Bright itself seemed to indicate that the major questions doctrine remains part of the law, a point that would have been unnecessary if that doctrine had been subsumed in an even broader rule that all delegation, of whatever scope and importance, must be clearly stated. The best reading of the Court ' s discussion, then, is that even under Loper Bright , delegation of authority may be implied as well as express.",text,body_text,"The point of administrative law doctrine is that to read Loper Bright to require that all delegations be express would threaten to make the major questions doctrine redundant. That doctrine requires (roughly speaking) that delegations must be express when, but only when, they authorize the agency to decide a question of major economic or political significance. It does not, however, say that all delegations must be express, period. In other words, to read Loper Bright as erecting a heretofore unknown global clear statement rule against all delegated authority, one requiring that all delegations (not just major delegations) must be express, would go even farther than the Court has gone with the major questions doctrine. This seems an implausible reading, at least until the Justices inform us otherwise. After all, as I mention shortly, the discussion in Loper Bright itself seemed to indicate that the major questions doctrine remains part of the law, a point that would have been unnecessary if that doctrine had been subsumed in an even broader rule that all delegation, of whatever scope and importance, must be clearly stated. The best reading of the Court’s discussion, then, is that even under Loper Bright , delegation of authority may be implied as well as express.",,99.14196567862714,matched
17,"Overall, taken together with what seems to be the continuing validity of Skidmore and Hearst , I suspect that there is less to Loper Bright than meets the eye. Even after Loper Bright there is a rather large domain in which courts that would have deferred under Chevron can still defer, just with a different legal framework. Of course it is true that, we may con /uniFB01 dently expect, at least some cases will come out differently than under the Chevron regime. But the Chevron regime was itself heavily quali /uniFB01 ed by the time of its demise, and agencies and courts had for some time been used to avoiding it or at least not putting too much reliance on it. And as we have seen, there is much more continuity across the triptych of Chevron , Mead , and Loper Bright than initially appears. Delegation is a central concept in all three, and all three acknowledge that -within whatever fairly loose boundaries the constitutional nondelegation doctrine allows -Congress may ' delegate ' or grant to agencies a legal space within which",text,body_text,"Overall, taken together with what seems to be the continuing validity of Skidmore and Hearst , I suspect that there is less to Loper Bright than meets the eye. Even after Loper Bright there is a rather large domain in which courts that would have deferred under Chevron can still defer, just with a different legal framework. Of course it is true that, we may confidently expect, at least some cases will come out differently than under the Chevron regime. But the Chevron regime was itself heavily qualified by the time of its demise, and agencies and courts had for some time been used to avoiding it or at least not putting too much reliance on it. And as we have seen, there is much more continuity across the triptych of Chevron , Mead , and Loper Bright than initially appears. Delegation is a central concept in all three, and all three acknowledge that—within whatever fairly loose boundaries the constitutional nondelegation doctrine allows—Congress may “delegate” or grant to agencies a legal space within which to create binding rules, whether through rulemaking or adjudication. The task of the judge, in all three decisions, is to determine the outer boundaries of the relevant delegations. If Loper Bright now describes that task as determining the one right answer to statutory meaning, that is more a façon de parler than an about-face.",,98.8360814742968,matched
18,"to create binding rules, whether through rulemaking or adjudication. The task of the judge, in all three decisions, is to determine the outer boundaries of the relevant delegations. If Loper Bright now describes that task as determining the one right answer to statutory meaning, that is more a façon de parler than an about-face.",text,body_text,"Overall, taken together with what seems to be the continuing validity of Skidmore and Hearst , I suspect that there is less to Loper Bright than meets the eye. Even after Loper Bright there is a rather large domain in which courts that would have deferred under Chevron can still defer, just with a different legal framework. Of course it is true that, we may confidently expect, at least some cases will come out differently than under the Chevron regime. But the Chevron regime was itself heavily qualified by the time of its demise, and agencies and courts had for some time been used to avoiding it or at least not putting too much reliance on it. And as we have seen, there is much more continuity across the triptych of Chevron , Mead , and Loper Bright than initially appears. Delegation is a central concept in all three, and all three acknowledge that—within whatever fairly loose boundaries the constitutional nondelegation doctrine allows—Congress may “delegate” or grant to agencies a legal space within which to create binding rules, whether through rulemaking or adjudication. The task of the judge, in all three decisions, is to determine the outer boundaries of the relevant delegations. If Loper Bright now describes that task as determining the one right answer to statutory meaning, that is more a façon de parler than an about-face.",,100.0,matched
18,"And indeed the Court ' s frequent swing voter, Justice Kavanaugh, seemed to reach the same conclusion. In public remarks delivered after the decision, Justice Kavanaugh described Loper Bright as ' a course correction consistent with the separation of powers to make sure that the executive branch is acting within the authorization granted to it by Congress ' and urged:",text,body_text,"And indeed the Court’s frequent swing voter, Justice Kavanaugh, seemed to reach the same conclusion. In public remarks delivered after the decision, Justice Kavanaugh described Loper Bright as “a course correction consistent with the separation of powers to make sure that the executive branch is acting within the authorization granted to it by Congress” and urged: [D]on’t over-read Loper Bright , oftentimes Congress will grant a broad authorization to an executive agency. So it’s really important as a neutral umpire to respect the line that Congress has drawn, when it’s granted broad authorization, not to unduly hinder the executive branch when performing its congressional authorized functions, but at the same time not allowing the executive branch, as it could with Chevron in its toolkit, to go beyond the congressional authorization. 51 If Loper Bright just means that agencies may not go beyond the boundaries of “broad” congressional authorization, it reiterates, in different language, a legal constraint as old as the hills. 52 And even if the best reading of Loper Bright is more consequential, contrary to the account I have offered, Justice Kavanaugh’s position as the Court’s (frequent) swing voter makes his view, and my view, something of a self-fulfilling prophecy.",,99.45504087193461,matched
18,"[D]on ' t over-read Loper Bright , oftentimes Congress will grant a broad authorization to an executive agency. So it ' s really important as a neutral umpire to respect the line that Congress has drawn, when it ' s granted broad authorization, not to unduly hinder the executive branch when performing its congressional authorized functions, but at the same time not allowing the executive branch, as it could with Chevron in its toolkit, to go beyond the congressional authorization. 51",text,body_text,"[D]on’t over-read Loper Bright , oftentimes Congress will grant a broad authorization to an executive agency. So it’s really important as a neutral umpire to respect the line that Congress has drawn, when it’s granted broad authorization, not to unduly hinder the executive branch when performing its congressional authorized functions, but at the same time not allowing the executive branch, as it could with Chevron in its toolkit, to go beyond the congressional authorization. 51",,99.16839916839916,matched
18,"If Loper Bright just means that agencies may not go beyond the boundaries of ' broad ' congressional authorization, it reiterates, in different language, a legal constraint as old as the hills. 52 And even if the best reading of Loper Bright is more consequential, contrary to the account I have offered, Justice Kavanaugh ' s position as the Court ' s (frequent) swing voter makes his view, and my view, something of a self-ful /uniFB01 lling prophecy.",text,body_text,"And indeed the Court’s frequent swing voter, Justice Kavanaugh, seemed to reach the same conclusion. In public remarks delivered after the decision, Justice Kavanaugh described Loper Bright as “a course correction consistent with the separation of powers to make sure that the executive branch is acting within the authorization granted to it by Congress” and urged: [D]on’t over-read Loper Bright , oftentimes Congress will grant a broad authorization to an executive agency. So it’s really important as a neutral umpire to respect the line that Congress has drawn, when it’s granted broad authorization, not to unduly hinder the executive branch when performing its congressional authorized functions, but at the same time not allowing the executive branch, as it could with Chevron in its toolkit, to go beyond the congressional authorization. 51 If Loper Bright just means that agencies may not go beyond the boundaries of “broad” congressional authorization, it reiterates, in different language, a legal constraint as old as the hills. 52 And even if the best reading of Loper Bright is more consequential, contrary to the account I have offered, Justice Kavanaugh’s position as the Court’s (frequent) swing voter makes his view, and my view, something of a self-fulfilling prophecy.",,98.20224719101124,matched
18,"So far, cases in the lower courts cut in various directions, unsurprisingly. An illustrative pair of cases that have attracted early attention 53 are from the Seventh and Fifth Circuits, respectively. In the /uniFB01 rst, the court upheld, under Loper Bright , a rule of the Consumer Financial Protection Bureau that barred discrimination against not",text,body_text,"So far, cases in the lower courts cut in various directions, unsurprisingly. An illustrative pair of cases that have attracted early attention 53 are from the Seventh and Fifth Circuits, respectively. In the first, the court upheld, under Loper Bright , a rule of the Consumer Financial Protection Bureau that barred discrimination against not only applicants for credit, but also prospective applicants. 54 The court of appeals pointed to the broad statutory delegation of rulemaking authority in the Equal Credit Opportunity Act, which vested the Bureau with the power to make rules “necessary or proper to effectuate the purposes of this title” and “to prevent circumvention or evasion thereof.” 55 In the contrasting case, the court of appeals held that a Department of Labor rule clarifying the circumstances under which employers could reduce the wages of employees who receive tips was contrary to the Fair Labor Standards Act. 56 Note that it is by no means clear that these cases are in any sense inconsistent. The best reading of the statute, all things considered, may just be that in the first case there was a delegation and the agency stayed within its boundaries, whereas in the second case, the agency exceeded the boundaries of its authority. If this all sounds vaguely familiar, that is no accident; it is the same sort of discussion that happened under the pre-existing Chevron regime.",,98.7012987012987,matched
18,"51 A Conversation with Brett Kavanaugh Transcript , Cath. Univ. of Am. (Sept. 26, 2024), https://cit.catholic.edu/a-conversation-with-brett-kavanaugh-transcript.",footnote,footnote,,"51 A Conversation with Brett Kavanaugh Transcript , Cath. Univ. of Am. (Sept. 26, 2024), https://cit.catholic.edu/a-conversation-with-brett-kavanaugh-transcript .",100.0,matched
18,"52 See, e.g. , Little v. Barreme, 6 U.S. (2 Cranch) 170 (1804); Kendall v. U.S. ex rel. Stokes, 37 U.S. 524 (1838).",footnote,footnote,,"52 See, e.g. , Little v. Barreme, 6 U.S. (2 Cranch) 170 (1804); Kendall v. U.S. ex rel. Stokes, 37 U.S. 524 (1838).",100.0,matched
18,"53 See Christopher N. LaVigne, Kimberly Pallen, Jordan Garmen & Vahe Mesropyan, Employment Update: Recent Decisions and Agency Actions , N.Y. L.J. (Nov. 4, 2024, 8:00 AM), https://www.law.com/newyorklawjournal/2024/11/04/employment-update-recent-decisions -and-agency-actions.",footnote,footnote,,"53 See Christopher N. LaVigne, Kimberly Pallen, Jordan Garmen & Vahe Mesropyan, Employment Update: Recent Decisions and Agency Actions , N.Y. L.J. (Nov. 4, 2024, 8:00 AM), https://www.law.com/newyorklawjournal/2024/11/04/employment-update-recent-decisions-and-agency-actions .",99.63503649635037,matched
19,"only applicants for credit, but also prospective applicants. 54 The court of appeals pointed to the broad statutory delegation of rulemaking authority in the Equal Credit Opportunity Act, which vested the Bureau with the power to make rules ' necessary or proper to effectuate the purposes of this title ' and ' to prevent circumvention or evasion thereof. ' 55 In the contrasting case, the court of appeals held that a Department of Labor rule clarifying the circumstances under which employers could reduce the wages of employees who receive tips was contrary to the Fair Labor Standards Act. 56 Note that it is by no means clear that these cases are in any sense inconsistent. The best reading of the statute, all things considered, may just be that in the /uniFB01 rst case there was a delegation and the agency stayed within its boundaries, whereas in the second case, the agency exceeded the boundaries of its authority. If this all sounds vaguely familiar, that is no accident; it is the same sort of discussion that happened under the pre-existing Chevron regime.",text,body_text,"So far, cases in the lower courts cut in various directions, unsurprisingly. An illustrative pair of cases that have attracted early attention 53 are from the Seventh and Fifth Circuits, respectively. In the first, the court upheld, under Loper Bright , a rule of the Consumer Financial Protection Bureau that barred discrimination against not only applicants for credit, but also prospective applicants. 54 The court of appeals pointed to the broad statutory delegation of rulemaking authority in the Equal Credit Opportunity Act, which vested the Bureau with the power to make rules “necessary or proper to effectuate the purposes of this title” and “to prevent circumvention or evasion thereof.” 55 In the contrasting case, the court of appeals held that a Department of Labor rule clarifying the circumstances under which employers could reduce the wages of employees who receive tips was contrary to the Fair Labor Standards Act. 56 Note that it is by no means clear that these cases are in any sense inconsistent. The best reading of the statute, all things considered, may just be that in the first case there was a delegation and the agency stayed within its boundaries, whereas in the second case, the agency exceeded the boundaries of its authority. If this all sounds vaguely familiar, that is no accident; it is the same sort of discussion that happened under the pre-existing Chevron regime.",,99.38938468764678,matched
19,c. policymaking and interpretation,section_header,section_header,,,67.64705882352942,unmatched
19,"A corollary of the view I have advanced is that Loper Bright ' s efforts to relabel everything agencies do as ' policymaking ' rather than ' interpretation ' 57 is something of a red herring. The Justices in the majority seem to think, and indeed more or less said, that the sort of discretionary-choice-within-a-reasonable-range that the Monaghan relabeling leaves to agencies is best understood as ' policymaking ' rather than ' interpretation. ' That understanding saves the appearances, as the theologians say, and allows the Justices to take themselves to be doing all the law, while the agencies only ever do policy. (In the loophole passage on delegation that I have quoted from the majority opinion, the majority included references to some famous cases of arbitrariness review, doubtless due to this conceptualization of discretionary-choice-within-a-reasonable-range as ' policymaking. ' ) But",text,body_text,"A corollary of the view I have advanced is that Loper Bright ’s efforts to relabel everything agencies do as “policymaking” rather than “interpretation” 57 is something of a red herring. The Justices in the majority seem to think, and indeed more or less said, that the sort of discretionary-choice-within-a-reasonable-range that the Monaghan relabeling leaves to agencies is best understood as “policymaking” rather than “interpretation.” That understanding saves the appearances, as the theologians say, and allows the Justices to take themselves to be doing all the law, while the agencies only ever do policy. (In the loophole passage on delegation that I have quoted from the majority opinion, the majority included references to some famous cases of arbitrariness review, doubtless due to this conceptualization of discretionary-choice-within-a-reasonable-range as “policymaking.”) But of course, as many pointed out under the Chevron regime, 58 the authorized agency choice of a specifying or concretizing interpretation within a reasonable range is itself always also policymaking within a “policy space.” It is conceptually impossible for agencies to “choose policy” within a defined legal space granted by statute without first interpreting the statute to determine what the boundaries of the legal space are. Such choice by agencies is therefore both interpretation and policymaking, one hundred percent the one and one hundred percent the other, in a kind of hypostatic union of the administrative state. The Court’s relabeling of agency interpretation as agency policymaking is but a corollary of the Court’s more fundamental relabeling of Chevron deference as Loper Bright delegation. I have argued that the latter is more likely to confirm than to overturn the extant institutional relationship between courts and agencies, and so too with the former.",,99.33110367892976,matched
19,"54 Consumer Fin. Prot. Bureau v. Townstone Fin., Inc., 107 F.4th 768, 776 -77 (7th Cir. 2024).",footnote,footnote,,"54 Consumer Fin. Prot. Bureau v. Townstone Fin., Inc., 107 F.4th 768, 776–77 (7th Cir. 2024).",98.9010989010989,matched
19,"55 Id. at 776; see also May /uniFB01 eld v. U.S. Dep ' t of Lab., 117 F.4th 611, 614 (5th Cir. 2024) (upholding the Department of Labor ' s Minimum Salary Rule under the ' Department ' s explicitly delegated authority to de /uniFB01 ne and delimit the terms of the [statute] ' ).",footnote,footnote,,"55 Id. at 776; see also Mayfield v. U.S. Dep’t of Lab., 117 F.4th 611, 614 (5th Cir. 2024) (upholding the Department of Labor’s Minimum Salary Rule under the “Department’s explicitly delegated authority to define and delimit the terms of the [statute]”).",90.75975359342917,matched
19,"56 Rest. L. Ctr. v. U.S. Dep ' t of Lab., 120 F.4th 163, 174 -75 (5th Cir. 2024).",footnote,footnote,,"56 Rest. L. Ctr. v. U.S. Dep’t of Lab., 120 F.4th 163, 174–75 (5th Cir. 2024).",96.05263157894737,matched
19,57 See supra notes 39 -43 and accompanying text.,footnote,footnote,,57 See supra notes 39–43 and accompanying text.,97.82608695652173,matched
