document,text,html_label,docling_label,similarity,html_index,pdf_index
michigan_law_review_tort_law_in_a_world_of_scarce_compensatory_resources,See supra Section III.D.,footnote,list_item,1.0,104.0,286.0
michigan_law_review_tort_law_in_a_world_of_scarce_compensatory_resources,"In 1800, one inmate of a New York debtor's prison concluded that 'imprisonment for debt was a form of capital punishment wielded by private creditors with the acquiescence of the state.' 121 Some states subsequently adopted a reform that released debtors from jail 'who were genuinely impoverished or who were willing to assign all of their property for the benefit of their creditors,' an outcome that 'produced what Governor Oliver Wolcott of Connecticut was later to call a 'civil death.' ' 122",body_text,text,0.7789473684210526,111.0,288.0
michigan_law_review_tort_law_in_a_world_of_scarce_compensatory_resources,"Once again, accounting for the general availability of compensatory resources sheds new light on tort law's development. 'The prevailing view of American tort history regards nineteenth-century tort doctrine as deliberately structured to accommodate the economic interests of emerging industry.' 124 The associated claim that courts limited liability to 'subsidize' the newly industrializing economy is hard to square with available evidence. 125 The foregoing analysis provides additional historical reasons for rejecting the subsidy thesis. By limiting liability to avoid depressing economic development, courts could defensibly rely on the associated concern of ensuring that individuals would have the financial ability to maintain their physical health. The lack of social wealth in this era largely eliminated the normative difference between one's security interest and another's conflicting liberty interest chiefly concerned about survival. This reason of principle justified extensive rules of 'no liability.'",body_text,text,0.8265682656826568,113.0,289.0
michigan_law_review_tort_law_in_a_world_of_scarce_compensatory_resources,"Tobe clear, this penalty's severity bolsters incentives to prevent injury and avoid the associated tort liabilities, but one cannot confidently steer clear of tort liability for accidental harms (and even for some intentional torts) except by foregoing risky conduct altogether-an infeasible option. The looming prospect of debtor's prison factors into the normative calculus of tort law and explains why the characteristic tort rule before the twentieth century was one of 'no liability' rather than negligence liability. 123 Unable to normatively distinguish the injury victim's security interest from the injurer's associated liberty interest, tort law had to let the loss lie where it fell-on the injured party.",body_text,text,0.7972429638139,112.0,290.0
michigan_law_review_tort_law_in_a_world_of_scarce_compensatory_resources,"120. MANN, supra note 109, at 88 (quoting Dive v. Maningham (1551) 75 Eng. Rep. 96, 108-09; 1 Plowden 60, 68).",footnote,footnote,0.9395348837209302,105.0,291.0
michigan_law_review_tort_law_in_a_world_of_scarce_compensatory_resources,"121. Id. at 102, 105 (describing arguments in a newspaper published by William Keteltas while he was in debtor's prison).",footnote,footnote,0.9704641350210971,106.0,292.0
michigan_law_review_tort_law_in_a_world_of_scarce_compensatory_resources,"123. Robert L. Rabin, The Historical Development of the Fault Principle: A Reinterpretation , 15 GA. L. REV. 925 (1981) (arguing that the dominant rule in the 19th century was one of no liability or an immunity from liability or a privilege of conduct that would otherwise be a tortious form of negligence liability).",footnote,footnote,0.9808917197452229,108.0,294.0
michigan_law_review_tort_law_in_a_world_of_scarce_compensatory_resources,"124. Gary T. Schwartz, Tort Law and the Economy in Nineteenth-Century America: A Reinterpretation , 90 YALE L.J. 1717, 1717 (1981).",footnote,footnote,0.953125,109.0,295.0
michigan_law_review_tort_law_in_a_world_of_scarce_compensatory_resources,"Changing social conditions altered this normative calculus. Life expectancy at birth significantly improves with a 'sharp increase' in GDP per capita, underscoring the relation between survival and wealth. 126 Throughout the twentieth century, social wealth accumulated. From 1900 to 1950, the GDP per capita in the United States increased from $4,096 to $9,573 measured in constant 1990 international dollars; by 1992 it had further increased to $21,558 (approximately $52,817 in current dollars). 127 Consumption patterns changed accordingly. 'By comparison with the conveniences and comforts widely available in developed economies at the end of the 20th century, everyday life two centuries ago was most akin to what we know today as 'camping out.' ' 128 With the financial capacity to improve living conditions beyond the bare necessities, individuals had discretionary income to acquire other kinds of goods and services characteristic of modern life's conveniences and comforts. The increased social wealth made it possible for tort law to normatively distinguish between one's physical security and another's conflicting liberty interest involving the expenditure of financial resources.",body_text,text,0.875625721986908,114.0,297.0
michigan_law_review_tort_law_in_a_world_of_scarce_compensatory_resources,"Due to the increase in social wealth and emergence of modern bankruptcy law, tort law throughout the twentieth century could more sharply distinguish between one individual's interest in physical security and another's conflicting liberty and economic interests. Rather than being largely concerned about survival and avoiding debtor's prison, the ordinary duty-bearer now has the resources to consume modern life's conveniences and comforts. This kind of liberty interest is normatively distinguishable from the security interest, providing the foundation for tort rules designed to prevent injury.",body_text,text,0.993322203672788,116.0,298.0
michigan_law_review_tort_law_in_a_world_of_scarce_compensatory_resources,"126. Richard A. Easterlin, The Worldwide Standard of Living Since 1800 , J. ECON. PERSPS., Winter 2000, at 7, 12.",footnote,footnote,0.9,110.0,300.0
michigan_law_review_tort_law_in_a_world_of_scarce_compensatory_resources,"127. MADDISON, supra note 118, 23 tbl. 1-3 (OECD Development Centre 1995).",footnote,footnote,0.8671328671328671,111.0,301.0
michigan_law_review_tort_law_in_a_world_of_scarce_compensatory_resources,"Easterlin, supra note 126, at 11.",footnote,list_item,1.0,112.0,302.0
michigan_law_review_tort_law_in_a_world_of_scarce_compensatory_resources,"Every potential tortfeasor enjoys automatic asset protection in the form of exemptions from collection (valid even against intentional torts) and in the form of an optional bankruptcy discharge (valid against all but intentional torts). . . . The upshot . . . is that in most states individuals are entitled to commit torts while keeping much of their home equity, their retirement savings, most or all of their income, and their trust fund (if they have one).",footnote,text,0.8888888888888888,113.0,304.0
michigan_law_review_tort_law_in_a_world_of_scarce_compensatory_resources,"Recognizing that compensatory resources are scarce and injury compensation is imperfect, the common law has adopted the concept of an irreparable injury-one that 'cannot be adequately measured or compensated by money.' 130 According to the judicial conception of an irreparable injury, '[d]amages are inadequate if [a] plaintiff cannot use them to replace the specific thing he has lost.' 131 Consequently, compensatory damages are adequate 'for only one category of losses: to replace fungible goods or routine services in an orderly market.' 132 Bodily injuries are not fully fungible with any other goods or services, making them a paradigmatic example of an irreparable harm.",body_text,text,0.8695652173913043,117.0,306.0
michigan_law_review_tort_law_in_a_world_of_scarce_compensatory_resources,"For example, this equitable principle justifies the privilege of self-defense. As the Restatement (Third) of Torts explains:",body_text,text,1.0,119.0,307.0
michigan_law_review_tort_law_in_a_world_of_scarce_compensatory_resources,"For conduct threatening irreparable injuries such as premature death, 'judges have been brought to see and to acknowledge . . . that a remedy which prevents a threatened wrong is in its essential nature better than a remedy which permits the wrong to be done, and then attempts to pay for it.' 133 This equitable principle, though conventionally framed in remedial terms, has behavioral implications for substantive tort law.",body_text,text,0.806,118.0,308.0
michigan_law_review_tort_law_in_a_world_of_scarce_compensatory_resources,"An actor is justified in responding to the immediate threat or the infliction of violence or confinement with necessary and proportional force. It is both unrealistic and unfair to ask someone who is suddenly and wrongfully attacked to be content with the possibility of a subsequent tort lawsuit against, or criminal prosecution of, the assailant. 134",body_text,text,0.8634686346863468,120.0,309.0
michigan_law_review_tort_law_in_a_world_of_scarce_compensatory_resources,"The associated commentary never mentions the problem of irreparable injuries, although it must be the reason why prohibiting individuals from defending themselves against impending attacks would be both 'unrealistic and unfair.' A monetary damages award, even if coupled with criminal punishment for the wrongdoing, cannot adequately compensate a lost life or broken bone. Hence it would be both unfair and unrealistic to require individuals to rest on these remedial rights rather than empower them to prevent the irreparable harm through self-defense.",body_text,text,0.9963833634719711,121.0,310.0
michigan_law_review_tort_law_in_a_world_of_scarce_compensatory_resources,"131. Douglas Laycock, The Death of the Irreparable Injury Rule , 103 HARV. L. REV. 687, 703 (1990).",footnote,footnote,0.9166666666666666,115.0,313.0
michigan_law_review_tort_law_in_a_world_of_scarce_compensatory_resources,Injunctive relief prevents irreparable injuries by prohibiting the injurythreatening behavior altogether when it would be equitable to do so:,body_text,text,0.9964664310954063,123.0,318.0
michigan_law_review_tort_law_in_a_world_of_scarce_compensatory_resources,"Damages are the standard remedy for personal injury only because personal injuries can rarely be anticipated in time to prevent them by injunction. But where an injunction is possible, the irreparable injury rule is obviously satisfied: if it happens, the physical injury to the plaintiff will be irreparable. The most common examples are injunctions against family violence . . . . The issue also arises when courts are asked to enjoin conduct that creates a risk of serious injury. When the risk is great enough, those injunctions are routinely granted. 136",body_text,text,0.9073170731707317,124.0,319.0
michigan_law_review_tort_law_in_a_world_of_scarce_compensatory_resources,"In the absence of injunctive relief, there is no other remedy for preventing irreparable harms such as premature death. The monetary damages remedy, by definition, does not suffice. For the negligence rule to equitably prevent irreparable harms, it must instead formulate required forms of reasonably safe behavior.",body_text,text,1.0,125.0,320.0
michigan_law_review_tort_law_in_a_world_of_scarce_compensatory_resources,"135. Mark A. Geistfeld, The Principle of Misalignment: Duty, Damages, and the Nature of Tort Liability , 121 YALE L.J. 142, 162-64 (2011) (showing how the ordinary duty to exercise reasonable care equitably responds to the problem of irreparable injury).",footnote,footnote,0.9681274900398407,118.0,323.0
michigan_law_review_tort_law_in_a_world_of_scarce_compensatory_resources,"The problem of irreparable injury, which substantively shapes the tort rules of negligence liability and the privilege of self-defense, stems from the scarcity of compensatory resources. This important normative property, however, has not factored into leading theories of tort law.",body_text,text,1.0,129.0,329.0
michigan_law_review_tort_law_in_a_world_of_scarce_compensatory_resources,"140. To be more precise, 'deterrence is not merely influencing conduct, but doing so in a particular way: by creating a prudential reason' not to engage in the conduct. Sandy Steel, Deterrence in Private Law , in PRIVATE LAW AND PRACTICAL REASON: ESSAYS ON JOHN GARDNER'S PRIVATE LAW THEORY 123, 124 (Haris Psarras & Sandy Steel eds., 2023). By incorporating fatal harms into the standard of reasonable care, the negligence rule clearly creates a prudential reason for duty-bearers to avoid engaging in such unreasonable misconduct. 'But reasons are cheap.' Id. at 128. The more interesting question is whether deterrence supplies a decisive reason for formulating the duty in this manner. It does. In the absence of a compensatory remedy for fatal harms, their prevention must be the decisive reason for including them in the duty. Cf. id. at 140 & n.43 (arguing that 'duties to bear a deterrent burden' can be justified 'when we are under a moral duty to bear a burden, and the duty is one of sufficient importance that it may be enforced,' as can occur when 'compensation is not sufficient next best conformity to a duty not wrongfully to harm').",footnote,text,0.8952879581151832,123.0,332.0
michigan_law_review_tort_law_in_a_world_of_scarce_compensatory_resources,"141. See Ariel Porat, Misalignments in Tort Law , 121 YALE L.J. 82, 92 (2011) (emphasis omitted) (explaining why the negligence rule 'will, at least in theory,' only 'provide efficient incentives in all circumstances' if it 'aligns the standard of care with compensable harms').",footnote,text,0.9309090909090909,124.0,333.0
michigan_law_review_tort_law_in_a_world_of_scarce_compensatory_resources,"142. See, e.g. , ROBERT COOTER & THOMAS ULEN, LAW & ECONOMICS 389 (5th ed. 2008) (demonstrating that within the economic analysis of tort law, individuals are indifferent between being injured or otherwise receiving perfect compensation).",footnote,text,0.8085106382978723,125.0,334.0
michigan_law_review_tort_law_in_a_world_of_scarce_compensatory_resources,"For example, Arthur Ripstein defends the corrective-justice interpretation on the ground that compensatory damages as a normative matter 'make it as if the wrong had never happened.' 146 His reasoning is straightforward: 'Although few people would be indifferent between being free of injury and being injured and receiving compensation, adequate compensation can enable a person to have (almost) the same range of options.' 147 Compensatory damages adequately correct for the injustice, eliminating the prevention of bodily injury as a principled concern of substantive tort law. As Ernest Weinrib puts it, '[f]or corrective justice, deterrence plays no role in defining the nature of the wrong.' 148",body_text,text,0.9383050847457627,132.0,336.0
michigan_law_review_tort_law_in_a_world_of_scarce_compensatory_resources,"The failure to account for irreparable injuries also undermines prominent accounts of corrective justice. The thrust of this interpretive approach is that tort liability redresses the wrongdoing of a defendant who violated the plaintiff's correlative tort right. So interpreted, 'tort law 'corrects' the injusticerestores the pre-existing equilibrium-by ordering that the full value of the loss be transferred to the responsible party via a damage payment equal to the value of the loss.' 144 By assuming that compensatory damages are 'equal to the full value of the loss,' these accounts utterly ignore the problem of irreparable injuries and the fundamental importance of preventing those harms in the first instance. 145",body_text,text,0.851963746223565,131.0,337.0
michigan_law_review_tort_law_in_a_world_of_scarce_compensatory_resources,"It is striking how closely this account of corrective justice conforms to our earlier account of tort law under idealized compensatory conditions. Perfectly compensatory damages entirely erase the wrongdoing and fully restore normative equilibrium, in which case there is no further reason to worry about preventing bodily injuries. 149",body_text,text,0.9654178674351584,133.0,338.0
michigan_law_review_tort_law_in_a_world_of_scarce_compensatory_resources,"143. See generally Geistfeld, supra note 135 (developing and defending this interpretation of the negligence rule and showing why it undermines the conventional economic interpretation of tort law).",footnote,footnote,0.9872122762148338,126.0,340.0
michigan_law_review_tort_law_in_a_world_of_scarce_compensatory_resources,"144. John C.P. Goldberg, Twentieth-Century Tort Theory , 91 GEO. L.J. 513, 570 (2003). Although corrective justice scholars disagree about important matters, they agree on this proposition and related matters. Id.",footnote,footnote,0.9761904761904762,127.0,341.0
michigan_law_review_tort_law_in_a_world_of_scarce_compensatory_resources,"146. Ripstein, supra note 61, at 1961.",footnote,footnote,0.9295774647887324,55.0,343.0
michigan_law_review_tort_law_in_a_world_of_scarce_compensatory_resources,"148. Weinrib, supra note 64, at 638.",footnote,footnote,0.9253731343283582,129.0,345.0
michigan_law_review_tort_law_in_a_world_of_scarce_compensatory_resources,149. See supra Section II.B.,footnote,footnote,0.9019607843137255,76.0,346.0
michigan_law_review_tort_law_in_a_world_of_scarce_compensatory_resources,"to have (almost) the same range of options' they had prior to the injury. The damages remedy for these irreparable harms cannot 'make it as if the wrong had never happened.' Rather than rely on the inherently inadequate monetary damages remedy, tort law strives to prevent these irreparable injuries by incorporating their social values into the obligation to exercise reasonable carecontrary to Weinrib's claim that 'deterrence plays no role in defining the nature of the wrong.' The inadequacy of compensatory damages makes deterrence especially valuable. Deterrence is an essential property for understanding tort law that is overlooked by formulations of corrective justice which assume that compensatory damages can always normatively correct for wrongdoing and fully restore normative equilibrium.",body_text,text,0.8544959128065395,134.0,347.0
michigan_law_review_tort_law_in_a_world_of_scarce_compensatory_resources,"The substantive implications of this deterrence reasoning extend beyond the requirements of reasonable care. The foregoing discussion does not rule out the possibility that, in some cases, duty-bearers can reduce their costs by acting negligently and paying (inherently inadequate) compensatory damages instead of complying with a demanding behavioral obligation to exercise reasonable care. To address this problem, the common law relies on punitive remedies.",body_text,text,1.0,135.0,348.0
michigan_law_review_tort_law_in_a_world_of_scarce_compensatory_resources,"To prevent the irreparable injuries of premature death and other physical harms, tort law uses negligence liability as the baseline rule governing accidental injury. This liability rule obligates duty-bearers to act reasonably, thereby prohibiting them from choosing to engage in unreasonably dangerous behaviors in exchange for the payment of (inherently inadequate) damages as compensation for any ensuing (irreparable) harms. A defendant who consciously disregards or intentionally violates the plaintiff's tort right is subject to punishment under both tort law and criminal law.",body_text,text,0.9982847341337907,136.0,350.0
michigan_law_review_tort_law_in_a_world_of_scarce_compensatory_resources,"150. State Farm Mut. Auto. Ins. Co. v. Campbell, 538 U.S. 408, 416 (2003).",footnote,footnote,0.965034965034965,131.0,352.0
michigan_law_review_tort_law_in_a_world_of_scarce_compensatory_resources,"151. See generally A. Mitchell Polinsky & Steven Shavell, Punitive Damages: An Economic Analysis , 111 HARV. L. REV. 869 (1998) (rigorously specifying the deterrence rationale for punitive damages).",footnote,footnote,0.958974358974359,132.0,353.0
michigan_law_review_tort_law_in_a_world_of_scarce_compensatory_resources,"Once again, compensatory resource scarcity elucidates an important normative property of tort law. '[T]he legal culture lacks a full normative account of the relationship between retributive goals and punitive damages.' 153 The defendant's bad-faith rejection of the primary obligation to exercise reasonable care, even when coupled with the payment of compensatory damages for the breach, is reprehensible only because the compensatory damages remedy does not adequately protect the tort right in cases of irreparable injury. This inherent limitation of the compensatory damages remedy stems from the scarcity of compensatory resources and creates a retributive rationale for punitive damages-a property consistent with our earlier finding that perfectly compensatory damages obviate the need to punish injury-causing conduct. 154",body_text,text,0.8962520369364476,138.0,355.0
michigan_law_review_tort_law_in_a_world_of_scarce_compensatory_resources,"Like compensatory damages, punitive damage awards are issued in ordinary money and are also subject to the inherently limited ways in which that medium of exchange can fairly redress wrongdoing. After all, if money were sufficient for retributive purposes, wealthy individuals could intentionally kill or sexually attack others and buy their way out of responsibility by paying monetary damages. These kinds of retributive problems create a complementary role for criminal liability, explaining why 'punitive or exemplary damages have been assessed . . . upon evidence of such [willfulness], recklessness or wickedness, on the part of the party at fault, as amounted to criminality.' ' 155",body_text,text,0.9017798286090969,139.0,357.0
michigan_law_review_tort_law_in_a_world_of_scarce_compensatory_resources,"153. Cass R. Sunstein, Daniel Kahneman & David Schkade, Assessing Punitive Damages (with Notes on Cognition and Valuation in Law) , 107 YALE L.J. 2071, 2085 (1998).",footnote,footnote,0.9627329192546584,134.0,359.0
michigan_law_review_tort_law_in_a_world_of_scarce_compensatory_resources,154. See supra Section II.B.,footnote,footnote,0.9019607843137255,76.0,360.0
michigan_law_review_tort_law_in_a_world_of_scarce_compensatory_resources,"155. Lake Shore & Mich. S. Ry. Co. v. Prentice, 147 U.S. 101, 114-15 (1893) (quoting Hagan v. Providence & Worcester R.R., 3 R.I. 88, 91 (1854)).",footnote,footnote,0.9754385964912281,136.0,361.0
michigan_law_review_tort_law_in_a_world_of_scarce_compensatory_resources,"156. See generally Mark A. Geistfeld, Punitive Damages, Retribution, and Due Process , 81 S. CAL. L. REV. 263 (2008) (showing how punitive damages fully vindicate the rights-violation by first eliminating the expected wrongful gains of the reprehensible behavior, and then by increasing the award in a constitutionally permissible amount to punish the defendant for having reprehensibly rejected the perspective the right requires).",footnote,footnote,0.9790209790209791,137.0,362.0
michigan_law_review_tort_law_in_a_world_of_scarce_compensatory_resources,"Throughout its varied elements, the negligence rule accounts for the important substantive implications flowing from the manner in which scarce compensatory resources lead to the problem of imperfect injury compensation and the concomitant need to prevent these irreparable harms. The resultant, behaviorally demanding standard of reasonable care effectively functions as a rule of no-fault or strict liability in many cases, explaining why one can breach that duty and cause irreparable injury without incurring any obligation beyond the duty to pay (inherently inadequate) compensatory damages. However, when a defendant reprehensibly breaches the duty, the payment of compensatory damages does not adequately correct for the injustice of wrongfully causing irreparable harm. The normative value of preventing these irreparable injuries accordingly justifies punishing the wrongdoer for a bad-faith breach of the duty to exercise reasonable care, warranting awards of punitive damages and, in some cases, the imposition of criminal negligence liability.",body_text,text,1.0,142.0,364.0
michigan_law_review_tort_law_in_a_world_of_scarce_compensatory_resources,"Under conditions of scarce compensatory resources, the problem of irreparable injury justifies prioritizing ex ante prevention over ex post monetary compensation. To do so, tort law must prioritize the right-holder's interest in physical security (the protected object) over the duty-bearer's compensatory obligation and the associated burden on liberty. By justifying a relative interpersonal priority of the individual interest in physical security, the problem of scarce compensatory resources also creates two distinctive rationales for strict liability.",body_text,text,0.996415770609319,143.0,366.0
michigan_law_review_tort_law_in_a_world_of_scarce_compensatory_resources,"157. See GEISTFELD, supra note 20, at 180-91 (showing why duty-bearers who are unable to realistically comply with the objectively defined standard of reasonable care are fairly subject to no-fault or strict liability for creating a nonreciprocal risk that injured a right-holder).",footnote,footnote,0.9587073608617595,138.0,369.0
