document,text,html_label,docling_label,similarity,html_index,pdf_index
harvard_law_review_Background_Principles_And_The_General_Law_Of_Property,"The Takings Clause of the Fifth Amendment provides that when the government takes private property for a public purpose, it must compensate the property owner. 1 One exception to this rule, the 'background principles' exception, establishes that 'the government does not take a property interest when it merely asserts a 'pre-existing limitation upon the land owner's title.'' 2 For instance, if a landowner is creating a nuisance on his property, the government owes him no compensation for forcing him to stop, 'because he never had the right to engage in the nuisance in the first place.' 3 The concept is simple: One cannot lose what was never his. 4",body_text,text,0.9831288343558282,0.0,1.0
harvard_law_review_Background_Principles_And_The_General_Law_Of_Property,"Background principles are a strong medicine. 5 When a court analyzes a takings claim, it must first identify the property interest at issue before deciding the more complex, discretionary question of whether that property was 'taken.' 6 Background principles are 'logically antecedent' to this analysis, 7 meaning that they can foreclose an aggrieved property owner's claim before the first step. 8 If the court determines that, pursuant to a background principle, a plaintiff had no property interest to begin with, the government will completely evade takings liability for its interference with the plaintiff's property. 9 Judges, too, can use background principles to avoid difficult legal and factual questions that may arise later in the takings analysis. 10",body_text,text,0.961892247043364,1.0,2.0
harvard_law_review_Background_Principles_And_The_General_Law_Of_Property,1 U.S. CONST. amend. V.,footnote,footnote,0.782608695652174,0.0,5.0
harvard_law_review_Background_Principles_And_The_General_Law_Of_Property,"3 Id. (citing Lucas , 505 U.S. at 1029 -30 ).",footnote,footnote,0.9195402298850575,2.0,6.0
harvard_law_review_Background_Principles_And_The_General_Law_Of_Property,"2 Cedar Point Nursery v. Hassid, 141 S. Ct. 2063 , 2079 ( 2021 ) (quoting Lucas v. S.C. Coastal Council, 505 U.S. 1003 , 1028 -29 ( 1992 )).",footnote,footnote,0.9597069597069597,1.0,7.0
harvard_law_review_Background_Principles_And_The_General_Law_Of_Property,"4 Cf. James L. Huffman, Background Principles and the Rule of Law: Fifteen Years After Lucas, 35 ECOLOGY L.Q. 1 , 19 ( 2008 ) (arguing that '[t]here is nothing innovative or surprising about' the background principles exception).",footnote,footnote,0.9538461538461539,3.0,8.0
harvard_law_review_Background_Principles_And_The_General_Law_Of_Property,"6 See infra section I.A, pp. 2074 -77 .",footnote,footnote,0.9210526315789473,5.0,9.0
harvard_law_review_Background_Principles_And_The_General_Law_Of_Property,"5 See Robert Meltz, Takings Law Today: A Primer for the Perplexed , 34 ECOLOGY L.Q. 307 , 329 ( 2007 ) (characterizing background principles as 'a big exception' to an otherwise 'categorical takings rule[]').",footnote,footnote,0.9368932038834952,4.0,10.0
harvard_law_review_Background_Principles_And_The_General_Law_Of_Property,"7 Lucas , 505 U.S. at 1027 .",footnote,footnote,0.9259259259259259,6.0,11.0
harvard_law_review_Background_Principles_And_The_General_Law_Of_Property,"9 See, e.g. , Lucas , 505 U.S. at 1030 (citing, inter alia, Bd. of Regents of State Colls. v. Roth, 408 U.S. 564 , 577 ( 1972 )).",footnote,footnote,0.9723320158102767,8.0,12.0
harvard_law_review_Background_Principles_And_The_General_Law_Of_Property,"8 Meltz, supra note 5 , at 353 ('The stakes are high: as a threshold issue, finding that a government restriction merely embodies a background principle ends the taking analysis then and there.'); see also David A. Dana, 'Background Principles' in the Law of Takings , 73 AM. U. L. REV. 1789 , 1812 ( 2024 ) (observing that 'state and lower federal cases' provide 'very little explanation . . . as to why the court accept[ed] or reject[ed] a . . . source as creating a background limitation').",footnote,footnote,0.9520897043832823,7.0,13.0
harvard_law_review_Background_Principles_And_The_General_Law_Of_Property,"10 See Michael C. Blumm & Lucus Ritchie, Lucas 's Unlikely Legacy: The Rise of Background Principles as Categorical Takings Defenses , 29 HARV. ENV'T L. REV. 321 , 328 ( 2005 ) ('The rise of categorical background principles defenses seems to have appealed to lower courts, perhaps because it allows judges to resolve cases without having to employ detailed factual analysis.').",footnote,footnote,0.9386666666666666,9.0,14.0
harvard_law_review_Background_Principles_And_The_General_Law_Of_Property,"the Takings Clause with widely understood principles of property law. 11 Indeed, the case that introduced the background principles exception Lucas v. South Carolina Coastal Council 12 featured prominently the notion that property owners are on notice of background limitations . 13 In Lucas , Justice Scalia explained that background principles, like all property rights under the Takings Clause, are rooted in state-specific law. 14 By locating background principles in state law, Lucas ensured that takings law reflects property owners' actual expectations. 15",body_text,text,0.8816521048451151,2.0,15.0
harvard_law_review_Background_Principles_And_The_General_Law_Of_Property,"But despite its potential, background principles jurisprudence has long remained underdetermined. 16 Scholars and courts have struggled with questions as basic as what counts as a background principle 17 and what rationale justifies the exception. 18 Notwithstanding these open questions, one deeply rooted feature of takings law has provided some degree of determinacy for the exception over the last several decades: the courts' consistent use of state-specific law to define property interests. 19 But recently, even this fixture has come into flux.",body_text,text,0.9945454545454545,3.0,16.0
harvard_law_review_Background_Principles_And_The_General_Law_Of_Property,"11 See, e.g. , Dana, supra note 8 , at 1808 ('Justice Scalia's plurality opinion in Lucas hints at the idea that citizens' actual or constructive notice of background limitations is what makes them legitimate restrictions on private property rights.').",footnote,footnote,0.9740518962075848,10.0,19.0
harvard_law_review_Background_Principles_And_The_General_Law_Of_Property,"13 See, e.g. , Dana, supra note 8 , at 1808 (quoting Lucas , 505 U.S. at 1027 ).",footnote,footnote,0.9548387096774194,12.0,20.0
harvard_law_review_Background_Principles_And_The_General_Law_Of_Property,12 505 U.S. 1003 ( 1992 ).,footnote,footnote,0.8979591836734694,11.0,21.0
harvard_law_review_Background_Principles_And_The_General_Law_Of_Property,"14 Lucas , 505 U.S. at 1027 (quoting Pa. Coal Co. v. Mahon, 260 U.S. 393 , 413 ( 1922 )).",footnote,footnote,0.9595375722543352,13.0,22.0
harvard_law_review_Background_Principles_And_The_General_Law_Of_Property,"15 See id. (noting that 'the property owner necessarily expects' the state to occasionally impose limitations on 'the uses of his property' through the 'legitimate exercise of its police powers'); cf. Maureen E. Brady, The Illusory Promise of General Property Law , 132 YALE L.J.F. 1010 , 1048 -49 ( 2023 ) (criticizing the 'unpredictability of a general-law approach' that deems litigants to be 'on notice,' id. at 1048 , of property interests in 'every jurisdiction's law,' id. at 1049 ).",footnote,footnote,0.8004115226337448,14.0,23.0
harvard_law_review_Background_Principles_And_The_General_Law_Of_Property,"17 See, e.g. , Meltz, supra note 5 , at 353 ('Much ink has been spilled over what qualifies as a background principle, beyond the certainty that common law nuisance is included.'); Dana, supra note 8 , at 1856 (criticizing 'the courts' and especially the U.S. Supreme Court's failure to explain how they have decided and will decide questions regarding background limitations on title').",footnote,footnote,0.9431524547803618,16.0,24.0
harvard_law_review_Background_Principles_And_The_General_Law_Of_Property,"16 See, e.g. , Dana, supra note 8 , at 1806 -07 ('The problem . . . is that the Supreme Court and other courts have done little to clarify what is and is not a valid background limitation.'); Michael C. Blumm & Rachel G. Wolfard, Revisiting Background Principles in Takings Litigation , 71 FLA. L. REV. 1165 , 1169 ( 2019 ) ('What constitutes a valid background principles defense has proved to be a contentious and unsettled question over a quarter-century later.'); Meltz, supra note 5 , at 354 ('The Supreme Court has not spoken at length on the meaning of background principles since Lucas .').",footnote,footnote,0.9662731871838112,15.0,25.0
harvard_law_review_Background_Principles_And_The_General_Law_Of_Property,"18 See generally, e.g. , Dana, supra note 8 (identifying 'three possible rationales for the background principles exception,' id. at 1789 ).",footnote,footnote,0.9675090252707581,17.0,26.0
harvard_law_review_Background_Principles_And_The_General_Law_Of_Property,"20 Brady, supra note 15 , at 1014 (emphasis omitted).",footnote,footnote,0.9615384615384616,19.0,27.0
harvard_law_review_Background_Principles_And_The_General_Law_Of_Property,19 See sources cited infra note 80 .,footnote,footnote,0.9428571428571428,18.0,28.0
harvard_law_review_Background_Principles_And_The_General_Law_Of_Property,21 Id. at 1010 ; see also id. at 1015 (observing that the Supreme Court has increasingly 'relied on something approximating a general law of property in conducting takings analyses').,footnote,footnote,0.978021978021978,20.0,29.0
harvard_law_review_Background_Principles_And_The_General_Law_Of_Property,"shift. 22 Some have argued that the recent general law cases 'make[] a considerable amount of sense normatively and practically' 23 because, among other things, they show that the Court systematically departs from state-specific law to prevent states from circumventing the Takings Clause by simply extinguishing a property interest. 24 This argument trades on the tendency for general law interventions in an anticircumvention posture to protect, rather than undercut, property rights.",body_text,text,0.7671232876712328,4.0,30.0
harvard_law_review_Background_Principles_And_The_General_Law_Of_Property,"But that is only part of the story. A full examination of the ascent of general property law must also account for the recent emergence of general law background principles. Background principles found in the general law, rather than in state-specific law, complicate the dialogue around general property law because they serve as a basis for denials of otherwise viable takings claims. Yet many discussions of the sea change in constitutional property overlook the potentially problematic interaction between general property law and background principles. 25",body_text,text,0.9991063449508489,5.0,31.0
harvard_law_review_Background_Principles_And_The_General_Law_Of_Property,"This Note fills that gap by demonstrating that the collision of ascendant general property law and the background principles exception could ultimately cause the Takings Clause to underprotect property interests. Part I provides background on the law of takings and describes the development of background principles jurisprudence. Next, Part II tracks the Court's recent shift toward a general law approach to property. Finally, Part III challenges the intuition that federal courts primarily apply general law to protect property rights, for example by preventing a state from 'extinguish[ing] a property interest . . . to avoid paying just compensation.' 26 To do so, it examines two recent cases 27 in the federal circuit courts that denied takings claims based on general law background principles. The general law approach may systematically underprotect property rights by increasing the level of generality",body_text,text,0.8885630498533724,6.0,32.0
harvard_law_review_Background_Principles_And_The_General_Law_Of_Property,"22 See id. at 1015 . See generally Eric R. Claeys, Takings and Choice of Law After Tyler v. Hennepin County, 20 J.L. ECON. & POL'Y (forthcoming 2025 ), https://ssrn.com/abstract= 5084825 [https://perma.cc/ 4 X 4 H7 H 6 Q].",footnote,footnote,0.9354838709677419,21.0,34.0
harvard_law_review_Background_Principles_And_The_General_Law_Of_Property,"24 See id. (manuscript at 3) (quoting Tyler v. Hennepin County, 143 S. Ct. 1369 , 1375 ( 2023 )).",footnote,footnote,0.968421052631579,23.0,35.0
harvard_law_review_Background_Principles_And_The_General_Law_Of_Property,"23 Claeys, supra note 22 (manuscript at 2).",footnote,footnote,0.9647058823529412,22.0,36.0
harvard_law_review_Background_Principles_And_The_General_Law_Of_Property,"25 This Note engages with a few recent treatments of the background principles exception and its intersection with general property law. See Brady, supra note 15 , at 1047-48 (noting that cases involving general-law background principles 'illustrate the unpredictability of a general-law approach,' id. at 1048 , and 'elide the question' of what counts as a background principle, id. at 1047 ); Timothy M. Mulvaney, Reconceptualizing 'Background Principles' in Takings Law , 109 MINN. L. REV. 689 , 735 ( 2024 ) (arguing that the ascendant general law approach to statutory background principles serves to 'conceal . . . decidedly moral judgments'); Dana, supra note 8 , at 1814-49 (developing three conceptions of background principles).",footnote,footnote,0.8548057259713702,24.0,37.0
harvard_law_review_Background_Principles_And_The_General_Law_Of_Property,"27 Slaybaugh v. Rutherford County, 114 F. 4 th 593 ( 6 th Cir. 2024 ); Baker v. City of McKinney, 84 F. 4 th 378 ( 5 th Cir. 2023 ).",footnote,footnote,0.9486166007905138,26.0,38.0
harvard_law_review_Background_Principles_And_The_General_Law_Of_Property,"26 Tyler , 143 S. Ct. at 1379 (citing Phillips v. Wash. Legal Found., 524 U.S. 156 , 167 ( 1998 )); see also Claeys, supra note 22 (manuscript at 14 -15 ). See generally id. (concluding that courts 'consult the 'common law' understood in the broad sense,' id. (manuscript at 34) , when they suspect that a state has manipulated property rights such that the 'federal right' protected by the Takings Clause has been 'convert[ed] . . . into a dead letter,' id. (manuscript at 32)) .",footnote,footnote,0.9421661409043113,25.0,39.0
harvard_law_review_Background_Principles_And_The_General_Law_Of_Property,"This Part starts by providing a brief overview of the law of takings. After establishing that context, it discusses the development of the background principles exception.",body_text,text,1.0,7.0,42.0
harvard_law_review_Background_Principles_And_The_General_Law_Of_Property,"The background principles exception is best understood in the context of the Takings Clause's basic analytical framework. Claims arising under the Takings Clause follow two steps. First, courts discern the property interest at stake. 28 Second, they analyze whether that property was 'taken.' 29 This analysis proceeds differently depending on the type of government action underlying the claim.",body_text,text,0.9746192893401016,8.0,44.0
harvard_law_review_Background_Principles_And_The_General_Law_Of_Property,"There are two principal types of government action that can result in a taking. First, physical takings occur when the government physically appropriates or invades private property 30 for example, by using the eminent domain power to seize land for a public road. Second, regulatory takings occur when the government interferes with property interests through its legislative power 31 for example, by passing a zoning ordinance. Not all regulations result in takings. After all, the '[g]overnment hardly could go on if' it had to pay for every interference with property rights. 32 Instead, only 'regulations [that] go[] too far . . . will be recognized as . . . taking[s].' 33",body_text,text,0.9011799410029498,9.0,45.0
harvard_law_review_Background_Principles_And_The_General_Law_Of_Property,"28 Meltz, supra note 5 , at 317 ('[W]hether the plaintiff has alleged a Takings Clause-recognized property interest is the key threshold substantive inquiry in a taking case.').",footnote,footnote,0.9772727272727273,27.0,48.0
harvard_law_review_Background_Principles_And_The_General_Law_Of_Property,30 Id. at 328 (recognizing 'formal appropriation of property and physical invasion thereof' as the classic takings).,footnote,footnote,0.9696969696969697,29.0,49.0
harvard_law_review_Background_Principles_And_The_General_Law_Of_Property,"29 See id. at 310 . There is also a third inquiry, though it is not relevant for this Note: '[H]ow much compensation should the property owner receive?' Id.",footnote,footnote,0.9741935483870968,28.0,50.0
harvard_law_review_Background_Principles_And_The_General_Law_Of_Property,"32 Pa. Coal Co. v. Mahon, 260 U.S. 393 , 413 ( 1922 ).",footnote,footnote,0.9423076923076923,30.0,53.0
harvard_law_review_Background_Principles_And_The_General_Law_Of_Property,"34 See, e.g. , John A. Humbach, The Takings Clause and the Separation of Powers: An Essay , 21 PACE ENV'T L. REV. 3 , 8 ( 2003 ) ('For most of the twentieth century, however, the takings clause has led very much of a dual existence constituting a straightforward compensation requirement for cases of physical invasions of private property while also vaguely promising a possibility of compensation, under ill-defined circumstances, when the government affects property values by regulation .').",footnote,footnote,0.9624365482233502,31.0,55.0
harvard_law_review_Background_Principles_And_The_General_Law_Of_Property,"The Supreme Court has responded to these concerns with several efforts to guide judicial discretion in regulatory takings cases. 37 The first major effort arrived in Penn Central Transportation Co. v. New York City , 38 which instructed courts to use a three-factor balancing test to analyze regulatory takings claims. 39 But even with Penn Central 's added guidance, the law of regulatory takings continued to be criticized as being unduly vague. 40 Indeed, the Supreme Court has 'generally eschewed any 'set formula' for determining how far is too far,' instead 'preferring to 'engag[e] in . . . essentially ad hoc, factual inquiries.'' 41 Still, continuing its effort to bring certainty to regulatory takings law, the Court has developed two types of categorical, or 'per se,' takings instances where a court could hold a regulation to be a taking without resorting to the unpredictable Penn Central analysis. 42",body_text,text,0.9473684210526315,11.0,57.0
harvard_law_review_Background_Principles_And_The_General_Law_Of_Property,"First, a regulation that 'denies all economically beneficial or productive use of land' is a categorical taking. 43 In Lucas , the first case to recognize this rule, South Carolina passed a coastal protection law that prohibited David Lucas from building houses on his waterfront property. 44 Analyzing the regulation, the Lucas Court recognized the new per se rule that a state could take property by regulating its economic value down to nothing. 45 Having established the new per se rule, the Court remanded the case for the state court to determine, as a matter",body_text,text,0.8482549317147192,12.0,58.0
harvard_law_review_Background_Principles_And_The_General_Law_Of_Property,"35 See, e.g. , Mark Fenster, The Stubborn Incoherence of Regulatory Takings , 28 STAN. ENV'T L.J. 525 , 528 ( 2009 ) (observing that, among other things, 'doctrinal indeterminacy ha[s] always driven regulatory takings litigation and theory').",footnote,footnote,0.9456066945606695,32.0,60.0
harvard_law_review_Background_Principles_And_The_General_Law_Of_Property,"37 Meltz, supra note 5 , at 328 (observing the Court's 'effort, continuing today, to articulate a coherent body of rules or guidelines for determining which government regulations require compensation under the Takings Clause and which do not').",footnote,footnote,0.9713114754098361,34.0,61.0
harvard_law_review_Background_Principles_And_The_General_Law_Of_Property,"36 See, e.g. , Murr v. Wisconsin, 137 S. Ct. 1933 , 1943 ( 2017 ) ('A central dynamic of the Court's regulatory takings jurisprudence, then, is its flexibility.').",footnote,footnote,0.9595015576323987,33.0,62.0
harvard_law_review_Background_Principles_And_The_General_Law_Of_Property,38 438 U.S. 104 ( 1978 ).,footnote,footnote,0.8936170212765957,35.0,63.0
harvard_law_review_Background_Principles_And_The_General_Law_Of_Property,"40 See, e.g. , Maureen E. Brady, Essay, Penn Central Squared: What the Many Factors of Murr v. Wisconsin Mean for Property Federalism , 166 U. PA. L. REV. ONLINE 53 , 54 -55 ( 2017 ) (' Penn Central has been maligned by property scholars and the Court alike; it has been called a source of 'confusion,' the cause of 'protracted litigation and arbitrary outcomes,' and even 'disastrous.'' (footnotes omitted) (quoting Jed Rubenfeld, Usings , 102 YALE L.J. 1077 , 1089 ( 1993 ); Steven J. Eagle, The Four-Factor Penn Central Regulatory Takings Test , 118 PENN ST. L. REV. 601 , 605 ( 2014 ); Richard A. Epstein, Bundle-of-Rights Theory as a Bulwark Against Statist Conceptions of Private Property , 8 ECON J. WATCH 223 , 226 ( 2011 ))).",footnote,footnote,0.8908839779005525,36.0,65.0
harvard_law_review_Background_Principles_And_The_General_Law_Of_Property,"41 Lucas v. S.C. Coastal Council, 505 U.S. 1003 , 1015 ( 1992 ) (alterations in original) (quoting Penn Central , 438 U.S. at 124).",footnote,footnote,0.9727626459143969,37.0,66.0
harvard_law_review_Background_Principles_And_The_General_Law_Of_Property,42 See id. (identifying 'two discrete categories of regulatory action as compensable without casespecific inquiry into the public interest advanced in support of the restraint').,footnote,footnote,0.9775280898876404,38.0,67.0
harvard_law_review_Background_Principles_And_The_General_Law_Of_Property,44 Id. at 1006 -07 (citing S.C. CODE ANN. § 48 -39 -280 ( Supp. 1990) ).,footnote,footnote,0.855072463768116,40.0,68.0
harvard_law_review_Background_Principles_And_The_General_Law_Of_Property,"43 Id. (citing, inter alia, Agins v. City of Tiburon, 447 U.S. 255 , 260 ( 1980 )).",footnote,footnote,0.9629629629629629,39.0,69.0
harvard_law_review_Background_Principles_And_The_General_Law_Of_Property,"Second, regulations resulting in 'a physical 'invasion' of . . . property' are categorical takings. 47 This rule traces back to Loretto v. Teleprompter Manhattan CATV Corp. , 48 which held that permanent physical invasions through regulations for example, the required installation of cable equipment in an apartment building 49 are categorical takings. 50 Recently, in Cedar Point Nursery v. Hassid , 51 the Court broadened Loretto by establishing that 'it is a per se taking whenever the government authorizes an involuntary entry to land,' regardless of whether that invasion is permanent or temporary. 52",body_text,text,0.9488448844884488,13.0,72.0
harvard_law_review_Background_Principles_And_The_General_Law_Of_Property,"Cedar Point had the potential to provide greater clarity to the law of takings by expanding per se takings rules and therefore limiting the reach of Penn Central 's ad hoc balancing test. To this end, the Cedar Point Court swept some regulations into the realm of physical takings, bringing a greater class of legislation into the ambit of categorical rules. 53 An access-permitting regulation can now be a per se taking regardless of whether it is partial or absolute, temporary or permanent, minute or substantial. 54",body_text,text,0.9951690821256038,14.0,73.0
harvard_law_review_Background_Principles_And_The_General_Law_Of_Property,48 458 U.S. 419 ( 1982 ).,footnote,footnote,0.8936170212765957,42.0,77.0
harvard_law_review_Background_Principles_And_The_General_Law_Of_Property,"47 Id. at 1015 ; see also Loretto v. Teleprompter Manhattan CATV Corp., 458 U.S. 419 , 438 -39 ( 1982 ); Cedar Point Nursery v. Hassid, 141 S. Ct. 2063 , 2074 ( 2021 ).",footnote,footnote,0.9602446483180428,41.0,78.0
harvard_law_review_Background_Principles_And_The_General_Law_Of_Property,49 See id. at 438 (recognizing regulatory requirement to install cables on building as a taking).,footnote,footnote,0.9844559585492227,43.0,79.0
harvard_law_review_Background_Principles_And_The_General_Law_Of_Property,51 141 S. Ct. 2063 ( 2021 ).,footnote,footnote,0.9056603773584906,45.0,80.0
harvard_law_review_Background_Principles_And_The_General_Law_Of_Property,"50 Id. at 434 -35 (focusing on the 'constitutional distinction between a permanent occupation and a temporary physical invasion,' id. at 434 (emphasis added)).",footnote,footnote,0.9683544303797469,44.0,81.0
harvard_law_review_Background_Principles_And_The_General_Law_Of_Property,"52 Bethany R. Berger, Eliding Original Understanding in Cedar Point Nursery v. Hassid, 33 YALE J.L. & HUMANS. 307 , 309 ( 2022 ); see Cedar Point , 141 S. Ct. at 2074 .",footnote,footnote,0.9272727272727272,46.0,82.0
harvard_law_review_Background_Principles_And_The_General_Law_Of_Property,"54 See id. at 275 -76 (arguing that ' Cedar Point transforms 'appropriation' into a standard with no clear or predictable class of applications[,] . . . without mooring in shared lay or legal expectations' and that, as a result, '[p]otential litigants can no longer safely predict' outcomes).",footnote,footnote,0.9225473321858864,48.0,83.0
harvard_law_review_Background_Principles_And_The_General_Law_Of_Property,"53 Cf. Aziz Z. Huq, Property Against Legality: Takings After Cedar Point, 109 VA. L. REV. 233 , 276 ( 2023 ) (arguing that Cedar Point 's treatment of a regulation as an appropriation could result in 'the category of appropriation . . . expand[ing] to the point of collapsing the category of regulatory takings').",footnote,footnote,0.9662921348314607,47.0,84.0
