document,text,html_label,docling_label,similarity,html_index,pdf_index
michigan_law_review_good_cause_for_goodness_sake_a_new_approach_to_notice_and_comment_rulemaking,"60. Jason Webb Yackee & Susan Webb Yackee, Administrative Procedures and Bureaucratic Performance: Is Federal Rule-Making 'Ossified'? , 20 J. PUB. ADMIN. RSCH. & THEORY 261 (2010). Over 57% of public comments came from business interests in a 2006 study. Jason Webb Yackee & Susan Webb Yackee, A Bias Towards Business? Assessing Interest Group Influence on the U.S. Bureaucracy , 68 J. POL. 128, 133 (2006).",footnote,footnote,0.948019801980198,51.0,135.0
michigan_law_review_good_cause_for_goodness_sake_a_new_approach_to_notice_and_comment_rulemaking,"Shepherd, supra note 24, at 1635.",footnote,list_item,1.0,53.0,137.0
michigan_law_review_good_cause_for_goodness_sake_a_new_approach_to_notice_and_comment_rulemaking,"FACArequires Membership Balance Plans (a document an agency must submit to the General Services Administration to demonstrate its intent to select a balanced and diverse slate of members) only for discretionary committees, but the majority of federal advisory committees are non-discretionary because of the procedural hurdles required to charter a discretionary committee. MEGHAN M. STUESSY & KATHLEEN E. MARCHSTEINER, CONG. RSCH. SERV., R47984, THE FEDERALADVISORY COMMITTEEACT(FACA):OVERVIEWAND CONSIDERATIONSFORCONGRESS 5, 14-15 (2024).",footnote,list_item,0.7794117647058824,54.0,138.0
michigan_law_review_good_cause_for_goodness_sake_a_new_approach_to_notice_and_comment_rulemaking,Discussed supra in Section I.B.,footnote,list_item,1.0,55.0,139.0
michigan_law_review_good_cause_for_goodness_sake_a_new_approach_to_notice_and_comment_rulemaking,"See The Ezra Klein Show, supra note 53, at 2:39.",footnote,list_item,1.0,56.0,140.0
michigan_law_review_good_cause_for_goodness_sake_a_new_approach_to_notice_and_comment_rulemaking,"Bagley, supra note 53, at 345.",footnote,list_item,1.0,57.0,141.0
michigan_law_review_good_cause_for_goodness_sake_a_new_approach_to_notice_and_comment_rulemaking,See supra Section I.A.2.,footnote,list_item,1.0,58.0,142.0
michigan_law_review_good_cause_for_goodness_sake_a_new_approach_to_notice_and_comment_rulemaking,"[T]he outsize participation of industry groups in notice and comment means that agencies will have a wealth of information at their disposal about the costs of agency rules and why, given certain facts about the industry, they won't accomplish very much. As Tom McGarity and Ruth Ruttenberg have shown, 'industry cost estimates have usually been high, sometimes by orders of magnitude, when compared to actual costs incurred.' In contrast, regulatory beneficiaries often lack the resources, the technical know-how, and the industry-specific knowledge to contradict those estimates, leaving agencies to do the best they can with the information they have. 69",body_text,text,0.8753351206434317,35.0,144.0
michigan_law_review_good_cause_for_goodness_sake_a_new_approach_to_notice_and_comment_rulemaking,"Bagley here is in direct dialogue with advocates for notice and comment, who would posit that '[a]n agency's public proposal of a rule and acceptance of public comment prior to issuing the final rule can help us view the agency decision as democratic and thus essentially self-legitimating.' 70",body_text,text,0.9339774557165862,36.0,145.0
michigan_law_review_good_cause_for_goodness_sake_a_new_approach_to_notice_and_comment_rulemaking,68. See supra Section II.B.,footnote,footnote,0.92,59.0,147.0
michigan_law_review_good_cause_for_goodness_sake_a_new_approach_to_notice_and_comment_rulemaking,"69. Bagley, supra note 53, at 364 (quoting Thomas O. McGarity & Ruth Ruttenberg, Counting the Cost of Health, Safety, and Environmental Regulation , 80 TEX. L. REV. 1997, 1998 (2002)).",footnote,footnote,0.9641873278236914,60.0,148.0
michigan_law_review_good_cause_for_goodness_sake_a_new_approach_to_notice_and_comment_rulemaking,"70. Mendelson, supra note 47, at 1343.",footnote,footnote,0.9444444444444444,61.0,149.0
michigan_law_review_good_cause_for_goodness_sake_a_new_approach_to_notice_and_comment_rulemaking,71. As discussed supra in Section II.B.,footnote,footnote,0.9459459459459459,62.0,150.0
michigan_law_review_good_cause_for_goodness_sake_a_new_approach_to_notice_and_comment_rulemaking,72. As discussed supra in Section II.A.,footnote,footnote,0.9459459459459459,63.0,151.0
michigan_law_review_good_cause_for_goodness_sake_a_new_approach_to_notice_and_comment_rulemaking,"Nested in section 553 of the APA is a tactic rarely discussed in notice-andcomment legal scholarship. Good cause rulemaking refers to the exception articulated in the APA that allows an agency to forgo notice and comment 'when the agency for good cause finds . . . that notice and public procedure thereon are impracticable, unnecessary, or contrary to the public interest.' 75 The exception has been invoked and litigated in a number of lower court cases, 76 but the exact meaning of 'impracticable, unnecessary, or contrary to the public interest' has not been addressed by the Supreme Court, 77 leaving it unclear exactly when agencies can use the good cause exception. 78 Given the challenges with notice and comment, the issue seems ripe for review. However, even if the Court does not take up this question directly, there is room for agencies to rely more heavily on good cause rulemaking. They should combine the good cause exception with tools of public engagement that are less cumbersome and flawed than notice and comment to demonstrate to the courts that they are attempting to bypass not the purpose of notice and comment but instead the flawed process itself. A twofold approach-good cause rulemaking combined with practicable, modern means of public engagement-has a chance of surviving judicial scrutiny.",body_text,text,0.7716303708063567,38.0,155.0
michigan_law_review_good_cause_for_goodness_sake_a_new_approach_to_notice_and_comment_rulemaking,"Is Congress Broken? Because the Other Branches Are Doing Its Job , POLITICO (May 19, 2022, at 04:30 ET), https://www.politico.com/news/magazine/2022/05/19/supreme-court-activistslose-congress-00033478 [perma.cc/2WSF-9BX9]; see also Moira Warburton, WhyCongress Is Becoming Less Productive , REUTERS (Mar. 12, 2024), https://www.reuters.com/graphics/USACONGRESS/PRODUCTIVITY/egpbabmkwvq [perma.cc/78W6-AKCE]; Norman Ornstein & Thomas E. Mann, The Broken Branch: How Congress Is Failing America and How to Get It Back on Track , BROOKINGS (June 27, 2006), https://www.brookings.edu/articles/the-broken-branchhow-congress-is-failing-america-and-how-to-get-it-back-on-track [perma.cc/Z9MB-S8YE]. Expanding hiring authority seems a particularly unlikely move for the Trump Administration to support as a means to improve the notice-and-comment process, given its overall approach to 'government efficiency.' See Implementing the President's 'Department of Government Efficiency' Workforce Optimization Initiative , THE WHITE HOUSE (Feb. 11, 2025), https://www.whitehouse.gov/presidential-actions/2025/02/implementing-the-presidents-department-of-government-efficiency-workforce-optimization-initiative [perma.cc/37JX-YT4G] ('[T]he Director of the Office of Management and Budget shall submit a plan to reduce the size of the Federal Government's workforce through efficiency improvements and attrition (Plan). The Plan shall require that each agency hire no more than one employee for every four employees that depart, consistent with the plan and any applicable exemptions and details provided for in the Plan.').",footnote,text,0.7854088050314465,65.0,156.0
michigan_law_review_good_cause_for_goodness_sake_a_new_approach_to_notice_and_comment_rulemaking,75. 5 U.S.C. § 553(b)(B).,footnote,text,0.9130434782608695,66.0,157.0
michigan_law_review_good_cause_for_goodness_sake_a_new_approach_to_notice_and_comment_rulemaking,"76. See, e.g. , United States v. Brewer, 766 F.3d 884, 887-90 (8th Cir. 2014); United States v. Johnson, 632 F.3d 912, 927-30 (5th Cir. 2011); United States v. Gould, 568 F.3d 459, 469-70 (4th Cir. 2009); Buschmann v. Schweiker, 676 F.2d 352, 356-58 (9th Cir. 1982); Am. Fed'n of Gov't Emps. v. Block, 655 F.2d 1153, 1155-59 (D.C. Cir. 1981); U.S. Steel Corp. v. EPA, 605 F.2d 283, 286-90 (7th Cir. 1979).",footnote,text,0.9267080745341615,67.0,158.0
michigan_law_review_good_cause_for_goodness_sake_a_new_approach_to_notice_and_comment_rulemaking,77. There are a handful of cases where the Court approaches but declines to directly address the contours of the good cause exception. This case law is discussed infra in Section III.C.,footnote,text,0.9890710382513661,68.0,159.0
michigan_law_review_good_cause_for_goodness_sake_a_new_approach_to_notice_and_comment_rulemaking,"78. See COLE, supra note 10, at 1 n.4 (referring to the 'apparent circuit split' and the possibility that the Supreme Court might weigh in but has yet to do so).",footnote,text,0.9559748427672956,69.0,160.0
michigan_law_review_good_cause_for_goodness_sake_a_new_approach_to_notice_and_comment_rulemaking,"The notice-and-comment process has become a cumbersome, unreliable, and inequitable process. It is thus in agencies' interests to use the good cause exception alongside other methods of public engagement to justify bypassing notice and comment. Although the Ninth Circuit has held that the exception was not created to bypass notice and comment, it did so without considering the practical challenges outlined in this Note, many of which were less prevalent or apparent in 1992 when the Ninth Circuit made that observation. 79 Further, some courts have found that agencies can invoke good cause when engaging in standard notice and comment would undermine the underlying statute's purpose. 80 This jurisprudence is relevant in that notice and comment as it currently exists undermines the purpose of the APA itself-to engage the entire public-because it privileges some parties over others and may even go so far as to dissuade agencies from rulemaking at all because of the procedural burden. 81",body_text,text,0.8382867132867133,39.0,162.0
michigan_law_review_good_cause_for_goodness_sake_a_new_approach_to_notice_and_comment_rulemaking,"See id. at 8 (citing Riverbend Farms, Inc. v. Madigan, 958 F.2d 1479, 1487 (9th Cir. 1992)).",footnote,list_item,1.0,70.0,164.0
michigan_law_review_good_cause_for_goodness_sake_a_new_approach_to_notice_and_comment_rulemaking,"Id. (citing Nader v. Sawhill, 514 F.2d 1064, 1068 (Temp. Emer. Ct. App. 1975)).",footnote,list_item,1.0,71.0,165.0
michigan_law_review_good_cause_for_goodness_sake_a_new_approach_to_notice_and_comment_rulemaking,"Expanding rulemaking was a primary purpose of the APA, if not to expand regulatory authority. See Cass, supra note 4, at 690-95.",footnote,list_item,0.9921875,72.0,166.0
michigan_law_review_good_cause_for_goodness_sake_a_new_approach_to_notice_and_comment_rulemaking,"See, e.g. , Riverbend Farms, Inc. v. Madigan, 958 F.2d 1479, 1487 (9th Cir. 1992).",footnote,list_item,0.9938650306748467,73.0,167.0
michigan_law_review_good_cause_for_goodness_sake_a_new_approach_to_notice_and_comment_rulemaking,"PUBLIC PARTICIPATION IN THE REGULATORY PROCESS (2024), https://bidenwhitehouse.archives.gov/wp-content/uploads/2024/08/OIRA-2024-Public-Participation-Report.pdf [perma.cc/4RLK-X6MC]. This report identifies a number of practices done alongside notice and comment but acknowledges that 'there are factors that may limit the effectiveness of an agency's efforts to encourage public participation, particularly through public comments .' Id. at 5 (emphasis added).",footnote,footnote,0.8273092369477911,74.0,169.0
michigan_law_review_good_cause_for_goodness_sake_a_new_approach_to_notice_and_comment_rulemaking,"Agencies should engage the public in a meaningful and impactful way from the bottom up. The Biden Administration's approach had three primary elements: (1) broad publicity, 87 (2) listening sessions, town hall meetings, and tribal consultations, and (3) ongoing engagement during implementation. 88 The first of these prongs, broad publicity, 'used a variety of approaches to raise awareness and encourage input,' 89 reaching a far broader audience than a publication of notice in the Federal Register. The Biden White House and its executive agencies took a modern approach to publicity, using social media posts and websites dedicated to the review of specific rules and regulations alongside direct stakeholder outreach. 90 Critically, this direct outreach, to be implemented in place of notice and comment, should cover a wide swath of relevant interests, reaching community members outside traditional business interests who might be impacted by the rule under consideration. A varied approach to publicity (which could include field visits to community and faith centers, schools, local nonprofits, etc.) would reach stakeholders beyond those",body_text,text,0.8657056145675266,42.0,172.0
michigan_law_review_good_cause_for_goodness_sake_a_new_approach_to_notice_and_comment_rulemaking,"84. This Note recommends that all agencies take this approach in all instances of informal rulemaking. If an agency were to implement this approach only on rules they anticipate being particularly controversial, this could give the impression that the agency is trying to avoid true public participation rather than merely address the impracticability of notice and comment.",footnote,footnote,0.9946236559139785,75.0,173.0
michigan_law_review_good_cause_for_goodness_sake_a_new_approach_to_notice_and_comment_rulemaking,"85. To clarify, although this Note suggests that 'notice and comment' is the problem, the issues identified here are all related to the comment half of the process. There is no reason why an agency should not continue to comply with the notice half of its obligations under the APA, nor does this Note argue as much.",footnote,footnote,0.9299363057324841,76.0,174.0
michigan_law_review_good_cause_for_goodness_sake_a_new_approach_to_notice_and_comment_rulemaking,"87. If an agency decided that the notice half of notice and comment is similarly impracticable, this element of the Biden Administration's strategy could replace it.",footnote,footnote,0.9815950920245399,78.0,176.0
michigan_law_review_good_cause_for_goodness_sake_a_new_approach_to_notice_and_comment_rulemaking,"91. See Biden-Harris Administration Delivering on Promise to Connect Everyone in America to Reliable High-Speed Internet Service , U.S. DEP'T OF COM.: BLOG (Sep. 27, 2024), https://www.commerce.gov/news/blog/2024/09/biden-harris-administration-deliveringpromise-connect-everyone-america-reliable [perma.cc/HA92-6C6W] ('The Biden-Harris Administration's Internet for All initiative is delivering on its promise to connect everyone in America to affordable, reliable high-speed Internet service by 2030. Since the President took office, more than 2.4 million previously unserved homes and small businesses have been connected to high-speed Internet service.').",footnote,footnote,0.9725609756097561,80.0,183.0
michigan_law_review_good_cause_for_goodness_sake_a_new_approach_to_notice_and_comment_rulemaking,"The final prong, ongoing engagement during implementation, has obvious benefits, although it does not directly correspond with any requirement under traditional notice and comment. The Biden Administration approached this prong as an opportunity to meet with 'community organizations and data users to discuss the various changes . . . and to ensure that stakeholders understand' how a new rule or regulation works. 96 These engagement efforts could mirror the listening sessions, town halls, and direct outreach that take place during rulemaking. But instead of providing feedback on the rule, stakeholders provide feedback on the process itself, creating a more iterative public participation mechanism than notice and comment. Ongoing engagement after a rule is finalized helps facilitate buy-in and commitment from those stakeholders who were engaged during the rulemaking process, which encourages them to continue engaging meaningfully in future rulemakings. Continued engagement with stakeholders after a rule is finalized and during its implementation stage could also help an agency demonstrate to a court its intent to fulfill the APA's original purpose and prove that these new processes are not meant solely to make the rulemakers' lives simpler. Although this step seems unnecessary for an agency rulemaking to survive judicial review, it is nonetheless recommended.",body_text,text,0.9782840868636525,45.0,189.0
michigan_law_review_good_cause_for_goodness_sake_a_new_approach_to_notice_and_comment_rulemaking,"97. See Aaron Baum, How Much of the Regulatory State Is Safe PostLoper Bright ? , HARV. L. REV.: BLOG (Dec. 20, 2024), https://harvardlawreview.org/blog/2024/12/how-much-of-theregulatory-state-is-safe-post-loper-bright [perma.cc/6BTM-JHW5]. Alternatively, it is possible to see a court understanding an agency's attempt to bypass notice and comment for other public engagement mechanisms as, in and of itself, an interpretation of its statutory authority and requirements under the APA. Under Loper Bright , courts would not need to defer to the agency's understanding of 'impracticable' under the APA and could reject a case on these grounds. See Loper Bright Enters. v. Raimondo, 144 S. Ct. 2244 (2024).",footnote,footnote,0.9423487544483986,84.0,194.0
michigan_law_review_good_cause_for_goodness_sake_a_new_approach_to_notice_and_comment_rulemaking,"98. This is particularly important in today's hyper-politicized environment. See Alma Cohen, The Pervasive Influence of Political Composition on Circuit Court Decisions , VOXEU (Feb. 13, 2024), https://cepr.org/voxeu/columns/pervasive-influence-political-composition-circuitcourt-decisions [perma.cc/TV6K-85KY].",footnote,footnote,0.9805825242718447,85.0,195.0
michigan_law_review_good_cause_for_goodness_sake_a_new_approach_to_notice_and_comment_rulemaking,"The Supreme Court's most outspoken critic of notice and comment in its current form is Justice Kavanaugh, although his most obvious critiques came while he was serving on the D.C. Circuit. In his American Radio Relay League v. FCC dissent, then-Judge Kavanaugh explicitly voiced his disdain for the case law of the 1970s and '80s that gave rise to today's notice-and-comment requirements, 101 describing one such case decided in the D.C. Circuit as one that 'cannot be squared with the text of § 553 of the APA.' 102 Then-Judge Kavanaugh felt that circuit courts such as his own acted inappositely to the Supreme Court's holding in Vermont Yankee : '[T]he Supreme Court forcefully stated that the text of the APA binds courts: Section 553 of the APA 'established the maximumprocedural requirements which Congress was willing to have the courts impose upon agencies in conducting rulemaking procedures.' ' 103 Judge Kavanaugh's disapproval of the circuit court-led shift in jurisprudence came while reviewing a challenge to an agency rule that allegedly had not satisfied its notice-and-comment requirements.",body_text,text,0.834543370271303,48.0,198.0
michigan_law_review_good_cause_for_goodness_sake_a_new_approach_to_notice_and_comment_rulemaking,"99. See David French, What Happened to the Originalism of the Originalists? , N.Y. TIMES (July 7, 2024), https://www.nytimes.com/2024/07/07/opinion/supreme-court-trump-immunity.html [perma.cc/9UWU-HSX9]; see also Ian Millhiser, The Courts Were Never Going to Save America from Donald Trump , VOX (Mar. 4, 2024, at 11:15 ET), https://www.vox.com/scotus/24086594/donald-trump-supreme-court-trial-immunity-never-going-to-save-us [perma.cc/AA29-NYUF].",footnote,footnote,0.9797297297297297,86.0,200.0
michigan_law_review_good_cause_for_goodness_sake_a_new_approach_to_notice_and_comment_rulemaking,"100. See Lawrence Hurley, Trump Has Shaped the Supreme Court, but It Could Still Hinder His Agenda , NBC NEWS (Nov. 11, 2024, at 13:36 UTC), https://www.nbcnews.com/politics/2024-election/trump-shaped-supreme-court-still-hinder-agenda-rcna179288 [perma.cc/8APD-4CBN]; see also Loper Bright , 144 S. Ct. 2244.",footnote,footnote,0.9195402298850575,87.0,201.0
michigan_law_review_good_cause_for_goodness_sake_a_new_approach_to_notice_and_comment_rulemaking,101. See supra Section I.A.2.,footnote,footnote,0.9056603773584906,58.0,202.0
michigan_law_review_good_cause_for_goodness_sake_a_new_approach_to_notice_and_comment_rulemaking,"102. Am. Radio Relay League, Inc. v. FCC, 524 F.3d 227, 246 (D.C. Cir. 2008) (Kavanaugh, J., concurring in part and dissenting in part) (describing this period as 'an era when this Court created several procedural requirements not rooted in the text of the APA').",footnote,footnote,0.982725527831094,89.0,203.0
michigan_law_review_good_cause_for_goodness_sake_a_new_approach_to_notice_and_comment_rulemaking,"103. Id. (quoting Vt. Yankee Nuclear Power Corp. v. Nat. Res. Def. Council, 435 U.S. 519, 524 (1978)) (emphasis added by Court).",footnote,footnote,0.9800796812749004,90.0,204.0
michigan_law_review_good_cause_for_goodness_sake_a_new_approach_to_notice_and_comment_rulemaking,"Over time, those twin lines of decisions 104 have gradually transformed rulemaking-whether regulatory or deregulatory rulemaking-from the simple and speedy practice contemplated by the APA into a laborious, seemingly never-ending process. The judicially created obstacle course can hinder Executive Branch agencies from rapidly and effectively responding to changing or emerging issues within their authority, such as consumer access to broadband, or effectuating policy or philosophical changes in the Executive's approach to the subject matter at hand. The trend has not been good as a jurisprudential matter, and it continues to have significant practical consequences for the operation of the Federal Government and those affected by federal regulation and deregulation. 105",body_text,text,0.766750629722922,50.0,206.0
michigan_law_review_good_cause_for_goodness_sake_a_new_approach_to_notice_and_comment_rulemaking,"104. The second line of decisions referred to here (the first being those that imposed extratextual procedural requirements on notice and comment) is a line of cases at the circuit level that Justice Kavanaugh identifies which 'have grown State Farm's 'narrow' § 706 arbitrary-and-capricious review into a far more demanding test.' Id. at 248 (citing Motor Vehicle Mfrs. Ass'n v. State Farm Mut. Auto. Ins. Co., 463 U.S. 29 (1983)).",footnote,footnote,0.9744186046511628,91.0,210.0
michigan_law_review_good_cause_for_goodness_sake_a_new_approach_to_notice_and_comment_rulemaking,"Portland Cement Ass'n v. Ruckelshaus, 486 F.2d 375 (D.C. Cir. 1973).",footnote,list_item,0.9852941176470589,92.0,212.0
michigan_law_review_good_cause_for_goodness_sake_a_new_approach_to_notice_and_comment_rulemaking,"107. Some might counter that Justice Kavanaugh has positioned himself against a strong executive branch with his votes in Corner Post, Inc. v. Board of Governors of the Federal Reserve System , 144 S. Ct. 2440 (2024), and Loper Bright Enterprises v. Raimondo , 144 S. Ct. 2444 (2024). While true that Justice Kavanaugh has positioned himself as an advocate for judges wielding more power and the executive branch wielding less, he has also made himself known as an antiproceduralist. See, e.g. , FDA v. All. for Hippocratic Med., 144 S. Ct. 1540 (2024) (Kavanaugh, J.) (rejecting an attempt to challenge a regulation using a procedural foothold).",footnote,footnote,0.9929961089494164,93.0,213.0
michigan_law_review_good_cause_for_goodness_sake_a_new_approach_to_notice_and_comment_rulemaking,"108. Little Sisters of the Poor Saints Peter and Paul Home v. Pennsylvania, 140 S. Ct. 2367 (2020).",footnote,footnote,0.9740932642487047,94.0,214.0
michigan_law_review_good_cause_for_goodness_sake_a_new_approach_to_notice_and_comment_rulemaking,"109. Justice Thomas wrote the opinion, and Chief Justice Roberts and Justices Alito, Gorsuch, and Kavanaugh joined. Id.",footnote,footnote,0.9785407725321889,95.0,215.0
michigan_law_review_good_cause_for_goodness_sake_a_new_approach_to_notice_and_comment_rulemaking,"110. Little Sisters , 140 S. Ct. at 2374. The Court here describes the good cause exception as it applies to IFRs because those are the rules that HHS promulgated in this case. Nothing else in the opinion would suggest that they do not also view the good cause exception as providing the same leeway to an agency to promulgate a non-interim final rule without notice and comment. The Court's offhand characterization here of the good cause exception stands in direct contrast to the Ninth Circuit's staunch distaste for it in Riverbend Farms, Inc. v. Madigan , 958 F.2d 1479, 1487 (9th Cir. 1992). See supra note 79 and accompanying text.",footnote,footnote,0.9913317572892041,96.0,219.0
michigan_law_review_good_cause_for_goodness_sake_a_new_approach_to_notice_and_comment_rulemaking,"111. Little Sisters , 140 S. Ct. at 2374 (emphasis added) (quoting Perez v. Mortg. Bankers Ass'n, 575 U.S. 92, 96 (2015)). The Court here indicates that notice and comment often-but not always -applies to informal rulemaking.",footnote,footnote,0.9706546275395034,97.0,220.0
michigan_law_review_good_cause_for_goodness_sake_a_new_approach_to_notice_and_comment_rulemaking,"113. Id. at 2385 ('Even assuming that the APA requires an agency to publish a document entitled 'notice of proposed rulemaking' when the agency moves from an IFR to a final rule, there was no 'prejudicial error' here. § 706. We have previously noted that the rule of prejudicial error is treated as an 'administrative law . . . harmless error rule.' ' (citation omitted) (quoting Nat'l Ass'n of Home Builders v. Defs. of Wildlife, 551 U.S. 644, 659-60 (2007))).",footnote,footnote,0.9683751363140676,98.0,222.0
