document,text,html_label,docling_label,similarity,html_index,pdf_index
michigan_law_review_law_enforcement_privilege,"This Article has offered an alternative 'circumstantial evidence' rationale for confidentiality requirements that applies as easily to topical as to communications privileges: A privilege claimant's pre-dispute conduct concerning the confidentiality of information offers circumstantial evidence of the value of keeping that information secret. The evidence is especially useful because it is likely more reliable than post-dispute testimony, it leverages the claimant's own expertise to assist in judicial review, and it can be adjudicated publicly in a fully adversarial hearing without revealing the actual contents of the purportedly privileged information. None of this reasoning need be limited to the law enforcement privilege alone. The issue of adding confidentiality requirements to constrain other government secrecy powers is thus ripe for further scholarly contribution.",body_text,text,0.9694224235560589,125.0,601.0
michigan_law_review_law_enforcement_privilege,"372. Chesney, No Appetite , supra note 68.",footnote,footnote,0.9230769230769231,343.0,603.0
michigan_law_review_spending_clause_standing,"The Biden Administration's American Rescue Plan Act allotted almost $220 billion to state, local, and tribal governments to help combat the COVID-19 pandemic. This money, the Coronavirus State and Local Fiscal Recovery Fund, gave recipients wide spending discretion to address their struggling economies. But the legislation had one key limitation: Recipients could not use the money to 'directly or indirectly' cut their taxes. If a recipient violated this 'Offset Provision,' the Department of the Treasury might recoup the funds.",body_text,text,0.9492481203007519,1.0,20.0
michigan_law_review_spending_clause_standing,"Nearly two-dozen states alleged that the Offset Provision was unduly coercive and ambiguous, violating the Spending Clause. However, with no threatened recoupment looming, it was unclear whether the states had standing to sue at all. The five circuit courts that heard these cases did not reach consensus on the standing issue. Numerous opinions across six cases offered differing conceptions of 'sovereign' injuries and applied Massachusetts v. EPA 's command for 'special solicitude' to the state plaintiffs inconsistently.",body_text,text,0.9380362249761678,2.0,21.0
michigan_law_review_spending_clause_standing,"The Offset Provision cases provide the first opportunity to study the intersection of the Spending Clause and state standing. With no precedent on when states can challenge congressional spending legislation, the cases navigated standing's incoherent doctrine to craft new rules. The Offset Provision cases offer two novel categories of sovereign injuries-in-fact that states allegedly suffer in Spending Clause cases: the 'Spending Contract' and 'Tax Power' injuries. The former relates to an unconstitutionally ambiguous or coercive federal offer, while the latter describes an impermissible regulatory subject matter.",body_text,text,0.9838709677419355,3.0,22.0
michigan_law_review_spending_clause_standing,"The Offset Provision cases define the terms of federalism's future battleground. The Spending Contract and Tax Power injuries provide enterprising state attorneys general with the weapons to dismantle disfavored federal policy. Instead of adhering to standing doctrine's core separation-of-powers principles, a majority of the involved circuit courts have enabled states to readily air their policy grievances in federal court. Because Congress increasingly relies on its spending power to pass legislation, when states can and cannot challenge fed-",body_text,text,0.8348623853211009,4.0,23.0
michigan_law_review_spending_clause_standing,"* Thank you to my peers and friends in the Volume 122 Notes Office-Hannah Cohen Smith, Kassie Fotiadis, Ashley Munger, Katie Osborn, and Jordan Schuler-for making me a better writer and more empathetic person. Thank you to our successors, the Volume 123 Notes Office, for their incredible edits. Thank you to my research advisors-Evan Caminker and Daniel Deacon-for countless office hours discussing ridiculous spending hypotheticals. Thank you to my dad for his nearly illegible redline and my mother for her writing talent. And thank you to Grayson Metzger for her edits, support, and motivation to submit (and resubmit) this Note.",body_text,footnote,0.9936808846761453,124.0,24.0
michigan_law_review_spending_clause_standing,"American Rescue Plan Act of 2021, Pub. L. No. 117-2, 135 Stat. 4.",footnote,list_item,1.0,0.0,30.0
michigan_law_review_spending_clause_standing,"See Giovanni Russonello, What Does $1.9 Trillion Buy? , N.Y. TIMES (Apr. 29, 2021), https://nytimes.com/2021/03/10/us/politics/whats-in-covid-bill.html [perma.cc/5VJX-A7GE].",footnote,list_item,0.967930029154519,1.0,31.0
michigan_law_review_spending_clause_standing,"42 U.S.C. §§ 802(a), (c)(1).",footnote,list_item,1.0,2.0,32.0
michigan_law_review_spending_clause_standing,42 U.S.C. §§ 802-806.,footnote,list_item,0.9523809523809523,3.0,33.0
michigan_law_review_spending_clause_standing,42 U.S.C. § 802(c)(2)(A).,footnote,list_item,1.0,4.0,34.0
michigan_law_review_spending_clause_standing,"See infra Section I.A; U.S. CONST. art. I, § 8, cl. 1.",footnote,list_item,0.9259259259259259,5.0,36.0
michigan_law_review_spending_clause_standing,"See infra Section I.A; Missouri v. Yellen, 538 F. Supp. 3d 906 (E.D. Mo. 2021); Arizona v. Yellen, 550 F. Supp. 3d 791 (D. Ariz. 2021); West Virginia v. U.S. Dep't of Treasury, 571 F. Supp. 3d 1229 (N.D. Ala. 2021); Kentucky v. Yellen, 563 F. Supp. 3d 647 (E.D. Ky. 2021); Texas v. Yellen, 597 F. Supp. 3d 1005 (N.D. Tex. 2022); Ohio v. Yellen, 539 F. Supp. 3d 802 (S.D. Ohio 2021).",footnote,list_item,0.9973821989528796,6.0,37.0
michigan_law_review_spending_clause_standing,"See, e.g. , Missouri v. Yellen, 39 F.4th 1063, 1069-70 (8th Cir. 2022).",footnote,list_item,0.9787234042553191,7.0,38.0
michigan_law_review_spending_clause_standing,"See, e.g. , Arizona v. Yellen, 34 F.4th 841, 848 (9th Cir. 2022).",footnote,list_item,0.9922480620155039,8.0,39.0
michigan_law_review_spending_clause_standing,"See, e.g. , Kentucky v. Yellen, 54 F.4th 325, 329 (6th Cir. 2022).",footnote,list_item,0.9923664122137404,9.0,40.0
michigan_law_review_spending_clause_standing,"12. See Pennhurst State Sch. & Hosp. v. Halderman, 451 U.S. 1, 17 (1981); South Dakota v. Dole, 483 U.S. 203, 207, 211 (1987); Nat'l Fed'n of Indep. Bus. v. Sebelius, 567 U.S. 519, 58081 (2012).",footnote,footnote,0.9766233766233766,10.0,45.0
michigan_law_review_spending_clause_standing,"13. Massachusetts v. EPA, 549 U.S. 497, 519-20 (2007).",footnote,footnote,0.9423076923076923,11.0,46.0
michigan_law_review_spending_clause_standing,"See United States v. Texas, 143 S. Ct. 1964, 1977 (2023) (Gorsuch, J., concurring).",footnote,list_item,1.0,12.0,47.0
michigan_law_review_spending_clause_standing,"15. See Steve Vladeck, 16. When Can States Sue the Federal Government? , ONE FIRST (Feb. 27, 2023), https://stevevladeck.com/p/16-when-can-states-sue-the-federal [perma.cc/XE9LNM97] (noting the frequency of state challenges to Biden administration policies); Our Story: About the Alliance , GOVERNORS SAFEGUARDING DEMOCRACY, https://govsfordemocracy.org/about-us [perma.cc/Z5FE-YKW5] (reflecting the same litigious ambition of Democratic Governors J.B. Pritzker and Jared Polis in the second Trump administration).",footnote,footnote,0.9247311827956989,13.0,48.0
michigan_law_review_spending_clause_standing,"16. United States v. Texas, 143 S. Ct. at 1977 (Gorsuch, J., concurring).",footnote,footnote,0.971830985915493,14.0,49.0
michigan_law_review_spending_clause_standing,"Missouri v. Yellen, 39 F.4th 1063, 1070 (8th Cir. 2022); Kentucky v. Yellen, 54 F.4th 325, 329 (6th Cir. 2022); Ohio v. Yellen, 53 F.4th 983, 993 (6th Cir. 2022). The Sixth Circuit in Kentucky v. Yellen held that Tennessee had standing for a compliance cost injury. 54 F.4th at 342.",footnote,list_item,1.0,15.0,50.0
michigan_law_review_spending_clause_standing,"Arizona v. Yellen, 34 F.4th 841, 852 (9th Cir. 2022); West Virginia ex rel. Morrisey v. U.S. Dep't of the Treasury, 59 F.4th 1124, 1136 (11th Cir. 2023); Texas v. Yellen, 105 F.4th 755, 767 (5th Cir. 2024).",footnote,list_item,0.9951456310679612,16.0,51.0
michigan_law_review_spending_clause_standing,"19. Morrisey , 59 F.4th at 1148-49; Texas v. Yellen, 105 F.4th at 774.",footnote,footnote,0.9481481481481482,17.0,52.0
michigan_law_review_spending_clause_standing,"Spending Clause. The Offset Provision cases produced two general categories of sovereign injuries, styled here as the 'Spending Contract' injury and the 'Tax Power' injury. The Spending Contract injury, the asserted basis for standing in the Fifth, Ninth, and Eleventh Circuits, 20 focuses on the offer : Congress offends state sovereignty when it offers federal funds with coercive or ambiguous spending conditions. 21 The Tax Power injury-a 'plus factor' for standing in the Ninth and Eleventh Circuits-focuses on the subject matter : States can challenge congressional exercises of the Spending Clause that constrain certain sovereign prerogatives, like the power to tax. 22",body_text,text,0.7875457875457875,10.0,53.0
michigan_law_review_spending_clause_standing,"Although it is true that states suffer some form of sovereign injury when Congress exceeds its spending power, most of the Offset Provision decisions are simply too broad. An expansive Spending Contract injury incentivizes states to hunt for ambiguous provisions in legislative text and enjoin imagined enforcement merely because the ambiguity exists at the quasi-contractual offer stage. Furthermore, the Tax Power injury might significantly limit the use of the Spending Clause, granting standing if policy touches something-anything-'sovereign' enough. These injuries offer two new standing weapons to enterprising state attorneys general seeking to oppose federal spending policy: (1) searching and destroying legislative ambiguity, or (2) quarantining state tax policies from federal influence. Activist states and their chief prosecutors, already relying on 'dubious' and 'lawless' standing theories to circumvent decades of Article III limitations, 23 leave the fate of consequential policy decisions in the hands of an unelected judiciary. And unlike other forms of federal policymaking, the Spending Clause allows states to retain their agency and reject what Congress offers them. Because Congress often relies on its spending power for modern legislation, 24 an expansive 'welcome' mat into federal court risks further turning the judiciary into the arbiter of policy battles. 25",body_text,text,0.84472049689441,11.0,55.0
michigan_law_review_spending_clause_standing,See infra Section I.A.,footnote,list_item,1.0,18.0,56.0
michigan_law_review_spending_clause_standing,See infra Section I.A.,footnote,list_item,1.0,18.0,57.0
michigan_law_review_spending_clause_standing,See infra Section I.B.,footnote,list_item,1.0,20.0,58.0
michigan_law_review_spending_clause_standing,"23. See Vladeck, supra note 15; Steve Vladeck, Bonus 35: The Lawlessness of Missouri's Standing in Biden v. Nebraska, ONE FIRST (July 13, 2023) [hereinafter Vladeck, Lawlessness ], https://stevevladeck.com/p/bonus-35-the-lawlessness-of-missouris [perma.cc/6URZ-EV56].",footnote,footnote,0.9640831758034026,21.0,59.0
michigan_law_review_spending_clause_standing,"See Jonathan S. Gould, ARepublic of Spending , 123 MICH. L. REV. 209, 211, 213 (2024).",footnote,list_item,0.9302325581395349,22.0,60.0
michigan_law_review_spending_clause_standing,"25. See Stephen I. Vladeck, States' Rights and State Standing , 46 U. RICH. L. REV. 845, 872 (2012).",footnote,footnote,0.9128205128205128,23.0,61.0
michigan_law_review_spending_clause_standing,"26. These legal commentators have emerged from the 'new process' federalism camp. E.g. , Jessica Bulman-Pozen, Federalism All the Way Up: State Standing and 'The New Process Federalism' , 105 CALIF. L. REV. 1739, 1746-50 (2017).",footnote,footnote,0.9288888888888889,24.0,62.0
michigan_law_review_spending_clause_standing,"Part I outlines the Offset Provision and provides doctrinal background for the Spending Clause, standing, and special solicitude. Part II dives into the cases themselves, defining and explaining the Spending Contract and Tax Power injuries. Part III demonstrates the danger of the circuit courts' expansive approach to Spending Clause standing and prescribes better rules for future cases-ones that do not rely on special solicitude or illusory, novel theories of injury.",body_text,text,0.9957537154989384,13.0,64.0
michigan_law_review_spending_clause_standing,"Though largely incoherent, there are consistent, basic principles within the Supreme Court's standing jurisprudence. Among other things, a plaintiff in federal court must demonstrate a concrete and particularized injury-infact. 28 The Offset Provision cases considered whether the states met that requirement. At times, state plaintiffs have survived Article III scrutiny by alleging unique injuries via a 'special solicitude' that courts have drawn from their sovereign status. 29 But nearly two decades after Massachusetts v. EPA , what 'special solicitude' means remains unclear. This Part introduces the Offset Provision controversy and the sparse Spending Clause case law before drilling into the current state of standing doctrine.",body_text,text,0.8260594560404807,14.0,66.0
michigan_law_review_spending_clause_standing,"27. Samuel Moyn, Resisting the Juristocracy , BOS. REV. (Oct. 5, 2018), https://bostonreview.net/articles/samuel-moyn-resisting-juristocracy [perma.cc/69T8-LDAJ].",footnote,footnote,0.9592476489028213,25.0,69.0
michigan_law_review_spending_clause_standing,"28. Lujan v. Defs. of Wildlife, 504 U.S. 555 (1992).",footnote,footnote,0.96,26.0,70.0
michigan_law_review_spending_clause_standing,"29. See, e.g. , Massachusetts v. EPA, 549 U.S. 497, 519-20 (2007).",footnote,footnote,0.9448818897637795,27.0,71.0
michigan_law_review_spending_clause_standing,"30. Morgan Chalfant & Brett Samuels, Biden Signs $1.9 Trillion Relief Bill into Law , THE HILL (Mar. 11, 2021, 2:14 PM), https://thehill.com/homenews/administration/542790-bidensigns-19-trillion-relief-bill-into-law [perma.cc/JX43-YK5H].",footnote,footnote,0.9572649572649573,28.0,72.0
michigan_law_review_spending_clause_standing,"31. Russonello, supra note 2.",footnote,footnote,0.9259259259259259,29.0,73.0
michigan_law_review_spending_clause_standing,"American Rescue Plan , WHITE HOUSE, https://bidenwhitehouse.archives.gov/wpcontent/uploads/2021/03/American-Rescue-Plan-Fact-Sheet.pdf [perma.cc/LEC5-AVMF] (emphasis omitted).",footnote,list_item,0.9485714285714286,30.0,76.0
michigan_law_review_spending_clause_standing,"American Rescue Plan Act, Pub. L. No. 117-2, § 9901, 135 Stat. 4, 223 (2021).",footnote,list_item,1.0,31.0,77.0
michigan_law_review_spending_clause_standing,Id. § 802(c)(1)(A)-(E).,footnote,list_item,0.9565217391304348,32.0,79.0
michigan_law_review_spending_clause_standing,"See State and Local Fiscal Recovery Funds , U.S. DEP'T OF THE TREASURY, https://home.treasury.gov/policy-issues/coronavirus/assistance-for-state-local-and-tribal-governments/state-and-local-fiscal-recovery-funds [perma.cc/Z6AH-D624]; Alan Rappeport, Arizona Could Lose Relief Funds for Undermining School Mask Mandates , N.Y. TIMES (Oct. 14, 2021), https://nytimes.com/2021/10/05/us/politics/arizona-relief-funds-mask-mandates.html [perma.cc/JLE6-FB2T] (noting Treasury's only challenge to a state program).",footnote,list_item,0.950592885375494,33.0,80.0
michigan_law_review_spending_clause_standing,"See American Rescue Plan Funding , STATE BUDGET OFF. (Dec. 2024), https://michigan.gov/budget/covid-federal-funding/american-rescue-plan-funding [perma.cc/6C5BEYGD]; MI Clean Water Plan , DEP'T OF ENV'T, GREAT LAKES, & ENERGY, https://michigan.gov/egle/regulatory-assistance/funding/fd/mi-clean-water-plan [perma.cc/7GHR-PMVW].",footnote,list_item,0.8606431852986217,34.0,81.0
michigan_law_review_spending_clause_standing,"Alan Rappeport, Republicans Who Assailed Biden's Stimulus Bill Are Embracing the Money , N.Y. TIMES (Dec. 15, 2021), https://nytimes.com/2021/12/15/us/politics/biden-stimulus-bill-republicans.html [perma.cc/CM5B-LW8U].",footnote,list_item,0.9747126436781609,36.0,83.0
michigan_law_review_spending_clause_standing,"A State or territory shall not use the funds provided under this section . . . to either directly or indirectly offset a reduction in the net tax revenue of such State or territory resulting from a change in law, regulation, or administrative interpretation during the covered period that reduces any tax . . . or delays the imposition of any tax or tax increase. 42",body_text,text,0.9733333333333334,18.0,85.0
michigan_law_review_spending_clause_standing,"If a state violates the Offset Provision, the statute authorizes the Treasury to recoup the lesser of 'the amount of the applicable reduction to net tax revenue attributable to such violation' and the amount of money the state or territory received from the CSLFRF. 43 Essentially, states would have to pay back any of this federal money that they used to subsidize their tax cuts. 44 For example, a state could not cut its property taxes and use the CSLFRF funds to make up the difference. As professors Conor Clarke and Edward Fox explain, the Offset Provision is a variation on 'maintenance-of-effort' provisions common in federal education programs designed to ensure that federal money 'supplements and not supplants' state spending. 45 Interestingly enough, unlike other maintenance-of-effort provisions, Clarke and Fox argue that the Offset Provision is a far more flexible constraint than those in prior versions of the provision, ensuring that more federal dollars are used to support state and local governments than an equivalent 'earmarked' spending program. 46",body_text,text,0.7947631882941856,19.0,86.0
michigan_law_review_spending_clause_standing,42 U.S.C. § 802(c)(2)(B) (preventing states from using the CSLFRF in pension funds).,footnote,list_item,1.0,38.0,89.0
michigan_law_review_spending_clause_standing,"See Press Release, Janet L. Yellen, Treasury Secretary, Response to State Attorneys General Inquiries on Implementation of Section 9901 of the American Rescue Plan Act (Mar. 23, 2021), https://home.treasury.gov/news/press-releases/jy0075 [perma.cc/5KVM-VQ2L] [hereinafter Yellen Letter].",footnote,list_item,1.0,39.0,92.0
michigan_law_review_spending_clause_standing,"See Conor Clarke & Edward Fox, No New Tax Cuts? Examining the Rescue Plan's New State Tax Limits , 103 TAX NOTES STATE 1361, 1362 (2022).",footnote,list_item,0.9157509157509157,40.0,93.0
michigan_law_review_spending_clause_standing,"Letter from Mark Brnovich, Att'y Gen. of Ariz., et al., to Janet L. Yellen, Sec'y of the Treasury, Treasury Action to Prevent Unconstitutional Restriction on State's Fiscal Policy Through American Rescue Plan Act of 2021, at 2 (Mar. 16, 2021), https://ago.wv.gov/Documents/2021.03.16%20Yellen%20Letter%203-16%20FINAL.pdf [perma.cc/PTS2-2SBT] [hereinafter State AGs Letter].",footnote,list_item,0.9919571045576407,41.0,95.0
michigan_law_review_spending_clause_standing,"Yellen Letter, supra note 44; C-SPAN, Treasury Secretary and Federal Reserve Chair Testimony on COVID-19 Economic Recovery, at 55:40 (C-SPAN, streamed Mar. 24, 2021), https://c-span.org/video/?510059-1/treasury-secretary-federal-reserve-chair-testimony-covid19-economic-recovery [perma.cc/5Q2Z-PJ7L] (responding to question from Idaho Senator Mike Crapo).",footnote,list_item,0.9985935302390999,42.0,101.0
michigan_law_review_spending_clause_standing,"Yellen Letter, supra note 44.",footnote,list_item,1.0,43.0,102.0
michigan_law_review_spending_clause_standing,"The list of twenty-one state plaintiffs does not overlap perfectly with the twenty-one states that signed onto the letter. See State AGs Letter, supra note 47, at 7.",footnote,list_item,1.0,44.0,103.0
michigan_law_review_spending_clause_standing,"See generally Missouri v. Yellen, 538 F. Supp. 3d 906 (E.D. Mo. 2021) (Missouri); Arizona v. Yellen, 550 F. Supp. 3d 791 (D. Ariz. 2021) (Arizona); West Virginia v. U.S. Dep't of Treasury, 571 F. Supp. 3d 1229 (N.D. Ala. 2021) (Alabama, Arkansas, Alaska, Florida, Iowa, Kansas, Montana, New Hampshire, Oklahoma, South Carolina, South Dakota, Utah, and West Virginia); Kentucky v. Yellen, 563 F. Supp. 3d 647 (E.D. Ky. 2021) (Kentucky and Tennessee); Texas v. Yellen, 597 F. Supp. 3d 1005 (N.D. Tex. 2022) (Louisiana, Mississippi, and Texas). Ohio sued to enjoin the Offset Provision before the Secretary had responded to the state attorneys general. See Ohio v. Yellen, 539 F. Supp. 3d 802 (S.D. Ohio 2021).",footnote,list_item,0.9985855728429985,45.0,104.0
michigan_law_review_spending_clause_standing,"See, e.g. , Ohio v. Yellen, 539 F. Supp. 3d at 806.",footnote,list_item,0.9900990099009901,46.0,105.0
michigan_law_review_spending_clause_standing,"See West Virginia v. U.S. Dep't of Treasury, 571 F. Supp. 3d at 1249-54; Kentucky v. Yellen, 563 F. Supp. 3d at 653-58. Judge Kacsmaryk also held that the provision violated the anticommandeering principle of the Tenth Amendment. See Texas v. Yellen, 597 F. Supp. 3d at 101215.",footnote,list_item,0.9748201438848921,47.0,106.0
michigan_law_review_spending_clause_standing,"Coronavirus State and Local Fiscal Recovery Funds, 86 Fed. Reg. 26786 (May 17, 2021) (codified at 31 C.F.R. § 35).",footnote,list_item,1.0,48.0,107.0
michigan_law_review_spending_clause_standing,See 31 C.F.R. § 35.8 (2024).,footnote,list_item,1.0,49.0,108.0
michigan_law_review_spending_clause_standing,"That clarification did not deter the states, which pursued litigation anyway. Following its final rule, the Treasury argued that the state plaintiffs lacked standing for a pre-enforcement injunction. Specifically, the Treasury argued that because the states had not alleged a course of conduct that would violate the final rule's interpretation of the Offset Provision, the states faced no imminent injury as required by Article III. 61 This and the Treasury's other arguments have yielded mixed results. 62 For the first time, federal courts had to answer the question: When do states have standing to challenge under the Spending Clause?",body_text,text,0.8814285714285715,23.0,111.0
michigan_law_review_spending_clause_standing,"The state-plaintiffs' central argument in the Offset Provision cases was that the Provision exceeded Congress's power under the Spending Clause. 63 In short, the states argued that the Offset Provision was unconstitutionally ambiguous and unconstitutionally coercive. 64 Understanding how these constitutional limits manifested as the necessary sovereign injuries for standing purposes requires a brief explanation of the Spending Clause.",body_text,text,0.9041666666666667,24.0,113.0
michigan_law_review_spending_clause_standing,"E.g. , West Virginia ex rel. Morrisey v. U.S. Dep't of the Treasury, 59 F.4th 1124, 1135 (11th Cir. 2023).",footnote,list_item,0.985781990521327,50.0,118.0
michigan_law_review_spending_clause_standing,See supra Section I.A.,footnote,list_item,1.0,51.0,120.0
michigan_law_review_spending_clause_standing,"See, e.g. , Arizona v. Yellen, 34 F.4th 841, 847 (9th Cir. 2022).",footnote,list_item,0.9922480620155039,52.0,121.0
michigan_law_review_spending_clause_standing,"U.S. CONST. art. I, § 8, cl. 1.",footnote,list_item,0.8709677419354839,53.0,122.0
michigan_law_review_spending_clause_standing,"Gould, supra note 24, at 217 (citing United States v. Butler, 297 U.S. 1, 66 (1936)).",footnote,list_item,1.0,54.0,123.0
michigan_law_review_spending_clause_standing,"See id. ; Mitchell N. Berman, Coercion Without Baselines: Unconstitutional Conditions in Three Dimensions , 90 GEO. L.J. 1, 50-51 (2001).",footnote,list_item,0.9705882352941176,55.0,124.0
michigan_law_review_spending_clause_standing,"68. See Pennhurst State Sch. & Hosp. v. Halderman, 451 U.S. 1, 17 (1981); Lynn A. Baker & Mitchell N. Berman, Getting off the Dole : Why the Court Should Abandon Its Spending Doctrine, and How a Too-Clever Congress Could Provoke It to Do So , 78 IND. L.J. 459, 472 (2003).",footnote,footnote,0.9814126394052045,56.0,125.0
michigan_law_review_spending_clause_standing,"Of greatest significance to the Offset Provision cases (and most Spending Clause litigation) are the second and 'fifth' prongs of this test: Congress's conditions must be unambiguous, and it may not unduly coerce the states. As articulated in Pennhurst v. Halderman , courts evaluate the second prong according to the 'clear notice' canon of statutory interpretation. 75 The solution is not for courts to entirely strike down ambiguous provisions. 76 Instead, when interpreting relevant spending conditions, a court must fill the shoes of the funds' recipient (here, a state) at the time it chose to accept the deal and ask whether the state 'would clearly understand' its statutory obligations and liabilities. 77 The spending condition is still enforced but in a way that the states could have fairly anticipated. The Court's clear notice rule for the second prong helps facilitate federalism by ensuring the spending conditions are enforced in unsurprising ways.",body_text,text,0.7957559681697612,27.0,128.0
michigan_law_review_spending_clause_standing,"70. Dole , 483 U.S. at 207 (quoting Helvering v. Davis, 301 U.S. 619, 640-41 (1937)).",footnote,footnote,0.9575757575757575,58.0,130.0
michigan_law_review_spending_clause_standing,"71. Id. (quoting Pennhurst , 451 U.S. at 17).",footnote,footnote,0.9411764705882353,59.0,131.0
michigan_law_review_spending_clause_standing,"74. Id. at 211 (quoting Steward Mach. Co. v. Davis, 301 U.S. 548, 590 (1937)).",footnote,footnote,0.9736842105263158,60.0,134.0
