pdf_text,html_text,docling_label,docling_layer,ground_truth_label,match_score,label_match
"52 cf. william baude, the judgment power , 96 geo. l.j. 1807 (2008) (de /unifb01 ning the judgment power).","52 cf. william baude, the judgment power , 96 geo. l.j. 1807 (2008) (defining the judgment power).",footnote,unknown,body-text,0.951,✗
"53 see thomas w. merrill, article iii, agency adjudication, and the origins of the appellate model of administrative law , 111 colum. l. rev. 939 (2011).","53 see thomas w. merrill, article iii, agency adjudication, and the origins of the appellate model of administrative law , 111 colum. l. rev. 939 (2011).",footnote,unknown,body-text,1.000,✗
"55 id . § 157. thus, while it is common to talk about the powers of bankruptcy courts, it is perhaps more technically accurate to speak of bankruptcy cases or refer to a ' bankruptcy tribunal. ' see casey & macey, supra note 20.","55 id . § 157. thus, while it is common to talk about the powers of bankruptcy courts, it is perhaps more technically accurate to speak of bankruptcy cases or refer to a “bankruptcy tribunal.” see casey & macey, supra note 20.",footnote,unknown,body-text,0.987,✗
"3. due process . a /unifb01 nal constitutional challenge is that bankruptcy courts fail to protect due process rights. because bankruptcy courts are resolving private rights disputes outside of the direct control of article iii there is a risk of depriving parties of their right to a jury, forcing parties to give up choice of law rights, or coercing premature settlements. according to those who hold this view, bankruptcy law ' s pursuit of judicial ef /unifb01 ciency is in tension with due process values. while we are skeptical of such due process arguments -for reasons set forth elsewhere 59 -they do re /unifb02 ect a recurring concern about the constitutionality of certain bankruptcy practices. 60","3. due process . a final constitutional challenge is that bankruptcy courts fail to protect due process rights. because bankruptcy courts are resolving private rights disputes outside of the direct control of article iii there is a risk of depriving parties of their right to a jury, forcing parties to give up choice of law rights, or coercing premature settlements. according to those who hold this view, bankruptcy law’s pursuit of judicial efficiency is in tension with due process values. while we are skeptical of such due process arguments-for reasons set forth elsewhere 59 -they do reflect a recurring concern about the constitutionality of certain bankruptcy practices. 60",text,unknown,body-text,0.976,✗
"courts have occasionally echoed these concerns about bankruptcy exceptionalism, often cabining bankruptcy court power on formalist grounds. until recently, this formalism re /unifb02 ected a structural commitment to the special place of article iii courts.","courts have occasionally echoed these concerns about bankruptcy exceptionalism, often cabining bankruptcy court power on formalist grounds. until recently, this formalism reflected a structural commitment to the special place of article iii courts.",text,unknown,body-text,0.980,✗
"throughout the twentieth century, judicial review of bankruptcy exceptionalism tracked the constitutional concerns described in the previous part. the supreme court sometimes limited bankruptcy authority and sometimes accommodated broad discretion, but when the court worried that bankruptcy practice did not provide suf /unifb01 cient due process or article iii review, it considered the constitutionality of the practice head on and issued a constitutional ruling.","throughout the twentieth century, judicial review of bankruptcy exceptionalism tracked the constitutional concerns described in the previous part. the supreme court sometimes limited bankruptcy authority and sometimes accommodated broad discretion, but when the court worried that bankruptcy practice did not provide sufficient due process or article iii review, it considered the constitutionality of the practice head on and issued a constitutional ruling.",text,unknown,body-text,0.989,✗
"56 in certain instances, the bankruptcy court ' s judgment is advisory and only becomes /unifb01 nal after de novo review at the district court. see stern , 564 u.s. at 475; 28 u.s.c. §§ 157 -158.","56 in certain instances, the bankruptcy court’s judgment is advisory and only becomes final after de novo review at the district court. see stern , 564 u.s. at 475; 28 u.s.c. §§ 157-158.",footnote,unknown,body-text,0.963,✗
58 it is not surprising then that critics speak in terms of constraining bankruptcy court power. we adopt that same convention from here on.,58 it is not surprising then that critics speak in terms of constraining bankruptcy court power. we adopt that same convention from here on.,footnote,unknown,body-text,1.000,✗
"59 bankruptcy makes jury trials available, gives parties the right to appeal adverse judgments, and absent a single bankruptcy proceeding for resolving distressed /unifb01 rms, claimants or plaintiffs who bring suit late are likely to be left with nothing. see generally casey & macey, supra note 21.","59 bankruptcy makes jury trials available, gives parties the right to appeal adverse judgments, and absent a single bankruptcy proceeding for resolving distressed firms, claimants or plaintiffs who bring suit late are likely to be left with nothing. see generally casey & macey, supra note 21.",footnote,unknown,body-text,0.985,✗
"60 sergio campos & samir d. parikh, due process alignment in mass restructurings , 91 fordham l. rev. 325 (2022).","60 sergio campos & samir d. parikh, due process alignment in mass restructurings , 91 fordham l. rev. 325 (2022).",footnote,unknown,body-text,1.000,✗
"marathon pipe line co. , which involved the power to adjudicate contract disputes. 61 a divided court announced that bankruptcy courts did not have that power. it was relevant to the justices deciding northern pipeline that bankruptcy courts were neither territorial courts nor military courts-martial and that the case in question was not a public rights dispute. 62 as a result, bankruptcy courts did not, according to justice brennan ' s plurality decision, fall within any of the historic exceptions to the requirements of article iii. 63","the most direct challenge to the constitutionality of bankruptcy courts came in the early 1980s, in northern pipeline construction co. v. marathon pipe line co. , which involved the power to adjudicate contract disputes. 61 a divided court announced that bankruptcy courts did not have that power. it was relevant to the justices deciding northern pipeline that bankruptcy courts were neither territorial courts nor military courts-martial and that the case in question was not a public rights dispute. 62 as a result, bankruptcy courts did not, according to justice brennan’s plurality decision, fall within any of the historic exceptions to the requirements of article iii. 63",text,unknown,body-text,0.884,✗
"the northern pipeline decision led to the passage of the bankruptcy amendments and federal judgeship act of 1984 (bafja), which made bankruptcy judges ' a unit of the district court. ' 64 bafja seemingly endorsed the appellate review model in which non-article iii courts can be allowed to adjudicate private disputes if certain ' jurisdictional ' facts are subject to de novo review in an article iii court. 65","the northern pipeline decision led to the passage of the bankruptcy amendments and federal judgeship act of 1984 (bafja), which made bankruptcy judges “a unit of the district court.” 64 bafja seemingly endorsed the appellate review model in which non-article iii courts can be allowed to adjudicate private disputes if certain “jurisdictional” facts are subject to de novo review in an article iii court. 65",text,unknown,body-text,0.985,✗
62 id. at 70 (plurality opinion).,62 id. at 70 (plurality opinion).,footnote,unknown,body-text,1.000,✗
"64 bankruptcy amendments and federal judgeship act of 1984, pub. l. no. 98-353, § 151, 98 stat. 333, 336 ( ' in each judicial district, the bankruptcy judges in regular active service shall constitute a unit of the district court to be known as the bankruptcy court for that district. each bankruptcy judge, as a judicial of /unifb01 cer of the district court, may exercise the authority conferred under this chapter with respect to any action, suit, or proceeding and may preside alone and hold a regular or special session of the court, except as otherwise provided by law or by rule or order of the district court. ' ).","64 bankruptcy amendments and federal judgeship act of 1984, pub. l. no. 98-353, § 151, 98 stat. 333, 336 (“in each judicial district, the bankruptcy judges in regular active service shall constitute a unit of the district court to be known as the bankruptcy court for that district. each bankruptcy judge, as a judicial officer of the district court, may exercise the authority conferred under this chapter with respect to any action, suit, or proceeding and may preside alone and hold a regular or special session of the court, except as otherwise provided by law or by rule or order of the district court.”).",footnote,unknown,body-text,0.985,✗
"65 see merrill, supra note 53, at 944 ( ' the appellate review model -which cast article iii courts in the familiar role of reviewing records made by other tribunals and resolving questions of law -came to be seen as solving this danger of ' contamination ' of the judicial power by involvement in matters of administration. ' ); cf. id. at 945 ( ' the critical point is that the tension perceived by modern commentators between the language of article iii and the use of non-article iii agencies to adjudicate disputes under federal law was largely invisible during the years when the appellate review model was adopted. ' ).","65 see merrill, supra note 53, at 944 (“the appellate review model-which cast article iii courts in the familiar role of reviewing records made by other tribunals and resolving questions of law-came to be seen as solving this danger of ‘contamination’ of the judicial power by involvement in matters of administration.”); cf. id. at 945 (“the critical point is that the tension perceived by modern commentators between the language of article iii and the use of non-article iii agencies to adjudicate disputes under federal law was largely invisible during the years when the appellate review model was adopted.”).",footnote,unknown,body-text,0.981,✗
"congress gave the cftc the authority to adjudicate such matters, but the decision to invoke this forum is left entirely to the parties and the power of the federal judiciary to take jurisdiction of these matters is unaffected. in such circumstances, separation of powers concerns are diminished, for it seems self-evident that just as congress may encourage parties to settle a dispute out of court or resort to arbitration without impermissible incursions on the separation of powers, congress may make available a quasijudicial mechanism through which willing parties may, at their option, elect to resolve their differences. 71","congress gave the cftc the authority to adjudicate such matters, but the decision to invoke this forum is left entirely to the parties and the power of the federal judiciary to take jurisdiction of these matters is unaffected. in such circumstances, separation of powers concerns are diminished, for it seems self-evident that just as congress may encourage parties to settle a dispute out of court or resort to arbitration without impermissible incursions on the separation of powers, congress may make available a quasi-judicial mechanism through which willing parties may, at their option, elect to resolve their differences. 71",text,unknown,body-text,0.999,✗
"68 see stuart taylor jr., business and the law: dispute on bankruptcy , n.y. times ( june 24, 1984), https://www.nytimes.com/1984/07/24/business/business-and-the-law-bitter-dispute -on-bankruptcy.html; see also bankruptcy amendments and federal judgeship act of 1984 , nat ' l conf. of bankr. judges (dec. 15, 2023), https://ncbj.org/bankruptcy-amendments-and -federal-judgeship-act-of-1984.","68 see stuart taylor jr., business and the law: dispute on bankruptcy , n.y. times (june 24, 1984), https://www.nytimes.com/1984/07/24/business/business-and-the-law-bitter-dispute-on-bankruptcy.html ; see also bankruptcy amendments and federal judgeship act of 1984 , nat’l conf. of bankr. judges (dec. 15, 2023), https://ncbj.org/bankruptcy-amendments-and-federal-judgeship-act-of-1984 .",footnote,unknown,body-text,0.988,✗
"72 the supreme court formally extended this line of reasoning to bankruptcy in 2015. see wellness int ' l network v. sharif, 575 u.s. 665, 679 (2015) ( ' [w]e conclude that allowing bankruptcy litigants to waive the right to article iii adjudication of stern claims does not usurp the constitutional prerogatives of article iii courts. ' ).","72 the supreme court formally extended this line of reasoning to bankruptcy in 2015. see wellness int’l network v. sharif, 575 u.s. 665, 679 (2015) (“[w]e conclude that allowing bankruptcy litigants to waive the right to article iii adjudication of stern claims does not usurp the constitutional prerogatives of article iii courts.”).",footnote,unknown,body-text,0.982,✗
"occasions. for example, in 1989, in gran /unifb01 nanciera, s.a. v. nordberg , the court held that the seventh amendment guaranteed the right to a jury trial for fraudulent transfer claims even though congress had designated such claims as ' core ' proceedings triable by a bankruptcy judge without a jury. 73 as in purdue , the court recognized that the constitutional right could ' impede swift resolution of bankruptcy proceedings and increase the expense of chapter 11 reorganizations. ' 74 but these practical considerations were ' insuf /unifb01 cient to overcome the seventh amendment ' s clear command. ' 75 then, in 2011, in stern v. marshall , the court ruled that bankruptcy courts could not issue /unifb01 nal judgments involving state law counterclaims. 76 once again, the statutory designation of such claims as ' core ' was irrelevant to the constitutional analysis. 77 thecourtlater tempered this ruling when it announced that the constitution could tolerate bankruptcy court judgments over private rights when those judgments are subject to de novo review by an article iii court. 78","over the next thirty years, the supreme court considered the constitutionality of bankruptcy court adjudication on a few more occasions. for example, in 1989, in granfinanciera, s.a. v. nordberg , the court held that the seventh amendment guaranteed the right to a jury trial for fraudulent transfer claims even though congress had designated such claims as “core” proceedings triable by a bankruptcy judge without a jury. 73 as in purdue , the court recognized that the constitutional right could “impede swift resolution of bankruptcy proceedings and increase the expense of chapter 11 reorganizations.” 74 but these practical considerations were “insufficient to overcome the seventh amendment’s clear command.” 75 then, in 2011, in stern v. marshall , the court ruled that bankruptcy courts could not issue final judgments involving state law counterclaims. 76 once again, the statutory designation of such claims as “core” was irrelevant to the constitutional analysis. 77 the court later tempered this ruling when it announced that the constitution could tolerate bankruptcy court judgments over private rights when those judgments are subject to de novo review by an article iii court. 78",text,unknown,body-text,0.919,✗
"79 see, e.g. , united states v. energy res. co., 495 u.s. 545, 549 (1990) (reading sections 105(a) and 1123(b)(6) as providing ' broad authority to modify creditor-debtor relationships ' ).","79 see, e.g. , united states v. energy res. co., 495 u.s. 545, 549 (1990) (reading sections 105(a) and 1123(b)(6) as providing “broad authority to modify creditor-debtor relationships”).",footnote,unknown,body-text,0.981,✗
"80 see, e.g. , in re bonham, 229 f.3d 750, 771 (9th cir. 2000) (allowing for substantive consolidation); see also in re owens corning, 419 f.3d 195, 208 (3d cir. 2007) ( ' whatever the rationale, courts have permitted substantive consolidation as an equitable remedy in certain circumstances. ' ).","80 see, e.g. , in re bonham, 229 f.3d 750, 771 (9th cir. 2000) (allowing for substantive consolidation); see also in re owens corning, 419 f.3d 195, 208 (3d cir. 2007) (“whatever the rationale, courts have permitted substantive consolidation as an equitable remedy in certain circumstances.”).",footnote,unknown,body-text,0.986,✗
"recently, however, the supreme court has begun to avoid constitutional decisions in bankruptcy cases, opting instead to narrowly construe the text of the code. 84 our reading of purdue suggests this is part of a trend of reading broad provisions of the bankruptcy code narrowly to avoid constitutional questions about court structure. though the courts never explicitly say so, they have adopted something like a canon -seemingly rooted in notions of due process and structural separation of powers concerns -of narrowing the code ' s text. 85","recently, however, the supreme court has begun to avoid constitutional decisions in bankruptcy cases, opting instead to narrowly construe the text of the code. 84 our reading of purdue suggests this is part of a trend of reading broad provisions of the bankruptcy code narrowly to avoid constitutional questions about court structure. though the courts never explicitly say so, they have adopted something like a canon-seemingly rooted in notions of due process and structural separation of powers concerns-of narrowing the code’s text. 85",text,unknown,body-text,0.994,✗
"82 see, e.g. , in re integrated telecom express, inc., 384 f.3d 108, 118 (3d cir. 2004) (dismissing a case for not being /unifb01 led in good faith).","82 see, e.g. , in re integrated telecom express, inc., 384 f.3d 108, 118 (3d cir. 2004) (dismissing a case for not being filed in good faith).",footnote,unknown,body-text,0.969,✗
"83 see, e.g. , in re iridium operating llc, 478 f.3d 452, 464 (2d cir. 2007) ( ' [t]he bankruptcy court, in its discretion, could endorse a settlement that does not comply in some minor respects with the priority rule if the parties to the settlement justify, and the reviewing court clearly articulates the reasons for approving, a settlement that deviates from the priority rule. ' ).","83 see, e.g. , in re iridium operating llc, 478 f.3d 452, 464 (2d cir. 2007) (“[t]he bankruptcy court, in its discretion, could endorse a settlement that does not comply in some minor respects with the priority rule if the parties to the settlement justify, and the reviewing court clearly articulates the reasons for approving, a settlement that deviates from the priority rule.”).",footnote,unknown,body-text,0.990,✗
"84 jonathan seymour has described this practice as ' structural or holistic textualism. ' seymour, supra note 15, at 1953.","84 jonathan seymour has described this practice as “structural or holistic textualism.” seymour, supra note 15, at 1953.",footnote,unknown,body-text,0.975,✗
"85 see, e.g. , czyzewski v. jevic holding corp., 580 u.s. 451 (2017); law v. siegel, 571 u.s. 415, 424 (2014) ( ' the code ' s meticulous -not to say mind-numbingly detailed -enumeration of exemptions and exceptions to those exemptions con /unifb01 rms that courts are not authorized to create additional exceptions. ' ).","85 see, e.g. , czyzewski v. jevic holding corp., 580 u.s. 451 (2017); law v. siegel, 571 u.s. 415, 424 (2014) (“the code’s meticulous-not to say mind-numbingly detailed-enumeration of exemptions and exceptions to those exemptions confirms that courts are not authorized to create additional exceptions.”).",footnote,unknown,body-text,0.962,✗
"by our reading, however, non-textual concerns were the driving force behind the majority ' s decision. like the cases described in the previous section, the majority in purdue expressed a concern about structural issues that could be posed by third-party releases. the structural concerns stand out when the court expresses unease about a ' roving commission, ' and when it frames the question before it as one about the authority of bankruptcy courts rather than addressing the actual question before it, which dealt with the power of an article iii court presiding over a bankruptcy case .","by our reading, however, non-textual concerns were the driving force behind the majority’s decision. like the cases described in the previous section, the majority in purdue expressed a concern about structural issues that could be posed by third-party releases. the structural concerns stand out when the court expresses unease about a “roving commission,” and when it frames the question before it as one about the authority of bankruptcy courts rather than addressing the actual question before it, which dealt with the power of an article iii court presiding over a bankruptcy case .",text,unknown,body-text,0.992,✗
"in fact, one of the most notable parts of purdue is that the case satis /unifb01 ed the article iii requirements the supreme court had established a decade earlier. as a formal matter, the bankruptcy court order had been subject to and ultimately approved under de novo review in an article iii court (here, the second circuit). 89 the case thus came to the court as one not about the power of a bankruptcy court but about the power of an article iii court hearing a bankruptcy case to approve third-party releases. no direct constitutional claims were even raised on appeal. 90","in fact, one of the most notable parts of purdue is that the case satisfied the article iii requirements the supreme court had established a decade earlier. as a formal matter, the bankruptcy court order had been subject to and ultimately approved under de novo review in an article iii court (here, the second circuit). 89 the case thus came to the court as one not about the power of a bankruptcy court but about the power of an article iii court hearing a bankruptcy case to approve third-party releases. no direct constitutional claims were even raised on appeal. 90",text,unknown,body-text,0.991,✗
"86 harrington v. purdue pharma l.p., 603 u.s. 204, 218 -19 (2024) ( ' each of those ' other ' paragraphs authorizes a bankruptcy court to adjust claims without consent only to the extent such claims concern the debtor. from this, it follows naturally that an ' appropriate provision ' adopted pursuant to the catchall that purports to extinguish claims without consent should be similarly constrained. ' ).","86 harrington v. purdue pharma l.p., 603 u.s. 204, 218-19 (2024) (“each of those ‘other’ paragraphs authorizes a bankruptcy court to adjust claims without consent only to the extent such claims concern the debtor. from this, it follows naturally that an ‘appropriate provision’ adopted pursuant to the catchall that purports to extinguish claims without consent should be similarly constrained.”).",footnote,unknown,body-text,0.974,✗
"87 the most obvious provisions of the code limiting what can be in a plan are found in section 1129, which provides an extensive list of requirements that a plan must meet before it is approved. 11 u.s.c. § 1129.","87 the most obvious provisions of the code limiting what can be in a plan are found in section 1129, which provides an extensive list of requirements that a plan must meet before it is approved. 11 u.s.c. § 1129.",footnote,unknown,body-text,1.000,✗
"88 purdue pharma l.p. , 603 u.s. at 240 (kavanaugh, j., dissenting) ( ' the court has explained on numerous occasions that the ' ordinary meaning ' of a statute authorizing appropriate relief ' confers broad discretion ' on a court. ' (quoting sch. comm. v. dep ' t of ed., 471 u.s. 359, 369 (1985))).","88 purdue pharma l.p. , 603 u.s. at 240 (kavanaugh, j., dissenting) (“the court has explained on numerous occasions that the ‘ordinary meaning’ of a statute authorizing appropriate relief ‘confers broad discretion’ on a court.” (quoting sch. comm. v. dep’t of ed., 471 u.s. 359, 369 (1985))).",footnote,unknown,body-text,0.961,✗
"89 as the second circuit explained, ' the practical import of the stern issue is nonexistent given that only conclusions of law are at issue here, requiring our de novo review under any standard. ' in re purdue pharma l.p., 69 f.4th 45, 69 (2d cir. 2023).","89 as the second circuit explained, “the practical import of the stern issue is nonexistent given that only conclusions of law are at issue here, requiring our de novo review under any standard.” in re purdue pharma l.p., 69 f.4th 45, 69 (2d cir. 2023).",footnote,unknown,body-text,0.988,✗
"90 brief for the petitioner at 41, purdue pharma l.p. , 603 u.s. 204 (no. 23 -124), 2023 wl 6220089 (presenting only a constitutional avoidance argument).","90 brief for the petitioner at 41, purdue pharma l.p. , 603 u.s. 204 (no. 23-124), 2023 wl 6220089 (presenting only a constitutional avoidance argument).",footnote,unknown,body-text,0.997,✗
