pdf_text,html_text,docling_label,docling_layer,ground_truth_label,match_score,label_match
"and that is how purdue has proceeded. litigation against the sacklers is still enjoined while the parties continue to negotiate toward a near-global settlement. reports and court /unifb01 lings suggest they are close to a deal. but the parties have had to add creative mechanisms to protect against the risk of holdouts. according to one report, while the sacklers have increased their settlement offer by $500 million, they have also added a condition requiring the claimants ' to set aside as much as $800 million in an account akin to a legal-defense fund for the billionaires to /unifb01 ght such cases [brought by the hold outs]. ' 110","and that is how purdue has proceeded. litigation against the sacklers is still enjoined while the parties continue to negotiate toward a near-global settlement. reports and court filings suggest they are close to a deal. but the parties have had to add creative mechanisms to protect against the risk of holdouts. according to one report, while the sacklers have increased their settlement offer by $500 million, they have also added a condition requiring the claimants “to set aside as much as $800 million in an account akin to a legal-defense fund for the billionaires to fight such cases [brought by the hold outs].” 110",text,unknown,body-text,0.981,✗
"this structure is still subject to judicial approval and plan voting, but it provides a glimpse of the workarounds that might be attempted if mass tort cases are to be settled without nonconsensual releases in bankruptcy court.","this structure is still subject to judicial approval and plan voting, but it provides a glimpse of the workarounds that might be attempted if mass tort cases are to be settled without nonconsensual releases in bankruptcy court.",text,unknown,body-text,1.000,✗
"110 jan hoffman, sacklers up their offer to settle purdue opioids cases, with a new condition , n.y. times ( jan. 23, 2025), https://www.nytimes.com/2025/01/23/health/sacklers-purdue -settlement-opioids.html.","110 jan hoffman, sacklers up their offer to settle purdue opioids cases, with a new condition , n.y. times (jan. 23, 2025), https://www.nytimes.com/2025/01/23/health/sacklers-purdue-settlement-opioids.html .",footnote,unknown,body-text,0.993,✗
"nor do we have occasion today to express a view on what quali /unifb01 es as a consensual release or pass upon a plan that provides for the full satisfaction of claims against a third-party nondebtor. additionally, because this case involves only a stayed reorganization plan, we do not address whether our reading of the bankruptcy code would justify unwinding reorganization plans that have already become effective and been substantially consummated. 111","nor do we have occasion today to express a view on what qualifies as a consensual release or pass upon a plan that provides for the full satisfaction of claims against a third-party nondebtor. additionally, because this case involves only a stayed reorganization plan, we do not address whether our reading of the bankruptcy code would justify unwinding reorganization plans that have already become effective and been substantially consummated. 111",text,unknown,body-text,0.989,✗
"112 the court had received amicus brie /unifb01 ng on how its decision in purdue might affect that case. see brief of ad hoc group of local councils of the boy scouts of america as amicus curiae supporting debtor respondents, purdue pharma l.p. , 603 u.s. 204 (no. 23 -124), 2023 wl 7184149; brief for the boy scouts of america as amicus curiae in support of respondent, purdue pharma l.p. , 603 u.s. 204 (no. 23 -124). the court also received an application to stay the implementation of the plan of reorganization in the boy scouts of america bankruptcy pending the court ' s decision in purdue . see application for a stay of the bankruptcy plan presently being implemented in the united states bankruptcy court for the district of delaware (no. 22-1237), lujan claimants v. boy scouts of am., no. 23a741 (u.s. feb. 5, 2024). justice alito had granted a temporary stay for the court to consider that motion. see order, boy scouts of am. , no. 23a741 (u.s. feb. 16, 2024) (alito, j., in chambers). the court denied the application six days later. see order in pending case, boy scouts of am. , no. 23a741 (u.s. feb. 22, 2024). the boy scouts case was also mentioned during oral argument and around a dozen times in justice kavanaugh ' s dissent. see transcript of oral argument at 54, purdue pharma l.p. , 603 u.s. 204 (no. 23 -124); purdue pharma l.p. , 603 u.s. at 229, 238, 256, 264, 273, 275 n.7, 278 (kavanaugh, j., dissenting).","112 the court had received amicus briefing on how its decision in purdue might affect that case. see brief of ad hoc group of local councils of the boy scouts of america as amicus curiae supporting debtor respondents, purdue pharma l.p. , 603 u.s. 204 (no. 23-124), 2023 wl 7184149; brief for the boy scouts of america as amicus curiae in support of respondent, purdue pharma l.p. , 603 u.s. 204 (no. 23-124). the court also received an application to stay the implementation of the plan of reorganization in the boy scouts of america bankruptcy pending the court’s decision in purdue . see application for a stay of the bankruptcy plan presently being implemented in the united states bankruptcy court for the district of delaware (no. 22-1237), lujan claimants v. boy scouts of am., no. 23a741 (u.s. feb. 5, 2024). justice alito had granted a temporary stay for the court to consider that motion. see order, boy scouts of am. , no. 23a741 (u.s. feb. 16, 2024) (alito, j., in chambers). the court denied the application six days later. see order in pending case, boy scouts of am. , no. 23a741 (u.s. feb. 22, 2024). the boy scouts case was also mentioned during oral argument and around a dozen times in justice kavanaugh’s dissent. see transcript of oral argument at 54, purdue pharma l.p. , 603 u.s. 204 (no. 23-124); purdue pharma l.p. , 603 u.s. at 229, 238, 256, 264, 273, 275 n.7, 278 (kavanaugh, j., dissenting).",footnote,unknown,body-text,0.993,✗
"the boy scouts ' plan was con /unifb01 rmed by the bankruptcy court and now sits under consideration before the third circuit. 116 opponents of the plan argue it should be rejected under the reasoning of purdue because local councils, chartering organizations, and insurers are receiving nonconsensual nondebtor releases. 117","the boy scouts’ plan was confirmed by the bankruptcy court and now sits under consideration before the third circuit. 116 opponents of the plan argue it should be rejected under the reasoning of purdue because local councils, chartering organizations, and insurers are receiving nonconsensual nondebtor releases. 117",text,unknown,body-text,0.980,✗
"but proponents of the plan make two arguments for why it should survive the purdue decision. first, at the time of the purdue decision, the boy scouts ' plan was already con /unifb01 rmed and had been making payouts to victims for over a year. thus, they argue, it was ' substantially consummated, ' and the case is ' equitably moot. ' 118 because the purdue court speci /unifb01 cally declined to opine on substantial consummation, one might expect the third circuit to af /unifb01 rm the case, drawing some comfort that the supreme court will not step in to reverse.","but proponents of the plan make two arguments for why it should survive the purdue decision. first, at the time of the purdue decision, the boy scouts’ plan was already confirmed and had been making payouts to victims for over a year. thus, they argue, it was “substantially consummated,” and the case is “equitably moot.” 118 because the purdue court specifically declined to opine on substantial consummation, one might expect the third circuit to affirm the case, drawing some comfort that the supreme court will not step in to reverse.",text,unknown,body-text,0.959,✗
"114 see id. ; see also third modi /unifb01 ed fifth amended chapter 11 plan of reorganization (with technical modi /unifb01 cations) for boy scouts of america and delaware bsa, llc, boy scouts of am. , no. 20-10343 (bankr. d. del. aug. 29, 2022) [hereinafter boy scouts plan].","114 see id. ; see also third modified fifth amended chapter 11 plan of reorganization (with technical modifications) for boy scouts of america and delaware bsa, llc, boy scouts of am. , no. 20-10343 (bankr. d. del. aug. 29, 2022) [hereinafter boy scouts plan].",footnote,unknown,body-text,0.963,✗
"115 see boy scouts plan, supra note 114.","115 see boy scouts plan, supra note 114.",footnote,unknown,body-text,1.000,✗
"117 lujan claimants supplemental brief re: effect of purdue on appeal, boy scouts of am. , no. 23-01664 (3d cir. aug. 7, 2024).","117 lujan claimants supplemental brief re: effect of purdue on appeal, boy scouts of am. , no. 23-01664 (3d cir. aug. 7, 2024).",footnote,unknown,body-text,1.000,✗
"118 supplemental brief of appellees boy scouts of america, the ad hoc committee of local councils and the coalition of abused scouts for justice, boy scouts of am. , no. 2301664 (3d cir. aug. 7, 2024) [hereinafter supplemental brief of appellees]; see also supplemental brief of appellee future claimants ' representative regarding the effect of harrington v. purdue pharma l.p. , boy scouts of am. , no. 23-01664 (3d cir. aug. 7, 2024).","118 supplemental brief of appellees boy scouts of america, the ad hoc committee of local councils and the coalition of abused scouts for justice, boy scouts of am. , no. 23-01664 (3d cir. aug. 7, 2024) [hereinafter supplemental brief of appellees]; see also supplemental brief of appellee future claimants’ representative regarding the effect of harrington v. purdue pharma l.p. , boy scouts of am. , no. 23-01664 (3d cir. aug. 7, 2024).",footnote,unknown,body-text,0.995,✗
"119 to be clear, we do not think this example proves the account of bankruptcy exceptionalism. rather it is just an instance of the phenomenon common to all of law where one judicial doctrine developed by lower courts is inconsistent with the approach preferred by the supreme court.","119 to be clear, we do not think this example proves the account of bankruptcy exceptionalism. rather it is just an instance of the phenomenon common to all of law where one judicial doctrine developed by lower courts is inconsistent with the approach preferred by the supreme court.",footnote,unknown,body-text,1.000,✗
"the proponents of the plan in the boys scouts case might have two additional arrows in their quiver. first, section 363(m) of the code speci /unifb01 cally protects certain asset sales from appellate review after they have been consummated. 121 the boy scouts settlement plan included the sale of insurance policies back to insurers for almost $1.6 billion free and clear of any claims against the policies 122 as part of the release structure. 123 these sales were bound up with the entire plan and the releases of other nondebtor entities and co-insured parties. a court might read section 363(m) as protecting a consummated sale and all intertwined transactions from appellate review. as one might expect, the parties ' briefs very in their views about how intertwined the sales are with other transactions. 124","the proponents of the plan in the boys scouts case might have two additional arrows in their quiver. first, section 363(m) of the code specifically protects certain asset sales from appellate review after they have been consummated. 121 the boy scouts settlement plan included the sale of insurance policies back to insurers for almost $1.6 billion free and clear of any claims against the policies 122 as part of the release structure. 123 these sales were bound up with the entire plan and the releases of other nondebtor entities and co-insured parties. a court might read section 363(m) as protecting a consummated sale and all intertwined transactions from appellate review. as one might expect, the parties’ briefs very in their views about how intertwined the sales are with other transactions. 124",text,unknown,body-text,0.992,✗
"121 11 u.s.c. § 363(m); see supplemental brief of appellees, supra note 118, at 16 -18; appellees settling insurers supplemental brief, boy scouts of am. , no. 23-01664 (3d cir. aug. 7, 2024).","121 11 u.s.c. § 363(m); see supplemental brief of appellees, supra note 118, at 16-18; appellees settling insurers supplemental brief, boy scouts of am. , no. 23-01664 (3d cir. aug. 7, 2024).",footnote,unknown,body-text,0.997,✗
"122 there is an exception in the plan for claims belonging to one chartering organization that had potential claims as an additional insured party, the archbishop of agana, a corporation sole. see boys scouts plan, supra note 114. the archbishop was itself an entity in chapter 11 bankruptcy proceedings. the bankruptcy court in boy scouts had ruled that a sale free of the archbishop ' s interests would violate the automatic stay in the archbishop ' s bankruptcy. see in re boy scouts of am., 642 b.r. 504, 574 (bankr. d. del. 2022). this wrinkle demonstrates the naïveté of claims that releases were not needed in purdue because the sacklers could just /unifb01 le for bankruptcy themselves. such a proceeding would not foster resolution but instead would complicate matters and create what is often referred to as the ' dueling debtor ' problem. see id. at 578 (describing ' dueling debtor ' cases); see also harrington v. purdue pharma l.p., 603 u.s. 204, 273 (2024) (kavanaugh, j., dissenting) ( ' and in cases involving hundreds of af /unifb01 liated entities who share liability and share insurance, such as the boy scouts and the catholic church, it would be almost impossible to coordinate assets and ensure equitable victim recovery across hundreds of distinct bankruptcies. ' ).","122 there is an exception in the plan for claims belonging to one chartering organization that had potential claims as an additional insured party, the archbishop of agana, a corporation sole. see boys scouts plan, supra note 114. the archbishop was itself an entity in chapter 11 bankruptcy proceedings. the bankruptcy court in boy scouts had ruled that a sale free of the archbishop’s interests would violate the automatic stay in the archbishop’s bankruptcy. see in re boy scouts of am., 642 b.r. 504, 574 (bankr. d. del. 2022). this wrinkle demonstrates the naïveté of claims that releases were not needed in purdue because the sacklers could just file for bankruptcy themselves. such a proceeding would not foster resolution but instead would complicate matters and create what is often referred to as the “dueling debtor” problem. see id. at 578 (describing “dueling debtor” cases); see also harrington v. purdue pharma l.p., 603 u.s. 204, 273 (2024) (kavanaugh, j., dissenting) (“and in cases involving hundreds of affiliated entities who share liability and share insurance, such as the boy scouts and the catholic church, it would be almost impossible to coordinate assets and ensure equitable victim recovery across hundreds of distinct bankruptcies.”).",footnote,unknown,body-text,0.982,✗
"124 see brief for certain contributing and participating chartered organizations as amici curiae in support of af /unifb01 rmance at 4, 14, boy scouts of am. , no. 23-01664 (3d cir. aug. 7, 2024) (urging ' the court to treat the plan as the package deal that it is ' despite arguments by insurers that the court ' should uphold the buyback even if other aspects of the con /unifb01 rmation order, including the releases, are reversed ' ).","124 see brief for certain contributing and participating chartered organizations as amici curiae in support of affirmance at 4, 14, boy scouts of am. , no. 23-01664 (3d cir. aug. 7, 2024) (urging “the court to treat the plan as the package deal that it is” despite arguments by insurers that the court “should uphold the buyback even if other aspects of the confirmation order, including the releases, are reversed”).",footnote,unknown,body-text,0.961,✗
"the third circuit. 125 the concept is simple. if a claimant is paid the full amount it is owed by the third-party nondebtor, then there is nothing left to argue about, and the release cannot harm anyone. the full-satisfaction doctrine is most intuitive in an insurer or joint tortfeasor context. a victim who suffered $1 million in damages may be entitled to recover $1 million from either the debtor or a third party or both. but the victim is not entitled to recover more than $1 million in damages just because there might be two possible defendants. if the victim attempted to bring suit after fully recovering, the prior recovery would be a defense, and the case would be dismissed. and so, some courts have said that a bankruptcy court can release the victims ' claims against the nondebtor when the debtor ' s estate is providing full satisfaction of the claim (here, $1 million).","finally, there is the argument about full-satisfaction plans, which proponents of the boy scouts settlement plan have leaned on before the third circuit. 125 the concept is simple. if a claimant is paid the full amount it is owed by the third-party nondebtor, then there is nothing left to argue about, and the release cannot harm anyone. the full-satisfaction doctrine is most intuitive in an insurer or joint tortfeasor context. a victim who suffered $1 million in damages may be entitled to recover $1 million from either the debtor or a third party or both. but the victim is not entitled to recover more than $1 million in damages just because there might be two possible defendants. if the victim attempted to bring suit after fully recovering, the prior recovery would be a defense, and the case would be dismissed. and so, some courts have said that a bankruptcy court can release the victims’ claims against the nondebtor when the debtor’s estate is providing full satisfaction of the claim (here, $1 million).",text,unknown,body-text,0.925,✗
"but implementation of the doctrine is fraught. set aside future claimants, where the full-satisfaction doctrine is meaningless, and one still must /unifb01 gure out who decides what counts as full satisfaction. at the time of a mass tort settlement, most victims have not had their individual claims litigated. the court does not know the amount of a particular objecting victim ' s claim against the nondebtor (or against the debtor for that matter).","but implementation of the doctrine is fraught. set aside future claimants, where the full-satisfaction doctrine is meaningless, and one still must figure out who decides what counts as full satisfaction. at the time of a mass tort settlement, most victims have not had their individual claims litigated. the court does not know the amount of a particular objecting victim’s claim against the nondebtor (or against the debtor for that matter).",text,unknown,body-text,0.985,✗
"what does it mean then to say that the claim against the nondebtor is fully satis /unifb01 ed by the settlement trust? this question has two components. first, how much is owed to the victim, and second, when will the money be made available to the victims? in the boy scouts case, the judge made a detailed factual /unifb01 nding based on expert testimony to the effect that there would be enough money in the settlement trust to pay all claims in full. this is essentially a statistical /unifb01 nding that all potential liabilities will likely be covered, but it is far from a certainty. 126","what does it mean then to say that the claim against the nondebtor is fully satisfied by the settlement trust? this question has two components. first, how much is owed to the victim, and second, when will the money be made available to the victims? in the boy scouts case, the judge made a detailed factual finding based on expert testimony to the effect that there would be enough money in the settlement trust to pay all claims in full. this is essentially a statistical finding that all potential liabilities will likely be covered, but it is far from a certainty. 126",text,unknown,body-text,0.976,✗
"125 see supplemental brief of appellees, supra note 118, at 5 -12.","125 see supplemental brief of appellees, supra note 118, at 5-12.",footnote,unknown,body-text,0.992,✗
"126 see brubaker, supra note 39, at 10 (noting that it is impossible to know at con /unifb01 rmation if a mass tort plan is providing full payment).","126 see brubaker, supra note 39, at 10 (noting that it is impossible to know at confirmation if a mass tort plan is providing full payment).",footnote,unknown,body-text,0.965,✗
"again, the only provision that could possibly supply authority to include those full-satisfaction releases in a bankruptcy plan is the catchall in § 1123(b)(6). any contract-law theory would not work for full-satisfaction releases, given that holdout creditors often refuse to consent to fullsatisfaction releases. so if full-satisfaction releases are to be allowed, § 1123(b)(6) must be read to reach creditor claims against non-debtors, even without consent. 128","again, the only provision that could possibly supply authority to include those full-satisfaction releases in a bankruptcy plan is the catchall in § 1123(b)(6). any contract-law theory would not work for full-satisfaction releases, given that holdout creditors often refuse to consent to full-satisfaction releases. so if full-satisfaction releases are to be allowed, § 1123(b)(6) must be read to reach creditor claims against non-debtors, even without consent. 128",text,unknown,body-text,0.999,✗
one version of the full-satisfaction doctrine that might survive postpurdue scrutiny would be for courts to allow channeling injunctions that require victims to bring cases against the fund until and unless the fund runs out of money. such injunctions could be considered in aid of a rule that a tort victim is only entitled to one satisfaction 129 but would not bind victims to a release that may result in less than full payment. this would be consistent with the court ' s authority to enter injunctions either under section 105(a) ' s grant of power necessary to enforce a plan or the all writs act ' s grant of authority in aid of a court ' s jurisdiction.,one version of the full-satisfaction doctrine that might survive postpurdue scrutiny would be for courts to allow channeling injunctions that require victims to bring cases against the fund until and unless the fund runs out of money. such injunctions could be considered in aid of a rule that a tort victim is only entitled to one satisfaction 129 but would not bind victims to a release that may result in less than full payment. this would be consistent with the court’s authority to enter injunctions either under section 105(a)’s grant of power necessary to enforce a plan or the all writs act’s grant of authority in aid of a court’s jurisdiction.,text,unknown,body-text,0.988,✗
"such releases would become ineffective if, years down the road, the fund ran out of money. it is not clear whether debtors would get behind that version of releases. on the one hand, if the funds truly are providing full satisfaction, the possibility of the fund running out should be negligible. on the other hand, the entire point of the releases is to provide /unifb01 nality in aid of settlement. precisely because the number and magnitude of future claims is unknown and plagued by variance, the tail risk is high.","such releases would become ineffective if, years down the road, the fund ran out of money. it is not clear whether debtors would get behind that version of releases. on the one hand, if the funds truly are providing full satisfaction, the possibility of the fund running out should be negligible. on the other hand, the entire point of the releases is to provide finality in aid of settlement. precisely because the number and magnitude of future claims is unknown and plagued by variance, the tail risk is high.",text,unknown,body-text,0.991,✗
"127 it is possible that the court will view things differently than in purdue if the litigants /unifb01 nd the right statutory authority. one argument put forward in the red river talc bankruptcy is that the authority for full-satisfaction releases (and nonconsensual releases more broadly) may lie in the all writs act. see supra note 49. in this way, the lawyers have astutely separated the argument for releases from the bankruptcy code and from the powers of a bankruptcy judge. whether that is enough to distance the issue from the new bankruptcy exceptionalism remains to be seen, but it may be the strongest remaining argument (in the eyes of the court) for releases.","127 it is possible that the court will view things differently than in purdue if the litigants find the right statutory authority. one argument put forward in the red river talc bankruptcy is that the authority for full-satisfaction releases (and nonconsensual releases more broadly) may lie in the all writs act. see supra note 49. in this way, the lawyers have astutely separated the argument for releases from the bankruptcy code and from the powers of a bankruptcy judge. whether that is enough to distance the issue from the new bankruptcy exceptionalism remains to be seen, but it may be the strongest remaining argument (in the eyes of the court) for releases.",footnote,unknown,body-text,0.993,✗
"128 harrington v. purdue pharma l.p., 603 u.s. 204, 264 (2024) (kavanaugh, j., dissenting).","128 harrington v. purdue pharma l.p., 603 u.s. 204, 264 (2024) (kavanaugh, j., dissenting).",footnote,unknown,body-text,1.000,✗
