pdf_text,html_text,docling_label,docling_layer,ground_truth_label,match_score,label_match
"onits surface, the supreme court ' s decision in harrington v. purdue pharma l.p. 1 is about whether the text of the united states bankruptcy code gives courts the authority to approve nonconsensual third-party releases in chapter 11. 2 section 1123(b)(6) of the code allows chapter 11 plans of reorganization to ' include any other appropriate provision not inconsistent with the applicable provisions of this title. ' 3 the question posed to the court in purdue was whether that language encompasses nonconsensual third-party releases. the","on its surface, the supreme court’s decision in harrington v. purdue pharma l.p. 1 is about whether the text of the united states bankruptcy code gives courts the authority to approve nonconsensual third-party releases in chapter 11. 2 section 1123(b)(6) of the code allows chapter 11 plans of reorganization to “include any other appropriate provision not inconsistent with the applicable provisions of this title.” 3 the question posed to the court in purdue was whether that language encompasses nonconsensual third-party releases. the majority concluded it does not. justice kavanaugh, writing for a four-justice dissent, disagreed.",text,unknown,body-text,0.907,✗
anthony j. casey is the donald m. ephraim professor of law and economics at the university of chicago law school and the faculty director of the center on law and finance. joshua c. macey is an associate professor of law at yale law school.,anthony j. casey is the donald m. ephraim professor of law and economics at the university of chicago law school and the faculty director of the center on law and finance. joshua c. macey is an associate professor of law at yale law school.,footnote,unknown,body-text,1.000,✗
"authors ' note: the richard weil faculty research fund and the paul h. leffmann fund provided generous research support to casey. we are grateful to william baude for his excellent comments and to kelly bu, emma lotts, and elaine wang for their excellent research assistance.","authors’ note: the richard weil faculty research fund and the paul h. leffmann fund provided generous research support to casey. we are grateful to william baude for his excellent comments and to kelly bu, emma lotts, and elaine wang for their excellent research assistance.",footnote,unknown,body-text,0.995,✗
2 id. at 209. nonconsensual third-party releases are court orders that release nondebtor third parties from claims of liability when not all claimholders consent to the release. these releases are often provided as part of a settlement in exchange for contributions from the party bene /unifb01 tting from the releases. the orders often include channeling injunctions that prevent the claimholders from bringing their claims against the nondebtors and force them instead to bring their claims exclusively against a settlement fund.,2 id. at 209. nonconsensual third-party releases are court orders that release nondebtor third parties from claims of liability when not all claimholders consent to the release. these releases are often provided as part of a settlement in exchange for contributions from the party benefitting from the releases. the orders often include channeling injunctions that prevent the claimholders from bringing their claims against the nondebtors and force them instead to bring their claims exclusively against a settlement fund.,footnote,unknown,body-text,0.991,✗
"although both the majority and dissent anchored their arguments in the text of section 1123, non-textual concerns featured prominently in both opinions. for his part, justice kavanaugh emphasized that bankruptcy law is designed to address the kind of collectiveaction problems that arise in mass tort cases like purdue . 4 he further argued that third-party releases are an important tool in facilitating a collective resolution. 5 the majority, by contrast, expressed concern that bankruptcy courts operate as if they have a ' roving commission to resolve all such problems that happen [their] way, blind to the role other mechanisms (legislation, class actions, multi-district litigation, consensual settlements, among others) play in addressing them. ' 6","although both the majority and dissent anchored their arguments in the text of section 1123, non-textual concerns featured prominently in both opinions. for his part, justice kavanaugh emphasized that bankruptcy law is designed to address the kind of collective-action problems that arise in mass tort cases like purdue . 4 he further argued that third-party releases are an important tool in facilitating a collective resolution. 5 the majority, by contrast, expressed concern that bankruptcy courts operate as if they have a “roving commission to resolve all such problems that happen [their] way, blind to the role other mechanisms (legislation, class actions, multi-district litigation, consensual settlements, among others) play in addressing them.” 6",text,unknown,body-text,0.995,✗
"a version of this concern has long troubled courts and academics, who have argued that bankruptcy courts exercise too much discretion and too much power. these critiques typically refer to a concept of ' bankruptcy exceptionalism. ' often the concern is that a non-article iii tribunal (the bankruptcy court) wields article iii powers. 7 as we explain in part i, we are skeptical that there is anything exceptional about these powers. all courts exercise discretion and /unifb01 ll gaps, and bankruptcy court discretion is /unifb01 rmly rooted in the text of the bankruptcy code and subject to de novo review in an article iii tribunal. 8 still, since the code was enacted, the concern that bankruptcy courts possess too much authority and too much discretion has been the basis of numerous constitutional decisions limiting the power of bankruptcy courts.","a version of this concern has long troubled courts and academics, who have argued that bankruptcy courts exercise too much discretion and too much power. these critiques typically refer to a concept of “bankruptcy exceptionalism.” often the concern is that a non-article iii tribunal (the bankruptcy court) wields article iii powers. 7 as we explain in part i, we are skeptical that there is anything exceptional about these powers. all courts exercise discretion and fill gaps, and bankruptcy court discretion is firmly rooted in the text of the bankruptcy code and subject to de novo review in an article iii tribunal. 8 still, since the code was enacted, the concern that bankruptcy courts possess too much authority and too much discretion has been the basis of numerous constitutional decisions limiting the power of bankruptcy courts.",text,unknown,body-text,0.986,✗
"4 purdue pharma l.p. , 603 u.s. at 227 -28 (kavanaugh, j., dissenting).","4 purdue pharma l.p. , 603 u.s. at 227-28 (kavanaugh, j., dissenting).",footnote,unknown,body-text,0.993,✗
6 id. at 220 (majority opinion).,6 id. at 220 (majority opinion).,footnote,unknown,body-text,1.000,✗
"8 the discretion of the bankruptcy courts is quite routine and provided for by the text of the bankruptcy code. sometimes the code allocates discretion to the courts by using broad language (like ' appropriate ' ). other times it invokes the language of equity (like ' fair and equitable ' ). there is nothing particularly exceptional about these grants of discretion. as justice scalia wrote more than twenty/unifb01 ve years ago, drafting a law requires a decision about whether to set ex ante rules or to leave matters to ex post judicial discretion. and a court announcing a judicial doctrine must decide how much discretion to leave to future courts. see generally antonin scalia, the rule of law as a law of rules , 56 u. chi. l. rev. 1175 (1989).","8 the discretion of the bankruptcy courts is quite routine and provided for by the text of the bankruptcy code. sometimes the code allocates discretion to the courts by using broad language (like “appropriate”). other times it invokes the language of equity (like “fair and equitable”). there is nothing particularly exceptional about these grants of discretion. as justice scalia wrote more than twenty-five years ago, drafting a law requires a decision about whether to set ex ante rules or to leave matters to ex post judicial discretion. and a court announcing a judicial doctrine must decide how much discretion to leave to future courts. see generally antonin scalia, the rule of law as a law of rules , 56 u. chi. l. rev. 1175 (1989).",footnote,unknown,body-text,0.984,✗
"issues, at least not directly. with regard to article iii, the second circuit, in af /unifb01 rming the use of third-party releases, had decided that de novo review by an article iii court was required but noted it was providing that review. 9 thus, the question before the supreme court was not whether a bankruptcy court could approve the releases, but whether an article iii court hearing bankruptcy cases could. and yet, the majority repeatedly framed its inquiry as being about the power of bankruptcy courts. 10","an important but misunderstood feature of the purdue decision, however, is that the supreme court did not address any constitutional issues, at least not directly. with regard to article iii, the second circuit, in affirming the use of third-party releases, had decided that de novo review by an article iii court was required but noted it was providing that review. 9 thus, the question before the supreme court was not whether a bankruptcy court could approve the releases, but whether an article iii court hearing bankruptcy cases could. and yet, the majority repeatedly framed its inquiry as being about the power of bankruptcy courts. 10",text,unknown,body-text,0.877,✗
"as a result, the opinion is /unifb02 ush with exceptionalist rhetoric about expansive bankruptcy court power while the holding does not address the issue head on. instead, the court develops a new statutory canon of constraint that narrowly construes terms in the bankruptcy code -like ' appropriate, ' ' necessary, ' and ' fair and equitable ' -to cabin judicial authority in bankruptcy cases. 11 this, we argue, represents a new bankruptcy exceptionalism in which broad statutory provisions that should be interpreted by their plain meaning are narrowed to constrain the powers of bankruptcy courts.","as a result, the opinion is flush with exceptionalist rhetoric about expansive bankruptcy court power while the holding does not address the issue head on. instead, the court develops a new statutory canon of constraint that narrowly construes terms in the bankruptcy code-like “appropriate,” “necessary,” and “fair and equitable”-to cabin judicial authority in bankruptcy cases. 11 this, we argue, represents a new bankruptcy exceptionalism in which broad statutory provisions that should be interpreted by their plain meaning are narrowed to constrain the powers of bankruptcy courts.",text,unknown,body-text,0.976,✗
"10 purdue pharma l.p. , 603 u.s. at 218 ( ' [w]e do not think paragraph (6) affords a bankruptcy court the authority the plan proponents suppose. ' ); id. ( ' doubtless, paragraph (6) operates to confer additional authorities on a bankruptcy court. but the catchall cannot be fairly read to endow a bankruptcy court with the ' radically different ' power to discharge the debts of a nondebtor without the consent of affected nondebtor claimants. ' (citations omitted)); id. at 218 -19 ( ' each of those ' other ' paragraphs authorizes a bankruptcy court to adjust claims without consent only to the extent such claims concern the debtor. ' ); id. at 219 ( ' the dissent neglects why a bankruptcy court may resolve derivate claims under paragraph (3). . . . ' ); id. at 220 ( ' [n]o one (save perhaps the dissent) thinks it provides a bankruptcy court with a roving commission to resolve all such problems that happen its way. . . . ' ).","10 purdue pharma l.p. , 603 u.s. at 218 (“[w]e do not think paragraph (6) affords a bankruptcy court the authority the plan proponents suppose.”); id. (“doubtless, paragraph (6) operates to confer additional authorities on a bankruptcy court. but the catchall cannot be fairly read to endow a bankruptcy court with the ‘radically different’ power to discharge the debts of a nondebtor without the consent of affected nondebtor claimants.” (citations omitted)); id. at 218-19 (“each of those ‘other’ paragraphs authorizes a bankruptcy court to adjust claims without consent only to the extent such claims concern the debtor.”); id. at 219 (“the dissent neglects why a bankruptcy court may resolve derivate claims under paragraph (3)… .”); id. at 220 (“[n]o one (save perhaps the dissent) thinks it provides a bankruptcy court with a roving commission to resolve all such problems that happen its way… .”).",footnote,unknown,body-text,0.965,✗
"11 indeed, the supreme court ' s recent bankruptcy jurisprudence repeatedly emphasizes its intention to interpret the code to narrow the discretion of bankruptcy courts. see infra section ii.b. meanwhile, the third circuit announced a new good-faith /unifb01 ling requirement that will curtail the scope of cases that can come before a bankruptcy judge. see in re ltl mgmt., llc, 64 f.4th 84 (3d cir. 2023).","11 indeed, the supreme court’s recent bankruptcy jurisprudence repeatedly emphasizes its intention to interpret the code to narrow the discretion of bankruptcy courts. see infra section ii.b. meanwhile, the third circuit announced a new good-faith filing requirement that will curtail the scope of cases that can come before a bankruptcy judge. see in re ltl mgmt., llc, 64 f.4th 84 (3d cir. 2023).",footnote,unknown,body-text,0.984,✗
12 see infra part iii.,12 see infra part iii.,footnote,unknown,body-text,1.000,✗
"a canon of narrowing broad language and constraining bankruptcy judges thus draws into question the scope and meaning of these provisions and many of the common tools of the practice. if this new approach sticks, it could create barriers to collective resolution by incentivizing parties, lawyers, and bankruptcy judges to /unifb01 nd workarounds that are immune to appellate scrutiny.","a canon of narrowing broad language and constraining bankruptcy judges thus draws into question the scope and meaning of these provisions and many of the common tools of the practice. if this new approach sticks, it could create barriers to collective resolution by incentivizing parties, lawyers, and bankruptcy judges to find workarounds that are immune to appellate scrutiny.",text,unknown,body-text,0.988,✗
"this article explores these developments in three parts. part i describes and critiques conventional scholarly claims about bankruptcy exceptionalism. part ii presents the supreme court ' s approach to bankruptcy over the last four decades. while the court has historically questioned the constitutionality of bankruptcy courts in a direct fashion, we speculate that purdue marks the culmination of the court ' s shift toward a canon that reads broad provisions in the code narrowly to protect article iii power while avoiding direct constitutional questions. part iii considers how this new bankruptcy exceptionalism will affect bankruptcy practice and incentivize costly workarounds.","this article explores these developments in three parts. part i describes and critiques conventional scholarly claims about bankruptcy exceptionalism. part ii presents the supreme court’s approach to bankruptcy over the last four decades. while the court has historically questioned the constitutionality of bankruptcy courts in a direct fashion, we speculate that purdue marks the culmination of the court’s shift toward a canon that reads broad provisions in the code narrowly to protect article iii power while avoiding direct constitutional questions. part iii considers how this new bankruptcy exceptionalism will affect bankruptcy practice and incentivize costly workarounds.",text,unknown,body-text,0.994,✗
14 it has even made its way into the insolvency laws of several other jurisdictions around the world.,14 it has even made its way into the insolvency laws of several other jurisdictions around the world.,footnote,unknown,body-text,1.000,✗
"15 see, e.g. , jonathan c. lipson, debt and democracy: towards a constitutional theory of bankruptcy , 83 notre dame l. rev. 605, 611 (2008) ( ' bankruptcy appears to result in exceptions to conventional notions about the treatment of a variety of constitutional protections involving, among others, property, due process, and religious liberty. ' ); jonathan m. seymour, against bankruptcy exceptionalism , 89 u. chi. l. rev. 1925, 1956 (2022) ( ' [b]ankruptcy scholars are close to consensus that some kind of bankruptcy exceptionalism exists, whether typi /unifb01 ed by the","15 see, e.g. , jonathan c. lipson, debt and democracy: towards a constitutional theory of bankruptcy , 83 notre dame l. rev. 605, 611 (2008) (“bankruptcy appears to result in exceptions to conventional notions about the treatment of a variety of constitutional protections involving, among others, property, due process, and religious liberty.”); jonathan m. seymour, against bankruptcy exceptionalism , 89 u. chi. l. rev. 1925, 1956 (2022) (“[b]ankruptcy scholars are close to consensus that some kind of bankruptcy exceptionalism exists, whether typified by the claim that the bankruptcy court is a ‘court of equity’ with broad equitable powers, by a distinctly equitable flavor of statutory interpretation, or in some other form.”).",footnote,unknown,body-text,0.860,✗
"what exactly do scholars and courts mean when they describe bankruptcy courts as exceptional? at /unifb01 rst glance, some common descriptions seem unremarkable. bankruptcy courts /unifb01 ll gaps, /unifb01 nd exceptions to general rules, craft equitable remedies, and take account of unwritten norms. but so do judges in all courts in the united states. 18 so there would need to be something distinctive about bankruptcy courts and bankruptcy practice -something more fundamental -to set them apart.","what exactly do scholars and courts mean when they describe bankruptcy courts as exceptional? at first glance, some common descriptions seem unremarkable. bankruptcy courts fill gaps, find exceptions to general rules, craft equitable remedies, and take account of unwritten norms. but so do judges in all courts in the united states. 18 so there would need to be something distinctive about bankruptcy courts and bankruptcy practice-something more fundamental-to set them apart.",text,unknown,body-text,0.970,✗
"16 jonathan c. lipson & pamela foohey, the end(s) of bankruptcy exceptionalism: purdue pharma and the problem of social debt , 46 cardozo l. rev. (forthcoming 2025), https://ssrn .com/abstract p 5025124.","16 jonathan c. lipson & pamela foohey, the end(s) of bankruptcy exceptionalism: purdue pharma and the problem of social debt , 46 cardozo l. rev. (forthcoming 2025), https://ssrn.com/abstract=5025124 .",footnote,unknown,body-text,0.985,✗
"17 seymour, supra note 15, at 1930.","17 seymour, supra note 15, at 1930.",footnote,unknown,body-text,1.000,✗
"18 perhaps not justice gorsuch. but he is an outlier. during his con /unifb01 rmation hearings, one of his tenth circuit dissenting opinions refusing to /unifb01 nd an equitable exception to a statute was widely criticized. the case -commonly referred to as the ' frozen trucker case ' -involved a truck driver who was /unifb01 red for driving his employer ' s truck to safety to avoid life-threatening cold. the majority of the tenth circuit upheld /unifb01 ndings by the department of labor (dol) and an administrative law judge (alj) that the termination violated a law prohibiting discharge where an employee ' refuses to operate a vehicle ' because of unsafe conditions. transam trucking, inc. v. admin. rev. bd., 833 f.3d 1206 (10th cir. 2016). then-judge gorsuch dissented, explaining that the driver operated the vehicle and the statute only protected refusal to operate . he explained that neither the dol, nor the alj, nor the tenth circuit had the power to read an exception into the statute. far from labeling the majority as ' exceptionalist ' for its broad interpretation, critics viewed gorsuch ' s position as the exception. one scholar argued that gorsuch ' s approach revealed that that he might be un /unifb01 t for the supreme court. jed shugerman, neil gorsuch and the ' frozen trucker, ' slate (mar. 21, 2017, 10:38 am), https://slate.com/news-and-politics/2017/03 /neil-gorsuchs-arrogant-frozen-trucker-opinion-shows-he-wants-to-be-like-scalia.html.","18 perhaps not justice gorsuch. but he is an outlier. during his confirmation hearings, one of his tenth circuit dissenting opinions refusing to find an equitable exception to a statute was widely criticized. the case-commonly referred to as the “frozen trucker case”-involved a truck driver who was fired for driving his employer’s truck to safety to avoid life-threatening cold. the majority of the tenth circuit upheld findings by the department of labor (dol) and an administrative law judge (alj) that the termination violated a law prohibiting discharge where an employee “refuses to operate a vehicle” because of unsafe conditions. transam trucking, inc. v. admin. rev. bd., 833 f.3d 1206 (10th cir. 2016). then-judge gorsuch dissented, explaining that the driver operated the vehicle and the statute only protected refusal to operate . he explained that neither the dol, nor the alj, nor the tenth circuit had the power to read an exception into the statute. far from labeling the majority as “exceptionalist” for its broad interpretation, critics viewed gorsuch’s position as the exception. one scholar argued that gorsuch’s approach revealed that that he might be unfit for the supreme court. jed shugerman, neil gorsuch and the ‘frozen trucker,’ slate (mar. 21, 2017, 10:38 am), https://slate.com/news-and-politics/2017/03/neil-gorsuchs-arrogant-frozen-trucker-opinion-shows-he-wants-to-be-like-scalia.html .",footnote,unknown,body-text,0.970,✗
"justice gorsuch ' s reasoning in the frozen trucker case is of a kind with his purdue opinion. both are formalist approaches exhibiting a distrust of judicial discretion exercised in the /unifb01 rst instance by non-article iii judges. similar themes can also be found in his concurrence in loper bright enterprises v. raimondo , 603 u.s. 369 (2024), which was decided the day after purdue and overruled the chevron doctrine. id. at 416 (gorsuch, j., concurring).","justice gorsuch’s reasoning in the frozen trucker case is of a kind with his purdue opinion. both are formalist approaches exhibiting a distrust of judicial discretion exercised in the first instance by non-article iii judges. similar themes can also be found in his concurrence in loper bright enterprises v. raimondo , 603 u.s. 369 (2024), which was decided the day after purdue and overruled the chevron doctrine. id. at 416 (gorsuch, j., concurring).",footnote,unknown,body-text,0.986,✗
"in the remainder of this part, we explore these different accounts of bankruptcy exceptionalism. we start with the weak version focused on the exercise of equitable discretion and then move to more substantial claims grounded in constitutional concerns of due process, structure, and separation of powers.","in the remainder of this part, we explore these different accounts of bankruptcy exceptionalism. we start with the weak version focused on the exercise of equitable discretion and then move to more substantial claims grounded in constitutional concerns of due process, structure, and separation of powers.",text,unknown,body-text,1.000,✗
"some critics describe bankruptcy courts as exceptional for exercising discretion. because this same discretion is exercised by other federal and state courts, in our view, these accounts re /unifb02 ect an antibankruptcy bias that has long permeated academic scholarship.","some critics describe bankruptcy courts as exceptional for exercising discretion. because this same discretion is exercised by other federal and state courts, in our view, these accounts reflect an anti-bankruptcy bias that has long permeated academic scholarship.",text,unknown,body-text,0.979,✗
[i]n truth we are all exceptionalists to some extent. no one seriously argues that bankruptcy courts lack equitable discretion to recognize exceptions to general rules. . . . 22,[i]n truth we are all exceptionalists to some extent. no one seriously argues that bankruptcy courts lack equitable discretion to recognize exceptions to general rules… . 22,text,unknown,body-text,0.983,✗
"19 section 105(a) gives bankruptcy courts authority to ' issue any order, process, or judgment that is necessary or appropriate to carry out the provisions of this title. ' 11 u.s.c. § 105(a). section 1123(b)(6), as discussed, gives bankruptcy courts authority to ' include ' in a reorganization plan ' any other appropriate provision not inconsistent with the applicable provisions of this title. ' 11 u.s.c. § 1123(b)(6).","19 section 105(a) gives bankruptcy courts authority to “issue any order, process, or judgment that is necessary or appropriate to carry out the provisions of this title.” 11 u.s.c. § 105(a). section 1123(b)(6), as discussed, gives bankruptcy courts authority to “include” in a reorganization plan “any other appropriate provision not inconsistent with the applicable provisions of this title.” 11 u.s.c. § 1123(b)(6).",footnote,unknown,body-text,0.979,✗
