pdf_text,html_text,docling_label,docling_layer,ground_truth_label,match_score,label_match
"driving the point home, although the court claimed it was engaging in ordinary statutory interpretation, the majority opinion contains a number of passages that would /unifb01 t comfortably with constitutional arguments from earlier decades. for example, the majority emphasized that the third parties in purdue 94 were ' seek[ing] an injunction ' permanently and forever ' foreclosing similar suits in the future. and they seek all this without the consent of those affected. ' 95 later, the majority appears to invoke due process values by claiming that purdue ' s theory of nonconsensual third-party releases ' suggests those claims can be bargained away without the consent of those affected, as if the claims were somehow purdue ' s own property. ' 96","driving the point home, although the court claimed it was engaging in ordinary statutory interpretation, the majority opinion contains a number of passages that would fit comfortably with constitutional arguments from earlier decades. for example, the majority emphasized that the third parties in purdue 94 were “seek[ing] an injunction ‘permanently and forever’ foreclosing similar suits in the future. and they seek all this without the consent of those affected.” 95 later, the majority appears to invoke due process values by claiming that purdue’s theory of nonconsensual third-party releases “suggests those claims can be bargained away without the consent of those affected, as if the claims were somehow purdue’s own property.” 96",text,unknown,body-text,0.977,✗
"no one has directed us to a statute or case suggesting american courts in the past enjoyed the power in bankruptcy to discharge claims brought by nondebtors against other nondebtors, all without the consent of those affected. surely, if congress had meant to reshape traditional practice so profoundly in the present bankruptcy code, extending to courts the capacious new power the plan proponents claim, one might have expected it to say so expressly ' somewhere in the [c]ode itself. ' 97","no one has directed us to a statute or case suggesting american courts in the past enjoyed the power in bankruptcy to discharge claims brought by nondebtors against other nondebtors, all without the consent of those affected. surely, if congress had meant to reshape traditional practice so profoundly in the present bankruptcy code, extending to courts the capacious new power the plan proponents claim, one might have expected it to say so expressly ‘somewhere in the [c]ode itself.’ 97",text,unknown,body-text,0.994,✗
"92 the limitations on third-party releases in a plan or reorganization are found in 11 u.s.c. § 1129. the second circuit had gone to great lengths to set out the contours of those limitations. see purdue pharma l.p. , 69 f.4th at 75 -77.","92 the limitations on third-party releases in a plan or reorganization are found in 11 u.s.c. § 1129. the second circuit had gone to great lengths to set out the contours of those limitations. see purdue pharma l.p. , 69 f.4th at 75-77.",footnote,unknown,body-text,0.998,✗
"93 by contrast, the court announced that bankruptcy courts were not endowed with the power to extinguish nondebtor claims against nondebtors. purdue pharma l.p. , 603 u.s at 220 -21.","93 by contrast, the court announced that bankruptcy courts were not endowed with the power to extinguish nondebtor claims against nondebtors. purdue pharma l.p. , 603 u.s at 220-21.",footnote,unknown,body-text,0.997,✗
94 the releases in the case were granted in favor of the members of the sackler family who had previously owned and managed the company. id. at 211.,94 the releases in the case were granted in favor of the members of the sackler family who had previously owned and managed the company. id. at 211.,footnote,unknown,body-text,1.000,✗
"96 id. at 220; see also id. at 222 ( ' yet they seek a judicial order that would extinguish virtually all claims against them for fraud, willful injury, and even wrongful death, all without the consent of those who have brought and seek to bring such claims. in each of these ways, the sacklers seek to pay less than the code ordinarily requires and receive more than it normally permits. ' ).","96 id. at 220; see also id. at 222 (“yet they seek a judicial order that would extinguish virtually all claims against them for fraud, willful injury, and even wrongful death, all without the consent of those who have brought and seek to bring such claims. in each of these ways, the sacklers seek to pay less than the code ordinarily requires and receive more than it normally permits.”).",footnote,unknown,body-text,0.990,✗
"these quotes are all framed as reasons to adopt a narrow understanding of section 1123(b)(6), but they resemble the structural arguments that had for decades persuaded the supreme court to constitutionally limit bankruptcy courts ' judgment power. for example, in pointing out that nonconsensual third-party releases would give purdue a property right in plaintiffs ' claims, the majority hints -without saying so outright -that nonconsensual third-party releases would amount to an unconstitutional taking, or at least that they would raise property-rights concerns. similarly, concerns about ' roving ' and ' limitless ' bankruptcy court powers resemble concerns that bankruptcy courts are exercising article iii powers. and the resort to history and tradition suggests that congress needs to provide a clear -in our view, impossibly clear 98 -statement if it wants to ' reshape traditional practice ' by expanding bankruptcy court powers to include the right to order nonconsensual third-party releases. those concerns all appear to have been on the minds of the justices and likely in /unifb02 uenced the court ' s interpretation of the text of the bankruptcy code.","these quotes are all framed as reasons to adopt a narrow understanding of section 1123(b)(6), but they resemble the structural arguments that had for decades persuaded the supreme court to constitutionally limit bankruptcy courts’ judgment power. for example, in pointing out that nonconsensual third-party releases would give purdue a property right in plaintiffs’ claims, the majority hints-without saying so outright-that nonconsensual third-party releases would amount to an unconstitutional taking, or at least that they would raise property-rights concerns. similarly, concerns about “roving” and “limitless” bankruptcy court powers resemble concerns that bankruptcy courts are exercising article iii powers. and the resort to history and tradition suggests that congress needs to provide a clear-in our view, impossibly clear 98 -statement if it wants to “reshape traditional practice” by expanding bankruptcy court powers to include the right to order nonconsensual third-party releases. those concerns all appear to have been on the minds of the justices and likely influenced the court’s interpretation of the text of the bankruptcy code.",text,unknown,body-text,0.982,✗
"98 imagine a legislative drafter who did want to grant broad discretion to courts in approving plans of reorganization. this drafter wants plans to conform with all the requirements set forth explicitly in other provisions of the code, especially section 1129. but beyond that, the drafter wants to give the parties and the courts leeway. how would that drafter accomplish her objective?","98 imagine a legislative drafter who did want to grant broad discretion to courts in approving plans of reorganization. this drafter wants plans to conform with all the requirements set forth explicitly in other provisions of the code, especially section 1129. but beyond that, the drafter wants to give the parties and the courts leeway. how would that drafter accomplish her objective?",footnote,unknown,body-text,1.000,✗
"section 1123(b)(6) provides that a plan can approve any appropriate provisions not inconsistent with other provisions of the code. that is the most direct way of achieving this hypothetical drafter ' s objective. by our reading, the other items listed in sections 1123(b)(1) -(5) are speci /unifb01 c things that the drafters worried might be viewed by courts as inconsistent with other provisions. so they speci /unifb01 cally listed them as allowable.","section 1123(b)(6) provides that a plan can approve any appropriate provisions not inconsistent with other provisions of the code. that is the most direct way of achieving this hypothetical drafter’s objective. by our reading, the other items listed in sections 1123(b)(1)-(5) are specific things that the drafters worried might be viewed by courts as inconsistent with other provisions. so they specifically listed them as allowable.",footnote,unknown,body-text,0.972,✗
"perhaps a more adept drafter would have put section 1123(b)(6) /unifb01 rst to convey the point. beyond that option, there are not many other ways to say that parties can include any appropriate provisions in a plan as long as they are not prohibited elsewhere.","perhaps a more adept drafter would have put section 1123(b)(6) first to convey the point. beyond that option, there are not many other ways to say that parties can include any appropriate provisions in a plan as long as they are not prohibited elsewhere.",footnote,unknown,body-text,0.983,✗
"justice gorsuch avoids this problem by assuming that the question is not how a drafter would grant broad authority that includes releases but rather how a drafter would speci /unifb01 cally authorize these exact types of releases. those are meaningfully different drafting goals. the court ' s approach requires congress to add to the section 1123(b) list as every case reveals a new option. that approach undermines the discretionary language, and, by the court ' s logic, every addition further constrains discretion and narrows the set of other appropriate provisions.","justice gorsuch avoids this problem by assuming that the question is not how a drafter would grant broad authority that includes releases but rather how a drafter would specifically authorize these exact types of releases. those are meaningfully different drafting goals. the court’s approach requires congress to add to the section 1123(b) list as every case reveals a new option. that approach undermines the discretionary language, and, by the court’s logic, every addition further constrains discretion and narrows the set of other appropriate provisions.",footnote,unknown,body-text,0.984,✗
"purdue is the clearest and most important example to date in which the supreme court interpreted the bankruptcy code narrowly to limit the powers of non-article iii judges and to mitigate perceived constitutional in /unifb01 rmities. but it is not the only instance in which the court has voiced a concern about the scope of the bankruptcy code. for example, in mission products holdings, inc. v. tempnology, llc , a case about the right to reject intellectual property licenses in bankruptcy, the supreme court observed: ' the code of course aims to make reorganizations possible. but it does not permit anything and everything that might advance that goal. ' 100 in czyzewski v. jevic holding corp. , the court rejected a procedural maneuver, known as a ' structured dismissal, ' that was used to circumvent the code ' s absolute priority requirement. 101 while the holding of the case was narrow, the court ' s opinion noted: ' the importance of the priority system leads us to expect more than simple statutory silence if, and when, congress were to intend a major departure. ' 102 some lower courts have read this statement to create a clear-statement requirement for interpreting code provisions that might con /unifb02 ict with absolute priority. 103 other lower courts have taken jevic even further, inferring a general policy against bankruptcy court gap/unifb01 lling. 104 finally, jevic itself built on an earlier case, law v. siegel , where the","purdue is the clearest and most important example to date in which the supreme court interpreted the bankruptcy code narrowly to limit the powers of non-article iii judges and to mitigate perceived constitutional infirmities. but it is not the only instance in which the court has voiced a concern about the scope of the bankruptcy code. for example, in mission products holdings, inc. v. tempnology, llc , a case about the right to reject intellectual property licenses in bankruptcy, the supreme court observed: “the code of course aims to make reorganizations possible. but it does not permit anything and everything that might advance that goal.” 100 in czyzewski v. jevic holding corp. , the court rejected a procedural maneuver, known as a “structured dismissal,” that was used to circumvent the code’s absolute priority requirement. 101 while the holding of the case was narrow, the court’s opinion noted: “the importance of the priority system leads us to expect more than simple statutory silence if, and when, congress were to intend a major departure.” 102 some lower courts have read this statement to create a clear-statement requirement for interpreting code provisions that might conflict with absolute priority. 103 other lower courts have taken jevic even further, inferring a general policy against bankruptcy court gap-filling. 104 finally, jevic itself built on an earlier case, law v. siegel , where the court also made a point of noting that statutory silence “does not give courts discretion to grant or withhold exemptions based on whatever considerations they deem appropriate.” 105",text,unknown,body-text,0.922,✗
"103 see , e.g. , in re hertz corp., 120 f.4th 1181, 1200 (3d cir. 2024) ( ' [t]he supreme court concluded [absolute priority] applied everywhere absent a clear statement authorizing a departure. ' ).","103 see , e.g. , in re hertz corp., 120 f.4th 1181, 1200 (3d cir. 2024) (“[t]he supreme court concluded [absolute priority] applied everywhere absent a clear statement authorizing a departure.”).",footnote,unknown,body-text,0.980,✗
"104 see , e.g. , in re serta simmons bedding, llc, 125 f.4th 555, 589 (5th cir. 2025) (citing jevic for the need for a ' textual hook ' to approve certain bankruptcy settlements); in re george wash. bridge bus station dev. venture llc, 65 f.4th 43, 52 (2d cir. 2023) (citing jevic for the proposition that statutory silence should be read to constrain bankruptcy courts); in re purdue pharma l.p., 635 b.r. 26, 37 (bankr. s.d.n.y. 2021), rev ' d , 69 f.4th 45 (2d cir. 2023), rev ' d sub nom. harrington v. purdue pharma l.p., 603 u.s. 204 (2024) (citing jevic for the principle that rare case exceptions ' will no longer do ' ). some bankruptcy judges have pushed back on this reading of jevic . see in re genesis glob. holdco, llc, 660 b.r. 439, 488 (bankr. s.d.n.y. 2024) (approving a settlement over a jevic -based objection); in re nine w. holdings, inc., 588 b.r. 678, 690 (bankr. s.d.n.y. 2018) (overruling a jevic -based exception and noting that the court had left open the possibility of ' code-related objectives that [other] violating distributions serve ' (quoting jevic , 580 u.s. at 468)).","104 see , e.g. , in re serta simmons bedding, llc, 125 f.4th 555, 589 (5th cir. 2025) (citing jevic for the need for a “textual hook” to approve certain bankruptcy settlements); in re george wash. bridge bus station dev. venture llc, 65 f.4th 43, 52 (2d cir. 2023) (citing jevic for the proposition that statutory silence should be read to constrain bankruptcy courts); in re purdue pharma l.p., 635 b.r. 26, 37 (bankr. s.d.n.y. 2021), rev’d , 69 f.4th 45 (2d cir. 2023), rev’d sub nom. harrington v. purdue pharma l.p., 603 u.s. 204 (2024) (citing jevic for the principle that rare case exceptions “will no longer do”). some bankruptcy judges have pushed back on this reading of jevic . see in re genesis glob. holdco, llc, 660 b.r. 439, 488 (bankr. s.d.n.y. 2024) (approving a settlement over a jevic -based objection); in re nine w. holdings, inc., 588 b.r. 678, 690 (bankr. s.d.n.y. 2018) (overruling a jevic -based exception and noting that the court had left open the possibility of “code-related objectives that [other] violating distributions serve” (quoting jevic , 580 u.s. at 468)).",footnote,unknown,body-text,0.988,✗
"none of these cases directly confronted a constitutional challenge to any particular bankruptcy practice. nor did they state explicitly that they were limiting bankruptcy court authority to correct a constitutional in /unifb01 rmity in the u.s. bankruptcy system. nonetheless, in each case, the court went out of its way to express its concern that bankruptcy courts were exercising too much authority. and in each one, the court suggested -as have the scholarly critics of bankruptcy exceptionalism -that such authority is inconsistent with rule of law principles.","none of these cases directly confronted a constitutional challenge to any particular bankruptcy practice. nor did they state explicitly that they were limiting bankruptcy court authority to correct a constitutional infirmity in the u.s. bankruptcy system. nonetheless, in each case, the court went out of its way to express its concern that bankruptcy courts were exercising too much authority. and in each one, the court suggested-as have the scholarly critics of bankruptcy exceptionalism-that such authority is inconsistent with rule of law principles.",text,unknown,body-text,0.989,✗
"in that respect, the bankruptcy cases before the court are consistent with a new bankruptcy exceptionalism where the court -concerned about proper judicial authority -reads broad grants of authority in the bankruptcy code more narrowly than it might elsewhere. for example, as noted above, the court has taken a much different approach in dealing with broad grants of discretion that run directly and exclusively to article iii courts. 106","in that respect, the bankruptcy cases before the court are consistent with a new bankruptcy exceptionalism where the court-concerned about proper judicial authority-reads broad grants of authority in the bankruptcy code more narrowly than it might elsewhere. for example, as noted above, the court has taken a much different approach in dealing with broad grants of discretion that run directly and exclusively to article iii courts. 106",text,unknown,body-text,0.998,✗
"so does purdue create or curtail exceptionalism? the question is partly semantic, and the answer depends on how one de /unifb01 nes bankruptcy exceptionalism. if bankruptcy exceptionalism means that it is exceptional for non-article iii courts to adjudicate disputes that ordinarily fall under the authority of article iii courts, then purdue indirectly limits bankruptcy exceptionalism by announcing a limitation on all courts hearing bankruptcy cases. the non-exceptional approach would be for article iii or state courts to adjudicate private disputes among individuals. purdue has ensured that a swath of those","so does purdue create or curtail exceptionalism? the question is partly semantic, and the answer depends on how one defines bankruptcy exceptionalism. if bankruptcy exceptionalism means that it is exceptional for non-article iii courts to adjudicate disputes that ordinarily fall under the authority of article iii courts, then purdue indirectly limits bankruptcy exceptionalism by announcing a limitation on all courts hearing bankruptcy cases. the non-exceptional approach would be for article iii or state courts to adjudicate private disputes among individuals. purdue has ensured that a swath of those cases will never be resolved before a bankruptcy judge. one can debate whether this is a good outcome. we think it is not.",text,unknown,body-text,0.901,✗
"105 571 u.s. 415, 423 (2014); see also city of chicago v. fulton, 592 u.s. 154, 166 (2021) (sotomayor, j., concurring) ( ' [a]ny gap left by the court ' s ruling today is best addressed by rule drafters and policymakers, not bankruptcy judges. ' ).","105 571 u.s. 415, 423 (2014); see also city of chicago v. fulton, 592 u.s. 154, 166 (2021) (sotomayor, j., concurring) (“[a]ny gap left by the court’s ruling today is best addressed by rule drafters and policymakers, not bankruptcy judges.”).",footnote,unknown,body-text,0.976,✗
"106 as discussed above, the all writs act has formed the basis for the court ' s shadow docket, see supra note 49, and has been invoked routinely by lower courts to justify broad injunctions, including in mass tort cases, see, e.g. , stott v. cap. fin. servs., inc., 277 f.r.d. 316 (n.d. tex. 2011); next level commc ' ns lp v. dsc commc ' ns corp., 179 f.3d 244 (5th cir. 1999); in re johns-manville corp., 27 f.3d 48 (2d cir. 1994); in re baldwin-united corp., 770 f.2d 328 (2d cir. 1985); in re corrugated container antitrust litig., 659 f.2d 1332 (5th cir. 1981); united states v. n.y. tel. co., 434 u.s. 159 (1977); teas v. twentieth century-fox film corp., 413 f.2d 1263 (5th cir. 1969).","106 as discussed above, the all writs act has formed the basis for the court’s shadow docket, see supra note 49, and has been invoked routinely by lower courts to justify broad injunctions, including in mass tort cases, see, e.g. , stott v. cap. fin. servs., inc., 277 f.r.d. 316 (n.d. tex. 2011); next level commc’ns lp v. dsc commc’ns corp., 179 f.3d 244 (5th cir. 1999); in re johns-manville corp., 27 f.3d 48 (2d cir. 1994); in re baldwin-united corp., 770 f.2d 328 (2d cir. 1985); in re corrugated container antitrust litig., 659 f.2d 1332 (5th cir. 1981); united states v. n.y. tel. co., 434 u.s. 159 (1977); teas v. twentieth century-fox film corp., 413 f.2d 1263 (5th cir. 1969).",footnote,unknown,body-text,0.991,✗
"besides the merits of which forum should adjudicate these cases, the majority ' s interpretive approach also introduces signi /unifb01 cant uncertainty for bankruptcy courts and practitioners. instead of confronting the article iii question directly, the court invented a new kind of bankruptcy exceptionalism by distorting the substantive provisions of the bankruptcy code to sidestep underlying procedural concerns about the structural design of the bankruptcy courts. while this constitutional avoidance may have facilitated agreement among a majority of the court, it has already bred confusion and inconsistency in the lower courts. it is to that problem that we now turn.","besides the merits of which forum should adjudicate these cases, the majority’s interpretive approach also introduces significant uncertainty for bankruptcy courts and practitioners. instead of confronting the article iii question directly, the court invented a new kind of bankruptcy exceptionalism by distorting the substantive provisions of the bankruptcy code to sidestep underlying procedural concerns about the structural design of the bankruptcy courts. while this constitutional avoidance may have facilitated agreement among a majority of the court, it has already bred confusion and inconsistency in the lower courts. it is to that problem that we now turn.",text,unknown,body-text,0.990,✗
"many bankruptcy practices exist because judges and lawyers responded creatively to changes in capital markets. given how little guidance the text itself provides, and how much uncertainty there is about the new structural canon of bankruptcy interpretation, an enormous number of bankruptcy doctrines are vulnerable to supreme court reversal. we do not believe the court will reverse every practice, but the lack of a limiting principle in purdue could be just as harmful, since corporations and bankruptcy attorneys have little guidance about which bankruptcy principles remain acceptable and which do not. ironically, then, the court ' s attempt to constrain bankruptcy judges will incentivize unruly and strategic approaches by judges and practitioners. the following sections provide speci /unifb01 c examples of how purdue threatens future bankruptcy cases in distinct ways.","many bankruptcy practices exist because judges and lawyers responded creatively to changes in capital markets. given how little guidance the text itself provides, and how much uncertainty there is about the new structural canon of bankruptcy interpretation, an enormous number of bankruptcy doctrines are vulnerable to supreme court reversal. we do not believe the court will reverse every practice, but the lack of a limiting principle in purdue could be just as harmful, since corporations and bankruptcy attorneys have little guidance about which bankruptcy principles remain acceptable and which do not. ironically, then, the court’s attempt to constrain bankruptcy judges will incentivize unruly and strategic approaches by judges and practitioners. the following sections provide specific examples of how purdue threatens future bankruptcy cases in distinct ways.",text,unknown,body-text,0.992,✗
"accordingly, to the extent a debtor sought to justify a preliminary injunction on the notion that it was likely to succeed on the merits by ultimately obtaining a third-party release, such an argument would now need to fail in light of purdue pharma . 108","accordingly, to the extent a debtor sought to justify a preliminary injunction on the notion that it was likely to succeed on the merits by ultimately obtaining a third-party release, such an argument would now need to fail in light of purdue pharma . 108",text,unknown,body-text,1.000,✗
